,Unnamed: 0,symbol,name_of_company,series,date_of_listing,isin_number,industry_key,sector_key,macro,basic_industry,previous_close,open,day_low,day_high,regular_market_previous_close,regular_market_open,regular_market_day_low,regular_market_day_high,volume,regular_market_volume,average_volume,average_volume10days,average_daily_volume10_day,fifty_two_week_low,fifty_two_week_high,fifty_day_average,two_hundred_day_average,current_price,52_week_change,sand_p52_week_change,price_hint,debt_to_equity,quick_ratio,current_ratio,float_shares,shares_outstanding,implied_shares_outstanding,held_percent_insiders,compensation_as_of_epoch_date,ex_dividend_date,last_dividend_value,last_dividend_date,last_split_factor,last_split_date,payout_ratio,paid_up_value,market_lot,face_value,market_cap,enterprise_value,total_cash,total_cash_per_share,total_debt,total_revenue,revenue_per_share,ebitda,free_cashflow,operating_cashflow,book_value,price_to_book,price_to_sales_trailing12_months,enterprise_to_revenue,enterprise_to_ebitda,earnings_growth,revenue_growth,earnings_quarterly_growth,net_income_to_common,trailing_eps,forward_eps,trailing_pe,profit_margins,gross_margins,ebitda_margins,operating_margins,return_on_assets,return_on_equity,long_business_summary,beta,recommendation_key,market_cap_rank
32,32,KAYA,Kaya Limited,EQ,14-AUG-2015,INE587G01015,household-personal-products,consumer-defensive,Consumer Discretionary,Wellness,375.0,375.0,370.0,375.0,375.0,375.0,370.0,375.0,1622.0,1622.0,12317.0,11130.0,11130.0,267.15,699.45,390.222,418.59875,370.0,0.17850411,0.23397195,2.0,,0.155,0.478,4762072.0,13097500.0,13097500.0,0.65001,1735603200.0,,,,,,,10.0,1,10,484.607488,6918712832.0,251236992.0,19.186,2324989952.0,4096731904.0,313.187,-356891008.0,-421367136.0,199548992.0,-106.196,,1.1829123,1.689,-19.386,,-0.478,,-1299027968.0,-99.41,15.7,,-0.04923,0.47546002,-0.08712,-0.07131,-0.09549,,"Kaya Limited owns and operates skin and hair care clinics in India and the Middle East. The company offers skin care products, such as facewash, cleansers, toners, moisturizers, creams, face serums, sunscreens, kits and regimes, and wet wipes; hair care products that include shampoos, hair serums, hair lotions, hair oils, and hair masques; and bath and body products. It also provides skin services comprising laser hair, thermage, HIFU, dermal fillers, chemical peel, Q-switch laser, and skin brightening and lightening treatments; hair services, such as PRP GF treatment, PDO hair thread treatment, biocell hair therapy, intensive hair root therapy, and hair nutri-infusion therapy; and body contouring services consisting of Kaya wonder treatment, CM slim, Venus Legacy, and cool sculpting. The company sells its products through Kaya standalone stores, online, and third-party outlets. Kaya Limited has partnership with Bien-Etre Ltd to develop skin personalization platform using DNA biomarkers and AI. The company was founded in 2002 and is headquartered in Mumbai, India.",0.904,none,461.0
56,56,ATULAUTO,Atul Auto Limited,EQ,26-JUN-2013,INE951D01028,auto-manufacturers,consumer-cyclical,Industrials,Commercial Vehicles,591.25,595.0,565.0,608.45,591.25,595.0,565.0,608.45,90569.0,90569.0,66890.0,93970.0,93970.0,470.0,844.4,597.18,602.6515,572.95,0.03257072,0.23397195,2.0,33.693,,,10530501.0,27751300.0,27869900.0,0.61932,1735603200.0,1574294400.0,1.5,1574294400.0,2:1,1410480000.0,,5.0,1,5,1590.0107776,17663076352.0,453100000.0,16.327,1444600064.0,6027200000.0,197.539,524849984.0,,,151.29,3.787098,2.6380587,2.931,33.654,,1.265,,193300000.0,6.39,,89.66354,0.03207,0.25908002,0.08708,0.02258,,,"Atul Auto Limited manufactures and sells three-wheeler automobiles in India. It offers passenger and cargo, e-rickshaw, and delivery vans, as well as spare parts and accessories. The company's products are diesel, petrol, CNG, LPG, and electric vehicles. It offers its products under the Atul RIK, Atul Gem, Atul Gemini, Atul Gemi, Atul Elite, Atul Smart, and Atul Shakti brand names. The company exports its products to Bangladesh, Nepal, Cambodia, Myanmar, South Africa, the United Kingdom, Ethiopia, Liberia, Sierra Leone, Tanzania, Ecuador, Bolivia, Guatemala, Honduras, and Mexico. Atul Auto Limited was incorporated in 1986 and is headquartered in Rajkot, India.",0.284,none,352.0
108,108,SONACOMS,Sona BLW Precision Forgings Limited,EQ,24-JUN-2021,INE073K01018,auto-parts,consumer-cyclical,Consumer Discretionary,Auto Components & Equipments,609.6,609.6,586.55,614.45,609.6,609.6,586.55,614.45,1589882.0,1589882.0,2042074.0,1786400.0,1786400.0,562.1,768.65,668.522,671.22327,588.45,0.056499124,0.23397195,2.0,3.744,6.283,6.511,382792581.0,621436032.0,621740992.0,0.28033,1735603200.0,1718323200.0,1.53,1718323200.0,,,0.31780002,10.0,1,10,36568.4031488,324200136704.0,29349560320.0,49.342,2015040000.0,34792841216.0,59.116,9416240128.0,7276651008.0,8594410496.0,87.934,6.6919513,10.510324,9.318,34.43,0.147,0.171,0.162,5672829952.0,9.63,,61.10592,0.16305,0.55508,0.27064,0.2054,0.09466,0.144,"Sona BLW Precision Forgings Limited designs, manufactures, and supplies systems and components for the automotive industry in India and internationally. The company offers traction motors, controllers, differential bevel gears, differential assemblies, spool gears, integrated motor controller modules, drive motors, hub wheel motors, e-axles, starter motors, belt starter generators, reverse idlers, portal axle gears, couplings/sleeves, conventional and micro-hybrid starter motors, BSG systems, epicyclic geartrains/gears, inter-axle gear sets, EV traction motors, and motor control units, as well as electronically locking differentials, intermediate gears, and input/ rotor shafts. Its products are used in conventional and electric passenger vehicles, commercial vehicles, off highway vehicles, and electric two and three-wheeler applications. The company was formerly known as Sona Okegawa Precision Forgings Ltd. and changed its name to Sona BLW Precision Forgings Limited in 2013. Sona BLW Precision Forgings Limited was incorporated in 1995 and is headquartered in Gurugram, India.",0.221,none,75.0
110,110,RML,Rane (Madras) Limited,EQ,30-AUG-2005,INE050H01012,auto-parts,consumer-cyclical,Consumer Discretionary,Auto Components & Equipments,923.3,924.85,880.8,933.9,923.3,924.85,880.8,933.9,10242.0,10242.0,16342.0,16364.0,16364.0,631.0,1529.0,934.911,928.53,891.45,0.08419442,0.23397195,2.0,299.304,0.457,0.836,4394581.0,16265300.0,16401800.0,0.72777003,1735603200.0,1563235200.0,4.5,1563235200.0,,,,10.0,1,10,1462.1384704,21909299200.0,225400000.0,13.922,7701700096.0,20903999488.0,1282.294,1588199936.0,-825225024.0,843800000.0,158.933,5.6089673,0.69945395,1.048,13.795,,-0.135,,24500000.0,1.48,,602.33105,0.00117,0.34636003,0.07598,0.027309999,0.03371,0.00955,"Rane (Madras) Limited engages in the manufacture and marketing of auto components for transportation industry in India and internationally. It offers steering and suspension systems, linkage products, steering gears, cylinders, hydraulic products, high precision aluminum die castings, and other auto components. The company markets and sells its products to the manufacturers of passenger cars, utility vehicles, and farm tractors. It also exports its products. Rane (Madras) Limited was founded in 1960 and is headquartered in Chennai, India. Rane (Madras) Limited is a subsidiary of Rane Holdings Limited.",0.798,none,362.0
145,145,SRPL,Shree Ram Proteins Limited,BE,23-SEP-2020,INE008Z01020,farm-products,consumer-defensive,Fast Moving Consumer Goods,Edible Oil,1.3,1.29,1.23,1.29,1.3,1.29,1.23,1.29,1134170.0,1134170.0,1402285.0,692707.0,692707.0,0.99,1.95,1.4616,1.18825,1.24,0.23809528,0.23397195,4.0,79.456,,,202504462.0,257040000.0,270880992.0,,,,,,10:1,1684454400.0,,1.0,1,1,31.87296,707343488.0,970000.0,0.004,369396000.0,56607000.0,0.252,-99134248.0,,,2.101,0.5901951,5.6305685,12.496,-7.135,,,,-102928000.0,-0.45,,,-1.81829,-1.15837,-1.7512699,-1.88895,,,"Shree Ram Proteins Limited engages in cotton seeds extraction business in India. Its products include cotton linter, seed hull, seed meal, seed wash oil, and seed refine oil; and soyabean meal, rapeseed meal, groundnut meal, and raw cotton bales. The company also exports its products. Shree Ram Proteins Limited was incorporated in 2005 and is based in Rajkot, India.",-0.206,none,593.0
197,197,PONNIERODE,Ponni Sugars (Erode) Limited,EQ,16-APR-2002,INE838E01017,confectioners,consumer-defensive,Fast Moving Consumer Goods,Sugar,424.6,424.6,412.0,437.4,424.6,424.6,412.0,437.4,30883.0,30883.0,28298.0,24808.0,24808.0,363.25,598.9,430.938,459.7715,414.8,0.04865396,0.23397195,2.0,,1.566,5.462,4370308.0,8598420.0,8602560.0,0.50566,1672444800.0,1716336000.0,7.0,1716336000.0,,,0.1603,10.0,1,10,356.6624512,3395575808.0,170900000.0,19.877,,3450099968.0,401.226,350700000.0,-782600000.0,-114400000.0,691.284,0.6000428,1.0337743,0.984,9.682,-0.231,-0.26,-0.231,375500000.0,43.65,,9.502863,0.108839996,0.19014,0.10165,0.108,0.02441,0.06316,"Ponni Sugars (Erode) Limited engages in the manufacture and sale of sugar in India. It operates in two segments, Sugar and Co-generation. The company is involved in provision of bagasse and molasses; and cogeneration of power. It also exports its products. The company was formerly known as SPB Sugars and Chemicals Limited and changed its name to Ponni Sugars (Erode) Limited in January 2000. Ponni Sugars (Erode) Limited was incorporated in 1996 and is based in Chennai, India.",0.175,none,479.0
266,266,SAKUMA,Sakuma Exports Limited,EQ,08-MAR-2006,INE190H01024,farm-products,consumer-defensive,Services,Trading & Distributors,3.96,3.99,3.91,4.0,3.96,3.99,3.91,4.0,950569.0,950569.0,2276683.0,1296862.0,1296862.0,3.260858,10.3,4.1302,5.5490704,3.93,0.1890285,0.23397195,4.0,20.518,,,458680965.0,1567719936.0,1571680000.0,0.47692,1735603200.0,1721088000.0,0.01,1721088000.0,5:1,1723161600.0,0.0295,1.0,1,1,617.6702464,5391939584.0,254608992.0,0.217,990544000.0,23824461824.0,19.229,394472736.0,,,4.116,0.9548105,0.25925884,0.226,13.669,-0.052,0.534,0.191,408854016.0,0.33,1.18,11.909091,0.01716,0.05289,0.01656,0.01013,,,"Sakuma Exports Limited engages in the trading of agro commodities in India. It buys, processes, markets, and imports agricultural commodities, including sugar, edible oils, pulses, cotton, and various specialty crops; grains, such as rice, wheat, corn, barley, millet, and sorghum; pulses and beans; and spices comprising coriander and mustard seeds, turmeric, kalonji, fenugreek seed, fennel, ajwain, nutmeg, mustard, cardamom, black pepper, dill seed, ginger, and various grounded spices and curry powder. The company also offers de-oiled cakes consisting of soya bean, rapeseed, ground nut, and castor meals; and oil and oil seeds, which include sesame seeds, groundnut kernels, and sunflower and safflower seeds. In addition, it provides financial structured products that are linked to physical commodities. The company exports its products to the Middle East, South and Southeast Asia, the Far East, Australia, Europe, and Africa. Sakuma Exports Limited was founded in 1998 and is based in Mumbai, India.",0.802,none,439.0
276,276,MHRIL,Mahindra Holidays & Resorts India Limited,EQ,16-JUL-2009,INE998I01010,resorts-casinos,consumer-cyclical,Consumer Discretionary,Hotels & Resorts,372.95,371.6,359.85,377.55,372.95,371.6,359.85,377.55,177385.0,177385.0,126195.0,85948.0,85948.0,347.0,505.0,371.824,406.14276,360.8,0.018432498,0.23397195,2.0,495.696,1.021,1.468,64552685.0,201618000.0,206610000.0,0.70285004,,1532563200.0,2.666667,1532476800.0,3:2,1631059200.0,,10.0,1,10,7275.3512448,90995179520.0,11610589184.0,57.322,29453654016.0,27586203648.0,137.263,3007358976.0,528516864.0,6559485952.0,28.98,12.4499655,2.637315,3.299,30.258,-0.358,0.024,-0.355,1136681984.0,5.63,8.2,64.08525,0.041199997,0.6326,0.10902,0.04611,0.01143,0.21735,"Mahindra Holidays & Resorts India Limited operates in the leisure hospitality sector. It engages in the sale of vacation ownership and other accommodation related services. The company's flagship brand is Club Mahindra or CMH25, which entitles its members to a week's holiday every year for 25 years. It provides Club Mahindra Fundays, a corporate product that allows enrolled organizations to offer holiday entitlements to its employees either as a part of their reward and recognition programs or as an employment prerequisite; Bliss, a points-based product targeted at the 50-plus age group, which offers a week's holiday every year for 10 years; CMH4, a shorter duration four year nights-based product; and GoZest, which is a three-year points-based product. The company operates a network of resorts across various destinations, including hill stations, beaches, backwaters, wildlife sanctuaries, forts, and heritage destinations in India, as well as in international destinations, such as Thailand, Indonesia, Malaysia, Turkey, Singapore, Dubai, Sri Lanka, Maldives, Vietnam, Cambodia, Abu Dubai, Nepal, Finland, Sweden, and Spain. Mahindra Holidays & Resorts India Limited was incorporated in 1996 and is based in Mumbai, India. Mahindra Holidays & Resorts India Limited is a subsidiary of Mahindra & Mahindra Limited.",0.163,none,206.0
343,343,TTKHLTCARE,TTK Healthcare Limited,EQ,02-DEC-2015,INE910C01018,drug-manufacturers-general,healthcare,Diversified,Diversified,1455.3,1464.75,1440.6,1490.0,1455.3,1464.75,1440.6,1490.0,1621.0,1621.0,7533.0,3444.0,3444.0,1310.15,1893.95,1532.796,1543.5647,1443.45,0.038202286,0.23397195,2.0,2.999,3.968,5.167,3297608.0,14130300.0,14142500.0,0.75604,1735603200.0,1721088000.0,10.0,1721088000.0,,,0.1768,10.0,1,10,2041.3990912,12784975872.0,7928351744.0,560.941,311580000.0,7712925184.0,545.824,322808992.0,-1124477184.0,-8419000.0,734.946,1.9640218,2.646725,1.658,39.605,0.074,0.068,0.075,799425984.0,56.61,,25.498144,0.103649996,0.5194,0.04185,0.03135,0.011410001,0.0795,"TTK Healthcare Limited engages in the animal welfare and human pharma product, consumer product, medical device, protective device, food, and other businesses in India. It operates through Animal Welfare, Consumer Products, Medical Devices, Protective Devices, Foods, Human Pharma, and Others segments. The Animal Welfare segment offers various feed supplements, liver correctives, fertility inducers, antibiotics, anti-parasiticides, antispasmodics, cervical dilators, cocktail enzymes, etc. to veterinarians, dairy, poultry and aqua farmers, and pet parents. The Consumer Products segment is involved in the marketing and distribution of baby care products under the Woodward's Gripewater name; personal care products and cosmetics under the EVA name; home care products, such as scrubbers under the Good Home name; and air fresheners. The Medical Devices segment manufactures and markets artificial heart valves under the TTK Chitra name, as well as orthopedic implants and instruments for knee and hip replacements. The Protective Devices segment manufactures and markets sexual wellness products, including male contraceptives under the Skore brand name, and other allied products. The Foods segment engages in the manufacturing and marketing of food products, including papads under the Fryums name; and cereal, potato, rice, pulses, and corn-based products. The Human Pharma is involved in the development and commercialization of such as gynecology, infertility, respiratory, orthopedics, cardiology, and general health therapeutic needs. The Others segment prints and publishes maps, atlases, guidebooks, and educational publications under the TTK brand name. The company was founded in 1928 and is headquartered in Chennai, India. TTK Healthcare Limited operates as a subsidiary of TT Krishnamachari & Co., Ltd.",0.653,none,326.0
536,536,SAKHTISUG,Sakthi Sugars Limited,EQ,06-SEP-1995,INE623A01011,confectioners,consumer-defensive,Fast Moving Consumer Goods,Sugar,31.57,32.16,30.53,32.41,31.57,32.16,30.53,32.41,236083.0,236083.0,564898.0,161395.0,161395.0,26.75,46.75,34.3204,36.2859,30.73,0.10384619,0.23397195,2.0,655.801,,,44087317.0,118849000.0,119263000.0,0.66863996,1546214400.0,1196899200.0,1.5,1196899200.0,,,,10.0,1,10,366.4951808,11714340864.0,63235000.0,0.532,7734297088.0,10896868352.0,91.712,1046824000.0,,,9.923,3.0968456,0.33633074,1.075,11.19,-0.282,0.064,-0.281,971646976.0,6.99,,4.3962803,0.09804,0.36431998,0.09607001,0.14271,,,"Sakthi Sugars Limited manufactures and sells sugar in India. It operates through Sugar, Industrial Alcohol, Soya Products, and Power segments. The company offers white and refined sugar; industrial alcohol, including rectified spirit, extra neutral alcohol/neutral spirit, and ethanol manufactured from molasses; sugar by-products, such as molasses, bagasse, and press muds; bio earth products for use as an organic fertilizer and soil improver; and soya products. It also operates three cogeneration power plants with an aggregate power generation capacity of 92 megawatts. The company was incorporated in 1961 and is headquartered in Coimbatore, India. Sakthi Sugars Limited is a subsidiary of ABT Investments (India) Private Limited.",0.231,none,477.0
537,537,MSUMI,Motherson Sumi Wiring India Limited,EQ,28-MAR-2022,INE0FS801015,auto-parts,consumer-cyclical,Consumer Discretionary,Auto Components & Equipments,62.0,61.94,59.49,62.48,62.0,61.94,59.49,62.48,5750976.0,5750976.0,5362125.0,4251231.0,4251231.0,59.49,80.0,63.2128,68.43925,59.94,0.008950353,0.23397195,2.0,17.432,0.746,1.678,1710765812.0,4421109760.0,4510000128.0,0.61727,1735603200.0,1723593600.0,0.8,1723593600.0,7:5,1668556800.0,0.43330002,1.0,1,1,26504.388608,270401290240.0,526500000.0,0.118,2819699968.0,88130297856.0,19.941,9395500032.0,3397574912.0,6505299968.0,3.616,16.576328,3.0074093,3.068,28.78,-0.029,0.108,-0.024,6602399744.0,1.5,2.03,39.96,0.07492,0.33501,0.10661,0.08831,0.17083,0.45002997,"Motherson Sumi Wiring India Limited manufactures and sells components to automotive original equipment manufacturers in India and internationally. It provides wiring harness solutions to original equipment manufacturers; and manufactures, assembles, delivers integrated electrical and electronic distribution systems for power supply and data transfer across vehicle types. The company also provides integrated electrification solutions for vehicles with alternative powertrains, including high-voltage wire harnesses; and develops solutions for internal combustion engine vehicles, as well as electric and hybrid vehicles. In addition, it offers digital assembly boards, color detection systems, component presence sensors, and online work instructions. Further, the company manufactures wiring harnesses products for passenger cars; two-wheelers and recreational vehicles; heavy, medium, and light-duty commercial vehicles; motorcycles and three-wheelers; multi-utility vehicles; farm and material-handling equipment; and off-highway vehicles. Additionally, it offers specialized wiring harnesses for consumer durables, office automation equipment, medical diagnostic equipment, and other electrical and electronic equipment. The company was incorporated in 2020 and is headquartered in Noida, India.",-0.244,none,94.0
569,569,ALOKINDS,Alok Industries Limited,EQ,19-FEB-2020,INE270A01029,textile-manufacturing,consumer-cyclical,Consumer Discretionary,Other Textile Products,21.83,21.86,21.0,22.13,21.83,21.86,21.0,22.13,5770521.0,5770521.0,10387427.0,9883507.0,9883507.0,19.86,39.05,22.0994,25.63385,21.17,0.008314133,0.23397195,2.0,,0.205,0.577,1231078755.0,4965239808.0,4967520256.0,0.74998003,,1387324800.0,0.3,1387324800.0,,,,1.0,1,1,10516.2407936,362822828032.0,1155100032.0,0.234,259286302720.0,46143000576.0,9.257,-219700000.0,-14269762560.0,-16033899520.0,-40.944,,2.2790544,7.863,-1651.447,,-0.348,,-9148199936.0,-1.84,,,-0.19826001,0.3657,-0.00476,-0.13241,-0.028269999,,"Alok Industries Limited manufactures and sells textile products in India and internationally. It offers polyester yarns, including recycled drawn textured yarns (DTY), biodegradable DTY, specialty DTY, dyed yarn, staple fiber, polyester chips, and oriented yarns; ring spun, gassed, two-for-one, and open end yarns; and apparel fabrics, such as piece dyed, yarn dyed, printed, and specialty fiber blends. The company also provides home textiles comprising bed and bath textiles; garments, including polos, t-shirts, boxers, blouses, loungewear, nightwear, dresses, shirts, etc; textile accessories, such as handkerchiefs and bags; technical textiles comprising high visibility fabrics, healthcare uniforms, camouflage defence fabrics, workwear fabrics, and fire-retardant fabrics; and corrugated packaging, including corrugated boxes and textile tubes. The company was incorporated in 1986 and is based in Navi Mumbai, India.",0.686,none,165.0
580,580,INDSWFTLAB,Ind-Swift Laboratories Limited,EQ,02-JUL-1997,INE915B01019,drug-manufacturers-specialty-generic,healthcare,Healthcare,Pharmaceuticals,105.01,105.04,105.0,107.11,105.01,105.04,105.0,107.11,32057.0,32057.0,61436.0,45839.0,45839.0,86.2,186.0,110.7786,122.6716,107.11,0.08257735,0.23397195,2.0,1.785,,,21439906.0,59086900.0,59643900.0,0.64037,1735603200.0,1316476800.0,1.0,1316476800.0,,,,10.0,1,10,638.8457984,2336805376.0,4319270912.0,73.873,166216000.0,10037275648.0,170.281,1967919232.0,,,157.642,0.6794509,0.6364733,0.233,1.187,-0.945,-0.893,-0.946,4046546944.0,63.2,,1.6947784,0.40315,0.47544,0.19606,-0.30122998,,,"Ind-Swift Laboratories Limited, together with its subsidiaries, develops, manufactures, and sells active pharmaceutical ingredients (APIs), intermediates, and formulations in India and internationally. The company offers APIs in various therapeutic areas, including macrolide antibiotic, cardiovascular, antihistaminic, antidiabetic, antipsychotic, bone resorption inhibitor, Parkinson's disease, hyperparathyrodism, analgesic, aromatase inhibitor, nootropic, antidiarrhoeal/antiprotozoal, alcohol abstinence, antineoplastic, ADHD symptoms, anticancer, hypercholesterolemia, antimigraine, and thrombocytopenia. It also provides reference standards and impurities for acamprosate calcium, anastrozole, aripiprazole, atorvastatin calcium, azithromycin dihydrate, bexarotene, cinacalcet hydrochloride, clopidogrel bisulphate, clopidogrel hydrochloride, dapoxetine hydrochloride, donepezil hydrochloride, ezetimibe, fexofenadine hydrochloride, imatinib mesylate, ivabradine hydrochloride, ivabradine oxalate, letrozole, mecloxamine citrate, naratriptan hydrochloride, nateglinide, nitazoxanide, nitrosamine, pazopanib hydrochloride, quetiapine hemifumarate, raltegravir potassium, ropinirole hydrochloride, rosuvastatin calcium, saxagliptin monohydrate, silodosin, and temozolomide, as well as contract research and manufacturing services. The company exports its products. Ind-Swift Laboratories Limited was incorporated in 1995 and is headquartered in Manimajra, India.",0.265,none,436.0
