,Unnamed: 0,symbol,name_of_company,series,date_of_listing,isin_number,industry_key,sector_key,macro,basic_industry,previous_close,open,day_low,day_high,regular_market_previous_close,regular_market_open,regular_market_day_low,regular_market_day_high,volume,regular_market_volume,average_volume,average_volume10days,average_daily_volume10_day,fifty_two_week_low,fifty_two_week_high,fifty_day_average,two_hundred_day_average,current_price,52_week_change,sand_p52_week_change,price_hint,debt_to_equity,quick_ratio,current_ratio,float_shares,shares_outstanding,implied_shares_outstanding,held_percent_insiders,compensation_as_of_epoch_date,ex_dividend_date,last_dividend_value,last_dividend_date,last_split_factor,last_split_date,payout_ratio,paid_up_value,market_lot,face_value,market_cap,enterprise_value,total_cash,total_cash_per_share,total_debt,total_revenue,revenue_per_share,ebitda,free_cashflow,operating_cashflow,book_value,price_to_book,price_to_sales_trailing12_months,enterprise_to_revenue,enterprise_to_ebitda,earnings_growth,revenue_growth,earnings_quarterly_growth,net_income_to_common,trailing_eps,forward_eps,trailing_pe,profit_margins,gross_margins,ebitda_margins,operating_margins,return_on_assets,return_on_equity,long_business_summary,beta,recommendation_key,market_cap_rank
4,4,SANOFI,Sanofi India Limited,BE,19-MAY-2003,INE058A01010,drug-manufacturers-general,healthcare,Healthcare,Pharmaceuticals,7223.0,7237.0,7134.05,7237.0,7223.0,7237.0,7134.05,7237.0,10324.0,10324.0,19546.0,23489.0,23489.0,5892.8,10524.95,6725.918,7900.223,7199.95,0.0016937256,0.26327205,2.0,3.228,0.669,1.371,9078191.0,23030600.0,23037200.0,0.60582,1703980800.0,1714694400.0,117.0,1714694400.0,,,0.72730005,10.0,1,10,16581.9170816,162548088832.0,2481999872.0,107.77,221000000.0,27893000192.0,1211.097,7776000000.0,3393625088.0,3315000064.0,297.257,24.221298,5.944831,5.828,20.904,-0.16,-0.344,-0.16,5288000000.0,229.71,252.83,31.34365,0.1898,0.57226,0.27878,0.23020001,0.32641998,0.75071,"Sanofi India Limited manufactures and trades in drugs and pharmaceutical products in India, Singapore and internationally. The company provides pharmaceutical products in various therapeutic areas, such as diabetes, cardiology, thrombosis, infections, central nervous system, anti-infectives, epilepsy, allergy and vitamins, and minerals and supplements, as well as pain care and nutritional health under the Lantus, Toujeo, Clexane, Amaryl, Cardace, Glimepiride, Cetapin, Targocid, Frisium, Combiflam, DePura, Allegra, and Avil brands through independent distributors. It also exports its products to approximately 35 countries. The company was formerly known as Aventis Pharma Limited and changed its name to Sanofi India Limited in May 2012. The company was incorporated in 1956 and is headquartered in Mumbai, India. Sanofi India Limited is a subsidiary of Hoechst GmbH.",0.296,buy,402.0
202,202,INDTERRAIN,Indian Terrain Fashions Limited,EQ,11-MAR-2011,INE611L01021,apparel-manufacturing,consumer-cyclical,Consumer Discretionary,Garments & Apparels,58.03,59.0,58.7,63.47,58.03,59.0,58.7,63.47,695980.0,695980.0,299465.0,167294.0,167294.0,52.4,86.0,65.3466,70.05305,62.0,0.0348624,0.26327205,2.0,72.801,,,20339197.0,44291700.0,44441600.0,0.51741004,1703980800.0,,,,5:1,1450656000.0,,2.0,1,2,275.53792,3800844288.0,378400000.0,8.549,1433299968.0,4320900096.0,97.633,175624992.0,,,65.627,0.94473314,0.6376864,0.88,21.642,,-0.259,,-274000000.0,-6.19,10.95,,-0.06341,0.3447,0.04065,-0.23932,,,"Indian Terrain Fashions Limited engages in the retail of branded apparel in India. It offers shirts, T-shirts, sweaters, jackets, denims, sport coats, waistcoats, boxers, sweatshirts, shorts, trousers, jeans, and joggers; and accessories, including belts, wallets, caps, travel bags, socks, and watches for men and boys. The company provides its products for men under the Indian Terrain brand name, as well as for boys between the ages of 4 and 16 years under the Indian Terrain BOY brand name. It sells its products through multi-branded outlets, large format stores, and exclusive outlets, as well as through e-commerce platforms. Indian Terrain Fashions Limited was founded in 2000 and is based in Chengalpattu, India.",0.883,buy,1618.0
291,291,SASTASUNDR,Sastasundar Ventures Limited,EQ,05-OCT-2010,INE019J01013,pharmaceutical-retailers,healthcare,Healthcare,Healthcare Service Provider,315.15,315.0,311.0,318.5,315.15,315.0,311.0,318.5,13157.0,13157.0,66117.0,26097.0,26097.0,266.1,506.75,319.066,346.90076,311.1,0.09926212,0.26327205,2.0,0.388,,,6441839.0,31810500.0,32034200.0,0.81307,1735603200.0,1343001600.0,1.0,1343001600.0,,,,10.0,1,10,989.6246272,11875542016.0,489584000.0,15.386,38828000.0,13860082688.0,435.529,709786752.0,,,239.815,1.29725,0.7140106,0.857,16.731,22.878,-0.144,22.836,387270016.0,2.78,,111.90648,0.02794,0.11387999,0.051209997,0.07965,,,"Sastasundar Ventures Limited operates a digital network of healthcare and portfolio management services in India. The company operates through Financial Services and Healthcare Network segments. It is involved in financing of loans; investment in shares and securities; provision of financial consultancy, professional fees, wealth management, financial planning, distribution, and related services. The company engages in activities for pathology and marketing of healthcare and OTC products through e-commerce portal; and provision of diagnostic services, including pathological/radiological investigation. In addition, the company engages in the supply chain of medicine and wellness products; operates RetailerShakti.com and RetailerShakti mobile app for medicine, wellness, and FMCG products; and supplies products to retail pharmacies and local stores. The company was formerly known as Microsec Financial Services Limited and changed its name to Sastasundar Ventures Limited in November 2016. Sastasundar Ventures Limited was incorporated in 1989 and is based in Kolkata, India.",0.81,none,1283.0
316,316,RELCHEMQ,Reliance Chemotex Industries Limited,EQ,25-MAY-2022,INE750D01016,textile-manufacturing,consumer-cyclical,Consumer Discretionary,Other Textile Products,231.49,232.7,227.0,233.95,231.49,232.7,227.0,233.95,9690.0,9690.0,30105.0,18039.0,18039.0,181.0,349.0,236.1382,237.692,227.9,0.16385913,0.26327205,2.0,210.242,,,1661319.0,7543560.0,7560110.0,0.74794996,1735603200.0,1725408000.0,1.0,1725408000.0,,,1.1962,10.0,1,10,172.2948992,4026018304.0,503782016.0,66.783,2809868032.0,3697330944.0,490.322,254431248.0,,,177.17,1.2863351,0.46599805,1.089,15.824,-0.736,0.028,-0.736,15717000.0,2.1,,108.52381,0.00425,0.48714,0.06881,0.02578,,,"Reliance Chemotex Industries Limited engages in the manufacture and sale of synthetic and blended yarns in India. It offers home furnishing, industrial, and apparel yarns. The company also export its products to approximately 37 countries. Reliance Chemotex Industries Limited was incorporated in 1977 and is based in Mumbai, India.",0.477,none,1743.0
687,687,TREEHOUSE,Tree House Education & Accessories Limited,EQ,26-AUG-2011,INE040M01013,education-training-services,consumer-defensive,Consumer Discretionary,Education,20.96,21.2,20.5,21.2,20.96,21.2,20.5,21.2,46482.0,46482.0,77974.0,64849.0,64849.0,16.0,34.65,23.5008,23.63645,20.81,0.2211144,0.26327205,2.0,0.01,,,28451500.0,42310700.0,44143000.0,0.40854,1388448000.0,1442361600.0,2.0,1442361600.0,,,,10.0,1,10,88.5983616,,,,200000.0,84000000.0,1.952,-85323784.0,,,48.305,0.43080425,10.547424,,,,0.118,,-33000000.0,-0.78,,,-0.39286,0.46905,-1.01576,0.22936001,,,"Tree House Education & Accessories Limited provides educational and related services to the K-12 schools in India. The company operates preschools; and offers a range of programs for children, including play group, nursery, junior kindergarten, senior kindergarten, day care services, teacher's training courses, summer camps, and hobby classes. It also leases education infrastructure; and franchises education centers. Tree House Education & Accessories Limited was founded in 2003 and is based in Mumbai, India.",0.391,underperform,1848.0
745,745,MHLXMIRU,Mahalaxmi Rubtech Limited,EQ,27-JAN-2022,INE112D01035,textile-manufacturing,consumer-cyclical,Consumer Discretionary,Other Textile Products,174.37,176.87,171.21,176.87,174.37,176.87,171.21,176.87,7998.0,7998.0,45867.0,9903.0,9903.0,158.0,376.0,185.6844,242.89224,174.0,0.046501756,0.26327205,2.0,30.308,,,2648070.0,10620300.0,10654100.0,0.73072,1735603200.0,,,,,,,10.0,1,10,184.793216,1783240832.0,218968000.0,20.627,160290000.0,323857984.0,30.512,189955504.0,,,49.808,3.4934149,5.7059956,5.506,9.388,1.074,-0.684,1.07,127188000.0,10.91,,15.948671,0.39273,0.32953,0.58654,0.18676001,,,"Mahalaxmi Rubtech Limited manufactures and markets traditional textile, and polymer based technical textile and rubber products in India. The company operates through Rubber/Technical Textiles Products and Textile Products segments. It offers specialty fabrics; offset rubber printing blankets for use in sheet fed, web, metal deco, packaging, and security printing applications; and a range of technical coated fabrics for various applications, such as architecture, lifestyle, sports, advertising, military, mines, food and agriculture, vehicle, and transportation. The company also provides textile based digital print media for use in digital banners and signage printing. In addition, it exports its products. Mahalaxmi Rubtech Limited was incorporated in 1991 and is based in Ahmedabad, India.",0.136,none,1725.0
