663,663,JPPOWER,Jaiprakash Power Ventures Limited,EQ,18-APR-2005,INE351F01018,utilities-independent-power-producers,utilities,Utilities,Power Generation,19.9,19.9,19.4,20.34,19.9,19.9,19.4,20.34,72708883.0,72708883.0,51636343.0,134550467.0,134550467.0,8.35,24.0,18.5202,18.45515,20.01,1.2610168,0.38520622,2.0,37.026,,,5617941990.0,6853459968.0,6856940032.0,0.35298002,1735603200.0,1249862400.0,0.75,1249862400.0,,,,10.0,1,10,13713.7733632,245300428800.0,9572400128.0,1.099,42460401664.0,68096598016.0,7.815,27281750016.0,,,8.979,2.2285333,2.0138705,3.602,8.991,,0.027,0.819,11788399616.0,1.31,-1.7,15.27481,0.17311001,0.41124,0.40063,0.38318002,,,"Jaiprakash Power Ventures Limited engages in the power generation and cement grinding businesses in India and internationally. The company generates electricity through thermal and hydro energy sources. It owns and operates a 400 megawatts (MW) Jaypee Vishnuprayag hydro-electric power plant at District Chamoli, Uttarakhand; 1320 MW Jaypee Nigrie thermal power plant at village Nigrie, district Singrauli, Madhya Pradesh; and 500 MW Jaypee Bina thermal power plant at village Sirchopi, district Sagar, Madhya Pradesh. The company also operates Jaypee Nigrie cement grinding unit at Nigrie, District Singrauli, Madhya Pradesh; and sand mining in Andhra Pradesh. In addition, it operates coal mine located in Amelia and Bandha Madhya Pradesh. The company was formerly known as Jaiprakash Hydro-Power Limited and changed its name to Jaiprakash Power Ventures Limited in December 2009. Jaiprakash Power Ventures Limited was incorporated in 1994 and is based in New Delhi, India.",1.307,none,445.0
687,687,AURUM,Aurum PropTech Limited,EQ,19-AUG-2015,INE898S01029,real-estate-services,real-estate,Information Technology,IT Enabled Services,196.86,196.0,192.0,203.9,196.86,196.0,192.0,203.9,69727.0,69727.0,223283.0,38489.0,38489.0,117.65,249.9,214.0688,167.2571,195.21,0.5749092,0.38520622,2.0,169.665,,,26407955.0,29189700.0,65274100.0,0.3771,1735603200.0,1608681600.0,708.7265,1608681600.0,,,,5.0,1,5,1274.2157312,10554167296.0,480600000.0,12.075,3189199872.0,2347800064.0,59.448,225524992.0,,,45.494,4.2908955,5.427275,4.495,46.798,,0.469,,-531600000.0,-13.47,,,-0.22642,0.62936,0.09606,-0.1709,,,"Aurum PropTech Limited engages in the business of software development for the real estate and other services in India. It operates through Software as a Service (SaaS) and Real Estate as a Service segments. The company provides Sell.Do, a customer relationship management for real estate; Nestaway, a rental management platform that enables property owners to discover tenants; Aurum Analytica, a consumer profiles and cohorts, lead generation, data analytics, and broker community platform; AurumLiv that provides consumer experience and real estate services; TheHouseMonk, a platform for booking management, contract administration, and tenant help desk; and TheOfficeMonk, an end-to-end commercial property management software. It offers Integrow Asset Management, a data driven asset management platform for real estate; Aurum WiseX, a real estate investment platform; and Aurum KuberX, a home loan platform. In addition, the company offers HelloWorld, a co-living platform for students and young professionals; BeyondWalls, offers inventory and price information, collaterals, wallets, and other value-added services to the brokers; Aurum instaHome, a property valuations for home sale and resale properties; and Aurum CREX that offers technology-enabled real estate services. The company was formerly known as Majesco Limited and changed its name to Aurum PropTech Limited in October 2021. The company was incorporated in 2013 and is based in Navi Mumbai, India.",0.394,none,1202.0
701,701,MITTAL,Mittal Life Style Limited,EQ,29-APR-2020,INE997Y01027,textile-manufacturing,consumer-cyclical,Consumer Discretionary,Garments & Apparels,2.16,2.16,2.1,2.16,2.16,2.16,2.1,2.16,978346.0,978346.0,1615277.0,2370244.0,2370244.0,1.45,3.25,2.081449,2.0791123,2.11,0.21613836,0.38520622,4.0,2.391,,,167173032.0,308564992.0,308564992.0,,1735603200.0,1543795200.0,0.5,1544400000.0,10:1,1698796800.0,,1.0,1,1,65.1072128,525777408.0,106468000.0,0.36,7825000.0,652737984.0,1.893,8690250.0,,,1.106,1.9077758,0.9974479,0.805,60.502,0.154,-0.137,1.85,23565000.0,-0.16,,,0.0361,0.04399,0.013309999,0.00611,,,"Mittal Life Style Limited engages in supply of bottom weight fabrics and denims in India. It provides fashion fabrics, cotton canvas denims, dupion bottom fabrics, polyester and cotton fabrics, knit fabrics, etc. to textile industry. The company was incorporated in 2005 and is based in Mumbai, India.",0.119,none,1873.0
711,711,SEJALLTD,Sejal Glass Limited,BE,13-DEC-2021,INE955I01044,building-products-equipment,industrials,Industrials,Glass - Industrial,470.8,494.3,481.15,494.3,470.8,494.3,481.15,494.3,15391.0,15391.0,6325.0,10424.0,10424.0,239.1,494.3,370.457,344.5375,494.3,0.95221174,0.38520622,2.0,549.806,,,2040907.0,10100000.0,10207300.0,0.82424,1703980800.0,1221523200.0,184.50185,1221523200.0,0.298062:100,1620345600.0,,10.0,1,10,504.546816,6590460928.0,25746000.0,2.549,1620205952.0,1893897984.0,182.15,236631504.0,,,28.823,17.149498,2.6640654,3.48,27.851,136.0,0.942,154.315,46785000.0,4.65,,106.30107,0.0247,0.35571,0.12494001,0.101160005,,,"Sejal Glass Limited manufactures and sells value added glass in India and internationally. It offers solid, kool, tone, fort, armor, decor, fireban, body tinted, and pyrolytic coated solar control glass. The company was formerly known as Sezal Glass Limited and changed its name to Sejal Glass Limited in March 2014. Sejal Glass Limited was founded in 1991 and is based in Mumbai, India.",-1.187,none,1467.0
717,717,VARDHACRLC,Vardhman Acrylics Limited,EQ,30-SEP-2003,INE116G01013,textile-manufacturing,consumer-cyclical,Consumer Discretionary,Other Textile Products,57.7,57.5,56.4,57.5,57.7,57.5,56.4,57.5,35285.0,35285.0,109498.0,34799.0,34799.0,49.9,74.9,60.2278,59.79875,56.71,0.062980294,0.38520622,2.0,0.469,,,20116704.0,80363696.0,81766704.0,,1577750400.0,1725580800.0,2.0,1725580800.0,,,0.9398,10.0,1,10,455.7425152,3738903808.0,830300032.0,10.331,11400000.0,2737299968.0,33.634,176346256.0,,,29.395,1.9292396,1.6649345,1.366,21.202,8.0,-0.294,8.435,214200000.0,2.66,,21.319548,0.07825,0.36949003,0.06442,0.024719998,,,"Vardhman Acrylics Limited manufactures and supplies acrylic fibers and tows in India. It offers its products under the Varlan brand name. The company was incorporated in 1990 and is headquartered in Ludhiana, India. Vardhman Acrylics Limited operates as a subsidiary of Vardhman Textiles Limited.",0.146,none,1492.0
722,722,VEDL,Vedanta Limited,EQ,13-MAY-1998,INE205A01025,other-industrial-metals-mining,basic-materials,Commodities,Diversified Metals,472.15,472.65,464.0,483.65,472.15,472.65,464.0,483.65,10330911.0,10330911.0,15601271.0,10335594.0,10335594.0,211.2,523.65,467.558,393.71826,480.85,1.2359917,0.38520622,2.0,172.98,,,1534331332.0,3903800064.0,3903800064.0,0.58546,1735603200.0,1725926400.0,20.0,1725926400.0,10:1,1218153600.0,1.5816001,1.0,1,1,187714.2274048,2499576070144.0,125240000512.0,33.763,727709974528.0,1440689946624.0,387.585,393702506496.0,,,82.823,5.8057547,1.3029467,1.735,6.349,0.365,0.057,0.366,52050001920.0,13.9,46.38,34.593525,0.03613,0.51083,0.27327,0.23121999,,,"Vedanta Limited, a diversified natural resources company, explores, extracts, and processes minerals, and oil and gas in India, Europe, China, the United States, Mexico, and internationally. The company operates through seven reportable segments: Copper, Aluminium, Iron Ore, Power, Zinc India, Zinc International, Oil and Gas, and Others. It explores, produces, and sells oil and gas, zinc, lead, silver, copper, aluminum, steel, pig iron, chrome ores, and metallurgical coke. The company also operates a thermal coal-based commercial power facility of 600 megawatts (MW) at Jharsuguda in Odisha; a 1,200 MW thermal coal-based power plants in the Chhattisgarh; 1,980 MW thermal coal- based commercial power facilities in Punjab; wind power plants; a 1,000 MW coal-based power plant at Nellore, Andhra Pradesh; wind power plants; and power plants located at Mettur Dam in the state of Tamil Nadu in southern India. In addition, it manufactures and supplies billets, TMT bars, wire rods, and ductile iron pipes; mechanizes coal handling facilities and upgrades general cargo berth for handling coal at the outer harbor of Visakhapatnam Port on the east coast of India; offers port/berth services; and manufactures glass substrates, semiconductor, display glass panels, ferro alloys, and slag cements. The company was formerly known as Sesa Sterlite Limited and changed its name to Vedanta Limited in March 2015. The company was founded in 1954 and is headquartered in Mumbai, India.",1.382,buy,50.0
