317,317,SUULD,Suumaya Industries Limited,EQ,19-OCT-2020,INE591Q01016,apparel-retail,consumer-cyclical,Fast Moving Consumer Goods,Other Agricultural Products,4.67,4.86,4.66,4.86,4.67,4.86,4.66,4.86,79261.0,79261.0,145365.0,66568.0,66568.0,4.65,11.0,5.0442,7.10875,4.74,-0.42891568,0.38520622,4.0,,,,61313435.0,61135300.0,64417700.0,,,1632787200.0,1.375,1632787200.0,2:1,1648598400.0,,10.0,1,10,28.9781312,3525734656.0,87600000.0,1.294,3292400128.0,12398199808.0,184.564,-15093000192.0,,,-40.96,,0.023372853,0.284,-0.234,,0.719,,-20233900032.0,-188.82,,,-1.632,0.0091699995,-1.21735,-54.586212,,,"Suumaya Industries Limited manufactures, distributes, and retails garments and fabrics. The company operates through three segments: Textile, Retail, and Agri produce. The Textile segment manufactures and retails apparels, PPE kits, and other covid essentials, as well as trades in fabric, yarn, and other textile commodities. The Retail segment engages in retailing of groceries and staples through neighbourhood stores. The Agri produce segment involves in supply chain of various agri commodities, such as wheat, rice, and dal. The company also provides plastics resin/PVC which is used in pipe, wires and cables, synthetic leather, stretch film, and floor applications. The company was formerly known as Suumaya Lifestyle Limited and changed its name to Suumaya Industries Limited in February 2021. Suumaya Industries Limited was founded in 1985 and is based in Mumbai, India.",0.339,none,1940.0
321,321,OMKARCHEM,Omkar Speciality Chemicals Limited,BZ,10-FEB-2011,INE474L01016,specialty-chemicals,basic-materials,Commodities,Specialty Chemicals,9.18,9.35,8.73,9.35,9.18,9.35,8.73,9.35,9816.0,9816.0,26483.0,23598.0,23598.0,5.65,11.39,9.5108,8.04705,8.95,0.005617976,0.38520622,2.0,,,,17551799.0,20578000.0,20639300.0,0.14709,1609372800.0,1473897600.0,1.5,1473897600.0,,,,10.0,1,10,18.4173104,2460344576.0,3333000.0,0.162,2279497984.0,193578000.0,9.414,-55499000.0,,,-83.011,,0.9514155,12.71,-44.331,,-0.492,,-132226000.0,-5.57,,,-0.68306,0.29202998,-0.2867,-0.32417,,,"Omkar Speciality Chemicals Limited manufactures and sells specialty chemicals and intermediates for chemical and allied industries in India and internationally. It provides a range of organic, inorganic, and organo inorganic intermediates. The company offers selenium derivatives, iodine derivatives, resolving agents, and advance intermediates, as well as tartaric acid derivatives and other intermediates. Its products have applications in the pharmaceuticals, neutraceuticals, fragrances and flavours, foods, poultry and veterinary, glass and ceramics, and electro plating segments. The company also exports its products to Europe, Canada, Asia, South America, and Australia. Omkar Speciality Chemicals Limited was incorporated in 1983 and is based in Thane, India.",0.078,buy,1951.0
324,324,KREBSBIO,Krebs Biochemicals and Industries Limited,EQ,03-JAN-1996,INE268B01013,drug-manufacturers-specialty-generic,healthcare,Healthcare,Pharmaceuticals,83.29,81.62,81.62,83.29,83.29,81.62,81.62,83.29,11515.0,11515.0,14549.0,3337.0,3337.0,60.35,121.55,83.4602,76.24015,82.0,0.15411687,0.38520622,2.0,,,,4692558.0,21560600.0,22244200.0,0.77554,1735603200.0,1126656000.0,2.892983,1126656000.0,,,,10.0,1,10,182.4024448,3699713536.0,1374000.0,0.064,1934295040.0,527292000.0,24.495,-77922752.0,,,-55.459,,3.4592302,7.016,-47.479,,0.218,,-195666000.0,-9.09,,,-0.37108,0.85815,-0.14778,-0.29894,,,"Krebs Biochemicals & Industries Limited engages in the manufacture and sale of active pharmaceutical ingredients in India. The company develops biotech processes for application in medicine, agriculture, and industry. Its products include androstenedione, lovastatin, and simvastatin, which are used for anti-cholesterol and steroid intermediate applications. The company also develops various products, including amlodipine, cetirizine, orlistat, serratiopepetidase, telmisartan, and phenylephrine for anti-hypertension, anti-histamine, anti-obesity, anti-inflammatory, and cold and cough applications. In addition, it offers contract manufacturing services for large pharmaceutical and multinational companies. The company was incorporated in 1991 and is based in Visakhapatnam, India.",0.468,none,1723.0
333,333,UNIONBANK,Union Bank of India,EQ,24-SEP-2002,INE692A01016,banks-regional,financial-services,Financial Services,Public Sector Bank,111.53,111.16,110.27,114.27,111.53,111.16,110.27,114.27,11256773.0,11256773.0,10713713.0,8854667.0,8854667.0,91.25,172.5,120.6038,138.30174,112.22,0.18126321,0.38520622,2.0,,,,1473439402.0,7633610240.0,7642449920.0,0.74757004,,1721347200.0,3.6,1721347200.0,,,0.1568,10.0,1,10,85763.5749888,-46250287104.0,1159023558656.0,151.832,255089606656.0,483253157888.0,65.267,,,,134.738,0.8328756,1.7747132,-0.096,,-0.004,0.028,0.113,141672480768.0,19.13,17.46,5.866179,0.29316,,,0.43215,0.0104600005,0.1533,"Union Bank of India provides various banking products and services. It operates through four segments: Treasury Operations, Retail Banking Operations, Corporate and Wholesale Banking, and Other Banking Operations. The company offers savings and current accounts; term deposits; home, vehicle, education, personal, agriculture, and gold loans; loans against the property; and loans for senior citizen and pensioners, as well as products and loans for micro, small, and medium enterprises. It also provides mutual funds; life, non-life, and health insurance products; demat and online trading services; tax saving deposits; government saving schemes; and safe deposit locker and cheque collection services. In addition, the company offers corporate loans, that includes export scheme, line of credit, trade finance, working capital, project financing, and channel finance; debt structuring/restructuring, loan syndication, and structured finance services; cash management, ECGC cover, and foreign exchange services, as well as derivatives; export and import finance services; NRI banking services; and treasury and other products, and remittance services. Further, it provides app, internet, self-service, ATM, and SMS banking services; point of sale terminal and immediate payment services; and debit, credit, gift, and payroll cards. The company was incorporated in 1919 and is headquartered in Mumbai, India.",1.072,hold,124.0
342,342,IL&FSTRANS,IL&FS Transportation Networks Limited,BZ,30-MAR-2010,INE975G01012,infrastructure-operations,industrials,Industrials,Civil Construction,5.77,5.65,5.65,5.65,5.77,5.65,5.65,5.65,14822.0,14822.0,46472.0,53483.0,53483.0,3.8,8.62,6.1922,5.5277,5.65,0.04629624,0.38520622,2.0,385.701,0.016,0.075,81262995.0,328960000.0,328960000.0,0.74261004,1609372800.0,1469750400.0,2.0,1469750400.0,,,,10.0,1,10,185.8624,277504524288.0,9285300224.0,28.226,276430585856.0,995100032.0,3.025,-1182000000.0,-5176137728.0,-192500000.0,-451.717,,1.867776,278.871,-234.775,,0.76,0.033,-9729500160.0,-37.98,,,,-0.46227002,-1.18782,0.34368,-0.02629,,"IL&FS Transportation Networks Limited develops, operates, manages, and maintains transportation infrastructure projects in India and internationally. The company undertakes highway, flyover, bridge, road, metro rail, city bus, and border check post projects. It also provides operation, maintenance, and allied services; and toll collection services for toll road projects. The company was incorporated in 2000 and is based in Mumbai, India. IL&FS Transportation Networks Limited operates as a subsidiary of Infrastructure Leasing and Financial Services Limited.",0.522,buy,1719.0
344,344,REDINGTON,Redington Limited,EQ,15-FEB-2007,INE891D01026,information-technology-services,technology,Services,Trading & Distributors,174.08,174.3,171.0,175.74,174.08,174.3,171.0,175.74,536050.0,536050.0,1091630.0,816295.0,816295.0,136.2,237.55,192.7876,203.006,174.9,0.2260778,0.38520622,2.0,37.627,,,584032406.0,781774016.0,782537984.0,0.26984,1735603200.0,1720137600.0,6.2,1720137600.0,2:1,1629244800.0,0.3985,2.0,1,2,13673.2270592,153324044288.0,16122699776.0,20.623,29582100480.0,895643615232.0,1146.232,18756425728.0,,,96.559,1.8113278,0.15266371,0.171,8.174,-0.009,0.004,-0.011,12158799872.0,15.57,15.13,11.233141,0.01358,0.05709,0.02094,0.015039999,,,"Redington Limited provides supply chain solutions in India and internationally. It offers hyperconverged infrastructure, enterprise storage, all-flash, storage visualization, and fault tolerant solutions; enterprise networking and WAN solutions; AI and automation, software applications, security, digital printing, data and analytics, infrastructure, 3D printing, network modernization, cyber security, solar, gaming, AE and VR, home automation, wearables, and displays; and next-gen firewall, web application firewall, secure access service edge, endpoint security, and identity and access management solutions. The company also engages in the distribution of information technology, mobility, and other technology products comprising laptops, tablets, servers, software, notebooks, workstations, networking, power supply, desktops, accessories, components, and smart lighting products. In addition, it offers technology services comprising consulting as a service, training as a service, infrastructure transformation, software consulting, virtualization and application delivery, networking, cybersecurity, and cloud services; and logistics services, such as warehousing, reverse logistics, in plant logistics and project management, supply chain consulting, ecommerce, mission-critical, and transportation services. Further, the company provides supply chain management, sourcing and procurement, sales and lead generation, and finance and accounting services; and financial services comprising channel financing, project financing, leasing, credit card-based financing, and but now and pay later services, as well as cloud consulting, managed, and security solutions. It serves healthcare, finance, print services providers, hospitality, manufacturing, education, government, retail, and IT/ITes industries. The company was formerly known as Redington (India) Limited and changed its name to Redington Limited. Redington Limited was incorporated in 1961 and is headquartered in Chennai, India.",0.959,none,447.0
381,381,MIRCELECTR,MIRC Electronics Limited,EQ,24-MAY-2004,INE831A01028,furnishings-fixtures-appliances,consumer-cyclical,Consumer Discretionary,Consumer Electronics,22.45,22.5,22.15,23.05,22.45,22.5,22.15,23.05,411386.0,411386.0,1479463.0,285132.0,285132.0,15.5,32.99,25.3046,22.74145,22.26,0.19677424,0.38520622,2.0,80.909,,,95169800.0,230952992.0,233960992.0,0.56741,1735603200.0,1307577600.0,0.88806,1307577600.0,2:1,1060732800.0,,1.0,1,1,520.797184,5776500224.0,159900000.0,0.727,1039200000.0,10123599872.0,44.271,-395064736.0,,,5.554,4.007922,0.51443875,0.571,-14.622,,0.242,,-555500032.0,-2.4,,,-0.05487,0.09417,-0.03902,0.01273,,,"MIRC Electronics Limited manufactures, trades in, and markets electronics and consumer durables in India. The company offers LED and LCD televisions, air conditioners, washing machines, microwave ovens, DVD home theatre systems, mobile phones, projector systems, LED lights, refrigerators, healthcare, air cooler, dishwashers, and LED lights under the Onida and IGO brands. It also exports its products. The company was incorporated in 1981 and is based in Mumbai, India.",0.954,none,1456.0
409,409,DIACABS,Diamond Power Infrastructure Limited,BE,15-SEP-2023,INE989C01020,specialty-industrial-machinery,industrials,Industrials,Other Electrical Equipment,1817.9,1798.0,1740.0,1899.95,1817.9,1798.0,1740.0,1899.95,39671.0,39671.0,18248.0,31037.0,31037.0,65.15,1899.95,1462.952,942.08777,1844.65,27.31389,0.38520622,2.0,,,,4960982.0,52697100.0,53289900.0,0.92614,,1380153600.0,100.0,1380153600.0,1:100,1663113600.0,,10.0,1,10,9830.121472,120725897216.0,98362000.0,1.865,23553042432.0,4927840256.0,93.416,554751488.0,,,-185.011,,19.948133,24.499,217.622,1.99,2.007,2.0,280636992.0,5.35,,344.7944,0.056950003,0.23506,0.11257,0.08595,,,"Diamond Power Infrastructure Limited manufactures and sells power transmission equipment. The company provides power cables that includes low voltage, high voltage, and extra high voltage cables. It also offers transmission towers; and transmission and distribution conductors, such as aluminium wire rods, alloy wire rods, aluminium conductors, aluminum alloy conductors, aluminium conductor steel and alloy reinforced, aluminium alloy conductor steel reinforced high conductivity alloy conductors al  59, and stay wire / galvanised steel earth wire. In addition, the company provides turnkey services. The company offers its products through distributors in India, as well as exports its products and solutions under the Dicabs brand. The company was formerly known as Diamond Cables Limited. Diamond Power Infrastructure Limited was founded in 1970 and is headquartered in Ahmedabad, India.",-1.452,none,523.0
443,443,RAJRILTD,Raj Rayon Industries Limited,BE,16-MAR-2022,INE533D01032,textile-manufacturing,consumer-cyclical,Consumer Discretionary,Other Textile Products,23.66,24.11,23.18,24.11,23.66,24.11,23.18,24.11,11000.0,11000.0,46962.0,26721.0,26721.0,15.0,33.9,24.4672,22.548,23.46,-0.2825688,0.38520622,2.0,162.962,,,12532393.0,556081984.0,560281984.0,0.97932,1672444800.0,1315267200.0,3.0,1315267200.0,1:100,1635120000.0,,1.0,1,1,1304.56832,15067357184.0,294887008.0,0.509,1763264000.0,7942517248.0,12.233,273326016.0,,,2.022,11.602373,1.6425124,1.897,55.126,,0.321,,2722000.0,-0.02,,,0.00034000003,0.19428,0.03441,0.00118,,,"Raj Rayon Industries Limited manufactures and trades in polyester chips, and polyester and processed yarns in India. The company offers trilobal, cationic, cotluk, colored, fire retardant, anti-microbial, tri-lobal, and octa-lobal yarns. It also offers full dull, semi dull, doped dyed, micro filaments, non-intermingle, low/slight intermingle, and high intermingle yarns. In addition, the company provides partially oriented yarn and drawn textured yard. Raj Rayon Industries Limited exports its products to Brazil, Chile, Colombia, Egypt, Guatemala, Iran, Mexico, Morocco, Peru, Poland, Spain, Syria, Thailand, Vietnam, and internationally. The company was formerly known as Raj Rayon Limited and changed its name to Raj Rayon Industries Limited in August 2010. Raj Rayon Industries Limited was incorporated in 1993 and is based in Silvassa, India.",-1.856,none,1191.0
446,446,VSTIND,VST Industries Limited,EQ,05-SEP-2003,INE710A01016,tobacco,consumer-defensive,Fast Moving Consumer Goods,Cigarettes & Tobacco Products,374.8,372.95,365.3,372.95,374.8,372.95,365.3,372.95,178332.0,178332.0,1262188.0,369314.0,369314.0,287.18182,486.15,400.4519,365.15158,368.0,0.24847722,0.38520622,2.0,,,,21190937.0,169544000.0,172840000.0,0.62628,1735603200.0,1718323200.0,150.0,1718323200.0,11:1,1725580800.0,1.7066001,10.0,1,10,6247.6832768,59679318016.0,2821799936.0,16.614,,14085099520.0,97.122,3211138816.0,,,73.722,4.9917254,4.4356685,4.237,18.585,-0.36,-0.036,-0.36,2714500096.0,15.97,266.8,23.043205,0.19272,0.45814,0.22798,0.19668,,,"VST Industries Limited engages in the manufacturing, trading, and marketing of cigarettes, tobacco, and tobacco products in India and internationally. It also sells unmanufactured tobacco. The company was formerly known as Vazir Sultan Tobacco Company Limited and changed its name to VST Industries Limited in April 1983. VST Industries Limited was incorporated in 1930 and is based in Hyderabad, India.",0.392,buy,668.0
489,489,JETAIRWAYS,Jet Airways (India) Limited,BZ,14-MAR-2005,INE802G01018,airlines,industrials,Services,Airline,39.86,39.95,38.1,40.18,39.86,39.95,38.1,40.18,39316.0,39316.0,50379.0,35456.0,35456.0,37.52,65.9,39.802,45.43785,38.49,-0.35419464,0.38520622,2.0,,,,57930653.0,113597000.0,116224000.0,0.74991,,1189641600.0,6.0,1189641600.0,,,,10.0,1,10,437.2348928,36511416320.0,3471800064.0,30.571,35612098560.0,747600000.0,6.582,-5059800064.0,,,-1542.254,,5.8485136,48.838,-7.216,,1.998,,-6625999872.0,-58.33,,,,0.70425004,,-1.33112,,,"Jet Airways (India) Limited provides passenger and cargo air transportation services. It also provides aircraft leasing services. Jet Airways (India) Limited was incorporated in 1992 and is based in Mumbai, India.",1.333,buy,1501.0
499,499,PREMIER,Premier Limited,BE,03-APR-1996,INE342A01018,specialty-industrial-machinery,industrials,Industrials,Industrial Products,3.93,3.93,3.93,3.93,3.93,3.93,3.93,3.93,2600.0,2600.0,6565.0,4094.0,4094.0,2.45,5.8,4.3852,3.9513,3.93,-0.1068182,0.38520622,4.0,,,,18121143.0,30372600.0,30759000.0,0.39854,,1409184000.0,3.0,1409184000.0,,,,10.0,1,10,12.0882872,1746631424.0,156446000.0,5.133,1783305984.0,,,-10285750.0,,,-108.153,,,,-169.811,,,,-91200000.0,-3.0,,,,,,,,,"Premier Limited engages in the engineering businesses in India. The company manufactures CNC Machines and mechanical components for the wind energy and infrastructure sectors. It also offers professional and engineering related services. Premier Limited was formerly known as The Premier Automobiles Ltd. and changed its name to Premier Limited in March 2005. The company was incorporated in 1944 and is based in Mumbai, India.",0.799,none,1966.0
511,511,NOIDATOLL,Noida Toll Bridge Company Limited,BE,06-DEC-2002,INE781B01015,infrastructure-operations,industrials,Services,Road Assets - Toll Annuity Hybrid-Annuity,14.01,14.0,13.93,14.0,14.01,14.0,13.93,14.0,43373.0,43373.0,112308.0,59535.0,59535.0,7.45,17.06,14.3604,11.5229,13.93,0.6104046,0.38520622,2.0,32.631,,,110453091.0,186195008.0,186195008.0,0.43103,1672444800.0,1474416000.0,1.5,1474416000.0,,,,10.0,1,10,259.3696512,2830528000.0,405103008.0,2.197,667081024.0,276031008.0,1.485,68259248.0,,,10.989,1.2676313,9.396396,10.254,41.467,,2.091,,-278985984.0,-1.5,,,-1.01071,0.43278998,0.24729,-0.59669995,,,"Noida Toll Bridge Company Limited engages in the development, establishment, construction, operation, and maintenance of Delhi Noida toll bridge on a build-own-operate-transfer basis in India. The company also provides space rentals for advertisements and offices. Noida Toll Bridge Company Limited was founded in 1976 and is based in Noida, India.",0.459,none,1638.0
521,521,SELMC,SEL Manufacturing Company Limited,EQ,26-OCT-2021,INE105I01020,textile-manufacturing,consumer-cyclical,Consumer Discretionary,Other Textile Products,48.9,50.0,47.0,50.0,48.9,50.0,47.0,50.0,17711.0,17711.0,88458.0,17398.0,17398.0,46.09,111.4,59.8452,70.5063,47.48,-0.55667603,0.38520622,2.0,,0.014,0.099,8283675.0,33134700.0,33295200.0,0.91936,1735603200.0,1202169600.0,1000.0,1202169600.0,1:1000,1615248000.0,,10.0,1,10,158.0856064,10938621952.0,33922000.0,1.024,9399308288.0,3746078976.0,113.051,-549235968.0,548653760.0,371904000.0,-17.018,,0.42200285,2.92,-19.916,,-0.864,,-1929528064.0,-49.08,,,-0.51508,0.111379996,-0.14661999,-0.94314003,-0.082100004,-4.1932697,"SEL Manufacturing Company Limited operates as a textile company primarily in India. Its products portfolio includes knitted garments, terry towels, knitted and processed fabrics, and various yarns. The company was founded in 1969 and is based in Ludhiana, India.",-0.951,none,1761.0
574,574,A2ZINFRA,A2Z Infra Engineering Limited,BE,23-DEC-2010,INE619I01012,engineering-construction,industrials,Industrials,Civil Construction,18.01,18.0,17.41,18.91,18.01,18.0,17.41,18.91,369835.0,369835.0,196775.0,449063.0,449063.0,8.25,24.57,17.81,16.59665,18.55,1.1199999,0.38520622,2.0,948.741,,,108563803.0,176120000.0,176804000.0,0.36992002,,1316649600.0,2.0,1316649600.0,,,,10.0,1,10,326.702592,5104780288.0,28604000.0,0.162,1979510016.0,3770310912.0,22.058,-543674752.0,,,1.859,9.978483,0.86651367,1.354,-9.389,,-0.122,,-47996000.0,-0.27,,,-0.01273,0.12818,-0.1442,0.02957,,,"A2Z Infra Engineering Limited offers engineering, procurement, construction, and facility management services in India and internationally. The company operates through Engineering Services, Facility Management Services, Municipal Solid Waste Management, Power Generation Projects, and Others segments. It offers integrated design, testing, installation, construction, and commissioning services, as well as engages in telecom infrastructure projects. In addition, the company engages in rural and railway electrification, reduction of AT&C losses, and feeder renovation and segregation; underground cabling; installation of high and low voltage distribution systems; erection of distribution lines; renewable energy and construction of substations and transmission lines; and provision of operation and maintenance services. Further, it provides and optical fiber cable NLD/access networking construction and maintenance, network integration, telecom infrastructure operation and maintenance, material planning and project management, and engineering construction and infrastructure services. The company collects, transports, treats, and disposes solid waste; trades in goods; rents equipment; manufactures electrical equipment; and provides operation and maintenance services, etc. Additionally, it provides facility management services, such as clean train station scheme, mechanized cleaning, intensive rake cleaning, hospitality and hygiene, and board housekeeping services to Indian railways; and deep cleaning, technical, and business support services, as well as offers renewable energy generation services. The company develops ecotech green toilet and green toilet projects. A2Z Infra Engineering Limited formerly known as A2Z Maintenance & Engineering Services Limited and changed its name to A2Z Infra Engineering Limited in October 2014. The company was incorporated in 2002 and is based in Gurugram, India.",0.597,none,1585.0
582,582,RADIANTCMS,Radiant Cash Management Services Limited,EQ,04-JAN-2023,INE855R01021,specialty-business-services,industrials,Services,Diversified Commercial Services,80.07,80.0,78.7,81.15,80.07,80.0,78.7,81.15,277463.0,277463.0,379270.0,300834.0,300834.0,71.1,102.0,81.5826,83.4929,80.1,-0.15372425,0.38520622,2.0,12.894,,,39204730.0,106708000.0,108076000.0,0.58792,1735603200.0,1724889600.0,2.5,1724889600.0,,,0.5176,1.0,1,1,856.8617472,7298107904.0,1641720064.0,15.28,327030016.0,3928549888.0,36.516,599920000.0,,,23.32,3.43482,2.1811147,1.858,12.165,-0.246,0.07,-0.239,413489984.0,3.86,,20.751295,0.10524999,0.99669,0.15271,0.14246,,,"Radiant Cash Management Services Limited engages in the provision of cash logistics and other related services in India. The company offers cash pick-up and delivery, network currency management, cash processing, cash vans/cash-in-transit, and other value-added services, such as man-behind counter and currency chest operations. It also provides instant credit services through platform. The company serves banks, NBFCs, microfinance institutions, logistics companies, e-commerce businesses, restaurants, jewelry stores, electronics retailers, auto parts suppliers, petrol pumps, furniture stores, supermarkets, salons, sports goods retailers, footwear retailers, pharmacies, diagnostics/labs, apparel and lifestyle retailers, hospitals, cafes, sweet shops, grocery stores, auto service stations, retail stores, MSME businesses, and cinemas. The company was incorporated in 2005 and is headquartered in Chennai, India.",,none,1317.0
617,617,MOHITIND,Mohit Industries Limited,EQ,14-MAR-2013,INE954E01012,textile-manufacturing,consumer-cyclical,Consumer Discretionary,Other Textile Products,28.18,28.5,26.85,28.5,28.18,28.5,26.85,28.5,47886.0,47886.0,22372.0,28223.0,28223.0,16.5,36.75,27.5944,24.2127,27.27,0.5024793,0.38520622,2.0,19.184,,,5510562.0,14157600.0,14178300.0,0.57433,1672444800.0,1470873600.0,1.0,1470873600.0,,,,10.0,1,10,38.664224,906769024.0,1741000.0,0.123,524003008.0,1160297984.0,81.968,15672250.0,,,185.251,0.14720568,0.33322668,0.781,57.858,,-0.424,,-16580000.0,-1.17,,,-0.01429,0.23369,0.01351,0.0082,,,"Mohit Industries Limited engages in manufacturing texturized yarn from partially oriented yarn and weaving of yarn to grey cloth in India. It offers yarn, grey, and fabric products; and exports polyester draw texturized yarns. The company also exports its products to West and South East Asia, the United Kingdom, Italy, Spain, Germany, Mexico, Thailand, Peru, Bangladesh, South Africa, Egypt, Brazil, Colombia, Guatemala, Vietnam, Indonesia, Bulgaria, Uzbekistan, Chili, and internationally. The company was incorporated in 1991 and is headquartered in Surat, India.",0.418,none,1925.0
