272,272,COALINDIA,Coal India Limited,EQ,04-NOV-2010,INE522F01014,thermal-coal,energy,Energy,Coal,417.15,420.0,413.5,424.9,417.15,420.0,413.5,424.9,7785617.0,7785617.0,8734144.0,8830042.0,8830042.0,338.05,543.55,461.75,473.105,415.2,0.21920216,0.31326675,2.0,8.053,1.032,1.809,2270666927.0,6162729984.0,6162729984.0,0.63137,1735603200.0,1730764800.0,15.75,1730764800.0,,,0.4356,10.0,1,10,255876.5563904,2285983498240.0,370303696896.0,60.117,78161600512.0,1326622703616.0,215.284,472389713920.0,115140083712.0,250836598784.0,156.171,2.6586242,1.9287816,1.723,4.839,-0.074,-0.09,-0.075,360741896192.0,58.53,25.43,7.0937986,0.27193,0.8557,0.35608003,0.24639,0.10689,0.43018,"Coal India Limited, together with its subsidiaries, engages in the production and marketing of coal and coal products in India. The company offers coking coal for use in steel making and metallurgical industries, and for hard coke manufacturing; and semi coking coal that is used as blend-able coal in steel making, merchant coke manufacturing, and other metallurgical industries. It also provides non-coking coal that is used as thermal grade coal for power generation, as well as for cement, fertilizer, glass, ceramic, paper, chemical, and brick manufacturing, and other heating purposes. In addition, the company offers washed and beneficiated non-coking coal for use in power generation; beneficiated non-coking coal for use in cement, sponge iron, and other industrial plants; and middling products for power generation and by domestic fuel plants, brick manufacturing units, cement plants, industrial plants, etc. Further, it provides rejects that are used for fluidized bed combustion boilers for power generation, road repairs, briquette making, land filling, etc.; CIL/LTC coke used in furnaces and kilns of industrial units, as well as used as domestic fuel by halwais, hotels, etc.; coal/coke fines used in industrial furnaces, as well as for domestic purposes; and tar, heavy oil, light oil, and soft pitch used in furnaces and boilers of industrial plants, as well as power houses, oil, dye, pharmaceutical industries, etc. The company was incorporated in 1973 and is headquartered in Kolkata, India.",0.244,buy,11.0
309,309,ASMS,Bartronics India Limited,EQ,09-FEB-2023,INE855F01042,information-technology-services,technology,Information Technology,IT Enabled Services,18.98,19.04,18.99,20.1,18.98,19.04,18.99,20.1,320449.0,320449.0,590865.0,224879.0,224879.0,15.67,28.75,21.1158,20.7688,19.28,0.06033516,0.31326675,2.0,,,,42901525.0,304576992.0,305219008.0,0.85568,,1316563200.0,1.0,1316563200.0,,,,1.0,1,1,588.4622848,5494231552.0,103300000.0,0.347,,503353984.0,2.127,2396250.0,,,0.87,22.160921,11.690824,10.915,2292.846,2.0,0.124,0.953,18178000.0,0.11,,175.27274,0.03611,0.08439,0.00476,0.01616,,,"Bartronics India Limited provides automatic identification and data capture solutions in India and internationally. The company provides banking services; health care analytics; and Microsoft technologies, POS - linux development, power BI analytics, and app development. It also offers E- government solutions that includes health insurance projects, public distribution system, smart card based driving license and vehicle registration, and pilgrim management system. In addition, the company provides internet of things solutions in healthcare, agriculture, smart cities, and industrial automation industries. The company was formerly known as Super Bartronics Limited and changed its name to Bartronics India Limited in January 1996. Bartronics India Limited was incorporated in 1990 and is headquartered in Hyderabad, India.",,none,433.0
312,312,GVKPIL,GVK Power & Infrastructure Limited,BE,27-FEB-2006,INE251H01024,utilities-independent-power-producers,utilities,Industrials,Civil Construction,5.05,5.1,5.0,5.15,5.05,5.1,5.0,5.15,1384909.0,1384909.0,1387646.0,1632421.0,1632421.0,4.52,17.0,5.6458,8.4655,5.12,-0.5144231,0.31326675,2.0,817.233,,,728716214.0,1579209984.0,1594969984.0,0.5425,1703980800.0,1162771200.0,0.25,1162771200.0,10:1,1202428800.0,,1.0,1,1,813.3580288,53192515584.0,18231699456.0,11.446,45991399424.0,8037300224.0,5.113,6097399808.0,,,-7.385,,1.0119791,6.618,8.724,,-0.552,,-1094200064.0,3.48,-1.2,1.4712644,-0.13614,1.0,0.75864,0.54526,,,"GVK Power & Infrastructure Limited, together with its subsidiaries, engages in the energy, transportation, hospitality, and life sciences businesses in India and internationally. It operates through Power, Roads, and Other segments. The company constructs and operates gas, hydro, and thermal power plants, highway projects; explores coal mines; and invests in SEZ and other assets, as well as generates power. GVK Power & Infrastructure Limited was founded in 1992 and is headquartered in Secunderabad, India.",0.083,none,405.0
316,316,MANAKSIA,Manaksia Limited,EQ,08-JAN-2008,INE015D01022,metal-fabrication,industrials,Industrials,Iron & Steel Products,88.71,89.0,87.3,90.5,88.71,89.0,87.3,90.5,59325.0,59325.0,191059.0,45830.0,45830.0,85.5,148.55,95.4768,101.80985,87.91,-0.32820898,0.31326675,2.0,12.81,,,15700425.0,65534000.0,65586500.0,0.76039004,1735603200.0,1694649600.0,3.0,1694649600.0,,,0.2786,2.0,1,2,576.1094144,1637382272.0,5086353920.0,77.618,742310976.0,5709416960.0,87.11,786688768.0,,,83.979,1.0468094,1.0090512,0.287,2.081,-0.226,-0.554,-0.225,705937024.0,9.48,,9.273208,0.12364,0.33868998,0.13779001,0.12037,,,"Manaksia Limited, together with its subsidiaries, engages in the manufacture, sale, and trading of metal products in India and internationally. The company operates through Metal Products, Packaging, and Others segments. It provides value-added steel products, such as cold rolled sheets, galvanised corrugated sheets, galvanised plain sheets, colour coated (pre-painted) sheets, PP caps, and crown closures; EP liners, washers, and EP sheets; roll on pilfer proof closures, aluminium and steel galvanized sheets, coils; colour coated aluminum sheets and coils for roofing and cladding; pre painted profile sheets; metal packaging products and containers; and paper packaging products and nonferrous alloys for the automotive industry. In addition, the company offers sponge iron and steel ingots; aluminum roofing sheets; direct reduced iron and sponge iron products; and pre-painted profiled sheets, roofing products, and galvanised steel under the Sumo brand; and kraft paper products. Further, it engages in the trading of spare parts of machine, including paper machine and consumables. The company was formerly known as Hindusthan Seals Ltd. Manaksia Limited was incorporated in 1984 and is headquartered in Kolkata, India.",0.698,none,434.0
325,325,VEDL,Vedanta Limited,EQ,13-MAY-1998,INE205A01025,other-industrial-metals-mining,basic-materials,Commodities,Diversified Metals,445.8,452.0,448.9,456.35,445.8,452.0,448.9,456.35,10792704.0,10792704.0,12042919.0,8115855.0,8115855.0,230.75,523.65,470.838,419.674,451.85,0.91043496,0.31326675,2.0,168.974,0.312,0.708,1598760923.0,3904019968.0,3928110080.0,0.58542997,1735603200.0,1725926400.0,20.0,1725926400.0,10:1,1218153600.0,1.541,1.0,1,1,176403.1463424,2393660981248.0,223930007552.0,57.938,797490020352.0,1426939969536.0,379.557,370809995264.0,63813750784.0,398359986176.0,96.993,4.6585836,1.2362338,1.677,6.455,,-0.036,,113399996416.0,29.87,49.43,15.127217,0.07947,0.49652,0.25986,0.19187,0.08351,0.35532,"Vedanta Limited, a diversified natural resources company, explores, extracts, and processes minerals, and oil and gas in India, Europe, China, the United States, Mexico, and internationally. The company operates through seven reportable segments: Copper, Aluminium, Iron Ore, Power, Zinc India, Zinc International, Oil and Gas, and Others. It explores, produces, and sells oil and gas, zinc, lead, silver, copper, aluminum, steel, pig iron, chrome ores, and metallurgical coke. The company also operates a thermal coal-based commercial power facility of 600 megawatts (MW) at Jharsuguda in Odisha; a 1,200 MW thermal coal-based power plants in the Chhattisgarh; 1,980 MW thermal coal- based commercial power facilities in Punjab; wind power plants; a 1,000 MW coal-based power plant at Nellore, Andhra Pradesh; wind power plants; and power plants located at Mettur Dam in the state of Tamil Nadu in southern India. In addition, it manufactures and supplies billets, TMT bars, wire rods, and ductile iron pipes; mechanizes coal handling facilities and upgrades general cargo berth for handling coal at the outer harbor of Visakhapatnam Port on the east coast of India; offers port/berth services; and manufactures glass substrates, semiconductor, display glass panels, ferro alloys, and slag cements. The company was formerly known as Sesa Sterlite Limited and changed its name to Vedanta Limited in March 2015. The company was founded in 1954 and is headquartered in Mumbai, India.",1.426,none,15.0
329,329,SETCO,Setco Automotive Limited,BE,01-JUL-2016,INE878E01021,auto-parts,consumer-cyclical,Consumer Discretionary,Auto Components & Equipments,10.33,10.74,10.1,10.75,10.33,10.74,10.1,10.75,136375.0,136375.0,99783.0,103637.0,103637.0,6.15,15.82,11.1042,11.09875,10.33,0.38657713,0.31326675,2.0,,,,52304886.0,133767000.0,134544000.0,0.60546,1735603200.0,1568851200.0,1.0,1568851200.0,,,,2.0,1,2,138.181312,11074700288.0,144100000.0,1.079,9878299648.0,6471399936.0,48.37,797753728.0,,,-35.188,,0.21352614,1.711,13.882,,0.12,,-1109100032.0,-7.9,,,-0.17138,0.49905998,0.12327,0.06889,,,"Setco Automotive Limited, together with its subsidiaries, engages in the manufacture and sale of clutches and other automotive component in India. The company offers brake lining, clutch, flywheel, lubricants, universal joint, and release bearing assembly products under the LIPE and Lava Cast brand names. It also exports its products. The company was formerly known as Gujrat Setco Clutch Limited and changed its name to Setco Automotive Limited in November 2005. Setco Automotive Limited was incorporated in 1982 and is based in Mumbai, India.",1.361,none,545.0
332,332,ZENITHSTL,Zenith Steel Pipes & Industries Limited,EQ,30-APR-2007,INE318D01020,steel,basic-materials,Industrials,Iron & Steel Products,9.04,9.25,8.62,9.25,9.04,9.25,8.62,9.25,120929.0,120929.0,145221.0,126473.0,126473.0,5.55,15.45,9.6232,9.25535,8.92,0.44640005,0.31326675,2.0,,,,84201883.0,142280000.0,142752992.0,0.43575,1451520000.0,1278460800.0,0.5,1278460800.0,1.2:1,1281484800.0,,10.0,1,10,126.9137664,3459214336.0,10901000.0,0.074,2151534080.0,1473262976.0,10.416,-16145500.0,,,-18.053,,0.8614468,2.348,-214.253,,0.168,,-516000.0,0.5,,17.84,-0.00171,0.48568,-0.01096,-0.10998,,,"Zenith Steel Pipes & Industries Limited, together with its subsidiaries, manufactures and sells steel pipes in India and internationally. The company offers electric resistance welded black and galvanized pipes; and helical submerged arc welded pipes. Its products are used for various applications, such as agriculture and irrigation water distribution, sprinklers, drill rods, bore-well, construction water distribution, space frames, fences, firefighting and chilled water systems, structural scaffolding and props, green house, industrial general engineering, container making, distribution of gas and crude, transportation of raw and potable water, poles, transmission tower, transportation of oil and gas, transportation of sewage disposal irrigation, piling, ash/slurry transportation, and electricity conduits, as well as the auto industry. The company exports its products to approximately 79 countries, including the United States. The company was formerly known as Zenith Birla (India) Limited and changed its name to Zenith Steel Pipes & Industries Limited in July 2020. Zenith Steel Pipes & Industries Limited was incorporated in 1960 and is based in Mumbai, India.",0.001,none,549.0
333,333,HEG,HEG Limited,EQ,10-MAY-1995,INE545A01016,electrical-equipment-parts,industrials,Industrials,Electrodes & Refractories,416.25,416.25,414.95,445.0,416.25,416.25,414.95,445.0,646035.0,646035.0,1651247.0,188273.0,188273.0,321.0,548.6,450.4468,431.2174,438.3,0.2702167,0.31326675,2.0,12.7,0.894,2.179,61905077.0,192978000.0,193167008.0,0.5955,1735603200.0,1722384000.0,22.5,1722384000.0,5:1,1729209600.0,0.3039,10.0,1,10,8459.2328704,81430732800.0,4611299840.0,23.875,5645199872.0,22576136192.0,117.024,2745899008.0,-993436352.0,2996516096.0,230.141,1.9044845,3.74698,3.607,29.655,-0.144,-0.006,-0.143,1818990976.0,14.82,38.18,29.574898,0.080570005,0.5125,0.12163,0.15006,0.00906,0.04137,"HEG Limited manufactures and sells graphite electrodes in India and internationally. The company operates through Graphite Electrodes and Power Generation segments. It provides ultra-high power and high power electrodes; graphite electrodes and nipples; carbon blocks; graphite specialties; and activated carbon fabric products. The company operates thermal power plants and a hydroelectric power facility. HEG Limited was incorporated in 1972 and is based in Noida, India.",,strong_buy,199.0
339,339,PTC,PTC India Limited,EQ,07-APR-2004,INE877F01012,utilities-independent-power-producers,utilities,Utilities,Power Trading,171.59,171.9,171.9,177.0,171.59,171.9,171.9,177.0,1109004.0,1109004.0,1695646.0,1385212.0,1385212.0,155.0,254.6,186.2674,204.28635,173.67,0.046599627,0.31326675,2.0,71.756,,,236545475.0,296008000.0,296112000.0,0.22650999,1735603200.0,1726704000.0,7.8,1726704000.0,,,0.5128,10.0,1,10,5142.577152,80357015552.0,22433200128.0,75.723,43271000064.0,166905298944.0,563.597,10867399680.0,,,173.709,0.99977547,0.3081135,0.481,7.394,0.337,-0.033,0.339,4503799808.0,15.75,13.2,11.026667,0.03121,0.07836,0.06511,0.06439,,,"PTC India Limited, together with its subsidiaries, engages in the trading of power in India, Nepal, Bhutan, and Bangladesh. The company operates in two segments, Power and Financing Business. It engages in long term, medium term, and short-term power trading activities; and cross border power trading business. The company provides financing solutions to the energy value chain which includes v or extending debt to power projects in generation, transmission, distribution, fuel resources, and fuel related infrastructure, as well as consultancy and advisory services. It serves its products to state distribution and private distribution companies, corporates, and entities trading power on power exchanges. The company was formerly known as Power Trading Corporation of India Ltd and changed its name to PTC India Limited. PTC India Limited was incorporated in 1999 and is based in New Delhi, India.",1.048,none,243.0
348,348,SEJALLTD,Sejal Glass Limited,BE,13-DEC-2021,INE955I01044,building-products-equipment,industrials,Industrials,Glass - Industrial,522.1,522.1,522.1,532.5,522.1,522.1,522.1,532.5,959.0,959.0,7599.0,1125.0,1125.0,239.1,678.95,505.263,380.66376,532.5,1.0722365,0.31326675,2.0,518.219,0.937,1.247,1924300.0,10100000.0,10150300.0,0.83591,1703980800.0,1221523200.0,184.50185,1221523200.0,0.298062:100,1620345600.0,,10.0,1,10,540.5034496,6942008832.0,42034000.0,4.165,1711454976.0,2112984960.0,209.218,264418000.0,-229103872.0,-88291000.0,32.336,16.467714,2.558009,3.285,26.254,1.243,0.552,1.216,51313000.0,5.06,,105.23715,0.02428,0.36216,0.12514,0.10520001,0.054130003,0.1685,"Sejal Glass Limited manufactures and sells value added glass in India and internationally. It offers solid, kool, tone, fort, armor, decor, fireban, body tinted, and pyrolytic coated solar control glass. The company was formerly known as Sezal Glass Limited and changed its name to Sejal Glass Limited in March 2014. Sejal Glass Limited was founded in 1991 and is based in Mumbai, India.",-1.362,none,441.0
356,356,LYPSAGEMS,Lypsa Gems & Jewellery Limited,EQ,05-NOV-2013,INE142K01011,luxury-goods,consumer-cyclical,Consumer Discretionary,Gems Jewellery And Watches,7.05,7.13,6.91,7.13,7.05,7.13,6.91,7.13,11918.0,11918.0,88471.0,27692.0,27692.0,4.7,12.05,7.7768,6.9161,7.03,0.28181815,0.31326675,2.0,19.352,,,15057653.0,29484000.0,29525800.0,0.38883,1609372800.0,1442966400.0,0.25,1442966400.0,7:5,1499817600.0,,10.0,1,10,20.7566384,233736336.0,4465000.0,0.181,61358000.0,84859000.0,3.431,-323765248.0,,,10.753,0.65377104,2.446015,2.754,-0.722,,-0.414,9.027,-326448992.0,-11.07,,,,0.050830003,,0.05234,,,"Lypsa Gems & Jewellery Limited manufactures and trades in diamonds in India. The company was incorporated in 1995 and is based in Mumbai, India.",0.477,none,597.0
361,361,YESBANK,Yes Bank Limited,EQ,12-JUL-2005,INE528G01035,banks-regional,financial-services,Financial Services,Private Sector Bank,20.26,20.1,20.06,20.65,20.26,20.1,20.06,20.65,101445038.0,101445038.0,82747504.0,84695467.0,84695467.0,19.02,32.85,20.875,23.29455,20.36,0.047028422,0.31326675,2.0,,,,16272779572.0,31349899264.0,32466200576.0,0.41022998,1735603200.0,1559520000.0,2.0,1559606400.0,5:1,1505952000.0,,2.0,1,2,63891.308544,1136778674176.0,290447392768.0,9.227,789497577472.0,127215058944.0,4.263,,,-463109783552.0,14.755,1.3798712,5.022307,8.936,,1.25,0.262,1.478,17924714496.0,0.59,1.19,34.508476,0.1409,,,0.20606,0.00457,0.040799998,"Yes Bank Limited engages in the provision of banking and financial products and services primarily in India. It operates through Treasury, Corporate/Wholesale Banking, Retail Banking, and Other Banking Operations segments. The company provides retail banking products, including savings accounts; fixed and recurring deposits; home, car, bike, commercial vehicle, construction equipment, gold, personal, mortgage, and secured business loans; loans against securities; and health care and printing equipment finance, as well as business banking services to micro, small, and medium enterprises. It offers corporate banking services, such as working capital, project, supply chain, agri commodity, and trade finance, as well as term loans; and cash management services, debt capital markets, treasury, investment banking solution, foreign currency loans and overseas financing, liquidity management, and other services. In addition, the company offers financial and advisory services to ministries under the union and state governments, central and state public sector undertakings, boards, and other affiliates; and banking solutions to cooperative banks, mutual funds, stockbrokers, non-banking finance companies (NBFCs), payment aggregators, regulated payment operators, non-resident Indians, and other financial institutions. Further, it provides debit and credit cards, wealth management and insurance products, and mobile and online banking services; transaction banking services; mergers and acquisition advisory; merchant acquiring; and remittance solutions, as well as operates ATMs and bunch note acceptors/recyclers. The company was incorporated in 2003 and is headquartered in Mumbai, India.",0.387,none,48.0
395,395,RANASUG,Rana Sugars Limited,EQ,24-FEB-2005,INE625B01014,confectioners,consumer-defensive,Fast Moving Consumer Goods,Sugar,19.28,19.5,19.28,19.99,19.28,19.5,19.28,19.99,249725.0,249725.0,601004.0,267443.0,267443.0,18.2,27.7,20.7108,22.54065,19.58,-0.20821357,0.31326675,2.0,76.704,,,112890803.0,153568000.0,153808000.0,0.26938,1735603200.0,1130716800.0,1.0,1130716800.0,,,,10.0,1,10,300.6861312,7104451584.0,317932000.0,2.009,4145594880.0,15547217920.0,100.424,692379776.0,,,33.363,0.5868777,0.19340189,0.457,10.261,-0.88,-0.076,-0.876,145010000.0,0.93,,21.053762,0.009330001,0.1869,0.04453,0.02221,,,"Rana Sugars Limited engages in the manufacture of sugar, distillery, and co-generation of power in India. It operates through three segments: Sugar Manufacturing, Ethanol/ENA Manufacturing, and Power Generation. The company offers sugar, molasses, and bagasse, as well as double refined white sulphurless sugar, plantation white sugar, raw sugar, and sugar from sugar beet. It also provides ethanol, liquor, and various grades of alcohol, such as rectified spirit and potable grade extra neutral alcohol. In addition, the company generates the power from by-products bagasse of sugar, as well as procures fuel. Further, it offers sugar beet pulp as cattle and poultry feed. The company was incorporated in 1991 and is based in Chandigarh, India.",0.43,none,496.0
428,428,SUULD,Suumaya Industries Limited,EQ,19-OCT-2020,INE591Q01016,apparel-retail,consumer-cyclical,Fast Moving Consumer Goods,Other Agricultural Products,4.06,4.06,3.96,4.16,4.06,4.06,3.96,4.16,97940.0,97940.0,100862.0,63619.0,63619.0,3.78,11.0,4.5346,6.42135,4.13,-0.40294117,0.31326675,4.0,,,,61313435.0,61135300.0,68177104.0,,,1632787200.0,1.375,1632787200.0,2:1,1648598400.0,,10.0,1,10,25.24888,3479693568.0,87600000.0,1.294,3292400128.0,12398199808.0,184.564,-15093000192.0,,,-40.96,,0.020364957,0.281,-0.231,,0.719,,-20233900032.0,-188.82,,,-1.632,0.0091699995,-1.21735,-54.586212,,,"Suumaya Industries Limited manufactures, distributes, and retails garments and fabrics. The company operates through three segments: Textile, Retail, and Agri produce. The Textile segment manufactures and retails apparels, PPE kits, and other covid essentials, as well as trades in fabric, yarn, and other textile commodities. The Retail segment engages in retailing of groceries and staples through neighbourhood stores. The Agri produce segment involves in supply chain of various agri commodities, such as wheat, rice, and dal. The company also provides plastics resin/PVC which is used in pipe, wires and cables, synthetic leather, stretch film, and floor applications. The company was formerly known as Suumaya Lifestyle Limited and changed its name to Suumaya Industries Limited in February 2021. Suumaya Industries Limited was founded in 1985 and is based in Mumbai, India.",0.358,none,595.0
475,475,FELDVR,Future Enterprises Limited,BE,13-FEB-2009,IN9623B01058,department-stores,consumer-cyclical,Consumer Discretionary,Diversified Retail,5.3,5.34,5.16,5.56,5.3,5.34,5.16,5.56,11818.0,11818.0,12158.0,9301.0,9301.0,4.1,6.85,5.2106,5.32775,5.4,-0.1782946,0.31326675,2.0,,0.197,0.366,322982990.0,39374700.0,119282000.0,0.72220004,1640908800.0,1503273600.0,0.24,1503273600.0,,,,2.0,1,2,36.7650944,77200490496.0,166000000.0,0.336,74595000320.0,21933699072.0,46.31,-1633600000.0,13640474624.0,3999399936.0,52.907,0.10206589,0.016761921,3.52,-47.258,,-0.132,,-28774299648.0,-56.2,,,-1.31188,0.07582,-0.07448,-0.97987,-0.05105,-2.38273,"Future Enterprises Limited, together with its subsidiaries engages in the retail business in India. The company offers IT enabled end-to-end supply chain and logistic services, which include modern warehousing, cold chain, and express and e-commerce logistics to food and beverages, lifestyle, consumer electronics and high tech, automotive and engineering, home and furniture, healthcare, general merchandise, and e-commerce industries. It provides general insurance solutions to customers and enterprise through retail, commercial, personal and rural product offerings; and design space of office supplies, equipment, and other products. In addition, the company also offers children's and women's apparel products; and media solutions to advertise deals to marketers. Future Enterprises Limited was formerly known as Future Retail Limited. The company was incorporated in 1987 and is headquartered in Mumbai, India. Future Enterprises Limited operates as a subsidiary of Central Departmental Stores Private Limited.",1.368,none,591.0
510,510,MIRCELECTR,MIRC Electronics Limited,EQ,24-MAY-2004,INE831A01028,furnishings-fixtures-appliances,consumer-cyclical,Consumer Discretionary,Consumer Electronics,21.24,21.24,20.7,21.6,21.24,21.24,20.7,21.6,182687.0,182687.0,389749.0,219111.0,219111.0,15.5,32.99,22.073,22.6509,20.71,0.30707693,0.31326675,2.0,87.271,0.584,1.127,97332750.0,230952992.0,231170000.0,0.56741,1735603200.0,1307577600.0,0.88806,1307577600.0,2:1,1060732800.0,,1.0,1,1,478.753024,5803100160.0,115400000.0,0.513,1139500032.0,9704965120.0,42.598,-297308992.0,-85007872.0,82252000.0,5.803,3.5688436,0.49330732,0.598,-19.519,,-0.217,,-477683008.0,-2.06,,,-0.04922,0.10152,-0.03063,0.02636,-0.03698,-0.30938998,"MIRC Electronics Limited manufactures, trades in, and markets electronics and consumer durables in India. The company offers LED and LCD televisions, air conditioners, washing machines, microwave ovens, DVD home theatre systems, mobile phones, projector systems, LED lights, refrigerators, healthcare, air cooler, dishwashers, and LED lights under the Onida and IGO brands. It also exports its products. The company was incorporated in 1981 and is based in Mumbai, India.",1.028,none,456.0
539,539,KRIDHANINF,Kridhan Infra Limited,BE,11-DEC-2015,INE524L01026,steel,basic-materials,Industrials,Civil Construction,4.03,4.06,3.9,4.09,4.03,4.06,3.9,4.09,120301.0,120301.0,139830.0,79305.0,79305.0,2.4,7.55,4.2714,4.5554,3.97,0.612,0.31326675,4.0,,,,21110609.0,94779200.0,95923904.0,0.53178,1735603200.0,1537228800.0,0.2,1537228800.0,,,,2.0,1,2,37.627344,455984992.0,14754000.0,0.307,274491008.0,17507000.0,0.21,11088000.0,,,-37.493,,21.492743,26.046,41.124,,0.061,,-2119132032.0,-15.62,,,,1.0,0.63335,-0.23833999,,,"Kridhan Infra Limited manufactures and sells steel products in India and internationally. The company provides bridge expansion joints for asphalt and concrete connections; and rebar mechanical couplers. It also trades in iron, steel, and allied materials, as well as offers bored piling, driven piling, micro piling and soil improvement, and soil investigation services. The company was formerly known as Readymade Steel India Limited and changed its name to Kridhan Infra Limited in June 2014. Kridhan Infra Limited was incorporated in 2006 and is based in Mumbai, India.",1.748,none,589.0
