,Unnamed: 0,symbol,name_of_company,series,date_of_listing,isin_number,industry_key,sector_key,macro,basic_industry,previous_close,open,day_low,day_high,regular_market_previous_close,regular_market_open,regular_market_day_low,regular_market_day_high,volume,regular_market_volume,average_volume,average_volume10days,average_daily_volume10_day,fifty_two_week_low,fifty_two_week_high,fifty_day_average,two_hundred_day_average,current_price,52_week_change,sand_p52_week_change,price_hint,debt_to_equity,quick_ratio,current_ratio,float_shares,shares_outstanding,implied_shares_outstanding,held_percent_insiders,compensation_as_of_epoch_date,ex_dividend_date,last_dividend_value,last_dividend_date,last_split_factor,last_split_date,payout_ratio,paid_up_value,market_lot,face_value,market_cap,enterprise_value,total_cash,total_cash_per_share,total_debt,total_revenue,revenue_per_share,ebitda,free_cashflow,operating_cashflow,book_value,price_to_book,price_to_sales_trailing12_months,enterprise_to_revenue,enterprise_to_ebitda,earnings_growth,revenue_growth,earnings_quarterly_growth,net_income_to_common,trailing_eps,forward_eps,trailing_pe,profit_margins,gross_margins,ebitda_margins,operating_margins,return_on_assets,return_on_equity,long_business_summary,beta,recommendation_key,market_cap_rank
13,13,SELMC,SEL Manufacturing Company Limited,EQ,26-OCT-2021,INE105I01020,textile-manufacturing,consumer-cyclical,Consumer Discretionary,Other Textile Products,46.22,44.5,43.9,46.21,46.22,44.5,43.9,46.21,13270.0,13270.0,88070.0,15574.0,15574.0,43.9,106.1,57.1634,69.42735,44.0,-0.5692458,0.39389753,2.0,,0.014,0.099,8283675.0,33134700.0,35658600.0,0.91936,1735603200.0,1202169600.0,1000.0,1202169600.0,1:1000,1615248000.0,,10.0,1,10,156.8978432,10822649856.0,33922000.0,1.024,9399308288.0,3746078976.0,113.051,-549235968.0,548653760.0,371904000.0,-17.018,,0.41883218,2.889,-19.705,,-0.864,,-1929528064.0,-49.08,,,-0.51508,0.111379996,-0.14661999,-0.94314003,-0.082100004,-4.1932697,"SEL Manufacturing Company Limited operates as a textile company primarily in India. Its products portfolio includes knitted garments, terry towels, knitted and processed fabrics, and various yarns. The company was founded in 1969 and is based in Ludhiana, India.",-0.951,none,1750.0
58,58,BANCOINDIA,Banco Products (I) Limited,EQ,22-DEC-2006,INE213C01025,auto-parts,consumer-cyclical,Consumer Discretionary,Auto Components & Equipments,662.85,662.5,636.95,675.75,662.85,662.5,636.95,675.75,166366.0,166366.0,145162.0,103321.0,103321.0,441.0,799.15,687.213,655.79877,650.0,0.45799303,0.39389753,2.0,40.225,,,20846352.0,71518600.0,72380200.0,0.68807,1735603200.0,1708041600.0,20.0,1708041600.0,5:1,1195776000.0,0.8964,2.0,1,2,4704.7131136,50208440320.0,634600000.0,8.872,4229700096.0,28229500928.0,394.73,4663014912.0,,,147.019,4.4211974,1.6665945,1.779,10.767,-0.002,0.073,-0.002,2712600064.0,37.93,,17.136831,0.096090004,0.43418,0.16518,0.14113,,,"Banco Products (India) Limited, together with its subsidiaries, engages in the manufacture and sale of heat exchangers/cooling systems in India and internationally. The company offers engine cooling systems, such as radiators, charge air coolers, oil coolers, transmission and hydraulic type, condensers, fuel coolers, battery coolers, inverter coolers configurations and accessories, expansion tanks, fan motor assembly, fan shroud and guard, and miscellaneous mounting plumbing accessories. It also provides engine sealing systems, including engine cylinder hear and peripheral gaskets, heat shiels, and industrial gaskets; and materials which includes multi-layered steel, graphite composite gaskets, compressed fiber jointing sheet gaskets, rubber cork and pre-coated beaded gaskets, edge molded and copper gaskets. The company's products are used in passenger cars; light, medium, and heavy commercial vehicle; agricultural tractors; harvesters; high performance bikes; construction machineries; material handling equipment; mining machinery; diesel generators and power generation equipment; traction rail locomotives; and air compressors. The company was incorporated in 1961 and is based in Baroda, India.",1.035,none,729.0
88,88,IL&FSTRANS,IL&FS Transportation Networks Limited,BZ,30-MAR-2010,INE975G01012,infrastructure-operations,industrials,Industrials,Civil Construction,5.26,5.15,5.15,5.15,5.26,5.15,5.15,5.15,27349.0,27349.0,45194.0,45370.0,45370.0,3.8,8.62,6.1498,5.5186,5.15,0.084210515,0.39389753,2.0,385.701,0.016,0.075,81262995.0,328960000.0,339819008.0,0.74261004,1609372800.0,1469750400.0,2.0,1469750400.0,,,,10.0,1,10,175.0067968,277340028928.0,9285300224.0,28.226,276430585856.0,995100032.0,3.025,-1182000000.0,-5176137728.0,-192500000.0,-451.717,,1.7586855,278.706,-234.636,,0.76,0.033,-9729500160.0,-34.62,,,,-0.46227002,-1.18782,0.34368,-0.02629,,"IL&FS Transportation Networks Limited develops, operates, manages, and maintains transportation infrastructure projects in India and internationally. The company undertakes highway, flyover, bridge, road, metro rail, city bus, and border check post projects. It also provides operation, maintenance, and allied services; and toll collection services for toll road projects. The company was incorporated in 2000 and is based in Mumbai, India. IL&FS Transportation Networks Limited operates as a subsidiary of Infrastructure Leasing and Financial Services Limited.",0.522,buy,1720.0
94,94,JPPOWER,Jaiprakash Power Ventures Limited,EQ,18-APR-2005,INE351F01018,utilities-independent-power-producers,utilities,Utilities,Power Generation,18.39,18.51,17.5,18.54,18.39,18.51,17.5,18.54,59167425.0,59167425.0,53566663.0,71656089.0,71656089.0,9.1,24.0,18.5988,18.5159,17.94,0.84432995,0.39389753,2.0,33.453,1.596,2.272,5608009924.0,6853459968.0,7071819776.0,0.35298002,1735603200.0,1249862400.0,0.75,1249862400.0,,,,10.0,1,10,12686.8447232,221051420672.0,12752499712.0,1.466,40139698176.0,67730501632.0,11.564,25659000832.0,8355700224.0,18077300736.0,9.42,1.9044586,1.873136,3.264,8.615,,-0.033,1.66,12901300224.0,1.31,-1.7,13.694657,0.19088,0.42389,0.37884,0.26417,0.07481,0.11387999,"Jaiprakash Power Ventures Limited engages in the power generation and cement grinding businesses in India and internationally. The company generates electricity through thermal and hydro energy sources. It owns and operates a 400 megawatts (MW) Jaypee Vishnuprayag hydro-electric power plant at District Chamoli, Uttarakhand; 1320 MW Jaypee Nigrie thermal power plant at village Nigrie, district Singrauli, Madhya Pradesh; and 500 MW Jaypee Bina thermal power plant at village Sirchopi, district Sagar, Madhya Pradesh. The company also operates Jaypee Nigrie cement grinding unit at Nigrie, District Singrauli, Madhya Pradesh; and sand mining in Andhra Pradesh. In addition, it operates coal mine located in Amelia and Bandha Madhya Pradesh. The company was formerly known as Jaiprakash Hydro-Power Limited and changed its name to Jaiprakash Power Ventures Limited in December 2009. Jaiprakash Power Ventures Limited was incorporated in 1994 and is based in New Delhi, India.",,none,448.0
116,116,OILCOUNTUB,Oil Country Tubular Limited,BE,30-AUG-1995,INE591A01010,oil-gas-equipment-services,energy,Energy,Oil Equipment & Services,50.9,51.0,49.88,51.0,50.9,51.0,49.88,51.0,6325.0,6325.0,25575.0,14413.0,14413.0,19.15,58.89,52.0018,43.87165,49.88,1.5002506,0.39389753,2.0,46.332,,,11846866.0,44289500.0,44396100.0,0.68278,,1401321600.0,2.0,1401321600.0,,,,10.0,1,10,221.4477568,3084195584.0,31468000.0,0.709,902390976.0,430307008.0,9.711,233836000.0,,,44.036,1.1327096,5.1462736,7.167,13.19,,117.998,,-615400000.0,-13.89,,,-1.43014,0.65639,0.54342,-0.30110002,,,"Oil Country Tubular Limited manufactures and sells casing, tubing, and drill pipes used in the oil and gas drilling and exploration sector in India and internationally. It offers heavy weight drill pipes and drill collars, as well as tubing, casing, and high collapse casing products. The company also provides accessories, such as rotary subs, lift plugs and subs, lifting bails, pup joints, sleeve stabilizers, tool joints, welded blade stabilizers, and couplings, as well as drill rods. In addition, it offers services comprising tool joint hardfacing, tool joints make and break, internal plastic coating of drill pipe and tubing, drill pipe reconditioning, drill pipe re-threading, tubing and casing, and field inspection. The company was incorporated in 1985 and is headquartered in Hyderabad, India. Oil Country Tubular Limited is in Corporate Insolvency Resolution Process under the Insolvency and Bankruptcy Code 2016.",-0.328,none,1668.0
122,122,IDEA,Vodafone Idea Limited,EQ,09-MAR-2007,INE669E01016,telecom-services,communication-services,Telecommunication,Telecom - Cellular & Fixed line services,8.13,8.11,7.59,8.11,8.13,8.11,7.59,8.11,601382237.0,601382237.0,387416066.0,393324952.0,393324952.0,7.59,19.18,11.9206,14.07305,7.67,-0.34248924,0.39389753,2.0,,0.413,0.61,19031498193.0,69699796992.0,75068301312.0,0.63862,,1474502400.0,0.361781,1474502400.0,,,,10.0,1,10,57577.3868032,2692229890048.0,190059003904.0,3.792,2498370994176.0,424254996480.0,8.465,107797504000.0,,,-18.115,,1.357141,6.346,24.975,,-0.01,,-298304995328.0,-5.82,-4.15,,-0.70313,0.4314,0.25409,-0.110810004,,,"Vodafone Idea Limited provides mobile telecommunication services in India. The company provides voice and data services on 4G VoLTE and Voice over WIFI calling services; broadband data services on 3G and/or 4G platforms; content and digital products and services; and other value-added services, including entertainment, utility, and voice and short messaging services. It offers long distance and ISP services; manpower services; business and enterprise services; and business connectivity services, such as IoT, cloud, managed services, etc. In addition, the company trades in mobile handsets, data cards, and related accessories and services; and rents passive infrastructure to telecommunication service providers. Further, it offers technology, software, hardware, VAS, application software, and contents and related products and services, which facilitate and develop access to information technology (IT) enabled VAS products and services on single or multiple platforms or operating systems; and data centre related services and IT solutions, including E-SIMs, as well as involved in the prepaid payment instrument; business correspondence; and mobile wallet and money transfer businesses. The company was formerly known as Idea Cellular Limited and changed its name to Vodafone Idea Limited in August 2018. Vodafone Idea Limited was incorporated in 1995 and is based in Mumbai, India.",0.402,hold,158.0
161,161,CHENNPETRO,Chennai Petroleum Corporation Limited,EQ,07-JUN-2000,INE178A01016,oil-gas-refining-marketing,energy,Energy,Refineries & Marketing,758.5,763.0,696.8,766.3,758.5,763.0,696.8,766.3,2299227.0,2299227.0,872750.0,1640928.0,1640928.0,537.0,1275.0,920.218,935.0035,708.0,0.21441436,0.39389753,2.0,79.216,0.103,1.034,45005986.0,148911008.0,165482000.0,0.68813,1735603200.0,1721347200.0,55.0,1721347200.0,,,1.1432,10.0,1,10,11716.1254912,164573413376.0,1935399936.0,12.999,61136998400.0,645275189248.0,4333.77,17795299328.0,-16412574720.0,-11694499840.0,518.341,1.3658962,0.18156789,0.255,9.248,,-0.269,,7165499904.0,48.12,,14.713218,0.0111,0.051119998,0.027579999,-0.0685,0.041160002,0.0922,"Chennai Petroleum Corporation Limited produces and supplies petroleum products in India. The company provides liquefied petroleum gas, motor spirit, superior kerosene oil, aviation turbine fuel, naphtha, bitumen, hexane, mineral turpentine oil, lube base stock, petrochemical feedstocks, paraffin wax, asphalt, JP 7 fuel equivalent, and pet-coke. It offers sulphur, isrosene, ISRO naphtha, light diesel oil, extracts, butene, micro crystalline wax, automotive high-speed and high flash diesel, bunker and non-bunker fuel oils, paving bitumen, and high viscosity index oils. In addition, the company offers linear alkyl benzene, methyl ethyl ketone, propylene glycol and polyols, poly iso-butylene, butene-2, and poly butene feed stocks. The company was formerly known as Madras Refineries Limited and changed its name to Chennai Petroleum Corporation Limited in June 2000. Chennai Petroleum Corporation Limited was incorporated in 1965 and is based in Chennai, India. Chennai Petroleum Corporation Limited operates as a subsidiary of Indian Oil Corporation Limited.",0.599,none,467.0
191,191,UFO,UFO Moviez India Limited,EQ,14-MAY-2015,INE527H01019,entertainment,communication-services,Consumer Discretionary,Film Production Distribution & Exhibition,106.47,107.05,101.5,107.84,106.47,107.05,101.5,107.84,174036.0,174036.0,359469.0,172828.0,172828.0,101.5,173.85,129.487,134.0873,102.5,-0.08784801,0.39389753,2.0,26.604,,,17666966.0,38606000.0,41014900.0,0.53326,1735603200.0,1583884800.0,15.0,1583884800.0,,,,10.0,1,10,420.4027136,3684058880.0,1073699968.0,27.75,764400000.0,4192499968.0,108.808,612784768.0,,,74.932,1.3679069,1.0027494,0.879,6.012,,0.107,,97000000.0,2.51,29.21,40.836655,0.023139998,0.54106,0.14616,-0.03217,,,"UFO Moviez India Limited, together with its subsidiaries, provides digital cinema services in India, the Middle East, and internationally. It distributes films; in-cinema advertising, that enables the advertisers to engage a captive audience by actively choosing and paying to experience the content; caravan talkies for marketers and advertisers for rural targeting; and UFO Framez, an in-cinema advertising offers marketing and promotional needs of local retailers, and business owners. The company also offers UFO-M4, a satellite-based, e-cinema movie delivery platform; and digital mastering, and movie marketing and release services; and operates club cinemas. The company operates through a network of PRIME and POPULAR screens. UFO Moviez India Limited was incorporated in 2004 and is headquartered in Mumbai, India.",-0.015,none,1498.0
204,204,MUNJALSHOW,Munjal Showa Limited,EQ,12-MAY-2003,INE577A01027,auto-parts,consumer-cyclical,Consumer Discretionary,Auto Components & Equipments,150.15,150.15,144.5,151.05,150.15,150.15,144.5,151.05,59619.0,59619.0,320326.0,76299.0,76299.0,126.4,211.9,167.9298,167.56485,147.0,0.07435703,0.39389753,2.0,,,,3303187.0,39995000.0,41767400.0,0.65336996,1735603200.0,1722556800.0,4.5,1722556800.0,5:1,1160956800.0,0.6016,2.0,1,2,613.9807744,3027169024.0,2820900096.0,70.531,,11956132864.0,298.949,139842000.0,,,166.083,0.88509965,0.51352787,0.253,21.647,-0.066,0.08,-0.066,299247008.0,7.49,,19.62617,0.02503,0.21829,0.0117,0.0137,,,"Munjal Showa Limited manufactures and sells auto components for the two-wheeler and four-wheeler industry primarily in India and internationally. Its products comprise front forks, rear cushions, shock absorbers, struts, gas springs, spring/rear door lifters, and window balancers. The company was incorporated in 1985 and is based in Gurugram, India.",0.779,buy,1397.0
236,236,JAGRAN,Jagran Prakashan Limited,EQ,22-FEB-2006,INE199G01027,publishing,communication-services,Consumer Discretionary,Print Media,87.59,87.8,84.34,88.17,87.59,87.8,84.34,88.17,323768.0,323768.0,643205.0,226924.0,226924.0,83.0,129.5,94.596,98.3699,85.3,-0.18569386,0.39389753,2.0,11.795,,,67477201.0,217654000.0,226271008.0,0.69024,1735603200.0,1726185600.0,5.0,1726185600.0,5:1,1199836800.0,,2.0,1,2,1930.0917248,17724020736.0,4986900992.0,22.893,2468231936.0,19234555904.0,88.345,3756566272.0,,,88.512,0.96371114,1.0034502,0.921,4.718,-0.078,-0.023,-0.078,1802700032.0,8.28,12.76,10.301933,0.09372,0.5389,0.19530001,0.08974,,,"Jagran Prakashan Limited engages in the printing and publication of newspapers and magazines in India. It operates through Printing, Publishing and Digital; FM Radio Business; and Others segments. The company offers Dainik Jagran, a daily newspaper; Inquilab, an Urdu daily newspaper; Punjabi Jagran, a Punjabi newspaper; Sakhi, a Hindi magazine; Khet Khalihaan, a monthly agricultural magazine; Dainik Jagran Inext, a bilingual newspaper; mid-day, a compact newspaper; and mid-day Gujarati, a Gujarati newspaper. It also operates Jagran English, an English news portal; HerZindagi, an lifestyle and entertainment website for female readers; Mid-day; Gujarati Mid-day, a Gujarati news portal; Nai Dunia, a Hindi news portal and newspaper; Jagranjosh.com, an education site; Punjabijagran.com, a digital platform for Punjab; The Inquilab, a Urdu news portal; inextLive, an online portal for youth offering content; Radiocity.in, a web radio station; Vishvas.News, a news website; Onlymyhealth, a health and lifestyle platform; JagranTV, an OTT platform; Jagran hitech, offers content on technology, automobiles, and innovation; Jagran podcast, an audio platform; Jagran Local, an all-in-one guide app; Gujaratijagaran.com, a go-to platform; Jagran.com, online news and information portal; khojle.com, a one-stop for shop; and Jagaran Fatafat app. In addition, the company offers out-of-home marketing services, as well as marketing solutions, such as brand activations, corporate events, product launches, event management, creative, shoppers, retail marketing, integrated media campaigns, public health programs, rural marketing, conferences, and exhibitions. Further, it operates radio stations under the Radio City brand name. The company was founded in 1942 and is based in Kanpur, India. Jagran Prakashan Limited is a subsidiary of Jagran Media Network Investment Private Limited.",0.493,underperform,1039.0
270,270,EROSMEDIA,Eros International Media Limited,EQ,06-OCT-2010,INE416L01017,entertainment,communication-services,Consumer Discretionary,Film Production Distribution & Exhibition,17.69,17.52,16.8,17.52,17.69,17.52,16.8,17.52,193892.0,193892.0,1147542.0,427459.0,427459.0,16.8,29.4,19.1124,20.5998,16.81,-0.07438016,0.39389753,2.0,16.57,,,75950554.0,95914096.0,102080000.0,0.25766,1703980800.0,1361404800.0,1.5,1361404800.0,,,,10.0,1,10,171.59648,3099957248.0,148100000.0,1.544,1593100032.0,4884499968.0,71.021,-1359200000.0,,,90.699,0.18533832,0.35130817,0.635,-2.281,,1.23,,-1301100032.0,-20.97,,,-0.26637,0.1439,-0.27827,-2.23788,,,"Eros International Media Limited, together with its subsidiaries, engages in the production, exploitation, and distribution of films in India, the United Arab Emirates, and internationally. It operates on a vertically integrated studio model controlling content, as well as provides distribution and exploitation across various formats, including cinema, digital, home entertainment, and television syndication. The company also engages in the sourcing of Indian film content through acquisition, co-production, or production; exploiting and distributing films through music release, theatrical distribution, DVD and VCD release, television licensing, and cable or DTH licensing; and trading and exporting international rights. Eros International Media Limited was founded in 1977 and is based in Mumbai, India.",1.014,none,1726.0
277,277,MOHITIND,Mohit Industries Limited,EQ,14-MAR-2013,INE954E01012,textile-manufacturing,consumer-cyclical,Consumer Discretionary,Other Textile Products,26.87,27.49,26.32,27.49,26.87,27.49,26.32,27.49,30595.0,30595.0,24115.0,36856.0,36856.0,16.5,36.75,27.7334,24.35125,27.04,0.46178865,0.39389753,2.0,19.184,,,5510562.0,14157600.0,14379500.0,0.57433,1672444800.0,1470873600.0,1.0,1470873600.0,,,,10.0,1,10,38.2821504,902539008.0,1741000.0,0.123,524003008.0,1160297984.0,81.968,15672250.0,,,185.251,0.14596413,0.3299338,0.778,57.588,,-0.424,,-16580000.0,-1.17,,,-0.01429,0.23369,0.01351,0.0082,,,"Mohit Industries Limited engages in manufacturing texturized yarn from partially oriented yarn and weaving of yarn to grey cloth in India. It offers yarn, grey, and fabric products; and exports polyester draw texturized yarns. The company also exports its products to West and South East Asia, the United Kingdom, Italy, Spain, Germany, Mexico, Thailand, Peru, Bangladesh, South Africa, Egypt, Brazil, Colombia, Guatemala, Vietnam, Indonesia, Bulgaria, Uzbekistan, Chili, and internationally. The company was incorporated in 1991 and is headquartered in Surat, India.",0.418,none,1922.0
284,284,INDUSTOWER,Indus Towers Limited,EQ,28-DEC-2012,INE121J01017,telecom-services,communication-services,Telecommunication,Telecom - Infrastructure,350.25,352.0,330.1,352.0,350.25,352.0,330.1,352.0,14093116.0,14093116.0,11037271.0,6736691.0,6736691.0,167.0,460.35,404.286,344.18024,335.45,0.9705622,0.39389753,2.0,75.207,0.56,1.031,1238435256.0,2637890048.0,2815219968.0,0.53051996,1735603200.0,1652400000.0,11.0,1652400000.0,,,,10.0,1,10,94436.5568,1093574852608.0,2905999872.0,1.102,213580005376.0,292404985856.0,108.692,146469994496.0,34147000320.0,156761997312.0,107.657,3.1159146,3.2296493,3.74,7.466,0.729,0.047,0.717,75430002688.0,28.05,21.1,11.9590025,0.25796,0.53752,0.50091,0.44566002,0.12465999,0.28957,"Indus Towers Limited, a telecom infrastructure company, engages in the operation and maintenance of wireless communication towers and related infrastructures for various telecom service providers in India. The company offers ground base towers, smart poles, rooftop tower, small cells, and fibre backhauls; and offers energy supply to telecom equipment, as well as acquires the requisite space from residential and commercial property owners and landlords for placing passive infrastructure at strategic locations. It also provides smart digital infrastructure, which includes smart poles LED lights, CCTV cameras, variable digital messaging board, environment sensors, and city public Wi-Fi services including fiber services. The company was formerly known as Bharti Infratel Limited and changed its name to Indus Towers Limited in December 2020. Indus Towers Limited was incorporated in 2006 and is based in Gurugram, India.",0.191,hold,105.0
301,301,UNIONBANK,Union Bank of India,EQ,24-SEP-2002,INE692A01016,banks-regional,financial-services,Financial Services,Public Sector Bank,110.27,110.45,106.68,110.77,110.27,110.45,106.68,110.77,8890099.0,8890099.0,10776189.0,10663522.0,10663522.0,99.15,172.5,119.7416,137.6823,108.45,0.085657,0.39389753,2.0,,,,1473439402.0,7633610240.0,7715409920.0,0.74757004,,1721347200.0,3.6,1721347200.0,,,0.1775,10.0,1,10,83673.6188416,38579945472.0,1048121901056.0,137.304,259399892992.0,499969163264.0,66.211,,,-802202976256.0,140.908,0.76965106,1.6735756,0.077,,0.21,0.143,0.33,153463783424.0,20.28,17.46,5.347633,0.30695,,,0.47973,0.01117,0.15493,"Union Bank of India provides various banking products and services. It operates through four segments: Treasury Operations, Retail Banking Operations, Corporate and Wholesale Banking, and Other Banking Operations. The company offers savings and current accounts; term deposits; home, vehicle, education, personal, agriculture, and gold loans; loans against the property; and loans for senior citizen and pensioners, as well as products and loans for micro, small, and medium enterprises. It also provides mutual funds; life, non-life, and health insurance products; demat and online trading services; tax saving deposits; government saving schemes; and safe deposit locker and cheque collection services. In addition, the company offers corporate loans, that includes export scheme, line of credit, trade finance, working capital, project financing, and channel finance; debt structuring/restructuring, loan syndication, and structured finance services; cash management, ECGC cover, and foreign exchange services, as well as derivatives; export and import finance services; NRI banking services; and treasury and other products, and remittance services. Further, it provides app, internet, self-service, ATM, and SMS banking services; point of sale terminal and immediate payment services; and debit, credit, gift, and payroll cards. The company was incorporated in 1919 and is headquartered in Mumbai, India.",1.072,hold,122.0
312,312,NOIDATOLL,Noida Toll Bridge Company Limited,BE,06-DEC-2002,INE781B01015,infrastructure-operations,industrials,Services,Road Assets - Toll Annuity Hybrid-Annuity,13.78,13.4,13.09,13.85,13.78,13.4,13.09,13.85,38878.0,38878.0,111366.0,80937.0,80937.0,7.45,17.06,14.4892,11.5665,13.2,0.5309942,0.39389753,2.0,32.631,,,109070169.0,186195008.0,186614000.0,0.43103,1672444800.0,1474416000.0,1.5,1474416000.0,,,,10.0,1,10,245.777408,2675640576.0,405103008.0,2.197,667081024.0,276031008.0,1.485,68259248.0,,,10.989,1.2012012,8.903978,9.693,39.198,,2.091,,-278985984.0,-1.5,,,-1.01071,0.43278998,0.24729,-0.59669995,,,"Noida Toll Bridge Company Limited engages in the development, establishment, construction, operation, and maintenance of Delhi Noida toll bridge on a build-own-operate-transfer basis in India. The company also provides space rentals for advertisements and offices. Noida Toll Bridge Company Limited was founded in 1976 and is based in Noida, India.",0.459,none,1641.0
