712,712,RADIANTCMS,Radiant Cash Management Services Limited,EQ,04-JAN-2023,INE855R01021,specialty-business-services,industrials,Services,Diversified Commercial Services,75.58,76.13,72.01,76.9,75.58,76.13,72.01,76.9,291899.0,291899.0,378773.0,257213.0,257213.0,71.1,102.0,81.1622,83.15105,75.5,-0.20312667,0.39389753,2.0,12.894,,,39204730.0,106708000.0,109668000.0,0.58792,1735603200.0,1724889600.0,2.5,1724889600.0,,,0.5176,1.0,1,1,827.9933952,6633019904.0,1641720064.0,15.28,327030016.0,3928549888.0,36.516,599920000.0,,,23.32,3.2375643,2.1076312,1.688,11.057,-0.246,0.07,-0.239,413489984.0,3.87,,19.509045,0.10524999,0.99669,0.15271,0.14246,,,"Radiant Cash Management Services Limited engages in the provision of cash logistics and other related services in India. The company offers cash pick-up and delivery, network currency management, cash processing, cash vans/cash-in-transit, and other value-added services, such as man-behind counter and currency chest operations. It also provides instant credit services through platform. The company serves banks, NBFCs, microfinance institutions, logistics companies, e-commerce businesses, restaurants, jewelry stores, electronics retailers, auto parts suppliers, petrol pumps, furniture stores, supermarkets, salons, sports goods retailers, footwear retailers, pharmacies, diagnostics/labs, apparel and lifestyle retailers, hospitals, cafes, sweet shops, grocery stores, auto service stations, retail stores, MSME businesses, and cinemas. The company was incorporated in 2005 and is headquartered in Chennai, India.",,none,1309.0
725,725,BANKBARODA,Bank of Baroda,EQ,19-FEB-1997,INE028A01039,banks-regional,financial-services,Financial Services,Public Sector Bank,244.77,244.0,234.25,245.9,244.77,244.0,234.25,245.9,13124438.0,13124438.0,14543988.0,10332061.0,10332061.0,190.65,299.7,244.5296,257.97714,239.0,0.20817149,0.39389753,2.0,,,,1859415202.0,5171359744.0,5438060032.0,0.64026,1735603200.0,1719532800.0,7.6,1719532800.0,5:1,1421884800.0,0.1965,2.0,1,2,123595.4958336,1840849485824.0,559799992320.0,108.301,1151060017152.0,628962951168.0,121.619,,,,261.513,0.9139125,1.965068,2.927,,0.219,0.136,0.219,200037793792.0,38.68,22.03,6.1789036,0.31804,,,0.45279,0.012150001,0.16038,"Bank of Baroda Limited provides various banking products and services to individuals, government departments, and corporate customers in India and internationally. The company operates through Treasury, Corporate/Wholesale Banking, Retail Banking, and Other Banking Operations segments. It offers savings, salary, and current accounts; and term deposits. The company also provides loans, such as home, education, vehicle, gold, mortgage, mudra, personal, mortgage, and other loans; overdrafts; loans for micro, small, and medium enterprises; corporate and agriculture loans; export finance, external commercial borrowings, foreign currency credits, and import finance; Foreign Currency Non-Resident Loans; and supply chain finance. In addition, it offers life insurance, general insurance, and health insurance products; merchant payment solutions; defense banking; investment products, treasury, trade, FX, remittances, appraisal merchant banking, cash management, correspondent banking, and other services; digital payment solutions; and debit, prepaid, and credit cards. Bank of Baroda Limited was incorporated in 1908 and is headquartered in Vadodara, India.",0.782,buy,72.0
763,763,OMKARCHEM,Omkar Speciality Chemicals Limited,BZ,10-FEB-2011,INE474L01016,specialty-chemicals,basic-materials,Commodities,Specialty Chemicals,7.92,7.92,7.6,8.25,7.92,7.92,7.6,8.25,7975.0,7975.0,26920.0,14031.0,14031.0,5.65,11.39,9.3036,8.0263,8.24,0.009937882,0.39389753,2.0,,,,17551799.0,20578000.0,20639300.0,0.14709,1609372800.0,1473897600.0,1.5,1473897600.0,,,,10.0,1,10,16.956272,2443470080.0,3333000.0,0.162,2279497984.0,193578000.0,9.414,-55499000.0,,,-83.011,,0.87594,12.623,-44.027,,-0.492,,-132226000.0,-5.06,,,-0.68306,0.29202998,-0.2867,-0.32417,,,"Omkar Speciality Chemicals Limited manufactures and sells specialty chemicals and intermediates for chemical and allied industries in India and internationally. It provides a range of organic, inorganic, and organo inorganic intermediates. The company offers selenium derivatives, iodine derivatives, resolving agents, and advance intermediates, as well as tartaric acid derivatives and other intermediates. Its products have applications in the pharmaceuticals, neutraceuticals, fragrances and flavours, foods, poultry and veterinary, glass and ceramics, and electro plating segments. The company also exports its products to Europe, Canada, Asia, South America, and Australia. Omkar Speciality Chemicals Limited was incorporated in 1983 and is based in Thane, India.",0.078,buy,1953.0
769,769,MITTAL,Mittal Life Style Limited,EQ,29-APR-2020,INE997Y01027,textile-manufacturing,consumer-cyclical,Consumer Discretionary,Garments & Apparels,1.95,2.0,1.86,2.04,1.95,2.0,1.86,2.04,1712961.0,1712961.0,1645795.0,1955309.0,1955309.0,1.45,3.25,2.079049,2.0708122,1.96,0.1079545,0.39389753,4.0,2.391,,,167173032.0,308564992.0,314895008.0,,1735603200.0,1543795200.0,0.5,1544400000.0,10:1,1698796800.0,,1.0,1,1,61.719424,478428000.0,106468000.0,0.36,7825000.0,652737984.0,1.893,8690250.0,,,1.106,1.7721521,0.9455467,0.733,55.053,0.154,-0.137,1.85,23565000.0,-0.16,,,0.0361,0.04399,0.013309999,0.00611,,,"Mittal Life Style Limited engages in supply of bottom weight fabrics and denims in India. It provides fashion fabrics, cotton canvas denims, dupion bottom fabrics, polyester and cotton fabrics, knit fabrics, etc. to textile industry. The company was incorporated in 2005 and is based in Mumbai, India.",0.119,none,1869.0
775,775,ANSALAPI,Ansal Properties & Infrastructure Limited,BZ,27-JAN-2006,INE436A01026,real-estate-development,real-estate,Consumer Discretionary,Residential Commercial Projects,11.6,11.5,11.5,11.79,11.6,11.5,11.5,11.79,113584.0,113584.0,81589.0,11668.0,11668.0,8.1,15.58,11.8638,10.58135,11.5,-0.056910574,0.39389753,2.0,,,,16047931.0,157404992.0,157535008.0,0.54826,1735603200.0,1316044800.0,0.5,1316044800.0,2:1,1177286400.0,,5.0,1,5,181.015744,6550295040.0,384102016.0,2.475,4757936128.0,5525199872.0,35.177,-16473000.0,,,-41.371,,0.32761845,1.186,-397.638,,-0.278,,-374600000.0,-4.05,,,-0.0678,0.37409002,-0.00298,-0.08239,,,"Ansal Properties & Infrastructure Limited, together with its subsidiaries, engages in the real estate development business in India. It develops Hi-Tech and integrated townships, group housings, malls, shopping complexes, and clubs, as well as other mixed-use and standalone developments in the residential, commercial, retail, and hospitality segments. The company was incorporated in 1967 and is based in New Delhi, India.",0.65,none,1715.0
779,779,JISLDVREQS,Jain Irrigation Systems Limited,EQ,30-NOV-2011,IN9175A01010,conglomerates,industrials,Industrials,Plastic Products - Industrial,29.16,29.39,28.81,29.7,29.16,29.39,28.81,29.7,34933.0,34933.0,102130.0,98231.0,98231.0,27.15,45.95,35.8084,35.79345,29.7,0.027225137,0.39389753,2.0,72.432,,,387285619.0,19294300.0,1330860032.0,0.33443,1735603200.0,1568246400.0,1.0,1568246400.0,,,,2.0,1,2,3952.654336,61012389888.0,968200000.0,1.41,40403791872.0,59241148416.0,86.692,7283267584.0,,,79.236,0.37482962,0.66721433,1.03,8.377,-0.655,-0.131,-0.616,716129984.0,0.96,,30.937502,0.0039500003,0.42924,0.12294,0.08112001,,,"Jain Irrigation Systems Limited manufactures and sells micro-irrigation systems in India, Europe, North America, and internationally. The company operates through Hi-Tech Agri Input Products, Plastic, Agro Processing, and Other Business segments. It provides drip irrigation; micro and mini sprinklers; sprinkler irrigation systems; hose reel and boom irrigation; filters, dosing pumps, and injectors; PVC and HDPE pipes and fittings; plastic sheets; hi-tech planting material; environment-controlled agriculture; polypropylene piping products; and plumbing and drainage systems. The company also offers green energy products, including solar photovoltaic (PV) modules, solar pumps, solar off grid power plants, solar rooftop grid connected plants, solar water heating systems, LED based home and street lighting products, LED lanterns, and module mounting structure solutions, as well as undertakes turnkey projects. In addition, it is involved in the fruit, vegetable, and spice processing activities; provision of dehydrated onion and vegetable products, aseptic fruit purees, concentrates, clarified juices, individually quick frozen, and frozen products under the Jain Farm Fresh brand; manufacture of fruit or vegetable juices and their concentrate squashes, powder, and spices; and manufactures and supplies tissue cultured plants and agriculture equipment and inputs. Further, the company engages in distribution of food ingredients, dehydrated onions, and other vegetables; and generates power through solar and biogas power plants. Additionally, the company manufactures and sells plastic sheets; and engages in the food and frozen foods business. Jain Irrigation Systems Limited was founded in 1963 and is headquartered in Jalgaon, India.",1.23,none,788.0
