,Unnamed: 0,symbol,name_of_company,series,date_of_listing,isin_number,industry_key,sector_key,macro,basic_industry,previous_close,open,day_low,day_high,regular_market_previous_close,regular_market_open,regular_market_day_low,regular_market_day_high,volume,regular_market_volume,average_volume,average_volume10days,average_daily_volume10_day,fifty_two_week_low,fifty_two_week_high,fifty_day_average,two_hundred_day_average,current_price,52_week_change,sand_p52_week_change,price_hint,debt_to_equity,quick_ratio,current_ratio,float_shares,shares_outstanding,implied_shares_outstanding,held_percent_insiders,compensation_as_of_epoch_date,ex_dividend_date,last_dividend_value,last_dividend_date,last_split_factor,last_split_date,payout_ratio,paid_up_value,market_lot,face_value,market_cap,enterprise_value,total_cash,total_cash_per_share,total_debt,total_revenue,revenue_per_share,ebitda,free_cashflow,operating_cashflow,book_value,price_to_book,price_to_sales_trailing12_months,enterprise_to_revenue,enterprise_to_ebitda,earnings_growth,revenue_growth,earnings_quarterly_growth,net_income_to_common,trailing_eps,forward_eps,trailing_pe,profit_margins,gross_margins,ebitda_margins,operating_margins,return_on_assets,return_on_equity,long_business_summary,beta,recommendation_key,market_cap_rank
1,1,IL&FSENGG,IL&FS Engineering and Construction Company Limited,BZ,25-OCT-2007,INE369I01014,engineering-construction,industrials,Industrials,Civil Construction,42.94,45.0,40.79,45.0,42.94,45.0,40.79,45.0,18197.0,18197.0,37466.0,11283.0,11283.0,18.81,51.65,44.1066,34.0957,41.2,0.49877834,0.28914618,2.0,,0.092,0.137,25713619.0,131121000.0,134648000.0,0.80331004,,1221782400.0,1.5,1221782400.0,,,,10.0,1,10,540.2185216,29084119040.0,3235000064.0,24.745,26705500160.0,2830799872.0,21.65,-1570800000.0,-353462496.0,-429200000.0,-244.633,,1.90836,10.274,-18.515,,-0.085,,-1043299968.0,-7.96,,,-0.36855,0.15201001,-0.5549,-0.34148,-0.05802,,"IL&FS Engineering and Construction Company Limited, together with its subsidiaries, engages in construction and infrastructure development, and project management businesses in India. The company develops and constructs roads and bridges, railways, expressways, and highways; residential buildings, commercial buildings, industrial structures, and hospital buildings; irrigation canals and dams; and thermal and hydel power projects. It also develops ports involving construction of berths, jetties, breakwaters, marine structures, and cargo handling facilities, as well as land for setting up port-based industries; and constructs terminal buildings, runways, aprons, parking bays, hangers, and other structures for the airport sector. In addition, the company constructs rail and rail-based systems; seaports; oil and gas pipelines and storage tank terminals; refineries and petro chemicals; water and water treatment plants; power generation, transmission, and distribution projects; and industrial construction projects. It serves the power, oil and gas, roads, railways and metros, water and irrigation, ports, and buildings and structures sectors. The company was formerly known as Maytas Infra Limited and changed its name to IL&FS Engineering and Construction Company Limited in January 2011. IL&FS Engineering and Construction Company Limited was incorporated in 1988 and is based in Hyderabad, India.",0.615,none,473.0
62,62,SAKHTISUG,Sakthi Sugars Limited,EQ,06-SEP-1995,INE623A01011,confectioners,consumer-defensive,Fast Moving Consumer Goods,Sugar,33.91,34.19,33.3,34.19,33.91,34.19,33.3,34.19,60168.0,60168.0,591663.0,147748.0,147748.0,26.75,46.75,35.2968,36.3284,33.42,0.21541214,0.28914618,2.0,655.801,,,44087317.0,118849000.0,118954000.0,0.66863996,1546214400.0,1196899200.0,1.5,1196899200.0,,,,10.0,1,10,397.5442432,11714340864.0,63235000.0,0.532,7734297088.0,10896868352.0,91.712,1046824000.0,,,9.923,3.3679328,0.3648243,1.075,11.19,-0.282,0.064,-0.281,971646976.0,6.99,,4.781116,0.09804,0.36431998,0.09607001,0.14271,,,"Sakthi Sugars Limited manufactures and sells sugar in India. It operates through Sugar, Industrial Alcohol, Soya Products, and Power segments. The company offers white and refined sugar; industrial alcohol, including rectified spirit, extra neutral alcohol/neutral spirit, and ethanol manufactured from molasses; sugar by-products, such as molasses, bagasse, and press muds; bio earth products for use as an organic fertilizer and soil improver; and soya products. It also operates three cogeneration power plants with an aggregate power generation capacity of 92 megawatts. The company was incorporated in 1961 and is headquartered in Coimbatore, India. Sakthi Sugars Limited is a subsidiary of ABT Investments (India) Private Limited.",0.231,none,500.0
63,63,HEG,HEG Limited,EQ,10-MAY-1995,INE545A01016,electrical-equipment-parts,industrials,Industrials,Electrodes & Refractories,568.5,568.5,543.15,574.2,568.5,568.5,543.15,574.2,1412324.0,1412324.0,3550438.0,11795192.0,11795192.0,321.0,619.5,461.1168,440.927,546.95,0.63127685,0.28914618,2.0,12.7,0.894,2.179,61905077.0,192978000.0,193567008.0,0.5955,1735603200.0,1722384000.0,22.5,1722384000.0,5:1,1729209600.0,0.3039,10.0,1,10,10554.9316096,110837137408.0,4611299840.0,23.875,5645199872.0,22576136192.0,117.024,2745899008.0,-993436352.0,2996516096.0,230.141,2.3765864,4.6752605,4.909,40.365,-0.144,-0.006,-0.143,1818990976.0,14.78,38.18,37.006092,0.080570005,0.5125,0.12163,0.15006,0.00906,0.04137,"HEG Limited manufactures and sells graphite electrodes in India and internationally. The company operates through Graphite Electrodes and Power Generation segments. It provides ultra-high power and high power electrodes; graphite electrodes and nipples; carbon blocks; graphite specialties; and activated carbon fabric products. The company operates thermal power plants and a hydroelectric power facility. HEG Limited was incorporated in 1972 and is based in Noida, India.",,none,177.0
80,80,MBECL,Mcnally Bharat Engineering Company Limited,BE,06-OCT-2006,INE748A01016,engineering-construction,industrials,Industrials,Civil Construction,3.83,3.9,3.9,3.9,3.83,3.9,3.9,3.9,32990.0,32990.0,62342.0,32507.0,32507.0,3.06,7.1,4.1884,4.7241,3.9,-0.33391303,0.28914618,4.0,,,,119334394.0,211571008.0,212696000.0,0.53987,1577750400.0,1379462400.0,1.0,1379462400.0,5:100,1711411200.0,,10.0,1,10,82.5126976,31612663808.0,206888992.0,0.978,31068461056.0,1533004032.0,7.244,-928671232.0,,,-198.862,,0.53824186,20.621,-34.041,,-0.361,,-8666003456.0,-42.24,,,,0.11928,-0.60578996,-0.21061,,,"McNally Bharat Engineering Company Limited engages in engineering, procurement, and construction businesses in India. It operates through two segments, Turnkey Engineering and Other Engineering Services. The company offers its turnkey solutions in the areas of power, steel, coal and mining, ports, aluminum, material handling, mineral processing, cement, water, mineral benefication, pyroprocessing, pneumatic handling of powdered materials, coal washing, port cranes, civic, industrial water supply, and oil and gas sectors, as well as for infrastructure sectors, such as buildings and townships, high rises, roads, metro, rail etc. It also manufactures a range of products, including crushers and screens, mobile crushing and screening plants, skid mounted coal sizers, mills, pressure vessels, material handling equipment, and steel plant equipment, as well as process equipment, such as flotation cells, thickeners, slurry pumps, etc. The company was formerly known as McNally-Bird Engineering Company Limited and changed its name to McNally Bharat Engineering Company Limited in 1972. McNally Bharat Engineering Company Limited was incorporated in 1961 and is based in Kolkata, India.",0.833,none,602.0
101,101,JPPOWER,Jaiprakash Power Ventures Limited,EQ,18-APR-2005,INE351F01018,utilities-independent-power-producers,utilities,Utilities,Power Generation,18.98,19.0,18.62,19.0,18.98,19.0,18.62,19.0,22625167.0,22625167.0,65642446.0,76941817.0,76941817.0,12.25,24.0,18.6262,18.3105,18.71,0.32727277,0.28914618,2.0,33.453,1.56,2.272,5608009924.0,6853459968.0,7071819776.0,0.35298002,1735603200.0,1249862400.0,0.75,1249862400.0,,,,10.0,1,10,12843.085824,230532349952.0,12752499712.0,1.466,40139698176.0,66862600192.0,7.687,24791099392.0,7813262336.0,18077300736.0,9.42,1.9861995,1.9208176,3.448,9.299,,-0.091,1.66,12901300224.0,0.91,-1.7,20.560438,0.19336,0.41641,0.37078,0.2169,0.07171,0.11387999,"Jaiprakash Power Ventures Limited engages in the power generation and cement grinding businesses in India and internationally. The company generates electricity through thermal and hydro energy sources. It owns and operates a 400 megawatts (MW) Jaypee Vishnuprayag hydro-electric power plant at District Chamoli, Uttarakhand; 1320 MW Jaypee Nigrie thermal power plant at village Nigrie, district Singrauli, Madhya Pradesh; and 500 MW Jaypee Bina thermal power plant at village Sirchopi, district Sagar, Madhya Pradesh. The company also operates Jaypee Nigrie cement grinding unit at Nigrie, District Singrauli, Madhya Pradesh; and sand mining in Andhra Pradesh. In addition, it operates coal mine located in Amelia and Bandha Madhya Pradesh. The company was formerly known as Jaiprakash Hydro-Power Limited and changed its name to Jaiprakash Power Ventures Limited in December 2009. Jaiprakash Power Ventures Limited was incorporated in 1994 and is based in New Delhi, India.",1.389,none,162.0
173,173,GTL,GTL Limited,BE,29-MAR-1995,INE043A01012,telecom-services,communication-services,Telecommunication,Other Telecom Services,13.87,13.98,13.5,14.05,13.87,13.98,13.5,14.05,948863.0,948863.0,1759766.0,1679882.0,1679882.0,7.6,19.45,13.0114,12.5713,13.6,0.7896774,0.28914618,2.0,,,,128047445.0,157296992.0,157410000.0,0.25718,1735603200.0,1317945600.0,1.0,1317945600.0,,,,10.0,1,10,213.9239168,59685711872.0,149506000.0,0.95,57842266112.0,2188665088.0,13.901,903910272.0,,,-382.802,,0.97741735,27.27,66.031,1.645,0.367,1.655,2188350976.0,10.31,,1.3191077,0.99986,0.56228,0.413,0.42360002,,,"GTL Limited operates as an infrastructure services company in India. The company offers services and solutions to address the network life cycle requirements of telecom operators, technology providers, and tower companies. It also offers network operation and maintenance services, such as network monitoring and operation, network field maintenance, technical support and process management, logistics and vendor management, and transition management services. In addition, the company offers energy management solutions in the areas of energy audits of telecom infrastructure, process improvement, technology upgradation, and alternate sources of energy. GTL Limited was incorporated in 1987 and is based in Mumbai, India.",0.865,none,553.0
178,178,TREEHOUSE,Tree House Education & Accessories Limited,EQ,26-AUG-2011,INE040M01013,education-training-services,consumer-defensive,Consumer Discretionary,Education,19.24,18.85,18.85,18.85,19.24,18.85,18.85,18.85,999.0,999.0,36303.0,27011.0,27011.0,15.09,34.65,17.273,21.5708,18.85,-0.04752475,0.28914618,2.0,0.043,4.28,4.832,29248187.0,42310700.0,43783500.0,0.39033002,,1442361600.0,2.0,1442361600.0,,,,10.0,1,10,81.0406784,,,,900000.0,84140000.0,2.006,9314000.0,-4762125.0,77000.0,47.349,0.39810768,9.631647,,,,,,-31281000.0,-0.75,,,-0.37177,0.48204,0.1107,0.090909995,0.00066,-0.014989999,"Tree House Education & Accessories Limited provides educational and related services to the K-12 schools in India. The company operates preschools; and offers a range of programs for children, including play group, nursery, junior kindergarten, senior kindergarten, day care services, teacher's training courses, summer camps, and hobby classes. It also leases education infrastructure; and franchises education centers. Tree House Education & Accessories Limited was founded in 2003 and is based in Mumbai, India.",0.348,none,604.0
191,191,A2ZINFRA,A2Z Infra Engineering Limited,BE,23-DEC-2010,INE619I01012,engineering-construction,industrials,Industrials,Civil Construction,20.86,20.5,19.89,21.24,20.86,20.5,19.89,21.24,1049824.0,1049824.0,399721.0,761719.0,761719.0,10.1,24.57,17.643,17.26705,20.14,1.0653465,0.28914618,2.0,948.741,,,108514489.0,176120000.0,176372992.0,0.36992002,,1316649600.0,2.0,1316649600.0,,,,10.0,1,10,355.2152064,4840600576.0,28604000.0,0.162,1979510016.0,3770310912.0,22.058,-543674752.0,,,1.827,11.023536,0.9421377,1.284,-8.903,,-0.122,,-47996000.0,0.16,,125.875,-0.01273,0.12818,-0.1442,0.02957,,,"A2Z Infra Engineering Limited offers engineering, procurement, construction, and facility management services in India and internationally. The company operates through Engineering Services, Facility Management Services, Municipal Solid Waste Management, Power Generation Projects, and Others segments. It offers integrated design, testing, installation, construction, and commissioning services, as well as engages in telecom infrastructure projects. In addition, the company engages in rural and railway electrification, reduction of AT&C losses, and feeder renovation and segregation; underground cabling; installation of high and low voltage distribution systems; erection of distribution lines; renewable energy and construction of substations and transmission lines; and provision of operation and maintenance services. Further, it provides and optical fiber cable NLD/access networking construction and maintenance, network integration, telecom infrastructure operation and maintenance, material planning and project management, and engineering construction and infrastructure services. The company collects, transports, treats, and disposes solid waste; trades in goods; rents equipment; manufactures electrical equipment; and provides operation and maintenance services, etc. Additionally, it provides facility management services, such as clean train station scheme, mechanized cleaning, intensive rake cleaning, hospitality and hygiene, and board housekeeping services to Indian railways; and deep cleaning, technical, and business support services, as well as offers renewable energy generation services. The company develops ecotech green toilet and green toilet projects. A2Z Infra Engineering Limited formerly known as A2Z Maintenance & Engineering Services Limited and changed its name to A2Z Infra Engineering Limited in October 2014. The company was incorporated in 2002 and is based in Gurugram, India.",0.653,none,508.0
207,207,UFO,UFO Moviez India Limited,EQ,14-MAY-2015,INE527H01019,entertainment,communication-services,Consumer Discretionary,Film Production Distribution & Exhibition,116.6,115.62,113.5,116.63,116.6,115.62,113.5,116.63,73470.0,73470.0,204248.0,120555.0,120555.0,97.2,173.85,112.6196,127.13715,114.15,0.0021487474,0.28914618,2.0,28.441,1.321,1.688,17470295.0,38705900.0,38705900.0,0.53181,1735603200.0,1583884800.0,15.0,1583884800.0,,,,10.0,1,10,441.82784,4223978240.0,947299968.0,24.759,803800000.0,4287655936.0,111.323,444987008.0,-86649248.0,630198016.0,73.867,1.5453451,1.0304648,0.985,9.492,,0.111,,55404000.0,1.43,29.21,79.82518,0.012920001,0.5115,0.10378,0.0073400005,0.0135699995,0.01984,"UFO Moviez India Limited, together with its subsidiaries, provides digital cinema services in India, the Middle East, and internationally. It distributes films; in-cinema advertising, that enables the advertisers to engage a captive audience by actively choosing and paying to experience the content; caravan talkies for marketers and advertisers for rural targeting; and UFO Framez, an in-cinema advertising offers marketing and promotional needs of local retailers, and business owners. The company also offers UFO-M4, a satellite-based, e-cinema movie delivery platform; and digital mastering, and movie marketing and release services; and operates club cinemas. The company operates through a network of PRIME and POPULAR screens. UFO Moviez India Limited was incorporated in 2004 and is headquartered in Mumbai, India.",0.047,none,493.0
219,219,PARSVNATH,Parsvnath Developers Limited,EQ,30-NOV-2006,INE561H01026,real-estate-development,real-estate,Consumer Discretionary,Residential Commercial Projects,19.44,19.4,18.88,20.41,19.44,19.4,18.88,20.41,2112973.0,2112973.0,598130.0,526106.0,526106.0,10.4,21.58,18.4948,15.5936,20.41,0.6066116,0.28914618,2.0,,,,141228322.0,435180992.0,435415008.0,0.68412,1735603200.0,1221436800.0,1.5,1221436800.0,2:1,1287360000.0,,5.0,1,5,888.2043904,36476096512.0,4630444032.0,10.644,32401577984.0,5278289920.0,12.111,11513000.0,,,-38.979,,1.6827503,6.911,3168.253,,0.633,,-4995833856.0,-12.69,,,-0.94649005,0.28964,0.0021799998,0.017280001,,,"Parsvnath Developers Limited, together with its subsidiaries, engages in the real estate development business in India. It promotes, constructs, and develops of integrated townships, residential and commercial complexes, multistoried buildings, flats, houses, apartments, shopping malls, IT parks, hotels, retail DMRC station, special economic zones, and third-party contracting projects. The company is also involved in the property leasing; and hotel business. Parsvnath Developers Limited was founded in 1984 and is based in New Delhi, India.",1.15,none,415.0
239,239,PTC,PTC India Limited,EQ,07-APR-2004,INE877F01012,utilities-independent-power-producers,utilities,Utilities,Power Trading,175.03,175.1,169.0,175.44,175.03,175.1,169.0,175.44,2522311.0,2522311.0,1672751.0,1219092.0,1219092.0,158.01,254.6,179.5442,203.2757,170.72,-0.073425114,0.28914618,2.0,71.756,,,236545475.0,296008000.0,296127008.0,0.22650999,1735603200.0,1726704000.0,7.8,1726704000.0,,,0.5128,10.0,1,10,5055.4802176,80357015552.0,22433200128.0,75.723,43271000064.0,166905298944.0,563.597,10867399680.0,,,173.709,0.9827931,0.30289513,0.481,7.394,0.337,-0.033,0.339,4503799808.0,15.75,13.2,10.839365,0.03121,0.07836,0.06511,0.06439,,,"PTC India Limited, together with its subsidiaries, engages in the trading of power in India, Nepal, Bhutan, and Bangladesh. The company operates in two segments, Power and Financing Business. It engages in long term, medium term, and short-term power trading activities; and cross border power trading business. The company provides financing solutions to the energy value chain which includes v or extending debt to power projects in generation, transmission, distribution, fuel resources, and fuel related infrastructure, as well as consultancy and advisory services. It serves its products to state distribution and private distribution companies, corporates, and entities trading power on power exchanges. The company was formerly known as Power Trading Corporation of India Ltd and changed its name to PTC India Limited. PTC India Limited was incorporated in 1999 and is based in New Delhi, India.",1.048,none,247.0
247,247,FLFL,Future Lifestyle Fashions Limited,BZ,01-OCT-2013,INE452O01016,apparel-manufacturing,consumer-cyclical,Consumer Discretionary,Diversified Retail,2.29,2.35,2.2,2.35,2.29,2.35,2.2,2.35,118769.0,118769.0,119082.0,69157.0,69157.0,1.8,3.15,2.3272,2.2703,2.32,-0.21034485,0.28914618,4.0,,0.078,0.675,170814997.0,201775008.0,203552992.0,0.23216,,1563753600.0,1.4,1563753600.0,,,,2.0,1,2,46.8118016,17102346240.0,924499968.0,4.543,17560700928.0,23132899328.0,114.603,-9979599872.0,4266737408.0,6971700224.0,-99.569,,0.020236028,0.739,-1.714,,-0.787,,-21350899712.0,-107.11,9.01,,-0.92297,0.16253,-0.4314,-0.61004,-0.13293,,"Future Lifestyle Fashions Limited operates as an integrated fashion company in India. The company retails fashion products through departmental and neighborhood stores. Its stores offer men's formals, casuals, youth wear, women's western wear, women's ethnic, sportswear, denim wear, infant wear, accessories, footwear, luggage, and other products; and cosmetics, fragrances, eyewear, watches, accessories, sportswear, toys, mobiles, electronics, home, and other products. The company offers its products under the Lee Cooper, Champion, aLL, Indigo Nation, RIG, Alice and Mae, Bare, Urban Yoga, Ancestry, Scullers, UMM, Clarks, Jealous 21, Lombard, Tresmode, Turtle, John Miller, Ceriz, Giovani, Converse, Urbana, Celio, Cover Story, Umbro, Mineral, Mother Earth, and Spunk brands. It operates its stores under the Central and Brand Factory brand names; and other exclusive brand outlets, as well as offers its products through e-commerce websites. The company was formerly known as Future Value Fashion Retail Limited and changed its name to Future Lifestyle Fashions Limited. Future Lifestyle Fashions Limited was incorporated in 2012 and is based in Mumbai, India.",1.14,none,626.0
249,249,YAARI,Yaari Digital Integrated Services Limited,BE,18-AUG-2011,INE126M01010,credit-services,financial-services,Services,Diversified Commercial Services,18.68,18.75,18.68,20.3,18.68,18.75,18.68,20.3,290160.0,290160.0,330752.0,472202.0,472202.0,6.7,20.3,14.0524,11.47775,18.68,0.72165895,0.28914618,2.0,,,,47643532.0,98687904.0,98687904.0,0.40003,,1525996800.0,1.0,1525996800.0,,,,2.0,1,2,184.3490048,3686456576.0,1500000.0,0.015,2435699968.0,34100000.0,0.34,-8600000.0,,,-23.687,,54.06129,108.107,-428.658,,1.083,,-213900000.0,-2.11,,,,0.97653997,-0.2522,0.02,,,"Yaari Digital Integrated Services Limited, together with its subsidiaries, engages in the digital platform business in India. The company provides web services, real estate project advisory services, construction and development of real estate projects and advisory services, aviation services, maintenance and management services, equipment hiring services, and other related activities. It operates its Yaarii, a social commerce app for reselling products. The company was formerly known as Indiabulls Integrated Services Limited and changed its name to Yaari Digital Integrated Services Limited in November 2020. Yaari Digital Integrated Services Limited was incorporated in 2007 and is based in Mumbai, India.",1.187,none,566.0
252,252,YESBANK,Yes Bank Limited,EQ,12-JUL-2005,INE528G01035,banks-regional,financial-services,Financial Services,Private Sector Bank,21.58,21.5,21.12,21.59,21.58,21.5,21.12,21.59,179853066.0,179853066.0,82689186.0,106101492.0,106101492.0,19.02,32.85,20.5298,23.11285,21.2,0.008411169,0.28914618,2.0,,,,16272779572.0,31349899264.0,31683700736.0,0.41022998,1735603200.0,1559520000.0,2.0,1559606400.0,5:1,1505952000.0,,2.0,1,2,66461.7877504,1178328629248.0,290447392768.0,9.227,789497577472.0,127215058944.0,4.263,,,-463109783552.0,14.755,1.4368011,5.2243648,9.262,,1.25,0.262,1.478,17924714496.0,0.59,1.19,35.932205,0.1409,,,0.20606,0.00457,0.040799998,"Yes Bank Limited engages in the provision of banking and financial products and services primarily in India. It operates through Treasury, Corporate/Wholesale Banking, Retail Banking, and Other Banking Operations segments. The company provides retail banking products, including savings accounts; fixed and recurring deposits; home, car, bike, commercial vehicle, construction equipment, gold, personal, mortgage, and secured business loans; loans against securities; and health care and printing equipment finance, as well as business banking services to micro, small, and medium enterprises. It offers corporate banking services, such as working capital, project, supply chain, agri commodity, and trade finance, as well as term loans; and cash management services, debt capital markets, treasury, investment banking solution, foreign currency loans and overseas financing, liquidity management, and other services. In addition, the company offers financial and advisory services to ministries under the union and state governments, central and state public sector undertakings, boards, and other affiliates; and banking solutions to cooperative banks, mutual funds, stockbrokers, non-banking finance companies (NBFCs), payment aggregators, regulated payment operators, non-resident Indians, and other financial institutions. Further, it provides debit and credit cards, wealth management and insurance products, and mobile and online banking services; transaction banking services; mergers and acquisition advisory; merchant acquiring; and remittance solutions, as well as operates ATMs and bunch note acceptors/recyclers. The company was incorporated in 2003 and is headquartered in Mumbai, India.",0.387,none,49.0
255,255,CELEBRITY,Celebrity Fashions Limited,EQ,12-JAN-2006,INE185H01016,apparel-manufacturing,consumer-cyclical,Consumer Discretionary,Garments & Apparels,16.46,16.77,16.1,16.77,16.46,16.77,16.1,16.77,104624.0,104624.0,111197.0,118023.0,118023.0,12.8,23.95,15.0782,17.3534,16.6,-0.048554897,0.28914618,2.0,197.704,,,30838675.0,56552100.0,57720200.0,0.50163,1735603200.0,1156896000.0,1.0,1156896000.0,,,,10.0,1,10,95.8155328,1460054272.0,35800000.0,0.632,671600000.0,2829700096.0,60.708,92850000.0,,,6.007,2.7634428,0.33860666,0.516,15.725,,-0.623,,-85100000.0,-2.36,,,-0.03007,0.40001,0.03281,-0.20557,,,"Celebrity Fashions Limited engages in the designing, manufacturing, sale, and export of garments and clothing accessories in India and internationally. It offers shirts, t-shirts, sweaters, shackets, trousers, shorts, and denims for men and boys under the Indian Terrain brand through retail outlets and e-commerce stores. Celebrity Fashions Limited was incorporated in 1988 and is based in Chennai, India.",0.16,none,599.0
