,Unnamed: 0,symbol,name_of_company,series,date_of_listing,isin_number,industry_key,sector_key,macro,basic_industry,previous_close,open,day_low,day_high,regular_market_previous_close,regular_market_open,regular_market_day_low,regular_market_day_high,volume,regular_market_volume,average_volume,average_volume10days,average_daily_volume10_day,fifty_two_week_low,fifty_two_week_high,fifty_day_average,two_hundred_day_average,current_price,52_week_change,sand_p52_week_change,price_hint,debt_to_equity,quick_ratio,current_ratio,float_shares,shares_outstanding,implied_shares_outstanding,held_percent_insiders,compensation_as_of_epoch_date,ex_dividend_date,last_dividend_value,last_dividend_date,last_split_factor,last_split_date,payout_ratio,paid_up_value,market_lot,face_value,market_cap,enterprise_value,total_cash,total_cash_per_share,total_debt,total_revenue,revenue_per_share,ebitda,free_cashflow,operating_cashflow,book_value,price_to_book,price_to_sales_trailing12_months,enterprise_to_revenue,enterprise_to_ebitda,earnings_growth,revenue_growth,earnings_quarterly_growth,net_income_to_common,trailing_eps,forward_eps,trailing_pe,profit_margins,gross_margins,ebitda_margins,operating_margins,return_on_assets,return_on_equity,long_business_summary,beta,recommendation_key,market_cap_rank
28,28,IDEA,Vodafone Idea Limited,EQ,09-MAR-2007,INE669E01016,telecom-services,communication-services,Telecommunication,Telecom - Cellular & Fixed line services,8.34,8.45,8.21,8.67,8.34,8.45,8.21,8.67,1022893509.0,1022893509.0,432921715.0,510063494.0,510063494.0,6.61,19.18,8.6586,13.23445,8.36,-0.36091954,0.31326675,2.0,,0.315,0.639,25428463505.0,69699796992.0,69783396352.0,0.64004,,1474502400.0,0.361781,1474502400.0,,,,10.0,1,10,58338.9151232,2940475015168.0,142230994944.0,2.042,2501666930688.0,426521001984.0,7.426,108779003904.0,-166984253440.0,175342993408.0,-13.693,,1.3677853,6.894,27.032,,0.019,,-282685014016.0,-5.06,-3.76,,-0.66277003,0.43624002,0.25504,-0.07952,-0.015190001,,"Vodafone Idea Limited provides mobile telecommunication services in India. The company provides voice and data services on 4G VoLTE and Voice over WIFI calling services; broadband data services on 3G and/or 4G platforms; content and digital products and services; and other value-added services, including entertainment, utility, and voice and short messaging services. It offers long distance and ISP services; manpower services; business and enterprise services; and business connectivity services, such as IoT, cloud, managed services, etc. In addition, the company trades in mobile handsets, data cards, and related accessories and services; and rents passive infrastructure to telecommunication service providers. Further, it offers technology, software, hardware, VAS, application software, and contents and related products and services, which facilitate and develop access to information technology (IT) enabled VAS products and services on single or multiple platforms or operating systems; and data centre related services and IT solutions, including E-SIMs, as well as involved in the prepaid payment instrument; business correspondence; and mobile wallet and money transfer businesses. The company was formerly known as Idea Cellular Limited and changed its name to Vodafone Idea Limited in August 2018. Vodafone Idea Limited was incorporated in 1995 and is based in Mumbai, India.",0.558,hold,51.0
32,32,CHENNPETRO,Chennai Petroleum Corporation Limited,EQ,07-JUN-2000,INE178A01016,oil-gas-refining-marketing,energy,Energy,Refineries & Marketing,621.6,622.25,621.05,633.8,621.6,622.25,621.05,633.8,916580.0,916580.0,1244298.0,1861060.0,1861060.0,565.2,1275.0,768.897,904.1968,628.05,-0.06589526,0.31326675,2.0,79.216,0.103,1.034,45005986.0,148911008.0,149139008.0,0.68813,1735603200.0,1721347200.0,55.0,1721347200.0,,,1.1432,10.0,1,10,9366.675456,151753687040.0,1935399936.0,12.999,61136998400.0,645275189248.0,4333.77,17795299328.0,-16412574720.0,-11694499840.0,518.341,1.2116541,0.14515784,0.235,8.528,,-0.269,,7165499904.0,48.11,,13.054458,0.0111,0.051119998,0.027579999,-0.0685,0.041160002,0.0922,"Chennai Petroleum Corporation Limited produces and supplies petroleum products in India. The company provides liquefied petroleum gas, motor spirit, superior kerosene oil, aviation turbine fuel, naphtha, bitumen, hexane, mineral turpentine oil, lube base stock, petrochemical feedstocks, paraffin wax, asphalt, JP 7 fuel equivalent, and pet-coke. It offers sulphur, isrosene, ISRO naphtha, light diesel oil, extracts, butene, micro crystalline wax, automotive high-speed and high flash diesel, bunker and non-bunker fuel oils, paving bitumen, and high viscosity index oils. In addition, the company offers linear alkyl benzene, methyl ethyl ketone, propylene glycol and polyols, poly iso-butylene, butene-2, and poly butene feed stocks. The company was formerly known as Madras Refineries Limited and changed its name to Chennai Petroleum Corporation Limited in June 2000. Chennai Petroleum Corporation Limited was incorporated in 1965 and is based in Chennai, India. Chennai Petroleum Corporation Limited operates as a subsidiary of Indian Oil Corporation Limited.",0.723,none,185.0
40,40,GFLLIMITED,GFL Limited,EQ,25-MAY-1995,INE538A01037,entertainment,communication-services,Financial Services,Holding Company,97.68,98.7,97.99,100.9,97.68,98.7,97.99,100.9,89735.0,89735.0,485826.0,277743.0,277743.0,66.0,125.69,93.3054,81.63625,98.26,0.0013326406,0.31326675,2.0,,,,24789047.0,109850000.0,109951000.0,0.7621,,1568160000.0,3.5,1568160000.0,2:1,1201824000.0,,1.0,1,1,1080.3785728,10982945792.0,12400000.0,0.113,,22200000.0,0.202,8401250.0,,,236.163,0.41606858,486.657,494.727,1307.299,,-1.0,,-218800000.0,-7.36,,,,1.0,0.37842998,0.41070998,,,"GFL Limited operates and manages multiplexes and cinema theatres under the INOX brand in India. It also engages in the real estate and property development activities, as well as distribution of investment products. The company was formerly known as Gujarat Fluorochemicals Limited and changed its name to GFL Limited in July 2019. GFL Limited was incorporated in 1987 and is based in Mumbai, India. GFL Limited was formerly a subsidiary of Inox Leasing and Finance Limited.",0.223,none,385.0
59,59,REDINGTON,Redington Limited,EQ,15-FEB-2007,INE891D01026,information-technology-services,technology,Services,Trading & Distributors,197.92,196.11,195.16,198.88,197.92,196.11,195.16,198.88,812330.0,812330.0,1989068.0,2299512.0,2299512.0,158.0,237.55,185.6118,202.82375,196.03,0.23161173,0.31326675,2.0,21.938,0.958,1.373,582881402.0,781774016.0,782524992.0,0.26856002,1735603200.0,1720137600.0,6.2,1720137600.0,2:1,1629244800.0,0.3985,2.0,1,2,15325.1151872,156822290432.0,17139900416.0,22.005,17244399616.0,922397704192.0,1179.213,18560700416.0,25668861952.0,30338299904.0,97.636,2.0077634,0.16614433,0.17,8.449,-0.031,0.12,-0.035,12052799488.0,15.56,15.13,12.598329,0.01307,0.05494,0.02012,0.01642,0.04302,0.15531999,"Redington Limited provides supply chain solutions in India and internationally. It offers hyperconverged infrastructure, enterprise storage, all-flash, storage visualization, and fault tolerant solutions; enterprise networking and WAN solutions; AI and automation, software applications, security, digital printing, data and analytics, infrastructure, 3D printing, network modernization, cyber security, solar, gaming, AE and VR, home automation, wearables, and displays; and next-gen firewall, web application firewall, secure access service edge, endpoint security, and identity and access management solutions. The company also engages in the distribution of information technology, mobility, and other technology products comprising laptops, tablets, servers, software, notebooks, workstations, networking, power supply, desktops, accessories, components, and smart lighting products. In addition, it offers technology services comprising consulting as a service, training as a service, infrastructure transformation, software consulting, virtualization and application delivery, networking, cybersecurity, and cloud services; and logistics services, such as warehousing, reverse logistics, in plant logistics and project management, supply chain consulting, ecommerce, mission-critical, and transportation services. Further, the company provides supply chain management, sourcing and procurement, sales and lead generation, and finance and accounting services; and financial services comprising channel financing, project financing, leasing, credit card-based financing, and but now and pay later services, as well as cloud consulting, managed, and security solutions. It serves healthcare, finance, print services providers, hospitality, manufacturing, education, government, retail, and IT/ITes industries. The company was formerly known as Redington (India) Limited and changed its name to Redington Limited. Redington Limited was incorporated in 1961 and is headquartered in Chennai, India.",0.95,none,140.0
107,107,JHS,JHS Svendgaard Laboratories Limited,BE,21-OCT-2006,INE544H01014,household-personal-products,consumer-defensive,Fast Moving Consumer Goods,Personal Care,21.81,22.6,21.69,22.9,21.81,22.6,21.69,22.9,322572.0,322572.0,304819.0,220833.0,220833.0,15.55,39.5,26.3922,22.77435,21.9,-0.15136188,0.31326675,2.0,3.719,,,42773295.0,85604000.0,86310496.0,0.52337,1735603200.0,1324857600.0,0.75,1324857600.0,,,,10.0,1,10,189.0199808,1743813888.0,103648000.0,1.318,63177000.0,836065984.0,10.708,68547504.0,,,21.67,1.0106137,2.260826,2.086,25.439,,0.218,,-20982000.0,-1.46,1.51,,-0.0251,0.43359002,0.08199,0.01273,,,"JHS Svendgaard Laboratories Limited, together with its subsidiaries, manufactures, trades, and sells a range of oral and dental products for adults and kids in India. The company offers oral care products, such as toothbrushes, toothpastes, mouthwash products, hand sanitizers, laundry detergents, room fresheners, and denture tablet products under the Dr. Gold, Dr. Fresh, Boots, Lavoris, Peanuts, Amway, Dabur, Future Group, Apollo Pharmacy, Sandika Pharma, Elder Pharma, JL Morisons, Aquawhite, 6 Ten Store, Modi Care, Infectiguard, and Odonil brands. It also provides contract manufacturing services for oral care products of other brands. The company also exports its products. JHS Svendgaard Laboratories Limited was founded in 1997 and is based in New Delhi, India.",0.776,none,525.0
161,161,GTL,GTL Limited,BE,29-MAR-1995,INE043A01012,telecom-services,communication-services,Telecommunication,Other Telecom Services,12.95,13.2,12.86,13.38,12.95,13.2,12.86,13.38,933718.0,933718.0,1793523.0,1126086.0,1126086.0,7.5,19.45,12.9064,12.5836,12.97,0.6709677,0.31326675,2.0,,,,128047445.0,157296992.0,157904000.0,0.25718,1735603200.0,1317945600.0,1.0,1317945600.0,,,,10.0,1,10,204.8014976,59685711872.0,149506000.0,0.95,57842266112.0,2188665088.0,13.901,903910272.0,,,-382.802,,0.935737,27.27,66.031,1.645,0.367,1.655,2188350976.0,10.31,,1.2580019,0.99986,0.56228,0.413,0.42360002,,,"GTL Limited operates as an infrastructure services company in India. The company offers services and solutions to address the network life cycle requirements of telecom operators, technology providers, and tower companies. It also offers network operation and maintenance services, such as network monitoring and operation, network field maintenance, technical support and process management, logistics and vendor management, and transition management services. In addition, the company offers energy management solutions in the areas of energy audits of telecom infrastructure, process improvement, technology upgradation, and alternate sources of energy. GTL Limited was incorporated in 1987 and is based in Mumbai, India.",0.865,none,518.0
162,162,NOIDATOLL,Noida Toll Bridge Company Limited,BE,06-DEC-2002,INE781B01015,infrastructure-operations,industrials,Services,Road Assets - Toll Annuity Hybrid-Annuity,15.74,15.95,15.5,15.95,15.74,15.95,15.5,15.95,50250.0,50250.0,100284.0,122741.0,122741.0,7.45,17.06,15.15,12.01535,15.89,0.16592598,0.31326675,2.0,34.512,0.4,0.541,110138068.0,186195008.0,186544992.0,0.45805,1672444800.0,1474416000.0,1.5,1474416000.0,,,,10.0,1,10,295.8638848,3151837440.0,446192992.0,2.396,667081024.0,339486016.0,1.823,103910000.0,171353248.0,23598000.0,10.38,1.5308285,8.715054,9.284,30.332,,1.792,,-248462000.0,-1.33,,,-0.73188,0.44122002,0.30607998,-0.67357004,-0.04868,-0.120299995,"Noida Toll Bridge Company Limited engages in the development, establishment, construction, operation, and maintenance of Delhi Noida toll bridge on a build-own-operate-transfer basis in India. The company also provides space rentals for advertisements and offices. Noida Toll Bridge Company Limited was founded in 1976 and is based in Noida, India.",0.562,none,497.0
165,165,SIMBHALS,Simbhaoli Sugars Limited,EQ,14-MAR-2016,INE748T01016,confectioners,consumer-defensive,Fast Moving Consumer Goods,Sugar,22.29,22.4,22.15,22.48,22.29,22.4,22.15,22.48,22034.0,22034.0,40728.0,23341.0,23341.0,20.7,38.5,23.7942,27.2451,22.16,-0.27275693,0.31326675,2.0,,,,15042209.0,41279000.0,42342900.0,0.60321,1735603200.0,1153699200.0,3.0,1153699200.0,,,,10.0,1,10,91.4742656,11479896064.0,725177024.0,17.553,10276569088.0,11917104128.0,288.765,254278000.0,,,-31.793,,0.0767588,0.963,45.147,,0.042,,-152496992.0,3.49,,6.3495703,-0.0128,0.17615,0.021340001,-0.04033,,,"Simbhaoli Sugars Limited primarily manufactures and sells sugar in India. The company operates through Sugar and Alcohol segments. It produces sugar under the TRUST brand name; spirit and liquor; denatured spirit; bagasse; molasses; extra neutral alcohol (ENA); ethanol; brown mineral and coffee sugar, and jaggery and jaggery powder under the Sunehra brand; and cane sugar under the G-Low brand. The company also provides powdered fruit drink mixes and coconut water under the SIPP brand; hand sanitizers and multi surface disinfectants under the TRUST brand; and organic bio-manures, bio-compost, plant nutrients, plant growth regulators, and herbicides under the SOM brand name. In addition, it offers logistics and transport services; agriculture advisory services; and technology and engineering consulting services, as well as trades ENA and corogen and others. Further, the company operates co-generation power plants to generate bio-mass based power. The company was founded in 1933 and is based in Noida, India.",0.426,none,565.0
167,167,SWARAJENG,Swaraj Engines Limited,EQ,06-DEC-1995,INE277A01016,auto-parts,consumer-cyclical,Industrials,Compressors Pumps & Diesel Engines,3082.05,3097.95,3082.35,3150.0,3082.05,3097.95,3082.35,3150.0,8718.0,8718.0,13548.0,11096.0,11096.0,2148.0,3470.0,3038.861,2786.9001,3104.45,0.4006772,0.31326675,2.0,0.453,1.495,1.904,5236359.0,12147300.0,12179600.0,0.57372004,1640908800.0,1719532800.0,95.0,1719532800.0,3:1,1123804800.0,0.78050005,10.0,1,10,3771.068416,35612811264.0,1842300032.0,151.659,15500000.0,15127393280.0,1245.38,2018148992.0,952446144.0,1571204992.0,281.429,11.031024,2.492874,2.354,17.646,0.205,0.194,0.206,1478860032.0,121.74,86.44,25.500658,0.09776,0.20583999,0.13340999,0.123509996,0.2086,0.45433998,"Swaraj Engines Limited manufactures and sells diesel engines, diesel engine components, and spare parts for tractors in India. The company was incorporated in 1985 and is based in Mohali, India. Swaraj Engines Limited operates as a subsidiary of Mahindra & Mahindra Limited.",0.589,none,264.0
195,195,DIACABS,Diamond Power Infrastructure Limited,BE,15-SEP-2023,INE989C01020,specialty-industrial-machinery,industrials,Industrials,Other Electrical Equipment,1444.0,1443.95,1421.15,1486.95,1444.0,1443.95,1421.15,1486.95,7617.0,7617.0,16620.0,10693.0,10693.0,108.25,1899.95,1517.887,1120.272,1449.65,12.339492,0.31326675,2.0,,,,4960982.0,52697100.0,53523700.0,0.9278,,1380153600.0,100.0,1380153600.0,10:1,1733184000.0,,10.0,1,10,7639.2349696,107052605440.0,98362000.0,1.865,23553042432.0,4927840256.0,93.416,554751488.0,,,-184.705,,15.502197,21.724,192.974,1.99,2.007,2.0,280636992.0,5.63,,257.48666,0.056950003,0.23506,0.11257,0.08595,,,"Diamond Power Infrastructure Limited manufactures and sells power transmission equipment. The company provides power cables that includes low voltage, high voltage, and extra high voltage cables. It also offers transmission towers; and transmission and distribution conductors, such as aluminium wire rods, alloy wire rods, aluminium conductors, aluminum alloy conductors, aluminium conductor steel and alloy reinforced, aluminium alloy conductor steel reinforced high conductivity alloy conductors al  59, and stay wire / galvanised steel earth wire. In addition, the company provides turnkey services. The company offers its products through distributors in India, as well as exports its products and solutions under the Dicabs brand. The company was formerly known as Diamond Cables Limited. Diamond Power Infrastructure Limited was founded in 1970 and is headquartered in Ahmedabad, India.",-1.27,none,206.0
203,203,TGBHOTELS,TGB Banquets And Hotels Limited,EQ,17-MAY-2007,INE797H01018,lodging,consumer-cyclical,Consumer Discretionary,Hotels & Resorts,14.58,14.9,14.57,15.24,14.58,14.9,14.57,15.24,48423.0,48423.0,131525.0,24609.0,24609.0,12.6,20.3,14.9782,15.53775,14.91,-0.088750005,0.31326675,2.0,9.619,,,14236069.0,29286400.0,29427000.0,0.46307,1735603200.0,1316649600.0,1.0,1316649600.0,,,,10.0,1,10,43.8756576,462011392.0,2867000.0,0.105,71312000.0,354624992.0,12.239,-14103500.0,,,25.315,0.5889788,1.237241,1.303,-32.759,-0.167,-0.078,-0.192,-35922000.0,-1.22,,,-0.1013,0.49521,-0.03977,0.011519999,,,"TGB Banquets and Hotels Limited provides restaurant, banquet, and hotel services in India. The company operates hotel under The Grand Bhagwati name located in Ahmedabad. It also offers dining under the Café Piano and Mr. & Mrs. Somani brand names; and food and catering services. In addition, the company operates meeting and convention centers under The Grand Bhagwati name, as well as clubs and events. The company was formerly known as Bhagwati Banquets and Hotels Limited and changed its name to TGB Banquets and Hotels Limited in April 2013. TGB Banquets and Hotels Limited was founded in 1989 and is based in Ahmedabad, India.",0.666,none,587.0
209,209,NAGAFERT,Nagarjuna Fertilizers and Chemicals Limited,EQ,15-JUN-2016,INE454M01024,agricultural-inputs,basic-materials,Commodities,Fertilizers,9.61,9.7,9.63,10.13,9.61,9.7,9.63,10.13,908404.0,908404.0,1266597.0,564424.0,564424.0,8.5,15.85,10.4902,10.93715,9.86,0.1305883,0.31326675,2.0,,,,233311138.0,598065024.0,599985984.0,0.561,1514678400.0,1310601600.0,1.0,1310601600.0,,,,1.0,1,1,589.6921088,38471073792.0,101705000.0,0.17,32610093056.0,45662969856.0,76.348,-1770179200.0,,,-56.049,,0.12914011,0.843,-21.733,,-0.189,,19746584576.0,34.92,,0.2823597,0.43243998,0.05126,-0.03877,-0.08986,,,"Nagarjuna Fertilizers and Chemicals Limited manufactures and markets fertilizers and micro irrigation equipment in India. It manufactures urea and anhydrous ammonia; and markets diammonium phosphate, muriate of potash, zinc sulphate heptahydrate, zinc sulphate mono-hydrate, chelated zinc, and di-sodium octa borate tetra hydrate, as well as specialty fertilizers. The company also provides micro irrigation products and services, including head control units, water carrier system components, and water distribution system components for the delivery of water and agricultural inputs to the crop; and operation, maintenance, project management, and other specialist services for the management of chemical process plants, as well as agri informatic services. In addition, it offers online and offline services to facilitate farm yield and profitability enhancement through agricultural technology transfer and critical information dissemination. Nagarjuna Fertilizers and Chemicals Limited was founded in 1973 and is based in Hyderabad, India.",0.559,none,432.0
211,211,NDL,Nandan Denim Limited,EQ,23-MAR-2012,INE875G01030,textile-manufacturing,consumer-cyclical,Consumer Discretionary,Other Textile Products,4.76,4.76,4.76,4.85,4.76,4.76,4.76,4.85,745210.0,745210.0,18977540.0,690110.0,690110.0,2.62,7.35,5.86222,4.73348,4.85,0.5813954,0.31326675,4.0,51.191,1.04,1.403,572466190.0,1441469952.0,1456610048.0,0.52568,1735603200.0,1567641600.0,0.166667,1567641600.0,10:1,1726704000.0,,10.0,1,10,706.4558592,9700451328.0,240291008.0,0.167,3079335936.0,26131709952.0,17.736,1423393024.0,-58363000.0,1155053952.0,4.173,1.1622335,0.2703443,0.371,6.815,0.053,1.052,0.07,513320992.0,0.71,18.19,6.830986,0.01964,0.15630999,0.05447,0.02229,0.047849998,0.08911,"Nandan Denim Limited engages in the manufacture and sale of denim and cotton fabrics, dyed yarns, shirting fabrics, and fibers in India. The company offers core classics, reinvented classics, novelties, structured, knit, light weight, blends, feather touch, stretch tech, and prints denims; plain, twill, dobby, chambray, fil a fil, herringbone, basket weave, and pin-point oxford shirting fabrics; and grey cotton fabrics, and khakis. It also exports its products. The company offers its products to fabric re-seller, garment converter, distributors, wholesalers, dealers, brand owners, and exporters. The company was formerly known as Nandan Exim Limited and changed its name to Nandan Denim Limited in November 2013. Nandan Denim Limited was incorporated in 1994 and is based in Ahmedabad, India.",0.871,none,418.0
222,222,BANKBARODA,Bank of Baroda,EQ,19-FEB-1997,INE028A01039,banks-regional,financial-services,Financial Services,Public Sector Bank,246.45,247.45,245.6,252.0,246.45,247.45,245.6,252.0,12626117.0,12626117.0,13676530.0,14773610.0,14773610.0,196.35,299.7,245.985,257.37225,249.0,0.25038052,0.31326675,2.0,,,,1859449926.0,5171359744.0,5173459968.0,0.64026,1735603200.0,1719532800.0,7.6,1719532800.0,5:1,1421884800.0,0.1965,2.0,1,2,128819.1475712,1393253285888.0,1043232718848.0,201.824,1151055953920.0,628964655104.0,121.62,,,-1228531564544.0,261.508,0.9521697,2.0481143,2.215,,0.219,0.136,0.219,200038793216.0,38.67,22.03,6.4391003,0.31804,,,0.45283002,0.012150001,0.16038,"Bank of Baroda Limited provides various banking products and services to individuals, government departments, and corporate customers in India and internationally. The company operates through Treasury, Corporate/Wholesale Banking, Retail Banking, and Other Banking Operations segments. It offers savings, salary, and current accounts; and term deposits. The company also provides loans, such as home, education, vehicle, gold, mortgage, mudra, personal, mortgage, and other loans; overdrafts; loans for micro, small, and medium enterprises; corporate and agriculture loans; export finance, external commercial borrowings, foreign currency credits, and import finance; Foreign Currency Non-Resident Loans; and supply chain finance. In addition, it offers life insurance, general insurance, and health insurance products; merchant payment solutions; defense banking; investment products, treasury, trade, FX, remittances, appraisal merchant banking, cash management, correspondent banking, and other services; digital payment solutions; and debit, prepaid, and credit cards. Bank of Baroda Limited was incorporated in 1908 and is headquartered in Vadodara, India.",0.777,buy,21.0
260,260,RBL,Rane Brake Lining Limited,EQ,20-JUN-2008,INE244J01017,auto-parts,consumer-cyclical,Consumer Discretionary,Auto Components & Equipments,916.85,929.85,916.85,943.95,916.85,929.85,916.85,943.95,2405.0,2405.0,6796.0,2186.0,2186.0,642.95,1370.0,1065.656,956.46625,931.0,0.101056814,0.31326675,2.0,1.081,1.119,2.142,2145377.0,7729870.0,7967200.0,0.70927,1672444800.0,1721001600.0,30.0,1721001600.0,,,0.5108,10.0,1,10,741.7463296,7105805312.0,10500000.0,1.359,30100000.0,6840300032.0,884.841,828400000.0,57737500.0,449100000.0,360.338,2.5836852,1.0843769,1.039,8.578,0.153,0.099,0.153,454000000.0,58.77,55.21,15.841415,0.06637,0.43868,0.12111,0.078150004,0.096379995,0.16975,"Rane Brake Lining Limited manufactures and markets auto components to original equipment manufacturers and aftermarket customers in India and internationally. It offers friction material products, such as brake linings, disc pads, clutch facings, clutch buttons, brake shoes, and railway brake blocks for passenger cars, utility vehicles, commercial vehicles, two wheelers, and railways. The company was formerly known as Rane Brake Products Limited and changed its name to Rane Brake Lining Limited in February 2008. The company was founded in 1964 and is headquartered in Chennai, India.",0.903,none,414.0
262,262,JETAIRWAYS,Jet Airways (India) Limited,BZ,14-MAR-2005,INE802G01018,airlines,industrials,Services,Airline,34.16,36.69,34.16,37.75,34.16,36.69,34.16,37.75,234505.0,234505.0,32923.0,,,34.0,65.9,36.7574,42.74315,34.16,-0.40227473,0.31326675,2.0,,,,57930653.0,113597000.0,119151000.0,0.74991,,1189641600.0,6.0,1189641600.0,,,,10.0,1,10,388.04736,36019679232.0,3471800064.0,30.571,35612098560.0,747600000.0,6.582,-5059800064.0,,,-1542.254,,5.1905746,48.18,-7.119,,1.998,,-6625999872.0,-58.33,,,,0.70425004,,-1.33112,,,"Jet Airways (India) Limited provides passenger and cargo air transportation services. It also provides aircraft leasing services. Jet Airways (India) Limited was incorporated in 1992 and is based in Mumbai, India.",1.409,none,470.0
