514,514,IL&FSENGG,IL&FS Engineering and Construction Company Limited,BZ,25-OCT-2007,INE369I01014,engineering-construction,industrials,Industrials,Civil Construction,42.47,43.8,40.6,44.59,42.47,43.8,40.6,44.59,130551.0,130551.0,55659.0,56977.0,56977.0,18.81,51.65,40.0868,33.95315,41.94,0.89638007,0.39389753,2.0,,,,25790205.0,131121000.0,132414000.0,0.80331004,,1221782400.0,1.5,1221782400.0,,,,10.0,1,10,549.9214336,28788983808.0,3414000128.0,26.037,26707699712.0,2891800064.0,22.075,-1383524992.0,,,-242.85,,1.9016578,9.955,-20.808,,0.558,,-649600000.0,-4.96,,,-0.22464001,0.17387,-0.47842997,-0.07063,,,"IL&FS Engineering and Construction Company Limited, together with its subsidiaries, engages in construction and infrastructure development, and project management businesses in India. The company develops and constructs roads and bridges, railways, expressways, and highways; residential buildings, commercial buildings, industrial structures, and hospital buildings; irrigation canals and dams; and thermal and hydel power projects. It also develops ports involving construction of berths, jetties, breakwaters, marine structures, and cargo handling facilities, as well as land for setting up port-based industries; and constructs terminal buildings, runways, aprons, parking bays, hangers, and other structures for the airport sector. In addition, the company constructs rail and rail-based systems; seaports; oil and gas pipelines and storage tank terminals; refineries and petro chemicals; water and water treatment plants; power generation, transmission, and distribution projects; and industrial construction projects. It serves the power, oil and gas, roads, railways and metros, water and irrigation, ports, and buildings and structures sectors. The company was formerly known as Maytas Infra Limited and changed its name to IL&FS Engineering and Construction Company Limited in January 2011. IL&FS Engineering and Construction Company Limited was incorporated in 1988 and is based in Hyderabad, India.",0.518,none,1422.0
520,520,EQUIPPP,Equippp Social Impact Technologies Limited,BE,19-MAY-2021,INE217G01035,agricultural-inputs,basic-materials,Information Technology,Computers - Software & Consulting,23.3,23.3,22.28,24.46,23.3,23.3,22.28,24.46,60065.0,60065.0,20329.0,34876.0,34876.0,20.41,36.3,22.7704,26.7255,24.0,-0.027160466,0.39389753,2.0,29.425,,,10832215.0,103095000.0,103361000.0,0.89097,1735603200.0,1221782400.0,40.0,1221782400.0,5:100,1612742400.0,,1.0,1,1,247.4279936,2455728128.0,1300000.0,0.013,19857000.0,23232000.0,0.241,2966500.0,,,0.655,36.641224,106.5031,105.705,827.82,,,,856000.0,,,inf,0.036849998,0.59981996,0.12769,-0.11071999,,,"Equippp Social Impact Technologies Limited provides IT solutions and services in India. It enables organizations to capture the business benefits of emerging technologies of digital engineering, business intelligence, analytics, machine learning, testing, and IT consulting, as well as offers degree of skills, IPs, and domain expertise across in the areas of digital transformation, enterprise solutions, tech platforms for ESG, CSR, and public private partnership projects; and financing for the capital requirements in social and infrastructure projects of local bodies and state governments. The company's products include EquiPPP, a platform that facilitates cross-sectoral partnerships for the purpose of carrying out social projects; EquiPPP PAAS, a service-based platform to create and scale an organization's purpose-driven culture; EquiPPP 3.0, a decentralized Web 3.0 platform to incentivize community participation using social impact tokens; and EquiPPP Field Force Information Exchange, a platform that enables individuals or organizations to communicate and share information through the use of digital formats and field forces. It also offers EQUIPPP Ix, a market place for insights and impact assessments that allows collection of feedback and insights from project beneficiaries across multiple geographical locations through digital media, CAPI, CATI, CAWI, and social value partners; EquiPPP M-PACT, a platform for the film industry and society; EquiPPP Consumer Insights Exchange, a collaboration and knowledge management platform, which enables consumers to contribute ideas, insights, and involvement in the social projects; and EquiPPP Connect, a launchpad cum business center for Indian origin next gen tech entrepreneurs. The company was formerly known as Proseed India Limited and changed its name to Equippp Social Impact Technologies Limited in June 2021. The company was incorporated in 2002 and is based in Hyderabad, India.",-0.642,none,1638.0
538,538,DIACABS,Diamond Power Infrastructure Limited,BE,15-SEP-2023,INE989C01020,specialty-industrial-machinery,industrials,Industrials,Other Electrical Equipment,1638.35,1600.1,1556.45,1619.0,1638.35,1600.1,1556.45,1619.0,7341.0,7341.0,18782.0,31899.0,31899.0,70.45,1899.95,1480.811,978.8663,1556.45,21.092974,0.39389753,2.0,,,,4960982.0,52697100.0,58493500.0,0.9278,,1380153600.0,100.0,1380153600.0,1:100,1663113600.0,,10.0,1,10,9104.22016,105528664064.0,98362000.0,1.865,23553042432.0,4927840256.0,93.416,554751488.0,,,-185.011,,18.47507,21.415,190.227,1.99,2.007,2.0,280636992.0,5.29,,294.22495,0.056950003,0.23506,0.11257,0.08595,,,"Diamond Power Infrastructure Limited manufactures and sells power transmission equipment. The company provides power cables that includes low voltage, high voltage, and extra high voltage cables. It also offers transmission towers; and transmission and distribution conductors, such as aluminium wire rods, alloy wire rods, aluminium conductors, aluminum alloy conductors, aluminium conductor steel and alloy reinforced, aluminium alloy conductor steel reinforced high conductivity alloy conductors al  59, and stay wire / galvanised steel earth wire. In addition, the company provides turnkey services. The company offers its products through distributors in India, as well as exports its products and solutions under the Dicabs brand. The company was formerly known as Diamond Cables Limited. Diamond Power Infrastructure Limited was founded in 1970 and is headquartered in Ahmedabad, India.",-1.452,none,534.0
554,554,SEPC,SEPC Limited,EQ,20-FEB-2008,INE964H01014,engineering-construction,industrials,Industrials,Civil Construction,25.1,25.11,23.5,25.24,25.1,25.11,23.5,25.24,15061649.0,15061649.0,35363572.0,16220822.0,16220822.0,15.5,33.45,27.8786,21.959606,24.24,0.35915422,0.39389753,2.0,37.54,,,829858599.0,1563660032.0,1687350016.0,0.66449,1703980800.0,1347321600.0,1.141012,1347321600.0,,,,10.0,1,10,4090.136576,38123446272.0,305977984.0,0.217,4549458944.0,5935294976.0,4.336,366479488.0,,,8.585,2.8235295,6.89121,6.423,104.026,0.5,0.227,0.639,259324000.0,0.18,,134.66666,0.04369,0.18194,0.061750002,0.13027,,,"SEPC Limited provides integrated design, engineering, procurement, construction, and project management services in India and internationally. It offers turnkey contracting solutions, including design, engineering, and construction for ferrous and non-ferrous industries, cement plants, coke oven and by-product plants, process plants, and material handling plants, as well as transportation; water and sewage treatment plants, intake wells and pump houses, underground drainage systems, water distribution, and pipe rehabilitation systems; and biomass and thermal power plants, as well as wind farms. The company also provides engineering services for mining and mineral processing. The company was formerly known as Shriram EPC Limited and changed its name to SEPC Limited in March 2022. SEPC Limited was incorporated in 2000 and is headquartered in Chennai, India.",0.976,none,779.0
569,569,ZENITHSTL,Zenith Steel Pipes & Industries Limited,EQ,30-APR-2007,INE318D01020,steel,basic-materials,Industrials,Iron & Steel Products,9.45,9.45,9.26,9.45,9.45,9.45,9.26,9.45,63736.0,63736.0,147476.0,81977.0,81977.0,5.2,15.45,9.985,9.07275,9.26,0.6245614,0.39389753,2.0,,,,86625182.0,142280000.0,147658000.0,0.42008,1451520000.0,1278460800.0,0.5,1278460800.0,1.2:1,1281484800.0,,10.0,1,10,136.7313152,3506411776.0,10901000.0,0.074,2151534080.0,1473262976.0,10.416,-16145500.0,,,-17.925,,0.9280849,2.38,-217.176,,0.168,,-516000.0,,,inf,-0.00171,0.48568,-0.01096,-0.10998,,,"Zenith Steel Pipes & Industries Limited, together with its subsidiaries, manufactures and sells steel pipes in India and internationally. The company offers electric resistance welded black and galvanized pipes; and helical submerged arc welded pipes. Its products are used for various applications, such as agriculture and irrigation water distribution, sprinklers, drill rods, bore-well, construction water distribution, space frames, fences, firefighting and chilled water systems, structural scaffolding and props, green house, industrial general engineering, container making, distribution of gas and crude, transportation of raw and potable water, poles, transmission tower, transportation of oil and gas, transportation of sewage disposal irrigation, piling, ash/slurry transportation, and electricity conduits, as well as the auto industry. The company exports its products to approximately 79 countries, including the United States. The company was formerly known as Zenith Birla (India) Limited and changed its name to Zenith Steel Pipes & Industries Limited in July 2020. Zenith Steel Pipes & Industries Limited was incorporated in 1960 and is based in Mumbai, India.",0.125,none,1774.0
577,577,FELDVR,Future Enterprises Limited,BE,13-FEB-2009,IN9623B01058,department-stores,consumer-cyclical,Consumer Discretionary,Diversified Retail,4.82,4.82,4.6,4.82,4.82,4.82,4.6,4.82,4642.0,4642.0,15017.0,5677.0,5677.0,4.1,6.85,5.3678,5.43965,4.69,-0.071287155,0.39389753,4.0,,0.197,0.366,322982990.0,39374700.0,119282000.0,0.72220004,1640908800.0,1503273600.0,0.24,1503273600.0,,,,2.0,1,2,38.0615072,76898959360.0,166000000.0,0.336,74595000320.0,21933699072.0,46.31,-1633600000.0,13640474624.0,3999399936.0,52.907,0.088646114,0.017352981,3.506,-47.073,,-0.132,,-28774299648.0,-49.73,,,-1.31188,0.07582,-0.07448,-0.97987,-0.05105,-2.38273,"Future Enterprises Limited, together with its subsidiaries engages in the retail business in India. The company offers IT enabled end-to-end supply chain and logistic services, which include modern warehousing, cold chain, and express and e-commerce logistics to food and beverages, lifestyle, consumer electronics and high tech, automotive and engineering, home and furniture, healthcare, general merchandise, and e-commerce industries. It provides general insurance solutions to customers and enterprise through retail, commercial, personal and rural product offerings; and design space of office supplies, equipment, and other products. In addition, the company also offers children's and women's apparel products; and media solutions to advertise deals to marketers. Future Enterprises Limited was formerly known as Future Retail Limited. The company was incorporated in 1987 and is headquartered in Mumbai, India. Future Enterprises Limited operates as a subsidiary of Central Departmental Stores Private Limited.",1.379,none,1924.0
583,583,VARDHACRLC,Vardhman Acrylics Limited,EQ,30-SEP-2003,INE116G01013,textile-manufacturing,consumer-cyclical,Consumer Discretionary,Other Textile Products,56.37,56.0,52.0,56.0,56.37,56.0,52.0,56.0,160718.0,160718.0,97091.0,48776.0,48776.0,49.9,74.9,59.7004,59.50525,53.5,-0.018801868,0.39389753,2.0,,1.114,2.329,20550947.0,80363696.0,82386800.0,,1577750400.0,1725580800.0,2.0,1725580800.0,,,0.9398,10.0,1,10,440.7693824,3731363072.0,639100032.0,7.784,,2580286976.0,31.971,126651000.0,-24468500.0,39641000.0,28.353,1.8869255,1.7082185,1.446,29.462,-0.753,-0.142,-0.748,167856000.0,2.66,,20.112782,0.06505,0.32945,0.04908,0.04709,0.01638,0.06925,"Vardhman Acrylics Limited manufactures and supplies acrylic fibers and tows in India. It offers its products under the Varlan brand name. The company was incorporated in 1990 and is headquartered in Ludhiana, India. Vardhman Acrylics Limited operates as a subsidiary of Vardhman Textiles Limited.",,none,1487.0
588,588,FLFL,Future Lifestyle Fashions Limited,BZ,01-OCT-2013,INE452O01016,apparel-manufacturing,consumer-cyclical,Consumer Discretionary,Diversified Retail,2.15,2.15,2.04,2.15,2.15,2.15,2.04,2.15,205315.0,205315.0,120299.0,208102.0,208102.0,1.8,3.65,2.328,2.3461,2.07,-0.29152542,0.39389753,4.0,,0.078,0.675,170814997.0,201775008.0,213360000.0,0.23216,,1563753600.0,1.4,1563753600.0,,,,2.0,1,2,44.16552,17061643264.0,924499968.0,4.543,17560700928.0,23132899328.0,114.603,-9979599872.0,4266737408.0,6971700224.0,-99.569,,0.019092081,0.738,-1.71,,-0.787,,-21350899712.0,-107.11,9.01,,-0.92297,0.16253,-0.4314,-0.61004,-0.13293,,"Future Lifestyle Fashions Limited operates as an integrated fashion company in India. The company retails fashion products through departmental and neighborhood stores. Its stores offer men's formals, casuals, youth wear, women's western wear, women's ethnic, sportswear, denim wear, infant wear, accessories, footwear, luggage, and other products; and cosmetics, fragrances, eyewear, watches, accessories, sportswear, toys, mobiles, electronics, home, and other products. The company offers its products under the Lee Cooper, Champion, aLL, Indigo Nation, RIG, Alice and Mae, Bare, Urban Yoga, Ancestry, Scullers, UMM, Clarks, Jealous 21, Lombard, Tresmode, Turtle, John Miller, Ceriz, Giovani, Converse, Urbana, Celio, Cover Story, Umbro, Mineral, Mother Earth, and Spunk brands. It operates its stores under the Central and Brand Factory brand names; and other exclusive brand outlets, as well as offers its products through e-commerce websites. The company was formerly known as Future Value Fashion Retail Limited and changed its name to Future Lifestyle Fashions Limited. Future Lifestyle Fashions Limited was incorporated in 2012 and is based in Mumbai, India.",1.154,none,1908.0
600,600,GTL,GTL Limited,BE,29-MAR-1995,INE043A01012,telecom-services,communication-services,Telecommunication,Other Telecom Services,12.85,12.92,11.72,13.14,12.85,12.92,11.72,13.14,1991664.0,1991664.0,1985926.0,2547212.0,2547212.0,7.45,19.45,13.7178,12.8923,12.22,0.60132456,0.39389753,2.0,,,,126213364.0,157296992.0,169266000.0,0.26312,1735603200.0,1317945600.0,1.0,1317945600.0,,,,10.0,1,10,206.8430592,59594477568.0,149506000.0,0.95,57842266112.0,2188665088.0,13.901,903910272.0,,,-382.802,,0.9450649,27.229,65.93,1.645,0.367,1.655,2188350976.0,13.91,,0.8785047,0.99986,0.56228,0.413,0.42360002,,,"GTL Limited operates as an infrastructure services company in India. The company offers services and solutions to address the network life cycle requirements of telecom operators, technology providers, and tower companies. It also offers network operation and maintenance services, such as network monitoring and operation, network field maintenance, technical support and process management, logistics and vendor management, and transition management services. In addition, the company offers energy management solutions in the areas of energy audits of telecom infrastructure, process improvement, technology upgradation, and alternate sources of energy. GTL Limited was incorporated in 1987 and is based in Mumbai, India.",0.754,none,1686.0
606,606,HINDZINC,Hindustan Zinc Limited,EQ,21-NOV-2006,INE267A01025,other-industrial-metals-mining,basic-materials,Commodities,Zinc,539.5,538.5,503.15,539.5,539.5,538.5,503.15,539.5,3661702.0,3661702.0,3366023.0,2926047.0,2926047.0,284.6,807.7,506.119,493.463,510.2,0.74167657,0.39389753,2.0,191.929,0.474,0.612,297230962.0,4225319936.0,4336330240.0,0.92964,1735603200.0,1724803200.0,19.0,1724803200.0,5:1,1299456000.0,1.6925,2.0,1,2,221239.574528,2221898727424.0,78409998336.0,18.566,146250006528.0,304469999616.0,71.989,153749995520.0,76296249344.0,135139999744.0,18.043,28.276896,7.266383,7.298,14.451,0.347,0.209,0.346,87380000768.0,20.66,,24.695065,0.28699,0.70569,0.50498,0.40555,0.21858,0.82142997,"Hindustan Zinc Limited explores for, extracts, and processes minerals in India, rest of Asia, and internationally. It operates through two segments, Zinc, Lead, Silver & Others; and Wind Energy. The company produces refined zinc and lead, and silver, as well as sulphuric acid; and manufactures metals and related alloys. It also operates captive thermal, wind and solar power, and waste heat recovery boiler power plants. In addition, the company engages in sport activities; and manufactures and sells phosphatic fertilizers. The company was incorporated in 1966 and is based in Udaipur, India. Hindustan Zinc Limited is a subsidiary of Vedanta Limited.",0.691,none,43.0
608,608,TREEHOUSE,Tree House Education & Accessories Limited,EQ,26-AUG-2011,INE040M01013,education-training-services,consumer-defensive,Consumer Discretionary,Education,18.25,18.1,17.88,18.1,18.25,18.1,17.88,18.1,397.0,397.0,58746.0,41883.0,41883.0,15.7,34.65,20.1926,23.1741,17.88,-0.09007633,0.39389753,2.0,0.043,4.28,4.832,30231250.0,42310700.0,44061800.0,0.36786,1388448000.0,1442361600.0,2.0,1442361600.0,,,,10.0,1,10,78.782496,,,,900000.0,84140000.0,2.006,9314000.0,-4762125.0,77000.0,47.349,0.37762147,9.363263,,,,,,-31281000.0,-0.75,,,-0.37177,0.48204,0.1107,0.090909995,0.00066,-0.014989999,"Tree House Education & Accessories Limited provides educational and related services to the K-12 schools in India. The company operates preschools; and offers a range of programs for children, including play group, nursery, junior kindergarten, senior kindergarten, day care services, teacher's training courses, summer camps, and hobby classes. It also leases education infrastructure; and franchises education centers. Tree House Education & Accessories Limited was founded in 2003 and is based in Mumbai, India.",0.313,underperform,1852.0
610,610,KREBSBIO,Krebs Biochemicals and Industries Limited,EQ,03-JAN-1996,INE268B01013,drug-manufacturers-specialty-generic,healthcare,Healthcare,Pharmaceuticals,77.35,75.81,75.81,77.1,77.35,75.81,75.81,77.1,846.0,846.0,8152.0,3630.0,3630.0,60.35,121.55,83.394,76.33445,77.1,0.106963396,0.39389753,2.0,,,,4692558.0,21560600.0,22723900.0,0.77554,1735603200.0,1126656000.0,2.892983,1126656000.0,,,,10.0,1,10,175.2012672,3594136832.0,1374000.0,0.064,1934295040.0,527292000.0,24.495,-77922752.0,,,-55.459,,3.3226612,6.816,-46.124,,0.218,,-195666000.0,-9.09,,,-0.37108,0.85815,-0.14778,-0.29894,,,"Krebs Biochemicals & Industries Limited engages in the manufacture and sale of active pharmaceutical ingredients in India. The company develops biotech processes for application in medicine, agriculture, and industry. Its products include androstenedione, lovastatin, and simvastatin, which are used for anti-cholesterol and steroid intermediate applications. The company also develops various products, including amlodipine, cetirizine, orlistat, serratiopepetidase, telmisartan, and phenylephrine for anti-hypertension, anti-histamine, anti-obesity, anti-inflammatory, and cold and cough applications. In addition, it offers contract manufacturing services for large pharmaceutical and multinational companies. The company was incorporated in 1991 and is based in Visakhapatnam, India.",0.468,none,1719.0
651,651,CELEBRITY,Celebrity Fashions Limited,EQ,12-JAN-2006,INE185H01016,apparel-manufacturing,consumer-cyclical,Consumer Discretionary,Garments & Apparels,14.64,14.67,13.9,14.68,14.64,14.67,13.9,14.68,98928.0,98928.0,456740.0,97824.0,97824.0,13.8,23.95,16.7044,17.97225,14.3,-0.29400003,0.39389753,2.0,197.704,,,30838675.0,56552100.0,59796200.0,0.42317,1735603200.0,1156896000.0,1.0,1156896000.0,,,,10.0,1,10,85.5085696,1436244992.0,35800000.0,0.632,671600000.0,2829700096.0,60.708,92850000.0,,,4.487,3.1869848,0.30218244,0.508,15.468,,-0.623,,-85100000.0,-1.5,,,-0.03007,0.40001,0.03281,-0.20557,,,"Celebrity Fashions Limited engages in the designing, manufacturing, sale, and export of garments and clothing accessories in India and internationally. It offers shirts, t-shirts, sweaters, shackets, trousers, shorts, and denims for men and boys under the Indian Terrain brand through retail outlets and e-commerce stores. Celebrity Fashions Limited was incorporated in 1988 and is based in Chennai, India.",0.053,none,1839.0
658,658,JHS,JHS Svendgaard Laboratories Limited,BE,21-OCT-2006,INE544H01014,household-personal-products,consumer-defensive,Fast Moving Consumer Goods,Personal Care,24.95,25.5,23.7,25.7,24.95,25.5,23.7,25.7,325653.0,325653.0,533863.0,239602.0,239602.0,15.55,39.5,27.9792,23.632,23.7,0.09722221,0.39389753,2.0,3.719,,,42773295.0,85604000.0,89071504.0,0.52337,1735603200.0,1324857600.0,0.75,1324857600.0,,,,10.0,1,10,211.0994688,1823237760.0,103648000.0,1.318,63177000.0,836065984.0,10.708,68547504.0,,,22.594,1.048951,2.524914,2.181,26.598,,0.218,,-20982000.0,-0.27,1.51,,-0.0251,0.43359002,0.08199,0.01273,,,"JHS Svendgaard Laboratories Limited, together with its subsidiaries, manufactures, trades, and sells a range of oral and dental products for adults and kids in India. The company offers oral care products, such as toothbrushes, toothpastes, mouthwash products, hand sanitizers, laundry detergents, room fresheners, and denture tablet products under the Dr. Gold, Dr. Fresh, Boots, Lavoris, Peanuts, Amway, Dabur, Future Group, Apollo Pharmacy, Sandika Pharma, Elder Pharma, JL Morisons, Aquawhite, 6 Ten Store, Modi Care, Infectiguard, and Odonil brands. It also provides contract manufacturing services for oral care products of other brands. The company also exports its products. JHS Svendgaard Laboratories Limited was founded in 1997 and is based in New Delhi, India.",0.744,none,1682.0
693,693,TGBHOTELS,TGB Banquets And Hotels Limited,EQ,17-MAY-2007,INE797H01018,lodging,consumer-cyclical,Consumer Discretionary,Hotels & Resorts,14.7,14.9,14.15,14.9,14.7,14.9,14.15,14.9,53295.0,53295.0,165997.0,157506.0,157506.0,10.6,20.3,15.4534,15.7346,14.45,0.33981478,0.39389753,2.0,9.619,,,14236069.0,29286400.0,30197200.0,0.46307,1735603200.0,1316649600.0,1.0,1316649600.0,,,,10.0,1,10,43.6349536,461739584.0,2867000.0,0.105,71312000.0,354624992.0,12.239,-14103500.0,,,25.326,0.57055986,1.2304534,1.302,-32.739,-0.167,-0.078,-0.192,-35922000.0,-1.23,,,-0.1013,0.49521,-0.03977,0.011519999,,,"TGB Banquets and Hotels Limited provides restaurant, banquet, and hotel services in India. The company operates hotel under The Grand Bhagwati name located in Ahmedabad. It also offers dining under the Caf Piano and Mr. & Mrs. Somani brand names; and food and catering services. In addition, the company operates meeting and convention centers under The Grand Bhagwati name, as well as clubs and events. The company was formerly known as Bhagwati Banquets and Hotels Limited and changed its name to TGB Banquets and Hotels Limited in April 2013. TGB Banquets and Hotels Limited was founded in 1989 and is based in Ahmedabad, India.",0.664,none,1910.0
710,710,AURUM,Aurum PropTech Limited,EQ,19-AUG-2015,INE898S01029,real-estate-services,real-estate,Information Technology,IT Enabled Services,192.21,191.99,183.7,199.0,192.21,191.99,183.7,199.0,70905.0,70905.0,204421.0,41697.0,41697.0,123.95,249.9,213.2912,167.90015,198.95,0.56193876,0.39389753,2.0,65.051,0.59,0.808,54393013.0,29253200.0,67915904.0,0.37627998,1735603200.0,1608681600.0,708.7265,1608681600.0,,,,5.0,1,5,1269.4780928,17497534464.0,778099968.0,9.451,1944899968.0,2459699968.0,53.051,-283900000.0,-451187488.0,356400000.0,34.523,5.762825,5.1611094,7.114,-61.633,,0.212,,-426100000.0,-9.53,,,-0.17322999,0.62231,-0.11542,-0.13743,-0.04754,-0.1927,"Aurum PropTech Limited engages in the business of software development for the real estate and other services in India. It operates through Software as a Service (SaaS) and Real Estate as a Service segments. The company provides Sell.Do, a customer relationship management for real estate; Nestaway, a rental management platform that enables property owners to discover tenants; Aurum Analytica, a consumer profiles and cohorts, lead generation, data analytics, and broker community platform; AurumLiv that provides consumer experience and real estate services; TheHouseMonk, a platform for booking management, contract administration, and tenant help desk; and TheOfficeMonk, an end-to-end commercial property management software. It offers Integrow Asset Management, a data driven asset management platform for real estate; Aurum WiseX, a real estate investment platform; and Aurum KuberX, a home loan platform. In addition, the company offers HelloWorld, a co-living platform for students and young professionals; BeyondWalls, offers inventory and price information, collaterals, wallets, and other value-added services to the brokers; Aurum instaHome, a property valuations for home sale and resale properties; and Aurum CREX that offers technology-enabled real estate services. The company was formerly known as Majesco Limited and changed its name to Aurum PropTech Limited in October 2021. The company was incorporated in 2013 and is based in Navi Mumbai, India.",0.394,none,1184.0
