429,429,VIDHIING,Vidhi Specialty Food Ingredients Limited,EQ,02-MAR-2016,INE632C01026,specialty-chemicals,basic-materials,Commodities,Specialty Chemicals,515.75,519.8,495.0,519.8,515.75,519.8,495.0,519.8,22735.0,22735.0,37964.0,29431.0,29431.0,381.55,569.15,504.711,469.307,498.6,0.18372738,0.2353071,2.0,7.274,,,14377883.0,49945000.0,50075700.0,0.67643,1735603200.0,1726531200.0,1.0,1731974400.0,,,0.19129999,1.0,1,1,2496.7743488,24829200384.0,234934000.0,4.701,203847008.0,3067237120.0,61.461,578321728.0,,,56.107,8.886592,8.1401415,8.095,42.933,0.006,0.041,0.01,365283008.0,7.58,,65.778366,0.119090006,0.37390998,0.18855,0.14651,,,"Vidhi Specialty Food Ingredients Limited engages in manufacture and trading of synthetic food colors. The company offers synthetic water-soluble colors, aluminum lakes, FD&C colors and lakes, D&C colors, cosmetic colors, natural colors, blends, and co-blended lakes and granules, as well as color for personal and home care. It operates in India, rest of Asia, Europe, South Africa, the Middle East, the United States, and internationally. The company was formerly known as Vidhi Dyestuffs Manufacturing Limited and changed its name to Vidhi Specialty Food Ingredients Limited in August 2016. Vidhi Specialty Food Ingredients Limited was incorporated in 1994 and is based in Mumbai, India.",0.242,none,281.0
430,430,SUBROS,Subros Limited,EQ,13-JUL-2005,INE287B01021,auto-parts,consumer-cyclical,Consumer Discretionary,Auto Components & Equipments,653.7,653.7,643.85,670.95,653.7,653.7,643.85,670.95,47453.0,47453.0,58503.0,76249.0,76249.0,483.05,827.4,634.642,660.6735,661.4,0.011293292,0.2353071,2.0,4.72,0.718,1.357,20053191.0,65235800.0,65365500.0,0.74561995,1735603200.0,1726012800.0,1.8,1726012800.0,,,0.0913,2.0,1,2,4323.2743424,41872326656.0,1272899968.0,19.502,479000000.0,32021204992.0,490.735,2721300992.0,93774128.0,1583888000.0,155.469,4.254225,1.3501285,1.308,15.387,0.361,0.018,0.361,1287086976.0,19.74,15.13,33.505573,0.04019,0.27482998,0.08498,0.054050002,0.061139997,0.13451,"Subros Limited engages in the manufacture and sale of thermal products for automotive applications in India. The company offers compressors; automotive condensers; heating, ventilating, and air conditioning systems, such as heaters, evaporators, and blower units; tubes and hoses; bus AC; driver cabin AC for railway engines; commercial and residential AC; transport refrigeration systems; truck cabin AC systems; and off-roader AC systems. It also exports its products. The company was incorporated in 1985 and is headquartered in New Delhi, India.",0.788,strong_buy,226.0
434,434,KKCL,Kewal Kiran Clothing Limited,EQ,13-APR-2006,INE401H01017,apparel-manufacturing,consumer-cyclical,Consumer Discretionary,Garments & Apparels,576.6,577.0,559.35,583.95,576.6,577.0,559.35,583.95,56094.0,56094.0,43560.0,26372.0,26372.0,559.35,779.0,612.9,658.21075,565.85,-0.23053312,0.2353071,2.0,10.552,2.018,2.628,16389230.0,61625200.0,63865400.0,0.74259,1735603200.0,1706832000.0,2.0,1706832000.0,5:1,1639612800.0,0.0763,10.0,1,10,3489.4778368,36015403008.0,3301700096.0,51.929,985299968.0,8790985728.0,141.016,1701997056.0,98757752.0,905609024.0,120.576,4.6928906,3.9693818,4.097,21.161,0.32,0.174,0.362,1635757056.0,26.18,32.3,21.613827,0.18607001,0.43019,0.19361,0.17746,0.08813,0.21091999,"Kewal Kiran Clothing Limited manufacturing, marketing, and retailing of branded readymade garments and finished accessories in India and internationally. It offers jeans, shirts, trousers, t-shirt, and other products; and winterwear, athleisure, casual blazer, and accessories under the Killer, Easies, Lawman, Integriti, Desi Belle, Izel, and Iti brand names. The company distributes its products through exclusive brand outlets, large-format stores, traditional multi-brand outlets, and e-commerce platforms. Kewal Kiran Clothing Limited was founded in 1980 and is based in Mumbai, India.",0.487,strong_buy,247.0
436,436,GRPLTD,GRP Limited,EQ,12-FEB-2015,INE137I01015,auto-parts,consumer-cyclical,Industrials,Rubber,3357.05,3370.0,3300.0,3399.0,3357.05,3370.0,3300.0,3399.0,1502.0,1502.0,3335.0,2346.0,2346.0,1174.7375,4815.15,3218.154,2961.1194,3336.5,1.7975416,0.2353071,2.0,67.882,,,2035413.0,5333330.0,5349130.0,0.62221,1735603200.0,1721952000.0,9.375,1721952000.0,4:1,1723420800.0,0.090500005,10.0,1,10,1779.4656256,18181148672.0,17967000.0,3.369,1131881984.0,4882407936.0,915.544,513721504.0,,,312.634,10.672224,3.6446476,3.724,35.391,1.222,0.27,1.221,250371008.0,42.97,,77.647194,0.05128,0.53252,0.105220005,0.07083,,,"GRP Limited manufactures and sells reclaimed rubber products for tyre and non-tyre rubber goods in India and internationally. The company operates in Reclaim Rubber and Others segments. It offers reclaim natural and synthetic rubber products for use in inner liners and tubes, tyre side walls and piles, tyre treads and retreads, conveyor belts, moulded goods, adhesives, and footwear, as well as rubber mattings, profiles, and roofing; and POLYCOAT, an elastic powder in compounded form, which is used in NBR based molded products, metal to rubber bonded parts, NBR based oil seals, NBR matting/sheeting, and NBR-PVC blend, as well as use in tyres, conveyor belts, molded products, sheeting/matting, tread rubber, seals/gaskets, and flaps applications. The company also provides engineering plastics comprising glass filled and unfilled reprocessed nylon 6 and modified nylon 6,6 used in automotive, electrical and electronics, consumer, and industrial applications; repurposed polyolefins, such as impact copolymer polypropylene, IC PP custom colors, and PP based elastomers used in paint and lubricant pails, automotive battery covers, and pallets; and custom die forms consisting of link, door, and industrial mats, as well as dock bumpers primarily for use in civil and agricultural applications. In addition, it generates power from windmill; offers polymer composite products, including boards, wheel chocks, and assembled products used in logistics, construction, oil and gas, aviation, marine, industrial, and agriculture applications; and develops poly-blends and thermoplastic elastomers. The company was formerly known as Gujarat Reclaim and Rubber Products Limited and changed its name to GRP Limited in June 2012. GRP Limited was incorporated in 1974 and is headquartered in Mumbai, India.",0.527,strong_buy,318.0
438,438,MANORG,Mangalam Organics Limited,BE,02-NOV-2021,INE370D01013,specialty-chemicals,basic-materials,Commodities,Commodity Chemicals,420.95,424.0,416.05,424.8,420.95,424.0,416.05,424.8,3369.0,3369.0,6532.0,8954.0,8954.0,270.0,720.0,465.706,442.9,419.6,0.034275174,0.2353071,2.0,61.829,,,2478534.0,8564440.0,8606150.0,0.71089995,1609372800.0,1663632000.0,1.5,1663632000.0,,,,10.0,1,10,361.1140608,6112632832.0,21919000.0,2.557,1734896000.0,5031689216.0,576.339,412172896.0,,,327.758,1.2802129,0.71767956,1.215,14.83,4.417,0.081,4.464,56518000.0,8.38,,50.071598,0.01123,0.35887,0.081920005,0.05104,,,"Mangalam Organics Limited manufactures and sells chemicals in India and internationally. The company offers terpene products, including camphor, camphene, isobornyl acetate, Isoborneol, dipentene, sodium acetate trihydrate, camphor oil, terpineol, isoborneol flakes, and pine tar; resin products, such as terpene phenolic and alkyl phenolic resins, penta and glycerol modified ester gums; and camphor tablets. Its products are used in household, religious use, healthcare, hygiene, textiles and dyes, paints, cleaning and degreasing agents, leather tanning, adhesives, tires, rubber, chewing gums, and printing ink industries. The company was formerly known as Dujodwala Products Limited and changed its name to Mangalam Organics Limited in October 2013. Mangalam Organics Limited was incorporated in 1981 and is headquartered in Mumbai, India.",0.696,none,466.0
439,439,HDFCLIFE,HDFC Life Insurance Company Limited,EQ,17-NOV-2017,INE795G01014,insurance-life,financial-services,Financial Services,Life Insurance,619.85,620.05,615.1,623.25,619.85,620.05,615.1,623.25,1861506.0,1861506.0,3447988.0,2645610.0,2645610.0,511.4,761.2,658.528,651.47174,618.0,-0.03891772,0.2353071,2.0,6.096,0.316,1.138,948419319.0,2152260096.0,2152800000.0,0.56215,1735603200.0,1718928000.0,2.0,1718928000.0,,,0.2541,10.0,1,10,133009.6766976,1325524058112.0,18030200832.0,8.377,9500000256.0,1107492339712.0,515.048,12791538688.0,,,72.414,8.534261,1.2009987,1.197,103.625,0.149,0.228,0.149,16925920256.0,7.87,6.3,78.52605,0.01528,0.07478,0.01155,-0.00041,0.0025799999,0.11576,"HDFC Life Insurance Company Limited provides individual and group insurance solutions in India. It offers insurance and investment products, such as protection, pension, savings, investment, annuity, and health, as well as term, retirement, children, and unit linked insurance plans. The company was formerly known as HDFC Standard Life Insurance Company Limited changed its name to HDFC Life Insurance Company Limited in January 2019. HDFC Life Insurance Company Limited was incorporated in 2000 and is headquartered in Mumbai, India. HDFC Life Insurance Company Limited is a subsidiary of HDFC Bank Limited.",0.836,buy,22.0
441,441,NEOGEN,Neogen Chemicals Limited,EQ,08-MAY-2019,INE136S01016,specialty-chemicals,basic-materials,Commodities,Specialty Chemicals,2124.05,2110.0,2061.65,2150.0,2124.05,2110.0,2061.65,2150.0,22322.0,22322.0,55873.0,49858.0,49858.0,1176.0,2420.0,2110.591,1747.0052,2133.7,0.42124462,0.2353071,2.0,53.785,,,12632557.0,26381700.0,26427500.0,0.53251,1735603200.0,1726704000.0,2.0,1726704000.0,,,0.2085,10.0,1,10,5629.063168,55430320128.0,124900000.0,4.737,4089200128.0,7057399808.0,272.37,1136749952.0,,,288.189,7.403822,7.9761147,7.854,48.762,0.11,0.091,0.176,373700000.0,15.29,32.06,139.54872,0.052950002,0.45161,0.16107,0.13331,,,"Neogen Chemicals Limited engages in the manufacture and sale of specialty chemicals in India. It offers organo bromine compounds, such as alkyl bromide compounds, dibromoalkane compounds, bromo chloro alkanes, bromine derivatives of organoacids, bromoacid ester compounds, aromatic bromine derivatives, cyclic bromine derivatives, and speciality bromo fluro derivatives; speciality chloro compounds, unsaturated bromine derivatives, bromo hydroxy derivatives, and other compounds; and organo lithium compounds, including n-butyl lithium, lithium hexamethyldisilazide, lithium tetrahydride borate, lithium diisopropylamide, lithium tri-(t-butoxy) aluminium hydride, hexyl lithium, methyl lithium, and phenyl lithium. The company also provides inorganic chemicals comprising inorganic bromine compounds and lithium salts; grignard reagents; and advance intermediates; as well as chemistries, such as alkylation, acylation, aminatin, oxidation, dehalogenation, silylation, halex reaction, friedel craft, couplings, and chlorination; custom synthesis; and contract manufacturing services. It serves pharmaceuticals, agrochemicals, engineering, electronics, polymers, water treatment, construction, aroma chemicals, flavours and fragrances, and specialty polymers industries, as well as vapour absorption chillers. The company also exports its products to 31 countries. Neogen Chemicals Limited was incorporated in 1989 and is based in Thane, India.",0.385,buy,209.0
447,447,EMUDHRA,eMudhra Limited,EQ,01-JUN-2022,INE01QM01018,software-application,technology,Information Technology,IT Enabled Services,941.55,938.1,927.6,956.6,941.55,938.1,927.6,956.6,86043.0,86043.0,202399.0,110638.0,110638.0,415.0,1024.0,910.937,847.58374,944.75,1.2463319,0.2353071,2.0,,3.188,4.246,23541215.0,82811696.0,85267104.0,0.69281995,1735603200.0,1718841600.0,1.25,1718841600.0,,,0.12560001,5.0,1,5,7823.6352512,74822033408.0,1665440000.0,20.508,,4307279872.0,54.047,1019969984.0,-202293744.0,1048899968.0,84.923,11.124784,18.16375,17.371,73.357,0.128,0.466,0.194,808969984.0,9.98,19.1,94.66433,0.18781,0.40825,0.2368,0.18667999,0.08988,0.14636,"eMudhra Limited provides trust and enterprise solutions to individuals and organizations worldwide. The company provides enterprise signing solutions, such as emSinger enterprise signing suite, esign, digital stamp, and eBG; digital security solutions, which include emCA-certifiying solutions, identity and access management, multi-factor authentication, and CLM; digital trust services including private trust services, SSL/TL, code signing, email encryption, document signing, and IoT certificates, as well as emsign CertHub; and emSign managed services. It offers emSinger enterprise and emSinger for banks; bulksign; and remote sign as-a-services. It serves banking, government, manufacturing, healthcare, aviation, QTSP, telecom, enterprise, and electric vehicles industries. The company was incorporated in 2008 and is based in Bengaluru, India.",-0.04,buy,188.0
449,449,KIRLOSBROS,Kirloskar Brothers Limited,EQ,20-APR-2010,INE732A01036,specialty-industrial-machinery,industrials,Industrials,Compressors Pumps & Diesel Engines,2274.8,2242.85,2162.4,2338.4,2274.8,2242.85,2162.4,2338.4,982434.0,982434.0,274888.0,432335.0,432335.0,837.0,2684.0,2145.576,1881.908,2225.6,1.4476006,0.2353071,2.0,8.997,0.81,1.899,25216870.0,79408896.0,83914200.0,0.69253,1735603200.0,1721952000.0,6.0,1721952000.0,,,0.12060001,2.0,1,2,17673.2438528,175012741120.0,7238000128.0,91.212,1672999936.0,42552991744.0,536.171,5544056832.0,2747883520.0,5014755840.0,233.525,9.5304575,4.1532316,4.113,31.568,0.899,0.134,0.899,3948345088.0,49.82,,44.672825,0.09279,0.51088,0.13029,0.11595,0.09713,0.23833999,"Kirloskar Brothers Limited provides fluid management solutions in India and internationally. The company manufactures various pumps, including utility, solid handling, process, split-case, multi-stage, sump, vertical inline and turbine, non-clog submersible, special engineered, hydro turbines and PAT, and submersible pumps; and sluice/gate, non-return/check, globe, air, ball, suction diffuser, triple duty, and butterfly valves. It also provides hydro turbines comprising PAT, PICO, Kaplan, Francis, and Pelton turbines; and hydro-pneumatic, boiler feed, and firefighting pumping systems, as well as heating, ventilation, and air conditioning systems. In addition, the company offers steel castings for various industries, such as power, mining, cement, heavy engineering application, sugar, etc.; stators, rotors, and electric motors, as well as installs SPP pumps and systems; manufactures and sells head multi-stage and rubber lined slurry pumps, and metal lined bearings; and sells centrifugal, fire-fighting, and water and waste water pumps. Further, it is involved in the manufacture of API, non-API pumps, steam turbines, and hydraulic power recovery turbines; bare shaft and packaged pump sets; provision of solutions for HVAC, fire protection, turf irrigation, etc., as well as upgrade, repair and maintenance, and technical support services. The company serves building and construction, irrigation, marine and defence, oil and gas, power, valves, water resource management, retail pumps, and process industries through a network of dealers and distributors. Kirloskar Brothers Limited was founded in 1888 and is headquartered in Pune, India.",0.752,none,118.0
450,450,BSL,BSL Limited,EQ,27-JUL-1995,INE594B01012,textile-manufacturing,consumer-cyclical,Consumer Discretionary,Other Textile Products,269.25,271.95,258.55,271.95,269.25,271.95,258.55,271.95,23760.0,23760.0,128118.0,119955.0,119955.0,159.0,331.85,257.1362,214.65865,261.15,0.267357,0.2353071,2.0,388.009,,,3312740.0,10292200.0,10336100.0,0.6774,1735603200.0,1722297600.0,1.0,1722297600.0,,,0.1371,10.0,1,10,269.9272448,6768107520.0,1578000.0,0.153,4372228096.0,6697497088.0,650.48,672756480.0,,,109.485,2.3852582,0.40302706,1.011,10.06,0.014,0.021,0.015,112672000.0,10.93,1.04,23.892954,0.01682,0.43773997,0.10045,0.06617,,,"BSL Limited, a textile company, manufactures and sells various yarns and fabrics in India and internationally. The company offers polyester viscose, worsted, poly wool, vortex, and cotton yarns; and polyester viscose, worsted, and fashion fabrics. It also provides suits for men; pure wool and wool cashmere fabrics; and furnishings, such as curtains, upholsteries, madeups, and silk fabrics. The company offers its products under the Geoffrey Hammonds, Geoffrey Hammonds Insignia, Unicare, and Basilio brand names. It also exports its products. BSL Limited was incorporated in 1970 and is headquartered in Kolkata, India.",0.593,none,494.0
456,456,FINEORG,Fine Organic Industries Limited,EQ,02-JUL-2018,INE686Y01026,specialty-chemicals,basic-materials,Commodities,Specialty Chemicals,4484.1,4474.0,4427.0,4519.95,4484.1,4474.0,4427.0,4519.95,28137.0,28137.0,27013.0,23895.0,23895.0,4021.0,5958.85,4877.352,4907.879,4479.45,-0.05959207,0.2353071,2.0,0.17,6.293,8.138,7666494.0,30660000.0,30688000.0,0.75446,1735603200.0,1723507200.0,10.0,1723507200.0,,,0.0698,5.0,1,5,13746.536448,126972141568.0,10562156544.0,344.453,35989000.0,21807908864.0,711.296,5490788864.0,2282191872.0,4262796032.0,691.337,6.479402,6.303464,5.822,23.125,0.136,0.102,0.136,4394503168.0,143.49,151.68,31.217855,0.20151,0.42523998,0.25178,0.23198,0.14786,0.22929001,"Fine Organic Industries Limited engages in manufacture, processing, supply, distribution, dealing, import, and export of oleochemical-based additives in India and internationally. The company offers food additives, such as emulsifiers, antifungal agents, bread improvers, beverage clouding agents, and other specialized blends; polymer additives for various types of polymers, rubbers and elastomers, etc.; cosmetic and pharmaceutical additives; feed nutrition additives; coating additives; and additives for other specialty application in various industries. It products are used in foods, plastics, cosmetics, coatings, and other specialty applications. Fine Organic Industries Limited was founded in 1970 and is headquartered in Mumbai, India.",0.056,hold,139.0
458,458,IRISDOREME,Iris Clothings Limited,EQ,22-FEB-2021,INE01GN01025,apparel-manufacturing,consumer-cyclical,Consumer Discretionary,Garments & Apparels,61.6,62.94,61.05,62.94,61.6,62.94,61.05,62.94,71854.0,71854.0,91174.0,86244.0,86244.0,58.91,90.9,64.703,70.30105,61.82,-0.2955975,0.2353071,2.0,62.027,0.803,1.946,23752112.0,81570600.0,83743696.0,,1735603200.0,,,,5:1,1691712000.0,,2.0,1,2,504.2694656,5493872128.0,8671000.0,0.106,467856992.0,1382923008.0,16.936,249770000.0,-2209625.0,74811000.0,9.229,6.6984506,3.646403,3.973,21.996,0.044,0.283,0.05,117377000.0,1.44,,42.930553,0.08488,0.4738,0.18061,0.14901,0.08976,0.16865999,"Iris Clothings Limited engages in the designing, manufacturing, branding, and sale of readymade garments in India. The company offers summer wear, winter wear, sportswear, and swimwear; tops, t-shirts, pyjamas, loungewear/nightwear sets, trousers, shorts, dresses, polyfil suits, sweatshirts, hoodies, joggers, and dryfit apparel; and accessories, including bags and bottles for infants, toddlers, boys, girls, women, and men under the DOREME and Oxcgen brand names. It sells its products through its exclusive brand outlets; and distributors. The company also exports its products to Nepal, Portugal, Mozambique, Zambia, and Saudi Arabia. Iris Clothings Limited was founded in 2004 and is based in Howrah, India.",-0.131,none,441.0
467,467,ONEPOINT,One Point One Solutions Limited,EQ,09-MAY-2019,INE840Y01029,specialty-business-services,industrials,Services,Business Process Outsourcing (BPO)/ Knowledge Process Outsourcing (KPO),58.75,57.5,56.83,61.53,58.75,57.5,56.83,61.53,8910812.0,8910812.0,758909.0,1105019.0,1105019.0,44.65,77.5,60.5466,62.28835,58.5,-0.052419364,0.2353071,2.0,41.576,,,80209524.0,188060000.0,204756992.0,,1735603200.0,1568246400.0,0.013333,1568246400.0,5:1,1642464000.0,,2.0,1,2,1100.1509888,14277261312.0,181036000.0,0.857,580632000.0,1951796992.0,9.502,627082496.0,,,6.538,8.94769,5.6366057,7.315,22.768,0.545,0.711,0.76,246640992.0,1.3,,45.0,0.12637,0.46890998,0.32127997,0.16721001,,,"One Point One Solutions Limited engages in the customer life cycle management, business process management, and technology servicing activities in India. The company provides contact center services, such as sales and leads generation, customer care, and debt management and collections services. It offers back-office services, including email and content management, chat bots solutions, and social media management services, as well as billing, payment/settlement, exception management, account maintenance, charge back, dispute management, and data analysis services. In addition, the company provides business solutions, such as workflow management, speech analytics, process automation, and quality monitoring services; and security and compliance services, IT infrastructure services, and omni channel solutions. Further, it offers origination services comprising know your customer (KYC), data administration, IB/OB verification, application screening, fraud verification, and underwriting support services; and customer services, technical help desk, and customers retention services. It serves banking and financial, telecommunications, insurance, airlines, FMCG, consumer durables, retail, e-commerce, travel, and hospitality industries. The company was incorporated in 2008 and is headquartered in Navi Mumbai, India.",0.937,none,357.0
472,472,TPLPLASTEH,TPL Plastech Limited,EQ,20-MAY-2015,INE413G01022,packaging-containers,consumer-cyclical,Industrials,Packaging,100.92,102.99,98.33,102.99,100.92,102.99,98.33,102.99,150571.0,150571.0,122582.0,181369.0,181369.0,51.45,136.0,103.0216,98.93155,99.38,0.92045677,0.2353071,2.0,23.447,,,15069649.0,78003000.0,78103504.0,0.78069,1672444800.0,1726531200.0,0.8,1726531200.0,5:1,1666137600.0,0.22729999,2.0,1,2,776.1926144,8608439296.0,55084000.0,0.701,305632992.0,3209675008.0,40.952,374118752.0,,,16.711,5.9469805,2.4182904,2.682,23.01,0.213,0.117,0.228,206776000.0,2.79,,35.62007,0.06442,0.20834999,0.116560005,0.09307,,,"TPL Plastech Limited engages in the manufacture and sale of polymer products in India. The company provides its IBCs under QuBC and re-bottled IBC under COBO brand names. It offers narrow mouth drums; narrow mouth and wide mouth carboys for specialty chemical and adhesive industries; bulk and medium open top drums that are used for packing powder, paste type, and semi liquid/solid products. In addition, the company offers HDPE packaging products, such as bottles for packing lubricant oil, pesticides, cosmetics, food and beverages, and cleaning and hygiene products; packaging solutions for pharma and agro based products, and cosmetics and personal care products; and caps and closures, small containers, promotional packaging solutions, etc. The company was formerly known as Tainwala Polycontainers Limited and changed its name to TPL Plastech Limited in January 2007. The company was incorporated in 1992 and is based in Mumbai, India. TPL Plastech Limited operates as a subsidiary of Time Technoplast Limited.",0.739,none,398.0
474,474,ITDCEM,ITD Cementation India Limited,EQ,10-FEB-1999,INE686A01026,engineering-construction,industrials,Industrials,Civil Construction,526.05,528.6,518.55,530.45,526.05,528.6,518.55,530.45,461388.0,461388.0,917503.0,698385.0,698385.0,256.1,694.3,525.051,490.3615,521.05,0.68632793,0.2353071,2.0,59.446,0.854,1.098,79828737.0,171788000.0,172064992.0,0.52456003,1735603200.0,1724198400.0,1.7,1724198400.0,10:1,1440115200.0,0.0859,1.0,1,1,8953.5660032,95737061376.0,4480643072.0,26.06,9724294144.0,86472433664.0,503.501,8081468928.0,-2676231168.0,2751013888.0,94.874,5.4920206,1.0354244,1.107,11.846,0.343,0.236,0.343,3401315072.0,19.78,17.17,26.342264,0.039330002,0.34052,0.09345999,0.06771,0.06727,0.22965,"ITD Cementation India Limited provides construction and civil engineering contracting services in India. The company constructs maritime structures, including jetties, dolphins, service platforms, quay, berths on concrete and steel piles, solid gravity type wharf structures, ship lifts, dry docks, wet basins, and inclined berths; and offers breakwater and piled approach trestles, steel piles and bored casts, undersea ground improvement, dredging and land reclamation, and coastal erosion protection and rock bund services. It also constructs highways, bridges, and flyovers; tunnels and airports; hydroelectric and irrigation projects comprising pumping stations, power houses, tunnels, intake structures, pressure shafts, and penstock pipes; mass rapid transit systems; and dams, buildings, and industrial structures. In addition, the company offers foundation and specialist engineering services comprising geotechnical investigations, piling, diaphragm walling, slope stabilization, sandwicks/band drains, vibrofloatation stone columns, drilling and grouting, rock/soil anchors repairs, colcrete, gunite/shotcrete, grouted mattress, box pushing, tube heading, microtunneling, and rehabilitation and underpinning services. Further, it engages in the civil works for refinery, petrochemical, power, steel, and fertilizer plants; design, construction, supply, installation, and commissioning of pipelines; and operation of water and wastewater treatment plants, and pumping stations. The company serves state and central government departments, ministries, local municipal bodies, and private clients. The company was formerly known as Skanska Cementation India Limited and changed its name to ITD Cementation India Limited in May 2005. ITD Cementation India Limited was founded in 1931 and is based in Mumbai, India.",0.816,none,174.0
