339,339,TTKHLTCARE,TTK Healthcare Limited,EQ,02-DEC-2015,INE910C01018,drug-manufacturers-general,healthcare,Diversified,Diversified,1323.3,1342.7,1322.9,1342.7,1323.3,1342.7,1322.9,1342.7,1319.0,1319.0,4546.0,3569.0,3569.0,1310.15,1893.95,1456.323,1532.737,1333.5,-0.07774329,0.24450636,2.0,2.999,3.968,5.167,3297608.0,14130300.0,14142600.0,0.75604,1735603200.0,1721088000.0,10.0,1721088000.0,,,0.1768,10.0,1,10,1885.9157504,11230941184.0,7928351744.0,560.941,311580000.0,7712925184.0,545.824,322808992.0,-1124477184.0,-8419000.0,734.946,1.814419,2.4451368,1.456,34.791,0.074,0.068,0.075,799425984.0,56.5,,23.60177,0.103649996,0.5194,0.04185,0.03135,0.011410001,0.0795,"TTK Healthcare Limited engages in the animal welfare and human pharma product, consumer product, medical device, protective device, food, and other businesses in India. It operates through Animal Welfare, Consumer Products, Medical Devices, Protective Devices, Foods, Human Pharma, and Others segments. The Animal Welfare segment offers various feed supplements, liver correctives, fertility inducers, antibiotics, anti-parasiticides, antispasmodics, cervical dilators, cocktail enzymes, etc. to veterinarians, dairy, poultry and aqua farmers, and pet parents. The Consumer Products segment is involved in the marketing and distribution of baby care products under the Woodward's Gripewater name; personal care products and cosmetics under the EVA name; home care products, such as scrubbers under the Good Home name; and air fresheners. The Medical Devices segment manufactures and markets artificial heart valves under the TTK Chitra name, as well as orthopedic implants and instruments for knee and hip replacements. The Protective Devices segment manufactures and markets sexual wellness products, including male contraceptives under the Skore brand name, and other allied products. The Foods segment engages in the manufacturing and marketing of food products, including papads under the Fryums name; and cereal, potato, rice, pulses, and corn-based products. The Human Pharma is involved in the development and commercialization of such as gynecology, infertility, respiratory, orthopedics, cardiology, and general health therapeutic needs. The Others segment prints and publishes maps, atlases, guidebooks, and educational publications under the TTK brand name. The company was founded in 1928 and is headquartered in Chennai, India. TTK Healthcare Limited operates as a subsidiary of TT Krishnamachari & Co., Ltd.",0.653,none,310.0
340,340,CAPLIPOINT,Caplin Point Laboratories Limited,EQ,23-JUN-2014,INE475E01026,drug-manufacturers-specialty-generic,healthcare,Healthcare,Pharmaceuticals,2232.8,2284.95,2207.0,2297.95,2232.8,2284.95,2207.0,2297.95,104800.0,104800.0,185807.0,183277.0,183277.0,1225.0,2641.0,2286.816,1773.2402,2243.95,0.5392251,0.24450636,2.0,0.094,4.527,6.067,19297178.0,76011696.0,79458600.0,0.73269,1735603200.0,1727049600.0,2.5,1727049600.0,5:1,1476835200.0,0.0773,2.0,1,2,17056.6434816,163270983680.0,8266200064.0,108.826,24300000.0,18327900160.0,241.314,6032900096.0,1072512512.0,3747800064.0,324.909,6.9063954,9.306382,8.908,27.063,0.137,0.178,0.139,4935600128.0,64.75,,34.655598,0.26929,0.5702,0.32916,0.30635,0.12741,0.21243,"Caplin Point Laboratories Limited, together with its subsidiaries, engages in the development, production, marketing, and export of generic pharmaceutical formulations and branded products in India. The company provides tablets, capsules, injections, ophthalmic, liquid orals, softgel capsules, ointments, creams and gels, powder for injections, suppositories, ovules, pre-mix bag formulations, inhalers, and sprays and IV infusion. It also provides dry syrups, lyophilized vials, prefilled syringes, emulsion injection, and topicals. Caplin Point Laboratories Limited was incorporated in 1990 and is headquartered in Chennai, India.",0.399,strong_buy,94.0
343,343,JWL,Jupiter Wagons Limited,EQ,18-OCT-2010,INE209L01016,railroads,industrials,Industrials,Railway Wagons,433.15,438.0,438.0,514.4,433.15,438.0,438.0,514.4,26283843.0,26283843.0,1952920.0,1047599.0,1047599.0,300.5,748.1,487.478,533.6182,494.75,0.12316871,0.24450636,2.0,17.507,1.215,2.209,134996750.0,424497984.0,432387008.0,0.73241997,1672444800.0,1728259200.0,1.0,1728259200.0,,,0.17899999,10.0,1,10,21002.0384768,177190682624.0,10802147328.0,25.52,4500218880.0,39001473024.0,92.297,5473867776.0,-979917504.0,873902016.0,60.379,8.194074,5.384935,4.543,32.37,0.034,0.148,0.093,3682894080.0,8.92,14.15,55.465244,0.09443,0.23236999,0.14035,0.12554,0.10547,0.20286,"Jupiter Wagons Limited manufactures and sells railway wagons, wagon components, and railway transportation equipment in India and internationally. It offers open, covered, flat, hopper, container, and special purpose wagons; and wagon accessories, such as alloy steel cast bogies, high tensile center buffer couplers, and high-capacity draft gears. The company also provides passenger and metro coaches, and train sets; and passenger coach accessories, including fabricated bogies, couplers and draft gears for passenger trains, axle mounted disc brake systems, brake discs and split brake discs, and brake pads. In addition, it offers track solutions, such as CMS crossings and weldable CMS crossings on PSC slipper; commercial vehicles; commercial electric vehicles; and containers, such as marine, refrigerated, and truck mounted containers, as well as cold chain transport solution. Further, the company engages in letting out of property; and manufacturing of electrical equipment, as well as provides drone delivery services. The company serves railway engineering company, the Indian Railway, private wagon aggregators, commercial vehicles OEMs, Indian defence and logistics companies. The company was formerly known as Commercial Engineers & Body Builders Co Limited and changed its name to Jupiter Wagons Limited in May 2022. Jupiter Wagons Limited was incorporated in 1979 and is based in Kolkata, India.",0.906,hold,83.0
344,344,TEGA,Tega Industries Limited,EQ,13-DEC-2021,INE011K01018,specialty-industrial-machinery,industrials,Industrials,Industrial Products,1636.65,1626.0,1626.0,1655.9,1636.65,1626.0,1626.0,1655.9,18163.0,18163.0,82481.0,41366.0,41366.0,1059.85,2328.9,1721.831,1695.2465,1646.75,0.48254,0.24450636,2.0,25.844,,,15446880.0,66535500.0,66698100.0,0.74786,1735603200.0,1723161600.0,2.0,1723161600.0,,,0.0637,10.0,1,10,10983.510016,128157589504.0,3352689920.0,50.389,3080150016.0,15646170112.0,235.338,3181104896.0,,,179.125,9.193301,7.019935,8.191,40.287,0.72,0.268,0.718,2092099968.0,25.37,36.23,64.90934,0.13371,0.55647,0.20332001,0.12226,,,"Tega Industries Limited designs, manufactures, and installs process equipment and accessories for the mineral processing, mining, and material handling industries. It offers a range of grinding mill liners, such as DynaPrime, DynaSteel, DynaPulp, and DynaWear. The company also offers conveyor components products comprising centrax, friflo, spill-ex skirt sealing, bed system manufacturer, eco-flip skirt, single wing, ceramic pulley lagging, and ceradisc. In addition, it provides wear products, such as ceramic liners, composite liners, rubber liners, flow promoting liners, thunder air blasters, and engineered chutes; screens and trommels; wear-resistant lining components made of rubber, polyurethane, steel and ceramics, essential for mineral processing, screening, grinding, and material handling; and trommels for heavy and light duty applications. Further, the company designs and supplies tornado hydrocyclones for the mining and mineral processing sectors. It operates in North America, South America, Europe, the Middle East, Russia, Africa, South East Asia, Australia, and India. The company was incorporated in 1976 and is based in Kolkata, India. Tega Industries Limited is a subsidiary of Nihal Fiscal Services Private Limited.",0.51,buy,122.0
348,348,AUROPHARMA,Aurobindo Pharma Limited,EQ,19-JUL-2000,INE406A01037,drug-manufacturers-specialty-generic,healthcare,Healthcare,Pharmaceuticals,1147.55,1154.55,1148.1,1162.5,1147.55,1154.55,1148.1,1162.5,383025.0,383025.0,1078845.0,1243071.0,1243071.0,958.5,1592.0,1260.51,1321.44,1156.3,0.020225763,0.24450636,2.0,27.286,0.855,1.829,290923057.0,580801984.0,594441984.0,0.5363,1735603200.0,1708387200.0,1.5,1708387200.0,2:1,1437350400.0,0.0734,1.0,1,1,67158.1339648,690753372160.0,68682301440.0,117.638,84272496640.0,302950187008.0,518.561,63952297984.0,-11765600256.0,15866600448.0,528.882,2.18631,2.2168045,2.28,10.801,0.091,0.08,0.08,35816398848.0,61.28,62.29,18.869127,0.11823,0.57493997,0.21110001,0.15185,0.06765,0.12128,"Aurobindo Pharma Limited, a biopharmaceutical company, engages in the manufacture of generic formulations and active pharmaceutical ingredients in India, the United States of America, Europe, Puerto Rico, and internationally. The company offers formulation in form of oral solids, liquids, injectables, and vaccines, as well as over-the-counter drugs; and active pharmaceutical ingredients (APIs), biosimilars, biocatalysts, peptides, and hormones targeting key therapeutic areas, including central nervous system, cardiovascular, respiratory, antibiotics, anti-retroviral, anti-diabetics, gastroenterology, oncology, and dermatology. It also provides antiretroviral drugs for the people and children living with HIV; and provides project-based chemistry contract services that cover the clinical stage through to manufacturing and management of the entire drug lifecycle in the API space for sterile and non-sterile penicillin's, cephalosporins, penems, and non-beta lactams. The company was incorporated in 1986 and is headquartered in Hyderabad, India.",0.593,buy,32.0
354,354,ARTNIRMAN,Art Nirman Limited,EQ,18-OCT-2021,INE738V01013,real-estate-development,real-estate,Consumer Discretionary,Residential Commercial Projects,52.48,55.0,52.0,55.0,52.48,55.0,52.0,55.0,2690.0,2690.0,20000.0,3622.0,3622.0,48.2,97.7,59.1728,62.3958,52.0,-0.27862543,0.24450636,2.0,8.28,,,5798885.0,24956000.0,25406200.0,,,,,,,,,10.0,1,10,129.7712,1496307456.0,43512000.0,1.71,29224000.0,345744992.0,13.519,23397750.0,,,14.142,3.6769905,3.753379,4.328,63.951,1.0,0.055,1.169,13981000.0,0.53,,98.11321,0.04044,0.63312,0.06767,0.06316,,,"Art Nirman Limited engages in the real estate development and allied activities in India. The company is involved in the construction and development of residential, commercial, and plotting projects. It also engages in the construction and development of office spaces, showrooms, and shops. Art Nirman Limited was formerly known as Vishnudhara Buildcon Private Limited and changed its name to Art Nirman Limited in October 2011. The company was incorporated in 2011 and is based in Ahmedabad, India.",-0.158,none,545.0
357,357,TPLPLASTEH,TPL Plastech Limited,EQ,20-MAY-2015,INE413G01022,packaging-containers,consumer-cyclical,Industrials,Packaging,94.09,95.02,93.15,97.67,94.09,95.02,93.15,97.67,148976.0,148976.0,132636.0,188920.0,188920.0,51.45,136.0,102.516,99.76735,94.46,0.47940254,0.24450636,2.0,23.447,,,15069649.0,78003000.0,78094200.0,0.78069,1672444800.0,1726531200.0,0.8,1726531200.0,5:1,1666137600.0,0.22729999,2.0,1,2,737.677824,8608439296.0,55084000.0,0.701,305632992.0,3209675008.0,40.952,374118752.0,,,16.711,5.652564,2.2982945,2.682,23.01,0.213,0.117,0.228,206776000.0,2.79,,33.856632,0.06442,0.20834999,0.116560005,0.09307,,,"TPL Plastech Limited engages in the manufacture and sale of polymer products in India. The company provides its IBCs under QuBC and re-bottled IBC under COBO brand names. It offers narrow mouth drums; narrow mouth and wide mouth carboys for specialty chemical and adhesive industries; bulk and medium open top drums that are used for packing powder, paste type, and semi liquid/solid products. In addition, the company offers HDPE packaging products, such as bottles for packing lubricant oil, pesticides, cosmetics, food and beverages, and cleaning and hygiene products; packaging solutions for pharma and agro based products, and cosmetics and personal care products; and caps and closures, small containers, promotional packaging solutions, etc. The company was formerly known as Tainwala Polycontainers Limited and changed its name to TPL Plastech Limited in January 2007. The company was incorporated in 1992 and is based in Mumbai, India. TPL Plastech Limited operates as a subsidiary of Time Technoplast Limited.",0.739,none,412.0
358,358,GANECOS,Ganesha Ecosphere Limited,EQ,09-MAR-2015,INE845D01014,textile-manufacturing,consumer-cyclical,Consumer Discretionary,Other Textile Products,1824.7,1809.75,1746.0,1819.05,1824.7,1809.75,1746.0,1819.05,99689.0,99689.0,107602.0,127054.0,127054.0,900.0,2484.2,2150.658,1701.7128,1754.45,0.87736,0.24450636,2.0,37.904,,,14341066.0,25307800.0,25382700.0,0.42713,1735603200.0,1725321600.0,1.5,1732579200.0,,,0.0785,10.0,1,10,4453.2678656,60063068160.0,1807587968.0,71.433,3987902976.0,12053560320.0,519.038,1638381056.0,,,415.085,4.2267246,3.6945665,4.983,36.66,4.639,0.324,5.538,596692992.0,34.85,61.2,50.3429,0.0495,0.29283002,0.13593,0.101780005,,,"Ganesha Ecosphere Limited primarily manufactures and sells recycled polyester staple fiber in India and internationally. The company offers rPET fibre comprising solid, dope-dyed, hollow/conjugated, fire retardant, short-cut, micro, and trilobal fibers. It also offers yarns; rPET flakes; and rPET chips for bottle grade and textile/sheet grade. In addition, the company provides spun yarn and dyed texturized yarn. Its products are used in various application, such as spinning, blending with other fibres/ materials, industrial and fine fabrics, special effect, apparel, flooring, packaging, interiors, furnishing, body warmers, dress materials, suitings, shirtings, furnishing fabrics, shirts, trousers, suits, home textiles, bed linens, various ropes, medical textiles, home decor, clothing, T-shirts, sarees, and industrial textiles and fabrics; food grade and non-food-grade packaging; and functional textiles, including non-woven air filter fabric, geo textiles, carpets, and car upholstery; and fillings for pillows, duvets, and toys. The company serves paper and construction, technical textile, knitting, clothing, hosiery, healthcare, FMCG, beauty, pharmaceutical, beverage, and chemicals industries. It also exports its products. The company was formerly known as Ganesh Polytex Ltd. and changed its name to Ganesha Ecosphere Limited in September 2011. Ganesha Ecosphere Limited was incorporated in 1987 and is based in Kanpur, India.",0.951,strong_buy,218.0
359,359,MANYAVAR,Vedant Fashions Limited,EQ,16-FEB-2022,INE825V01034,apparel-manufacturing,consumer-cyclical,Consumer Discretionary,Speciality Retail,1206.15,1208.5,1180.0,1211.95,1206.15,1208.5,1180.0,1211.95,115444.0,115444.0,176336.0,297435.0,297435.0,886.05,1512.0,1321.676,1177.1903,1194.75,0.076535225,0.24450636,2.0,30.322,3.417,4.023,60920655.0,242922000.0,247006000.0,0.74956,1735603200.0,1724371200.0,8.5,1724371200.0,,,0.513,1.0,1,1,29023.1058432,290925019136.0,7143349760.0,29.362,4631799808.0,13453809664.0,55.43,5268129792.0,3776320000.0,4616529920.0,62.788,19.028318,21.572407,21.624,55.224,0.368,0.227,0.373,4028960000.0,16.52,,72.32143,0.29947,0.7297,0.39157,0.3161,0.13816,0.28219998,"Vedant Fashions Limited engages in the manufacture, trade, and sale of wedding and celebration wear in India and internationally. The company's products include men's ethnic and celebration wear items, such as kurta sets, Indo-Western sets, sherwani sets, short kurta and Jodhpuri products, jackets, and accessories; women's ethnic and celebration wear items, including lehengas, sarees, stitched suits, crop top lehengas, gowns, and accessories; and kurta sets, jackets, and Indo-Western products for kids. It offers its products under the Manyavar, Twamev, Manthan, Mohey, and Mebaz brands. The company sells its products through a network of franchise-owned exclusive brand outlets, multi-brand outlets, and large format stores; and online platforms, including its website, manyavar.com and mobile application. Vedant Fashions Limited was founded in 1999 and is headquartered in Kolkata, India.",-0.271,buy,61.0
361,361,NOCIL,NOCIL Limited,EQ,17-JAN-1996,INE163A01018,specialty-chemicals,basic-materials,Commodities,Specialty Chemicals,228.42,231.2,231.1,235.3,228.42,231.2,231.1,235.3,192777.0,192777.0,373587.0,388929.0,388929.0,217.95,336.0,260.2076,275.70114,233.06,-0.14641255,0.24450636,2.0,0.663,3.868,5.505,90741026.0,166960000.0,167128000.0,0.28914,1735603200.0,1721952000.0,3.0,1721952000.0,,,0.35669997,10.0,1,10,3895.085056,35171356672.0,3755599872.0,22.553,117400000.0,14409100288.0,86.423,1726099968.0,1220987520.0,1600800000.0,106.328,2.1918967,2.7032118,2.441,20.376,0.546,0.058,0.551,1407299968.0,8.41,10.65,27.712248,0.097670004,0.41942,0.11979,0.088549994,0.03949,0.082270004,"NOCIL Limited engages in the manufacture and sale of rubber chemicals for tire and other rubber processing industries in India and internationally. The company provides rubber chemicals, including pilflex, pilnox, pilcure, and pilgard. It offers anti-degradants/anti-oxidants accelerators. In addition, the company offers technical services. NOCIL Limited was incorporated in 1961 and is headquartered in Mumbai, India.",0.537,underperform,239.0
365,365,NITINSPIN,Nitin Spinners Limited,EQ,02-FEB-2006,INE229H01012,textile-manufacturing,consumer-cyclical,Consumer Discretionary,Other Textile Products,403.8,407.1,398.0,408.9,403.8,407.1,398.0,408.9,73301.0,73301.0,183952.0,126562.0,126562.0,293.0,494.35,425.433,393.122,399.4,0.19467461,0.24450636,2.0,96.894,0.81,1.674,30492683.0,56220000.0,56366200.0,0.56505,1735603200.0,1725840000.0,2.5,1725840000.0,,,0.09060001,10.0,1,10,2251.266048,34364690432.0,133686000.0,2.378,11798354944.0,31766272000.0,564.981,4524768768.0,-1305772160.0,2094818944.0,216.604,1.8439178,0.70869696,1.082,7.595,0.33,0.115,0.33,1551997952.0,27.62,,14.460535,0.048860002,0.35479,0.14244,0.094890006,0.07417,0.13542,"Nitin Spinners Limited manufactures and sells cotton and blended yarns, and knitted and woven fabrics in India and internationally. The company offers yarns, including cotton ring spun carded, cotton ring spun, cotton compact ring spun combed, cotton compact ring spun carded, poly/cotton blended ring spun, multifold ring spun, fancy and core slub, compact fancy slub, compact core spun, S and Z twist, organic, BCI/TBC certified, supima and giza certified, contamination free, zero and eli twist, poly/cotton blended open end yarns, and yarns made out of recycled fibers. It also provides knitted fabrics, such as single jersey, lycra blended fabrics, pique structures, interlock structures, rib structures, and 3 T fleece fabrics; and finished and printed fabrics. The company products are used for in woven and knitted apparel, furnishing fabrics, denims, terry towel, medical fabrics, tea bags, uniform, heath care apparel, hotel apparel, as well as inner, comfort, sports, baby, winter, fashion and image, industrial and protective, and defence wear applications. The company was incorporated in 1992 and is headquartered in Bhilwara, India.",0.465,strong_buy,292.0
367,367,UBL,United Breweries Limited,EQ,28-JUL-2008,INE686F01025,beverages-brewers,consumer-defensive,Fast Moving Consumer Goods,Breweries & Distilleries,1948.3,1947.85,1911.35,1963.0,1948.3,1947.85,1911.35,1963.0,90250.0,90250.0,209122.0,272986.0,272986.0,1647.25,2204.9,1970.258,1995.7423,1929.7,0.056791067,0.24450636,2.0,2.991,0.926,1.592,68836779.0,264404992.0,267004000.0,0.72801,1735603200.0,1721865600.0,10.0,1721865600.0,10:1,1149811200.0,0.55990005,1.0,1,1,51022.2303232,514794127360.0,1538899968.0,5.822,1265299968.0,85496897536.0,323.302,7917899776.0,-4262262528.0,-1931399936.0,159.852,12.071791,5.967729,6.021,65.016,0.232,0.12,0.232,4722599936.0,17.92,33.8,107.68415,0.05524,0.42016998,0.092609994,0.08035,0.0537,0.11479,"United Breweries Limited engages in manufacture, purchase, and sale of beer and non-alcoholic beverages in India and internationally. The company offers beer products under the Heineken, Heineken Silver, Kingfisher Premium, Kingfisher Strong, Kingfisher Ultra, Kingfisher Ultra Max, Kingfisher Ultra Witbier, Amstel Bier, Bullet, Bullet Super Strong, Cannon 10000, Zingaro, Kingfisher Storm, Kingfisher Blue, Kalyani Black Label, UB Export Large, UB Export Strong, London Pilsner, and London Pilsner Strong brands; and non-alcoholic products under the Kingfisher Premium Packaged Drinking Water, Kingfisher Strong Power Soda, Kingfisher Storm Strong Soda, Kingfisher Ultra Non-Alcoholic, and Heineken 0.0. It also licenses its brands; and offers contract manufacturing services. The company was founded in 1915 and is based in Bengaluru, India. United Breweries Limited operates as a subsidiary of Heineken N.V.",0.508,hold,42.0
370,370,DHANUKA,Dhanuka Agritech Limited,EQ,29-JUN-2011,INE435G01025,agricultural-inputs,basic-materials,Commodities,Pesticides & Agrochemicals,1404.7,1425.25,1403.05,1432.75,1404.7,1425.25,1403.05,1432.75,10045.0,10045.0,36818.0,32604.0,32604.0,933.8,1925.8,1517.713,1531.8638,1416.7,0.16737306,0.24450636,2.0,6.632,1.226,2.489,17382502.0,45078300.0,47103200.0,0.70656997,1735603200.0,1721347200.0,6.0,1721347200.0,,,0.2355,2.0,1,2,6391.47008,65111638016.0,186999008.0,4.11,843340992.0,19194122240.0,421.37,3682233088.0,700855872.0,1431292032.0,279.508,5.068549,3.32991,3.392,17.683,0.157,0.059,0.155,2707976960.0,59.42,75.3,23.84214,0.14107999,0.39768,0.19184,0.22454001,0.117910005,0.22028999,"Dhanuka Agritech Limited operates as an agro-chemical company in India. The company offers herbicides, insecticides, fungicides, and plant growth regulators in various forms, such as liquid, dust, powder, and granules. It also offers Biological portfolio to control insect, and protects from discase and nutrient uptake. The company was founded in 1980 and is headquartered in Gurugram, India.",0.828,buy,192.0
371,371,BLUESTARCO,Blue Star Limited,EQ,15-JUN-2000,INE472A01039,building-products-equipment,industrials,Consumer Discretionary,Household Appliances,1917.8,1932.8,1920.25,1954.95,1917.8,1932.8,1920.25,1954.95,527640.0,527640.0,445508.0,687890.0,687890.0,1033.1,2417.0,1971.746,1772.6655,1934.35,0.8277818,0.24450636,2.0,12.747,0.51,1.338,125875017.0,205615008.0,215068000.0,0.36886,1735603200.0,1721347200.0,7.0,1721347200.0,2:1,1687219200.0,0.2723,2.0,1,2,39773.1397632,397573095424.0,4363899904.0,21.187,3487099904.0,107102896128.0,520.369,7476700160.0,-310500000.0,3760699904.0,132.696,14.577305,3.7135448,3.712,53.175,0.279,0.204,0.361,5259599872.0,25.7,25.03,75.26653,0.04911,0.23868999,0.06981,0.05244,0.066589996,0.20624,"Blue Star Limited operates as a heating, ventilation, air conditioning, and commercial refrigeration (HVAC&R) company in India. The company operates through three segments: Electro-Mechanical Projects and Commercial Air Conditioning Systems; Unitary Products; and Professional Electronics and Industrial Systems. The Electro-Mechanical Projects and Commercial Air Conditioning Systems segment designs, manufactures, installs, commissions, and maintains central air conditioning plants, packaged/ducted systems, and variable refrigerant flow systems; and provides contracting services in mechanical works, electrification, plumbing, and fire-fighting, as well as after-sales services, such as revamp, retrofit, upgrades, and operational support services. The Unitary Products segment offers room air conditioners for residential and commercial applications; water purifiers, air purifiers, and air coolers; and a range of commercial refrigeration products and cold chain equipment. The Professional Electronics and Industrial Systems segment trades in and services testing machines, medical, analytical, test and measuring, data communications, and industrial products and systems. It also exports its products to the Middle East, Africa, SAARC, and ASEAN regions. Blue Star Limited was founded in 1943 and is headquartered in Mumbai, India.",0.636,buy,49.0
372,372,SPLPETRO,Supreme Petrochem Limited,EQ,24-MAY-2022,INE663A01033,specialty-chemicals,basic-materials,Commodities,Petrochemicals,646.0,643.6,643.6,664.35,646.0,643.6,643.6,664.35,36495.0,36495.0,44499.0,53357.0,53357.0,521.25,926.6,706.693,763.6955,648.95,0.20174873,0.24450636,2.0,5.856,1.716,2.392,63625722.0,188040992.0,188463008.0,0.66164,1735603200.0,1730332800.0,2.5,1730332800.0,2:1,1672963200.0,0.4111,2.0,1,2,12230.3070208,114186543104.0,9072580608.0,48.248,1229590016.0,58261630976.0,309.929,5343772160.0,1418299904.0,4332166144.0,111.669,5.8113713,2.0992043,1.96,21.368,0.157,0.178,0.157,4114571008.0,21.9,,29.632421,0.07062,0.15553,0.09172,0.07192,0.10872,0.20785,"Supreme Petrochem Limited manufactures and sells polystyrene, expandable polystyrene, masterbatches and compounds of styrenics, other polymers, and extruded polystyrene insulation board in India and internationally. It provides general purpose, high impact, and expandable polystyrene products; and white, black, color, filler, and additive masterbatches. The company also offers acrylonitrile butadiene styrene (ABS), pre-colors, and specialties for automotives, household appliances, electrical and electronics, toys and sports, and extrusion industries. Supreme Petrochem Limited was incorporated in 1989 and is based in Mumbai, India.",0.492,hold,116.0
