139,139,NRBBEARING,NRB Bearing Limited,EQ,08-MAR-2000,INE349A01021,auto-parts,consumer-cyclical,Consumer Discretionary,Auto Components & Equipments,270.55,270.9,267.0,271.55,270.55,270.9,267.0,271.55,53902.0,53902.0,232033.0,120346.0,120346.0,242.6,389.0,285.058,306.1875,267.9,-0.24077451,0.22677135,2.0,15.761,0.98,2.578,37997493.0,96922600.0,97249296.0,0.51131,1735603200.0,1729036800.0,2.5,1729036800.0,2:1,1283472000.0,,2.0,1,2,2596.5563904,26344871936.0,1269100032.0,13.101,1495100032.0,11338200064.0,116.932,1788400000.0,-273550016.0,1652999936.0,96.196,2.784939,2.2900958,2.324,14.731,0.468,0.081,0.465,2570099968.0,26.51,11.21,10.10562,0.22668,0.60611,0.15773,0.13352999,0.06716,0.31759,"NRB Bearings Limited, together with its subsidiaries, manufactures and sells ball and roller bearings for original equipment manufacturers in India and internationally. The company offers a range of friction solutions comprising drawn cup needle bearings, cylindrical roller bearings, polyamide and steel needle bearing cages, drawn cup cylindrical roller bearings, crank pins, full-complement needle bearings, special ball bearings, thrust bearings, formed strip cages for heavy gearboxes, tapered and spherical roller bearings, rocker-arm bearings, planetary shafts, and other special pins. It serves automotive sector and mobility applications. NRB Bearings Limited was incorporated in 1965 and is based in Mumbai, India.",0.72,strong_buy,283.0
141,141,DOLATALGO,Dolat Algotech Limited,EQ,12-JAN-2024,INE966A01022,capital-markets,financial-services,Financial Services,Stockbroking & Allied,108.82,108.65,106.55,110.55,108.82,108.65,106.55,110.55,434132.0,434132.0,491004.0,395662.0,395662.0,59.25,186.5,127.7464,136.6275,109.68,0.6550571,0.22677135,2.0,10.605,,,44345878.0,176000000.0,176098000.0,0.30786,1735603200.0,1707436800.0,0.25,1732579200.0,,,0.020399999,1.0,1,1,1930.368,25201014784.0,72750000.0,0.413,840979968.0,4497760256.0,25.564,,,,45.005,2.4370625,4.291843,5.603,,4.575,2.483,4.57,2161400064.0,14.08,,7.789773,0.48055,1.0,,0.75552005,,,"Dolat Algotech Limited engages in trading of shares, securities, commodities, and other financial products in India. The company was formerly known as Dolat Investments Limited and changed its name to Dolat Algotech Limited in November 2021. The company was incorporated in 1983 and is based in Mumbai, India.",0.183,none,309.0
146,146,DVL,Dhunseri Ventures Limited,EQ,11-JAN-2008,INE477B01010,capital-markets,financial-services,Diversified,Diversified,359.6,358.1,353.0,361.0,359.6,358.1,353.0,361.0,9451.0,9451.0,37219.0,29156.0,29156.0,302.2,558.7,390.559,397.096,359.45,0.063748,0.22677135,2.0,12.719,,,7628041.0,35024800.0,35311500.0,0.78216004,1735603200.0,1723507200.0,5.0,1723507200.0,,,0.0959,10.0,1,10,1258.966528,14258019328.0,5228682752.0,149.285,3769137920.0,5760952832.0,164.478,1124838272.0,,,844.887,0.4254415,2.1853442,2.475,12.676,0.728,2.064,0.729,1825751040.0,49.84,,7.212079,0.31691998,0.42816,0.19524999,0.28385,,,"Dhunseri Ventures Limited engages in the treasury operations in shares and securities in India. The company operates through Trading, Treasury Operations, Flexible Packaging Films, and Food and Beverages segments. It also manufactures and retails confectioneries in Singapore. In addition, the company offers bakery products; and manufactures and sells BOPET films. Further, it engages in the infrastructure business, as well as trades in commodities and PET Resin. Dhunseri Ventures Limited was formerly known as Dhunseri Petrochem Limited and changed its name to Dhunseri Ventures Limited in December 2018. The company was incorporated in 1916 and is based in Kolkata, India. Dhunseri Ventures Limited is a subsidiary of Dhunseri Investments Limited.",0.745,none,357.0
155,155,ALICON,Alicon Castalloy Limited,EQ,29-SEP-2006,INE062D01024,metal-fabrication,industrials,Consumer Discretionary,Auto Components & Equipments,970.25,971.0,941.1,971.0,970.25,971.0,941.1,971.0,14975.0,14975.0,20825.0,29876.0,29876.0,775.55,1541.9,1105.193,1182.417,949.6,-0.026684046,0.22677135,2.0,59.666,,,4588598.0,16261800.0,16287400.0,0.78474,1735603200.0,1726704000.0,4.5,1726704000.0,2:1,1165190400.0,0.1549,5.0,1,5,1544.2204672,22729652224.0,112126000.0,6.927,3312677888.0,16452969472.0,1020.131,2184939520.0,,,344.592,2.7557225,0.93856645,1.381,10.403,0.995,0.243,1.005,708283008.0,44.92,78.4,21.139805,0.04305,0.51402,0.1328,0.081420004,,,"Alicon Castalloy Limited provides design, manufacturing, engineering, casting, machining, assembly, painting, and surface treatment services for aluminum components in India and internationally. The company offers 2 and 4-wheeler cylinder heads, transcradles, motor and compressor housings, inlet pipes, motor stators, cac tanks, controller and distributor housings, battery trays, housings, enclosure bodies, fully finished cylinder heads, swing arms, cooling/junction boxes, inverter casings, transmission cases, e-axles, and top yokes/bridge fork tops as well as suspension, chassis, and brake parts. Its products are used in various sectors, such as e-mobility, automotive, agriculture, energy, medical and health, defence, infrastructure, locomotive, aerospace, and carbon-neutral. In addition, the company exports its products to approximately 18 countries. Alicon Castalloy Limited was formerly known as Enkei Castalloy Limited and changed its name to Alicon Castalloy Limited in December 2010. The company was incorporated in 1990 and is headquartered in Pune, India.",0.838,strong_buy,335.0
158,158,BEL,Bharat Electronics Limited,EQ,19-JUL-2000,INE263A01024,aerospace-defense,industrials,Industrials,Aerospace & Defense,276.15,275.45,274.05,283.9,276.15,275.45,274.05,283.9,12728283.0,12728283.0,18314879.0,14006123.0,14006123.0,171.75,340.5,293.824,287.43176,282.15,0.4394058,0.22677135,2.0,0.344,0.787,1.619,3496276980.0,7309779968.0,7309779968.0,0.52516997,1735603200.0,1723593600.0,0.8,1723593600.0,3:1,1663200000.0,0.3543,1.0,1,1,206245.4358016,1972527169536.0,83161899008.0,11.419,607500032.0,215747100672.0,29.506,57759100928.0,4171200000.0,20173199360.0,24.249,11.63553,9.559592,9.143,34.151,0.389,0.149,0.384,45401399296.0,6.21,7.64,45.43478,0.21044001,0.47675,0.26771998,0.27987,0.08809,0.27934,"Bharat Electronics Limited designs, manufactures, and supplies electronic equipment and systems for the defense and civilian markets in India. The company's defense products include defense communication products, land-based radars, naval systems, electronic warfare systems, avionics, electro optics, tank and armored fighting vehicle electronic systems, weapon systems, C4I systems, shelters and masts, simulators, and batteries; microwave tubes and power modules, microwave super components, digital multichannel data recorders, and hybrid micro circuits; and micro-electro mechanical systems, such as pressure transducers, and conductivity temperature and depth sensors. Its non-defense products comprise e-governance systems, homeland security products, civilian radars, and telecom and broadcast systems; integrated traffic management systems, real time train information systems, and solar power solutions; and PD and strategic products, silicon radiation detectors, passive vacuum devices, EMI filters, and multichannel voice logging recorder systems. The company also offers electronic manufacturing services, including PCB assembly and testing, precision machining and fabrication, opto-electronic components and assemblies, microwave integrated circuit assemblies, super components modules, cable assemblies and wiring harnesses, and antennae manufacturing services; designs and manufactures transformers, coils, chokes, and sub-assemblies; and software services. In addition, it offers cyber security products, such as data diodes and secure storage products; EV charging stations; and platform screen doors. Further, the company provides security architecture conceptualization and consulting, and information security audit services. It exports its products to the United States, France, China, Germany, Switzerland, ASEAN countries, Mauritius, the Republic of Armenia, Sri Lanka, Sweden, and Israel. The company was incorporated in 1954 and is headquartered in Bengaluru, India.",0.439,buy,18.0
163,163,TATACONSUM,TATA CONSUMER PRODUCTS LIMITED,EQ,18-NOV-1998,INE192A01025,packaged-foods,consumer-defensive,Fast Moving Consumer Goods,Tea & Coffee,937.7,942.0,935.35,959.35,937.7,942.0,935.35,959.35,677398.0,677398.0,1754587.0,2039361.0,2039361.0,882.9,1269.0,937.884,1084.6698,954.45,-0.19282085,0.22677135,2.0,14.401,0.634,1.448,621066159.0,989459008.0,990196992.0,0.34363,1735603200.0,1716508800.0,7.654853,1716508800.0,10:1,1277856000.0,0.64059997,1.0,1,1,94509.3541888,939566694400.0,23986399232.0,24.88,29546500096.0,162973794304.0,171.794,23807500288.0,11453974528.0,17939099648.0,198.448,4.809572,5.7990522,5.765,39.465,0.038,0.129,0.077,11502399488.0,11.91,14.94,80.13854,0.07058,0.43749002,0.14608,0.113170005,0.04674,0.062329996,"Tata Consumer Products Limited, together with its subsidiaries, produces, distributes, and trades in food products in India, the United States, the United Kingdom, and internationally. It operates through Branded Business and Non Branded Business segments. The company provides tea, coffee products, salt, mineral water, food ingredients, sweeteners, ready to cook and ready to eat options, breakfast cereals, snacks, mini meals, pulses, spices, sauces, chutney, pasta masala, ginger garlic paste, and dry fruits. It also offers health supplements; plant-based meat variants, including nuggets, burger patty, awadhi seekh kebab, and spicy fingers; honey and preserves; Chinese food products; glucose-based ready-to-serve drink; juices; and instant beverages. The company offers its products primarily under the Tata Tea, Tetley, 1868 by Tata Tea, Organic India, Tata Coffee Grand, Tata Coffee Gold, Tata Coffee Quick Filter, Sonnets by Tata Coffee, Tata Salt, Tata Sampann, Smith & Jones, Tata Sampann Yumside, Tata Soulfull, Himalayan honey and preserves, Ching's Secret, Tata Simply Better, Tata GoFit, Himalayan water, Tata Copper+, Tata Gluco+, Tata Fruski, Good Earth, Teapigs, Eight O'Clock, Tata Raasa, Joyfull Millets, Ching's Secret, Vitax, Laager, and Tea4Kidz brands. Tata Consumer Products Limited was formerly known as Tata Global Beverages Limited and changed its name to Tata Consumer Products Limited in February 2020. The company was incorporated in 1962 and is headquartered in Mumbai, India.",0.578,buy,30.0
166,166,MINDTECK,Mindteck (India) Limited,EQ,02-AUG-2016,INE110B01017,information-technology-services,technology,Information Technology,Computers - Software & Consulting,266.25,269.95,257.75,274.4,266.25,269.95,257.75,274.4,32110.0,32110.0,50137.0,44925.0,44925.0,134.68,368.0,283.299,276.2394,260.2,0.37696528,0.22677135,2.0,1.0,,,8183284.0,31848100.0,31997600.0,0.76515996,1735603200.0,1722556800.0,0.8,1722556800.0,5:4,1726790400.0,0.0933,10.0,1,10,832.5775872,7442572800.0,1248300032.0,39.751,22100000.0,4002700032.0,128.125,310675008.0,,,70.347,3.6988075,2.08004,1.859,23.956,0.016,0.158,0.024,274600000.0,8.57,,30.361729,0.0686,0.17083,0.07762,0.07277,,,"Mindteck (India) Limited provides engineering and information technology (IT) services in the United States, India, and internationally. The company offers product development, software applications, cybersecurity, Internet of Things solution deployment and commissioning, and IoT enablement consulting services; embedded design, verification and validation services, and system solutions; and product lifecycle management consulting, advisory, system implementation, administration, system validation/testing, program management, and system integration/data migration services. It also provides smart mobility solutions and cloud computing; advanced analytics, analytics on unstructured data, business intelligence, information/data management, and big data services; and IT security and protection services. In addition, it offers system and integration, specialized, software product, and cloud based testing services; test strategy, automation, and infrastructure services; product engineering, re-engineering, and sustenance services; data center transformation and IT infrastructure management services; custom application development, application maintenance and management, legacy modernization, and performance engineering and enhancement services; application and enterprise systems integration, business process management, packaged application, SAP solutions, and service oriented architecture services; and smart city solutions. Further, the company provides IT talent services. It serves medical device and healthcare, life science and analytical instrument, semiconductor, and data storage industries; and government. The company was formerly known as Hinditron Informatics Limited and changed its name to Mindteck (India) Limited in September 1999. The company was incorporated in 1991 and is based in Bengaluru, India. Mindteck (India) Limited is a subsidiary of Embtech Holdings Limited.",0.897,none,398.0
172,172,SUMICHEM,Sumitomo Chemical India Limited,EQ,27-JAN-2020,INE258G01013,agricultural-inputs,basic-materials,Commodities,Pesticides & Agrochemicals,483.45,483.45,479.75,499.6,483.45,483.45,479.75,499.6,686040.0,686040.0,458772.0,357455.0,357455.0,336.1,628.3,524.796,504.4835,495.0,0.20022345,0.22677135,2.0,1.064,2.166,2.976,122683462.0,499145984.0,499559008.0,0.76614,1735603200.0,1721347200.0,0.9,1721347200.0,,,0.6095,10.0,1,10,24728.1713152,234323853312.0,13222110208.0,26.474,288950016.0,30434091008.0,60.968,5913310208.0,2207875072.0,4714840064.0,54.33,9.110988,8.125155,7.699,39.627,0.341,0.094,0.34,4833789952.0,9.67,,51.189243,0.15883,0.40216,0.1943,0.23228,0.09309,0.18458,"Sumitomo Chemical India Limited engages in the manufacture and sale of household and public health insecticides, agricultural pesticides, and animal nutrition products in India and internationally. It also offers crop protection products, such as insecticides, herbicides, fungicides, and miticides; animal nutrition and plant growth regulators; fumigants and rodenticides; weedicides; and biological products. The company exports its products. Sumitomo Chemical India Limited was incorporated in 2000 and is headquartered in Mumbai, India. The company is a subsidiary of Sumitomo Chemical Company Limited.",0.418,buy,86.0
173,173,BLUESTARCO,Blue Star Limited,EQ,15-JUN-2000,INE472A01039,building-products-equipment,industrials,Consumer Discretionary,Household Appliances,1934.35,1944.65,1910.4,1949.55,1934.35,1944.65,1910.4,1949.55,169491.0,169491.0,450539.0,656152.0,656152.0,1047.0,2417.0,1974.862,1775.4185,1923.35,0.80182576,0.22677135,2.0,12.747,0.51,1.338,125875017.0,205615008.0,215068000.0,0.36886,1735603200.0,1721347200.0,7.0,1721347200.0,2:1,1687219200.0,0.2723,2.0,1,2,39546.96192,395307384832.0,4363899904.0,21.187,3487099904.0,107102896128.0,520.369,7476700160.0,-310500000.0,3760699904.0,132.696,14.494409,3.692427,3.691,52.872,0.279,0.204,0.361,5259599872.0,25.73,25.03,74.75127,0.04911,0.23868999,0.06981,0.05244,0.066589996,0.20624,"Blue Star Limited operates as a heating, ventilation, air conditioning, and commercial refrigeration (HVAC&R) company in India. The company operates through three segments: Electro-Mechanical Projects and Commercial Air Conditioning Systems; Unitary Products; and Professional Electronics and Industrial Systems. The Electro-Mechanical Projects and Commercial Air Conditioning Systems segment designs, manufactures, installs, commissions, and maintains central air conditioning plants, packaged/ducted systems, and variable refrigerant flow systems; and provides contracting services in mechanical works, electrification, plumbing, and fire-fighting, as well as after-sales services, such as revamp, retrofit, upgrades, and operational support services. The Unitary Products segment offers room air conditioners for residential and commercial applications; water purifiers, air purifiers, and air coolers; and a range of commercial refrigeration products and cold chain equipment. The Professional Electronics and Industrial Systems segment trades in and services testing machines, medical, analytical, test and measuring, data communications, and industrial products and systems. It also exports its products to the Middle East, Africa, SAARC, and ASEAN regions. Blue Star Limited was founded in 1943 and is headquartered in Mumbai, India.",0.636,buy,63.0
175,175,CLEAN,Clean Science and Technology Limited,EQ,19-JUL-2021,INE227W01023,specialty-chemicals,basic-materials,Commodities,Specialty Chemicals,1395.5,1398.7,1387.75,1432.1,1395.5,1398.7,1387.75,1432.1,77215.0,77215.0,183460.0,139198.0,139198.0,1243.0,1690.0,1383.502,1443.5198,1425.95,-0.06904602,0.22677135,2.0,0.157,3.21,4.492,22222560.0,106266000.0,106274000.0,0.79917,1735603200.0,1724889600.0,3.0,1724889600.0,,,0.20639999,1.0,1,1,15152.9996288,148157431808.0,3343709952.0,31.476,20380000.0,8844010496.0,83.222,3646249984.0,1497500.0,2231020032.0,122.123,11.676342,17.133629,16.752,40.633,0.126,0.315,0.126,2575759872.0,24.28,35.09,58.729404,0.29124,0.54817003,0.41228,0.3031,0.14101,0.21574,"Clean Science and Technology Limited, research, develops, manufactures, and markets specialty chemicals in India and internationally. The company operates through Performance Chemicals, FMCG Chemicals, and Pharma & Agro Intermediates segments. It also offers FMCG Chemicals, including anisole, guaiacol, 4-methoxy acetophenone, butylated hydroxy anisole, veratrole, L-ascorbyl palmitate, tertiary butyl hydroquinone, ortho methoxy toluene, and para di-methoxy benzene (1,4-DMB). In addition, the company offers performance chemicals comprising clean light stab 770, 4-hydroxy tempo, mono methyl ether of hydroquinone, butylated hydroxy anisole, L-ascorbyl palmitate, 2,5-di-tertiary butyl hydroquinone, tertiary butyl hydroquinone, and dimethyl sebacate. Further, it provides pharma and agro intermediates, such as dicyclohexylcarbodimide, veratrole, para benzoquinone, and para di-methoxy benzene (1,4-DMB). Clean Science and Technology Limited serves food and infant food formulations, agricultural chemicals, polymers and monomers, perfumes, cosmetic, and other sectors. The company was incorporated in 2003 and is based in Pune, India.",-0.079,buy,122.0
182,182,TIRUPATIFL,Tirupati Forge Limited,EQ,04-AUG-2020,INE319Y01024,metal-fabrication,industrials,Industrials,Castings & Forgings,53.68,52.6,52.6,52.6,53.68,52.6,52.6,52.6,152833.0,152833.0,322428.0,101102.0,101102.0,14.0,72.88,57.2518,34.01895,52.6,2.1483872,0.22677135,2.0,26.318,,,40472609.0,103680000.0,105805000.0,,1735603200.0,1628726400.0,0.011429,1628726400.0,7:4,1633564800.0,,2.0,1,2,545.3568,5722915840.0,44904000.0,0.432,131366000.0,1181837056.0,11.651,150887248.0,,,4.814,10.926464,4.614484,4.842,37.928,1.083,0.392,1.286,81051000.0,0.67,,78.50746,0.06858,0.39666,0.12767,0.1259,,,"Tirupati Forge Limited engages in the manufacture and sale of carbon steel forged flanges, and forged and other automotive components in India. The company provides slip-on, weld-neck, blind, lap-joint, threaded, and socket weld flanges; and elbow, tee, cross, coupling, half coupling, cap, plug, bushing, union, hex, nipple, and swag nipple forged pipe fittings. It also offers forged auto parts, gears, hammer unions, and seamless rolled rings. The company offers its products under the Tirupati brand name. Its products are used in automobile, construction and mining, aerospace, marine, railway, power, and oil and gas applications. The company was incorporated in 2012 and is based in Rajkot, India.",-0.175,none,439.0
188,188,CIGNITITEC,Cigniti Technologies Limited,EQ,13-OCT-2014,INE675C01017,information-technology-services,technology,Information Technology,IT Enabled Services,1588.05,1598.65,1564.5,1598.65,1588.05,1598.65,1564.5,1598.65,53320.0,53320.0,228052.0,175703.0,175703.0,942.1,1970.0,1678.807,1435.6465,1579.25,0.46249485,0.22677135,2.0,3.282,3.563,4.303,10530689.0,27300100.0,29603500.0,0.78888,1735603200.0,1700092800.0,3.0,1700092800.0,,,0.0594,10.0,1,10,4311.3680896,39183478784.0,4201618944.0,153.886,266035008.0,18913220608.0,692.725,1985467008.0,1761631872.0,1866168960.0,296.914,5.31888,2.2795527,2.072,19.735,0.15,0.105,0.154,1386299008.0,50.5,,31.272278,0.0733,0.36845002,0.10498,0.11125,0.11221,0.18747999,"Cigniti Technologies Limited provides software testing services worldwide. The company offers digital assurance services, such as artificial intelligence, Internet of Things, blockchain, big data and analytics, and mobile testing services, as well as security assurance, robotic process automation, cloud migration assurance, and 5G assurance services. It also provides quality engineering services, including accessibility, DevOps, compatibility, functional, performance, security, regression, test automation, and crowdsourced testing. In addition, the company offers enterprise application assurance services comprising medical device testing, ERP testing, and salesforce testing; and test management services, such as agile testing, service virtualization, and test data management; and test advisory and transformation services. Further, it provides digital engineering services, including programmatic innovation, and Agile and DevOps transformation advisory services; software products and platform engineering comprising DevSecOps, application modernization, blockchain engineering, enterprise application development, user experience engineering, and site reliability engineering; and data engineering services. It serves the airlines, banking, communications, energy and utilities, financial services, healthcare and life sciences, insurance, logistics, manufacturing, media and entertainment, retail and ecommerce, and travel and hospitality industries. The company was formerly known as Chakkilam Infotech Limited and changed its name to Cigniti Technologies Limited. The company was incorporated in 1998 and is headquartered in Hyderabad, India. As of December 20, 2024, Cigniti Technologies Limited operates as a subsidiary of Coforge Limited.",0.181,none,234.0
189,189,SHREEPUSHK,Shree Pushkar Chemicals & Fertilisers Limited,EQ,10-SEP-2015,INE712K01011,specialty-chemicals,basic-materials,Commodities,Dyes And Pigments,309.95,307.65,302.55,324.8,309.95,307.65,302.55,324.8,44536.0,44536.0,78712.0,84615.0,84615.0,155.15,384.8,310.588,245.1599,319.3,0.48407948,0.22677135,2.0,22.846,,,4222579.0,32337700.0,32359500.0,0.70678,1735603200.0,1726790400.0,1.5,1726790400.0,,,0.113299996,10.0,1,10,1032.54272,8352605184.0,1097053056.0,34.684,1081993984.0,7448322048.0,235.617,653632256.0,,,149.752,2.132192,1.3862756,1.121,12.779,0.622,0.106,0.628,420169984.0,14.69,16.15,21.735874,0.05641,0.33817002,0.08776,0.06236,,,"Shree Pushkar Chemicals & Fertilisers Limited, together with its subsidiaries, manufactures and trades in chemicals, dyes and dyes intermediate, cattle feeds, fertilizers, and soil conditioners in India. It offers reactive dyes under the DYECOL name; dye intermediates, including H acid, vinyl sulphone, sulpho para base, K acid, and gamma acid; and water-soluble fertilizer, such as single super phosphate, sulphate of potash, mono potassium phosphate, monoammonium phosphate, and calcium nitrate, as well as nitrogen, phosphorus, and potash fertilizers. The company also provides sulphuric, oleum, and chloro sulphonic acids; and cattle feed supplements. It also exports its products. The company was formerly known as Shree Pushkar Petro Products Limited and changed its name to Shree Pushkar Chemicals & Fertilisers Limited in March 2012. Shree Pushkar Chemicals & Fertilisers Limited was incorporated in 1993 and is headquartered in Mumbai, India.",0.515,none,378.0
191,191,JBCHEPHARM,JB Chemicals & Pharmaceuticals Limited,EQ,29-APR-2003,INE572A01036,drug-manufacturers-specialty-generic,healthcare,Healthcare,Pharmaceuticals,1785.0,1781.0,1735.0,1799.0,1785.0,1781.0,1735.0,1799.0,130989.0,130989.0,185500.0,181566.0,181566.0,1480.0,2030.0,1801.359,1834.7328,1747.8,0.10379374,0.22677135,2.0,3.12,1.983,3.076,71168337.0,155548992.0,158836992.0,0.54065,1735603200.0,1723593600.0,6.75,1723593600.0,2:1,1694995200.0,0.3188,1.0,1,1,27186.8542976,268286738432.0,4168600064.0,26.84,1002099968.0,37112639488.0,239.201,9648713728.0,3910009088.0,7450530816.0,206.825,8.450623,7.325497,7.229,27.805,0.153,0.135,0.159,6111278080.0,38.38,,45.539345,0.16466999,0.65397,0.25998,0.22850001,0.12942,0.20615,"J. B. Chemicals & Pharmaceuticals Limited manufactures and markets pharmaceutical formulations, herbal remedies, and active pharmaceutical ingredients (API) in India and internationally. The company's API product portfolio includes diclofenac sodium, diethylamine, acid, and potassium; nifedipine, atenolol, and cilnidipine; and ciprofloxacin, cetirizine, and meclizine HCI. It also provides dosage forms, such as tablets, lozenges, injectables, gels, creams, ointments, liquid herbal syrups, cold rubs, eye drops, troches, and capsules; and soft-centered, powder, medicated, and herbal lozenges, as well as various pharmaceutical dosage forms. In addition, it offers a range of contrast media products, including x-ray, magnetic resonance imaging (MRI), and ultrasound scanners; and contract manufacturing services. The company provides its products in gastroenterology, anti-infectives, wound care, neonatology and pediatrics, gynaecology, dental, vitamins and minerals, hypertension, diabetes, nephrology, respiratory, pain-analgesic, dermatology, antivirals, lozenges, and contrast media and radio diagnostic therapeutic areas. J. B. Chemicals & Pharmaceuticals Limited was incorporated in 1976 and is headquartered in Mumbai, India.",-0.016,buy,80.0
