942,942,BOSCHLTD,Bosch Limited,EQ,12-MAY-2003,INE323A01026,other_industry,other_sector,Consumer Discretionary,Auto Components & Equipments,34073.3,34073.3,33715.0,34650.0,34073.3,34073.3,33715.0,34650.0,20371.0,20371.0,60306.0,26110.0,26110.0,17931.15,36678.0,32612.48,26844.965,34135.6,,,2.0,0.326,1.191,1.948,8650780.0,29493600.0,,0.70669,1735603200.0,1721347200.0,,,10:1,1089244800.0,0.5742,10.0,1,10,100746.1072896,971485675520.0,33852999680.0,1147.807,393000000.0,165335007232.0,5605.785,20853999616.0,7445125120.0,12528000000.0,4087.966,8.3502655,6.093453,5.876,46.585,0.417,0.044,0.417,24913000448.0,845.02,,40.396206,0.15068,0.33715,0.12613,0.10973,0.062129997,0.21605,"Bosch Limited engages in the manufacture and trading of automotive products in India and internationally. It provides mobility, industrial technology, consumer goods, and energy and building technology products. The company offers powertrain solutions; electric drive systems; and gasoline powertrain sensors, fuel supply modules, air management products, and fuel charge assemblies; exhaust sensors, fuel injectors, and electronic control units. It also provides automotive batteries, auto electrical parts and components, braking parts, bulbs and lighting, diesel components and systems, electric and filtration parts, diesel and gasoline fuel injection systems, fuel supply, gasoline parts, horns, lubricants, sensors, spark plug, and wiper blades. In addition, it offers industrial equipment, security systems and industrial and consumer energy products and solutions; automotive aftermarket products; a range of spare parts for vehicles; and repair solutions for passenger cars and commercial vehicles. Further, it provides power tools, power-tool accessories, measuring technologies, and home and garden tools for professional users in trade and industry, the DIY market, and amateur crafters; video surveillance, access control, fire detection, evacuation, and voice alarm systems, as well as intrusion notification systems; and critical communication systems, professional audio, and conference systems for voice, sound, and music communication. Additionally, it offers drive and control technology, energy and building solutions, engineering and business solutions, safety and security solutions, and software solutions for industry and trades; home appliances comprising washers and dryers, dishwashers, and vacuum cleaners; cleaning tools; and hot water, heat pumps, air purifiers, heating systems, and air conditioners. The company was incorporated in 1951 and is headquartered in Bengaluru, India. Bosch Limited operates as a subsidiary of Robert Bosch Internationale Beteiligungen AG.",0.74,none,99.0
944,944,KIRLOSENG,Kirloskar Oil Engines Limited,EQ,24-DEC-2010,INE146L01010,other_industry,other_sector,Industrials,Compressors Pumps & Diesel Engines,1231.5,1225.0,1199.05,1292.0,1231.5,1225.0,1199.05,1292.0,225786.0,225786.0,348417.0,135402.0,135402.0,408.0,1450.0,1302.967,881.1782,1229.9,,,2.0,163.403,0.84,1.048,82845408.0,145059008.0,,0.42839,1735603200.0,1722470400.0,,,,,0.16409999,2.0,1,2,17840.807936,212362952704.0,9460799488.0,65.267,43469500416.0,58983198720.0,407.173,10061100032.0,1045299968.0,-4687799808.0,184.622,6.66172,3.024727,3.6,21.107,0.905,0.2,0.883,4418699776.0,30.42,12.46,40.430637,0.07491,0.39895,0.17058,0.16409999,0.07579,0.17716,"Kirloskar Oil Engines Limited manufactures and distributes diesel engines, agricultural pump sets, electric pump sets, power tillers, generating sets, and spares in India and internationally. It operates in three segments: Business to Business, Business to Customer, and Financial Services. The company offers power generation solutions for residential gensets, telecom, infrastructure, realty, hospitality, banks, defense, retail, healthcare, manufacturing, and data center; and farm mechanization products, such as power tillers and weeders, rotary tillers, and hand held tools for agriculture, as well as distributes spare parts, oil, and other allied products, including electric motors. It also provides industrial engines for applications in various sectors, such as earth moving, construction, railways, oil and gas, agriculture, defense and nuclear, firefighting and other pump sets, mining, fishery, excavation, material handling, and marine; and water management solutions, that includes diesel engines, electric and engine based pumps, pump-sets, alternators, induction motors, small engines, and column pipes and cables. In addition, the company offers organic waste and firefighting solutions. Further, it also provides financial services. The company uses retail channel for distribution. The company was formerly known as Kirloskar Engines India Limited and changed its name to Kirloskar Oil Engines Limited in March 2010. Kirloskar Oil Engines Limited was founded in 1946 and is based in Pune, India.",0.975,hold,360.0
945,945,GUJGASLTD,Gujarat Gas Limited,EQ,15-SEP-2015,INE844O01030,other_industry,other_sector,Energy,LPG/CNG/PNG/LNG Supplier,619.2,612.0,612.0,645.9,619.2,612.0,612.0,645.9,2016479.0,2016479.0,1333267.0,1006033.0,1006033.0,397.05,663.4,599.604,529.55725,643.5,,,2.0,1.946,0.695,0.792,172291404.0,688390016.0,,0.74984,1703980800.0,1694390400.0,,,5:1,1547510400.0,0.4004,2.0,1,2,44297.895936,418699804672.0,9261200384.0,13.447,1502599936.0,156901900288.0,227.869,18763800576.0,5044112384.0,16340400128.0,112.127,5.739028,2.823286,2.669,22.314,0.108,0.052,0.108,11436999680.0,16.59,28.33,38.788425,0.07289,0.19978,0.11959,0.11366,0.07748,0.15507,"Gujarat Gas Limited engages in the distribution of natural gas in India. It operates a network of approximately 36,000 kilometers of gas pipeline and 800 compressed natural gas stations. The company supplied piped natural gas to approximately 19.30 lakh households; approximately 4,335 industrial customers; and approximately 14,500 commercial and non-commercial customers. It operates in 44 districts in 6 states of Gujarat, Maharashtra, Rajasthan, Haryana, Punjab, Madhya Pradesh; and 1 union territory of Dadra and Nagar Haveli. The company was formerly known as GSPC Distribution Networks Limited and changed its name to Gujarat Gas Limited in May 2015. Gujarat Gas Limited was incorporated in 2012 and is based in Ahmedabad, India. Gujarat Gas Limited operates as a subsidiary of Gujarat State Petronet Limited.",0.419,buy,195.0
946,946,JYOTHYLAB,Jyothy Labs Limited,EQ,19-DEC-2007,INE668F01031,other_industry,other_sector,Fast Moving Consumer Goods,Household Products,495.9,494.0,486.0,504.9,495.9,494.0,486.0,504.9,753104.0,753104.0,1315487.0,1109471.0,1109471.0,237.75,554.0,448.95,448.175,496.9,,,2.0,2.793,1.695,2.371,113651075.0,367208992.0,,0.69044,1735603200.0,1719964800.0,,,2:1,1530144000.0,0.2982,1.0,1,1,18268.6777344,176524066816.0,6099299840.0,16.61,505600000.0,27610599424.0,75.19,4736799744.0,3247000064.0,4579200000.0,49.245,10.090364,6.616545,6.393,37.267,0.318,0.076,0.319,3694500096.0,10.07,5.05,49.34459,0.13381,0.48816,0.17156,0.16781999,0.12486,0.21974,"Jyothy Labs Limited, together with its subsidiaries, engages in the manufacture and marketing of fabric care, dishwashing, personal care, and household insecticides products in India and internationally. It operates through Dishwashing, Fabric Care, Household Insecticides, Personal Care, and Others segments. The Dishwashing segment offers dish wash bars, gels, and liquids, as well as dish wash scrubbers and powders under the Pril and Exo brands. The Fabric Care segment provides fabric whiteners, fabric enhancers, detergent powders, and detergent liquids and bar soaps under the Henko, Mr. White, Ujala, and More light brands. The Household Insecticides segment offers mosquito repellent coils, liquids, and insect repellent sticks, as well as surface cleaners and air care products under the Maya, T- Shine, and Maxo brands. The Personal Care segment provides body soaps, toothpastes, deodorants, talcum powders, after shave products, and hand washes under the Margo, Fa, and Neem Active brands. The Others segment offers incense sticks under the Maya brand; toilet and floor cleaner products; and provides dry cleaning and laundry services under the Fabric Spa brand. The company was formerly known as Jyothy Laboratories Limited and changed its name to Jyothy Labs Limited in July 2019. Jyothy Labs Limited was founded in 1983 and is based in Mumbai, India.",0.614,buy,356.0
948,948,AIRAN,Airan Limited,EQ,03-MAY-2019,INE645W01026,other_industry,other_sector,Information Technology,IT Enabled Services,29.26,29.25,28.55,29.7,29.26,29.25,28.55,29.7,263896.0,263896.0,321997.0,527977.0,527977.0,19.4,37.0,28.2832,26.6088,29.44,,,2.0,0.584,3.001,4.738,36590523.0,125020000.0,,0.72372,1703980800.0,,,,2:1,1555891200.0,,2.0,1,2,368.05888,3811760384.0,158740992.0,1.199,7864000.0,1054966016.0,8.24,195838000.0,-120485624.0,27710000.0,9.516,3.093737,3.4888222,3.613,19.464,0.591,0.157,0.654,125465000.0,1.0,,29.44,0.11893,0.3076,0.18563,0.21909,0.057690002,0.10034,"Airan Limited, together with its subsidiaries, provides information technology (IT) and IT-enabled services in India. It offers cash management, door step banking, fee collection/counter management, customer onboarding eKYC, cheque truncation/processing, e-stamping/registration fee collection, document management, contact center, records management, address verification and credit verification, back office management, bookkeeping, software development, self-managed superannuation fund, financials and taxation, data migration, payroll processing, labour law compliance, digital document verification, and automobile inspection services. The company also provides application outsourcing, BPO, and e-kyc solutions. In addition, it offers CTS clearing processing, pickup, account opening forms processing, and managing collection counters services. Airan Limited was founded in 1989 and is headquartered in Ahmedabad, India.",0.958,none,1532.0
950,950,EXIDEIND,Exide Industries Limited,EQ,17-JUN-2003,INE302A01020,other_industry,other_sector,Consumer Discretionary,Auto Components & Equipments,540.5,538.0,529.0,550.6,540.5,538.0,529.0,550.6,2758808.0,2758808.0,7260552.0,4026934.0,4026934.0,241.7,620.35,530.029,378.28525,546.9,,,2.0,9.119,0.475,1.406,416126000.0,850000000.0,,0.50909,1735603200.0,1721606400.0,,,10:1,1157673600.0,0.19399999,1.0,1,1,46486.503424,465521999872.0,5818899968.0,6.846,11764299776.0,167697301504.0,197.291,17781800960.0,-2325037568.0,15314100224.0,151.604,3.6074247,2.7720485,2.776,26.18,0.024,0.135,0.026,8766799872.0,10.32,,52.99419,0.05228,0.31523,0.10604,0.07391,0.047810003,0.07344,"Exide Industries Limited designs, manufactures, markets, and sells lead acid storage batteries in India and internationally. The company operates through Automotive and Industrial segments. It also offers automotive, industrial, genset, solar, inverter, institutional uninterrupted power supply (UPS), and submarine batteries, as well as home UPS systems, integrated power back-up systems, and e-rickshaw vehicles. In addition, the company manufactures and supplies recycled lead and lead alloys; offers lithium-ion batteries; produces and distributes industrial battery chargers, rectifiers, and parts; and provides energy storage solutions, as well as engages in the non-conventional energy business. Further, the company offers solutions in the areas of equipment selection, battery sizing, optimum room layout, installation, operation, and maintenance. It sells its batteries under the Exide, Index, Dynex, SF Sonic, Black Panther, Nexcharge, Chloride, and CEIL brand names through a distribution network of dealers. The company's products are used in power, solar, railways, telecom, UPS, projects, traction, and other industries. Exide Industries Limited was formerly known as Chloride Industries Ltd. and changed its name to Exide Industries Limited in August 1995. The company was founded in 1916 and is headquartered in Kolkata, India.",0.681,none,191.0
951,951,MALLCOM,Mallcom (India) Limited,EQ,02-FEB-2022,INE389C01015,other_industry,other_sector,Industrials,Other Industrial Products,1362.1,1352.0,1345.0,1382.95,1362.1,1352.0,1345.0,1382.95,6331.0,6331.0,17599.0,51342.0,51342.0,800.0,1569.0,1122.318,1052.703,1371.15,,,2.0,39.026,0.82,1.81,985784.0,6240000.0,,0.84203005,1703980800.0,1693785600.0,,,,,0.0515,10.0,1,10,855.5976192,8956866560.0,470000992.0,75.317,926918016.0,4207162112.0,674.243,576865024.0,-282286368.0,63747000.0,380.61,3.6025066,2.0336692,2.129,15.527,0.236,0.085,0.236,363158016.0,58.16,,23.575481,0.08632,0.19797,0.13711001,0.14122,0.08392,0.16479,"Mallcom (India) Limited, together with its subsidiaries, engages in the manufacture and distribution of personal protective equipment in India and internationally. The company offers head protection equipment comprising helmet, ear defender, goggles, glasses, masks, single lens, and cap; hand protection gears, such as gloves, latex, nitrile, textile, leather, knitted, cryogenic, and polyurethane gloves; body protection products, such as hi-visibility vest, jacket, workwear, disposable gown for hospital, disposable full sleeves apron, coverall, medical and surgical tunic and plants, and denim trousers and shirts; and feet protection equipment, including safety shoes. The company serves aviation, automobile and auto ancillary, cement and construction, chemical and metal, consumer goods, electronics and IT, food and beverages, hospitality and housekeeping, metal and mining, oil and gas, petrochemical, pharmaceuticals, and shipping industries. It exports its products. Mallcom (India) Limited was incorporated in 1983 and is headquartered in Kolkata, India.",0.818,none,1306.0
958,958,SONAMLTD,SONAM LIMITED,EQ,07-APR-2022,INE00LM01029,other_industry,other_sector,Consumer Discretionary,Consumer Electronics,46.2,47.0,46.0,53.4,46.2,47.0,46.0,53.4,1329589.0,1329589.0,55045.0,102534.0,102534.0,23.75,53.4,39.6961,39.2694,51.58,,,2.0,39.102,0.414,1.577,3990362.0,40032000.0,,,1609372800.0,1566172800.0,,,,,,5.0,1,5,206.4850688,1251556608.0,1541000.0,0.077,221559008.0,876387008.0,43.853,121294000.0,22287124.0,73447000.0,28.333,1.820492,2.3560946,1.428,10.318,4.793,0.281,1.888,55158000.0,1.0,,51.58,0.06294,0.27825,0.1384,0.10888,0.06938,0.101289995,"Sonam Limited manufactures and trades in horological items, clocks, clock movements, and related items in India. The company offers products, such as alarm time pieces, as well as dial, designer, divine tune, LCD, LED digital, light sensor, musical, office, pendulum, and pendulum musical clocks. It also provides picture God dial, regular, diamond series, rotating, rotating musical, rotating pendulum musical, SQ series, sweep, and sweep office clocks. The company exports its products. The company was formerly known as Sonam Clock Limited and changed its name to Sonam Limited in September 2023. Sonam Limited was founded in 1996 and is headquartered in Morbi, India.",-0.115,none,1672.0
959,959,ARVIND,Arvind Limited,EQ,08-FEB-1995,INE034A01011,other_industry,other_sector,Consumer Discretionary,Garments & Apparels,372.7,372.0,365.05,379.5,372.7,372.0,365.05,379.5,256633.0,256633.0,857746.0,676545.0,676545.0,124.65,403.65,372.327,293.1315,374.3,,,2.0,40.0,0.378,1.12,147405225.0,261630000.0,,0.44856,1735603200.0,1721347200.0,,,,,0.2916,10.0,1,10,9795.4676736,112127377408.0,644499968.0,2.463,14482700288.0,77377503232.0,295.822,8281600000.0,1324550016.0,6963599872.0,135.41,2.7641973,1.2659322,1.449,13.539,0.019,0.103,0.021,3366099968.0,12.86,24.17,29.105755,0.0435,0.48973998,0.107030004,0.09162,0.05238,0.100389995,"Arvind Limited, together with its subsidiaries, manufactures, markets, retails, supplies, and exports textiles in India and internationally. It operates through Textiles, Advanced Material, and Others segments. The company offers denim fabrics, woven and knitted fabrics, and voiles and garments products. It provides a range of specialized clothing and accessories for factory workers, fire-fighters, construction crew, soldiers, and healthcare and security personnel; hot-gas and liquid filtration products; automotive interiors and seating solutions; and composites and coated fabrics. In addition, the company offers water, industrial waste water, and sewage treatment solutions for industries, as well as zero liquid discharge solutions. Further, it is involved in the e-commerce, agriculture produce, engineering, telecommunication, technical textiles, and other businesses, as well as provision of EPABX and one to many radio solutions; and building residential, commercial, and industrial spaces. The company was founded in 1897 and is headquartered in Ahmedabad, India.",0.728,strong_buy,517.0
960,960,SIGMA,Sigma Solve Limited,EQ,09-JUN-2023,INE0A0S01010,other_industry,other_sector,Information Technology,IT Enabled Services,415.0,418.9,402.35,419.0,415.0,418.9,402.35,419.0,8904.0,8904.0,11043.0,10316.0,10316.0,341.1,570.0,403.897,434.441,406.2,,,2.0,16.007,4.381,4.452,1675452.0,10277500.0,,0.83821,1703980800.0,1695340800.0,,,,,0.0318,10.0,1,10,419.787392,4229094144.0,81596000.0,7.945,48368000.0,650545024.0,63.291,230808000.0,13511375.0,73965000.0,29.421,13.806465,6.452857,6.501,18.323,0.302,0.186,0.302,161374000.0,15.69,,25.889103,0.24806,0.46071,0.35479,0.34702,0.26650998,0.47158,"Sigma Solve Limited engages in the enterprise software development business in India. The company offers information and information enabled services; and turnkey consultancy services to customers in their business domain. It also provides services related to Web and E-commerce development, real time application development, business intelligence analytics, CRM development, digital marketing, UI and UX design, and automation testing and quality assurance. Sigma Solve Limited was incorporated in 2010 and is based in Ahmedabad, India.",-0.083,none,1497.0
967,967,CHOLAHLDNG,Cholamandalam Financial Holdings Limited,EQ,25-SEP-2017,INE149A01033,other_industry,other_sector,Financial Services,Investment Company,1490.35,1475.0,1473.85,1540.0,1490.35,1475.0,1473.85,1540.0,649785.0,649785.0,358397.0,472985.0,472985.0,885.1,1649.8,1270.223,1127.0685,1508.25,,,2.0,606.584,55.881,56.153,95817523.0,187776992.0,,0.47834,,1722470400.0,,,5:1,1149033600.0,0.0058,1.0,1,1,28387.9800832,1692749398016.0,47963000832.0,255.399,1342007017472.0,152453906432.0,811.845,,,-357264195584.0,545.363,2.7655892,1.8620697,11.103,,0.258,0.148,0.258,17725200384.0,94.34,,15.987387,0.11627,0.74588996,,0.36061,0.025009999,0.20064,"Cholamandalam Financial Holdings Limited, an investment company, provides financial services in India. It operates through Financial Services, and Insurance and Allied Services segments. The company provides vehicle finance, loan against property, home, and small and medium-sized enterprise loans, as well as secured, business and personal, and consumer and small enterprise loans; and general insurance services. Cholamandalam Financial Holdings Limited was formerly known as TI Financial Holdings Limited. The company was incorporated in 1949 and is based in Chennai, India.",0.758,none,266.0
969,969,ISEC,ICICI Securities Limited,EQ,04-APR-2018,INE763G01038,other_industry,other_sector,Financial Services,Stockbroking & Allied,776.7,776.1,767.05,776.1,776.7,776.1,767.05,776.1,150364.0,150364.0,607539.0,352826.0,352826.0,607.85,866.45,742.414,734.1435,774.6,,,2.0,430.223,1.193,1.204,81943645.0,323851008.0,,,1703980800.0,1714089600.0,,,,,0.4069,5.0,1,5,25085.4981632,303401664512.0,116394901504.0,360.121,168758706176.0,40622600192.0,125.721,,,-56210698240.0,121.363,6.3825054,6.1752567,7.469,,1.028,0.696,1.043,16966899712.0,52.19,54.07,14.841924,0.41766998,0.90405,,0.59072,0.08238,0.50086,"ICICI Securities Limited provides institutional and retail broking, merchant banking, financial products distribution, private wealth management, and issuer and advisory services. The company operates through three segments: Treasury, Broking & Distribution, and Issuer Services & Advisory. It offers investment and trading solutions across asset classes, including equity, commodity, derivatives, currency, margin trading funding, offshore investments, etc. The company also distributes financial products comprising mutual funds (MF), gold bonds, exchange traded funds, national pension schemes, and corporate fixed deposits (FD) and bonds; credit products, such as home loans, as well as loan against securities, property, FD, bonds, MF, rental discounting, asset financing, and overdrafts; and life, general, and business insurance products. In addition, it provides investment solutions, including equity, fixed income, offshore and alternate investments etc.; value-added services, such as insurance, mortgages and loans, tax advisory, and estate planning services, as well as block deal, algo trading, corporate access, investor meets, and equity research products; and customer engagement services comprising raising equity capital, debt syndication, and monetizing assets. Further, the company offers equity brokerage services for domestic and international institutional clients; and investment banking services, including equity capital market, debt advisory, mergers and acquisitions, private equity, and structured products and restructuring services. It serves corporates, financial institutions, high net-worth individuals, and retail investors in India and internationally. The company was formerly known as ICICI Securities and Finance Company Limited and changed its name to ICICI Securities Limited in April 2003. ICICI Securities Limited was incorporated in 1995 and is headquartered in Navi Mumbai, India. ICICI Securities Limited operates as a subsidiary of ICICI Bank Limited.",0.834,buy,285.0
970,970,AYMSYNTEX,AYM Syntex Limited,EQ,14-AUG-2015,INE193B01039,other_industry,other_sector,Consumer Discretionary,Other Textile Products,114.32,113.6,110.7,117.58,114.32,113.6,110.7,117.58,63401.0,63401.0,121888.0,137077.0,137077.0,63.15,125.29,98.7138,84.7097,115.64,,,2.0,76.455,0.306,1.054,8362939.0,50731300.0,,0.82115996,1703980800.0,,,,,,,10.0,1,10,586.656768,8820197376.0,195800000.0,3.876,3240300032.0,13581599744.0,267.618,1009400000.0,-260118000.0,636300032.0,83.888,1.3785046,0.43194968,0.649,8.738,20.201,0.134,20.452,20300000.0,0.4,,289.1,0.00149,0.44303,0.07432,0.06801,0.02765,0.00481,"AYM Syntex Limited engages in the manufacturing and export of polyester filament yarn, nylon filament yarn, and bulk continuous filament yarn in India. Its products are used in residential wall to wall, contract/hospitality, outdoor, and handmade carpets; rugs, bathmats, and carpet tiles; apparel and fashion, sarees, and hosiery and socks; automotive; home and medical textiles; narrow fabrics; sportswear; and sewing threads and industrial yarns. The company sells its products under the Comfeel, Elior, Polycycle, Arcticool, Synergy, Opulenz, Spinovate, Silque, Ultraflex, Assura, , Sorenyl, Beleaf, Rezilia, Ecose, Sparkle, Polymagic, Polywonder, Wonderfeel, Greenova, Kashmiere. Innoveda, Novacore, Thermique, Hygeia, Macrogard, Shadez, Colorize, Nycycle, Game Changer, and Silkenza brand names. AYM Syntex Limited also exports its products. The company was formerly known as Welspun Syntex Limited and changed its name to AYM Syntex Limited in December 2015. The company was incorporated in 1983 and is headquartered in Mumbai, India. AYM Syntex Limited operates as a subsidiary of Mandawewala Enterprises Limited.",0.824,none,1410.0
971,971,ICICIGI,ICICI Lombard General Insurance Company Limited,EQ,27-SEP-2017,INE765G01017,other_industry,other_sector,Financial Services,General Insurance,1881.4,1893.0,1861.5,1914.0,1881.4,1893.0,1861.5,1914.0,1590294.0,1590294.0,849407.0,625701.0,625701.0,1266.0,1916.0,1729.409,1584.027,1896.3,,,2.0,,0.002,0.268,221975499.0,493302016.0,,0.02646,1735603200.0,1717718400.0,,,,,0.2587,10.0,1,10,93582.2163968,926472601600.0,1231800064.0,2.498,,213876801536.0,434.577,28342390784.0,,,278.656,6.805165,4.3755198,4.332,32.689,0.471,0.19,0.487,21086013440.0,42.52,57.97,44.597836,0.09859,0.25410998,0.13252,0.13709,0.028350001,0.16736999,"ICICI Lombard General Insurance Company Limited provides various general insurance products and services in India. The company primarily offers fire, marine, cargo, engineering, aviation, public/product liability, employee group, workmen's compensation, cyber, personal accident, and travel insurance solutions. It also provides credit, crop, cattle, weather, group and mass health, and motor, as well as home insurance solutions. In addition, the company offers underwriting and claims, customer relationship, technology, operations, finance and accounts, human resources, legal and compliance, actuarial, marketing, business analytics, administration, and fraud control, as well as reinsurance solutions. It serves its customers comprising individuals, corporates, state and central governments, government-owned enterprises, and rural customers, as well as micro, small, and medium enterprises through agents, brokers, bancassurance, tele-sales, direct alliances, motor insurance service providers, and online platforms. The company was incorporated in 2000 and is based in Mumbai, India. ICICI Lombard General Insurance Company Limited operates as a subsidiary of ICICI Bank Limited.",0.63,buy,108.0
