301,301,NOCIL,NOCIL Limited,EQ,17-JAN-1996,INE163A01018,specialty-chemicals,basic-materials,Commodities,Specialty Chemicals,233.06,233.0,230.8,235.0,233.06,233.0,230.8,235.0,180101.0,180101.0,364753.0,384010.0,384010.0,217.95,336.0,259.1778,275.5087,233.27,-0.14457697,0.22677135,2.0,0.663,3.868,5.505,90741026.0,166960000.0,167128000.0,0.28914,1735603200.0,1721952000.0,3.0,1721952000.0,,,0.35669997,10.0,1,10,3894.6758656,35206324224.0,3755599872.0,22.553,117400000.0,14409100288.0,86.423,1726099968.0,1220987520.0,1600800000.0,106.328,2.1938717,2.7029278,2.443,20.396,0.546,0.058,0.551,1407299968.0,8.41,10.65,27.737219,0.097670004,0.41942,0.11979,0.088549994,0.03949,0.082270004,"NOCIL Limited engages in the manufacture and sale of rubber chemicals for tire and other rubber processing industries in India and internationally. The company provides rubber chemicals, including pilflex, pilnox, pilcure, and pilgard. It offers anti-degradants/anti-oxidants accelerators. In addition, the company offers technical services. NOCIL Limited was incorporated in 1961 and is headquartered in Mumbai, India.",0.537,underperform,248.0
302,302,ISFT,Intrasoft Technologies Limited,EQ,12-APR-2010,INE566K01011,internet-retail,consumer-cyclical,Consumer Discretionary,E-Retail/ E-Commerce,142.67,141.0,137.05,143.9,142.67,141.0,137.05,143.9,15121.0,15121.0,41198.0,32766.0,32766.0,107.5,191.75,145.674,138.5331,138.71,-0.16518432,0.22677135,2.0,65.954,,,5807527.0,16311700.0,16311700.0,0.62307,1735603200.0,1662336000.0,1.0,1662336000.0,,,,10.0,1,10,226.2596096,2891299584.0,771379968.0,47.388,1394004992.0,4882861056.0,321.063,194111744.0,,,129.576,1.0704914,0.46337506,0.592,14.895,0.213,0.023,0.339,107387000.0,7.75,12.87,17.898066,0.02199,0.34876,0.03975,0.03683,,,"IntraSoft Technologies Limited, through its subsidiaries, develops and delivers e-commerce and e-cards through internet platform in India and internationally. The company owns and operates 123stores.com, an e-commerce retail portal that provides sports and outdoor, home and kitchen, garden and outdoor, tool and home, and other products; 123Greetings.com, which offers various e-cards across various languages covering seasonal and everyday categories; and 123Greetings Studio, a platform for artists to upload and monetize on their own e-cards. It also sells its products through online marketplaces, such as Amazon and eBay. The company was incorporated in 1996 and is based in Kolkata, India.",0.6,none,507.0
306,306,UNIVASTU,Univastu India Limited,BE,22-JUN-2020,INE562X01013,engineering-construction,industrials,Industrials,Civil Construction,316.45,315.0,315.0,329.0,316.45,315.0,315.0,329.0,32105.0,32105.0,83235.0,165583.0,165583.0,110.05,345.35,256.3624,212.6667,325.5,1.704701,0.22677135,2.0,62.209,,,2755802.0,11364600.0,11863800.0,,1735603200.0,,,,2:1,1576713600.0,,10.0,1,10,369.9177216,2891725056.0,99702000.0,8.773,335865984.0,1301251968.0,114.5,217630256.0,,,45.737,7.1167765,2.8427832,2.222,13.287,0.915,0.048,0.915,80199000.0,8.26,,39.40678,0.06163,0.3068,0.16725,0.14129,,,"Univastu India Limited provides works contract services in India. It offers integrated engineering, procurement, and construction services for civil, structural, and infrastructure projects. The company handles various projects for metro stations, sports complexes, hospitals, commercial buildings, cold storages, educational institutions, mass housing, water supply, drainage, roads, and bridges, as well as multipurpose halls, industrial structures, minor irrigation, and other projects. It also trades in construction materials, including steel, cement, and electrical products; and offers construction contractors, project contractors, project executors, contractors, traders, dealers, distributors, agents, designers, supervisors, consultants, advisors, surveyors, and administrators of all types of heating, ventilation, and air conditioning products. The company serves governmental and private sectors. Univastu India Limited was incorporated in 2009 and is based in Pune, India.",0.303,none,469.0
308,308,NAGREEKCAP,Nagreeka Capital & Infrastructure Limited,EQ,18-SEP-2007,INE245I01016,capital-markets,financial-services,Financial Services,Investment Company,33.85,32.2,32.15,35.5,33.85,32.2,32.15,35.5,4814.0,4814.0,10991.0,4256.0,4256.0,15.35,43.93,36.1212,27.2187,33.12,0.8446866,0.22677135,2.0,3724.631,,,3762063.0,12615300.0,12747700.0,0.69323,1735603200.0,,,,,,,5.0,1,5,41.781872,1327161856.0,29906000.0,2.369,955553984.0,714275008.0,56.655,370971008.0,,,2.034,16.283186,0.584955,1.858,3.578,2.264,0.631,2.251,163636000.0,14.49,,2.2857141,0.22909,0.52939,0.51937,0.32799,,,"Nagreeka Capital & Infrastructure Ltd. is a publicly owned investment manager. The firm invests in equity markets, private equity, mutual funds, real estate, and renewable energy. The firm was founded Nagreeka Securities Ltd. and changed its name to Nagreeka Software Technologies Limited in September 2001. Nagreeka Software Technologies Limited further changed its name to Nagreeka Capital & Infrastructure Ltd. in July 2006. Nagreeka Capital & Infrastructure Ltd. was founded in 1953 is based in Mumbai, India with an additional office in Kolkata, India. Nagreeka Capital & Infrastructure Ltd. operates independently of Nagreeka Exports Ltd. as of September 18, 2007.",-0.391,none,580.0
310,310,CANBK,Canara Bank,EQ,23-DEC-2002,INE476A01022,banks-regional,financial-services,Financial Services,Public Sector Bank,97.33,96.96,96.5,98.37,97.33,96.96,96.5,98.37,15536487.0,15536487.0,23598917.0,25447543.0,25447543.0,87.79,128.9,101.0056,109.39285,97.88,0.04285872,0.22677135,2.0,,,,3231192223.0,9070650368.0,9071609856.0,0.64352995,1735603200.0,1718323200.0,3.22,1718323200.0,5:1,1715731200.0,0.1826,2.0,1,2,88783.5262976,216782094336.0,1629029138432.0,179.717,947697221632.0,612616306688.0,67.531,,,-824898224128.0,113.095,0.8654671,1.4492518,0.354,,0.104,0.148,0.103,159972343808.0,17.64,18.93,5.548753,0.26113,,,0.35966,0.0104600005,0.16986999,"Canara Bank provides various banking products and services in India and internationally. It offers personal banking services, such as savings and deposits comprising savings accounts, current accounts, recurring deposits, and term deposits; unclaimed deposit; loan products, including home, vehicle, education, personal, mortgage, gold, MSME, corporate, agri, solar, rent, and cash loans; working capital, infrastructure, and export finance products; life, general, and health insurance products; depository services, merchant banking, and online trading; and mutual funds. The company also provides digital lending portal; mobile and internet banking; credit, debit, and prepaid cards; UPI and fastag; missed call banking; online account; and payment solutions; NRI banking accounts; remittance facilities; attorneyship service; and nomination facility. In addition, it offers supply chain finance management; syndication services; IPO monitoring services; safe deposit lockers; and consultancy services, which cover estate and wills, private and charitable trustee, debenture and security trusteeship, and attorney services. The company was incorporated in 1906 and is headquartered in Bengaluru, India.",0.941,buy,33.0
312,312,IDBI,IDBI Bank Limited,EQ,20-SEP-1995,INE008A01015,banks-regional,financial-services,Financial Services,Private Sector Bank,79.63,79.0,78.2,85.0,79.63,79.0,78.2,85.0,31596834.0,31596834.0,7677865.0,13290313.0,13290313.0,65.89,107.9,78.636,85.8265,84.01,0.1432879,0.22677135,2.0,,,,559208046.0,10752400384.0,11320800256.0,0.45556,1735603200.0,1721088000.0,1.5,1721088000.0,8:5,981936000.0,0.2385,10.0,1,10,90330.9164544,944621289472.0,163607199744.0,15.211,203086200832.0,153360138240.0,14.26,,,-189126803456.0,50.834,1.6526341,5.890117,6.159,,0.341,0.087,0.343,67685715968.0,6.29,4.9,13.356121,0.44134998,,,0.5259,0.019170001,0.1321,"IDBI Bank Limited engages in the provision of banking and financial solutions to retail and corporate clients in India. It operates through three segments: Treasury, Retail Banking, and Corporate/Wholesale Banking. The company offers savings, current, and salary accounts, as well as fixed deposits; home, auto, education, and personal loans, as well as loans against properties and securities; debit, credit, and prepaid cards; mobile and Internet banking; and investment advisory and capital market services. It also provides fund and non-fund-based assistance; packing credit to exporters; receivable buyout with recourse; channel financing for dealers of corporates; scheme for financing automated teller machines/cash dispense vendors; technology upgrading fund scheme for textile and jute industries; and lending to non-banking finance companies/housing finance companies and commercial real estate sector. In addition, the company offers bank guarantees, letters of credit, documentary collection, bill discounting, and foreign currency; cash management, treasury, trade finance, and remittance services; and debt syndication and advisory services. Further, it provides finance to micro, small, and medium enterprises; agriculture finance; and products and services for non-resident Indians. Additionally, the company offers information technology and security, and contact center services; merchant banking, stock broking, corporate advisory, portfolio management of pension/PF funds and research activities, debt arranging and undertaking, and distributes financial products; mutual fund; and security trusteeship assignments, share pledge trustee, venture capital fund, safe keeping, escrow agency, and other trusteeship services, as well as acts as a trustee to securitization transactions and bond/debentures. The company was formerly known as IDBI Ltd. and changed its name to IDBI Bank Limited in May 2008. IDBI Bank Limited was founded in 1964 and is headquartered in Mumbai, India.",0.904,none,31.0
318,318,BHAGCHEM,Bhagiradha Chemicals & Industries Limited,EQ,18-OCT-2021,INE414D01027,agricultural-inputs,basic-materials,Commodities,Pesticides & Agrochemicals,290.9,290.9,288.2,303.0,290.9,290.9,288.2,303.0,111303.0,111303.0,113956.0,118646.0,118646.0,137.695,447.7,322.32,299.6703,300.8,0.9758873,0.22677135,2.0,14.864,,,34560571.0,124435000.0,124863000.0,0.73660004,1735603200.0,1722556800.0,0.1,1722556800.0,10:1,1714608000.0,0.6508,1.0,1,1,3755.8788096,40976494592.0,484223008.0,3.891,614934016.0,4190268928.0,39.261,474800000.0,,,39.759,7.5655828,8.963336,9.779,86.303,1.593,0.114,1.904,219626000.0,0.32,,940.0,0.052410003,0.38909,0.11331,0.07854,,,"Bhagiradha Chemicals & Industries Limited manufactures and sells crop protection chemicals in India, Asia, Australia, and Europe. The company offers insecticides, such as chlorpyrifos, chlorpyrifos-methyl, diafenthiuron, fipronil, dinotefuran, thiamethoxam, imidacloprid, pymetrozine, and chlorantraniliprole; fungicides, including azoxystrobin and trifloxystrobin; herbicides comprising triclopyr, cloquintocet-mexyl, clodinafop-propargyl, sulfosulfuron, and pinoxaden; and specialty intermediates, such as 2,6-dichloroaniline and 2-ethylsulfonylimidazo pyridine-3-sulfonamide. Bhagiradha Chemicals & Industries Limited was incorporated in 1993 and is headquartered in Hyderabad, India.",0.565,none,249.0
337,337,RAILTEL,Railtel Corporation Of India Limited,EQ,26-FEB-2021,INE0DD101019,telecom-services,communication-services,Telecommunication,Other Telecom Services,412.75,407.95,402.0,421.65,412.75,407.95,402.0,421.65,4059204.0,4059204.0,2360660.0,2530479.0,2530479.0,301.4,617.8,403.1,434.5345,414.35,0.06708896,0.22677135,2.0,2.596,0.824,1.401,83282081.0,320937984.0,338555008.0,0.72844005,1735603200.0,1730851200.0,1.0,1730851200.0,,,0.3506,10.0,1,10,13298.065408,131005292544.0,2663600128.0,8.287,490200000.0,29026600960.0,90.44,4623300096.0,-1566024960.0,2597499904.0,58.745,7.0533667,4.5813375,4.513,28.336,0.066,0.408,0.066,2609799936.0,8.13,,50.96556,0.08991,0.17979,0.15928,0.10604,0.05415,0.14455,"RailTel Corporation of India Limited provides broadband telecom and multimedia networks and services in India and internationally. The company operates through Telecom Services and Project Work Services segments. It also offers E-office, HD video conferencing, data center, RailWire broadband, cyber security, leased line, virtual private network, tower colocation, voice carriage, rack, and space collocation, signalling, consultancy, and aadhaar based services. RailTel Corporation of India Limited provides project services, including station Wi-Fi, content on demand, railway display network, national optical fiber network, and national knowledge network services, hospital management information and video surveillance systems. The company serves government institutions, educational institutions, corporates, banks, private enterprises, NBFCs. RailTel Corporation of India Limited was incorporated in 2000 and is based in New Delhi, India.",0.387,none,134.0
341,341,OCCL,Oriental Carbon & Chemicals Limited,EQ,27-JAN-2016,INE321D01016,chemicals,basic-materials,Commodities,Commodity Chemicals,219.23,219.49,218.0,221.99,219.23,219.49,218.0,221.99,8270.0,8270.0,26488.0,22073.0,22073.0,193.15,930.0,238.2478,402.85745,219.78,-0.75936556,0.22677135,2.0,,,,4533903.0,9990090.0,10003700.0,0.53172,1735603200.0,1721692800.0,7.0,1721692800.0,,,0.3158,10.0,1,10,219.5621888,,,,,4632048128.0,463.687,1015908480.0,,,637.949,0.34451032,0.4740067,,,11.82,0.892,11.878,442324000.0,41.87,,5.2491045,0.08124,0.59682,0.21932,0.18991,,,"Oriental Carbon & Chemicals Limited, together with its subsidiaries, manufactures and sells insoluble sulphur and sulphuric acid in India and internationally. It operates through Chemicals, Investments, and General Engineering Products segments. The company offers its insoluble sulphur products under the Diamond Sulf brand. It also provides commercial and battery grade sulphuric acid, and oleum for use as a dehydrating agent, catalyst, and active reactant in chemical processes, solvents, and absorbents . Its sulphuric acid products are used for storage battery, rayon, dye, acid slurry, and pharmaceutical applications, as well as for the steel, heavy chemical, and super-phosphates manufacturing industries. In addition, the company manufactures and trades fluid power and automation products. It exports its products. Oriental Carbon & Chemicals Limited was incorporated in 1978 and is based in Noida, India.",0.537,underperform,511.0
342,342,PIIND,PI Industries Limited,EQ,15-JUN-2011,INE603J01030,agricultural-inputs,basic-materials,Commodities,Pesticides & Agrochemicals,3480.45,3482.3,3479.05,3565.65,3480.45,3482.3,3479.05,3565.65,187756.0,187756.0,288061.0,351895.0,351895.0,3220.0,4804.05,3969.318,4066.4353,3550.9,0.022038579,0.22677135,2.0,1.827,2.727,3.457,80917694.0,151700992.0,151700992.0,0.46411,1735603200.0,1724112000.0,9.0,1724112000.0,5:1,1365724800.0,0.1282,1.0,1,1,53867.5052544,501185085440.0,39075000320.0,257.655,1744000000.0,79284002816.0,522.748,21899999232.0,10864624640.0,21667999744.0,629.41,5.6416326,6.794246,6.321,22.885,0.058,0.049,0.058,17750999040.0,116.94,131.42,30.365143,0.22389,0.52654,0.27622,0.24691999,0.107700005,0.20255,"PI Industries Limited, an agrisciences company, engages in the manufacture and distribution of agrochemicals in India, rest of Asia, North America, Europe, and internationally. The company offers agrochemicals, including insecticides, herbicides, fungicides, and bio stimulants, as well as crop protection products that provides nutrition, as well as treats weeds insects, and diseases in rice, cotton, tomato, cole, chili, potato, onion, brinjal, grapes, pomegranate, and apple corps. It also provides research and development services, such as target discovery, molecule design, library synthesis, lead optimization, biological evaluation, and route synthesis. In addition, the company offers custom synthesis and manufacturing solutions comprising process research and development, analytical method development, synthesis of reference standards, structure elucidation and synthesis of impurities, physio-chemical studies and 5-batch analysis under GLP conditions, scale-up studies, safety data generation, waste categorization and treatability studies, process/plant engineering, and large-scale commercial production. It sells its products through distributors, dealers, and retailers. The company was formerly known as Mewar Oil & General Mills Ltd. PI Industries Limited was incorporated in 1946 and is based in Gurugram, India.",0.679,buy,50.0
353,353,IRCTC,Indian Railway Catering And Tourism Corporation Limited,EQ,14-OCT-2019,INE335Y01020,railroads,industrials,Consumer Discretionary,Tour Travel Related Services,763.2,764.0,759.1,781.9,763.2,764.0,759.1,781.9,1489423.0,1489423.0,1257321.0,1582490.0,1582490.0,743.75,1138.9,802.593,923.6312,779.2,-0.22423255,0.22677135,2.0,1.202,1.401,1.918,293863426.0,800000000.0,800211008.0,0.62397,1735603200.0,1731542400.0,4.0,1731542400.0,5:1,1635379200.0,0.4336,2.0,1,2,62336.0016384,599304962048.0,24205819904.0,30.271,423379008.0,44587507712.0,55.701,14750702592.0,6820101120.0,9480977408.0,44.06,17.684975,13.9805975,13.441,40.629,0.046,0.069,0.045,11997666304.0,14.96,20.56,52.085564,0.26908,0.38107,0.33083,0.33806,0.14653,0.37674,"Indian Railway Catering & Tourism Corporation Limited engages in the provision of catering and hospitality, Internet ticketing, travel and tourism, and packaged drinking water services in India. The company operates through four segments: Catering & Hospitality, Travel & Tourism, Internet Ticketing, and Packaged Drinking Water. It provides mobile catering services for Vande Bharat, Rajdhani, Shatabdi, Duronto, Gatiman, Tejas, and mail/express trains as well as engages in the side vending and e-catering activities; and operates and maintains food plazas, fast food units, food courts, refreshment rooms, mini stores, base kitchens, executive lounges, retiring rooms, Rail Yatri Niwas/BNR hotels, and non-railway catering units. The company also offers tourism products and services comprising domestic tour packages, inbound tourist targeted tours, mass tourism, outbound tour packages, and air ticket and corporate travel; and other tourism activities, such as event management, booking of charter trains and coaches, hill and heritage charters, saloon tours and charters, online reservation and accommodation facilities, and adventure tourism. In addition, it offers packaged drinking water under the Rail Neer name; and train ticket booking and travel insurance services, as well as operates irctctourism.com, a tourism portal. The company was incorporated in 1999 and is based in New Delhi, India.",0.41,hold,45.0
361,361,GICRE,General Insurance Corporation of India,EQ,25-OCT-2017,INE481Y01014,insurance-reinsurance,financial-services,Financial Services,General Insurance,430.4,429.55,427.0,444.25,430.4,429.55,427.0,444.25,1242304.0,1242304.0,2504751.0,2252320.0,2252320.0,307.5,525.5,419.151,388.69525,437.7,0.20881903,0.22677135,2.0,,0.238,0.483,308970150.0,1754400000.0,1755010048.0,0.82397,1735603200.0,1726012800.0,10.0,1726012800.0,2:1,1531353600.0,0.24110001,5.0,1,5,76816.7903232,377534152704.0,244162297856.0,139.107,,467975110656.0,266.749,76942450688.0,,,488.439,0.89612013,1.6414717,0.807,4.907,0.433,0.162,0.433,71088799744.0,41.49,35.11,10.54953,0.15191,0.17468001,0.16442,0.11445,0.02646,0.08677,"General Insurance Corporation of India provides reinsurance services in India and internationally. It offers property, energy, marine, engineering, liability, spares, health, agriculture/weather, motor and workmen compensation, aviation, life, marine hull, cargo and offshore energy, and miscellaneous products. General Insurance Corporation of India was incorporated in 1972 and is headquartered in Mumbai, India.",0.999,hold,38.0
363,363,UBL,United Breweries Limited,EQ,28-JUL-2008,INE686F01025,beverages-brewers,consumer-defensive,Fast Moving Consumer Goods,Breweries & Distilleries,1929.7,1932.0,1922.25,1960.0,1929.7,1932.0,1922.25,1960.0,117046.0,117046.0,207178.0,256365.0,256365.0,1647.25,2204.9,1969.347,1996.207,1951.3,0.046021223,0.22677135,2.0,2.991,0.926,1.592,68836779.0,264404992.0,264664992.0,0.72801,1735603200.0,1721865600.0,10.0,1721865600.0,10:1,1149811200.0,0.55990005,1.0,1,1,51644.0817664,515587145728.0,1538899968.0,5.822,1265299968.0,85496897536.0,323.302,7917899776.0,-4262262528.0,-1931399936.0,159.852,12.206916,6.0404625,6.03,65.117,0.232,0.12,0.232,4722599936.0,17.95,33.8,108.70752,0.05524,0.42016998,0.092609994,0.08035,0.0537,0.11479,"United Breweries Limited engages in manufacture, purchase, and sale of beer and non-alcoholic beverages in India and internationally. The company offers beer products under the Heineken, Heineken Silver, Kingfisher Premium, Kingfisher Strong, Kingfisher Ultra, Kingfisher Ultra Max, Kingfisher Ultra Witbier, Amstel Bier, Bullet, Bullet Super Strong, Cannon 10000, Zingaro, Kingfisher Storm, Kingfisher Blue, Kalyani Black Label, UB Export Large, UB Export Strong, London Pilsner, and London Pilsner Strong brands; and non-alcoholic products under the Kingfisher Premium Packaged Drinking Water, Kingfisher Strong Power Soda, Kingfisher Storm Strong Soda, Kingfisher Ultra Non-Alcoholic, and Heineken 0.0. It also licenses its brands; and offers contract manufacturing services. The company was founded in 1915 and is based in Bengaluru, India. United Breweries Limited operates as a subsidiary of Heineken N.V.",0.508,hold,52.0
364,364,LANCORHOL,Lancor Holdings Limited,EQ,12-MAR-2024,INE572G01025,real-estate-development,real-estate,Consumer Discretionary,Residential Commercial Projects,29.99,30.0,30.0,33.99,29.99,30.0,30.0,33.99,212098.0,212098.0,115474.0,106216.0,106216.0,28.96,57.0,37.1062,42.19735,30.95,-0.4204831,0.22677135,2.0,63.618,0.269,2.065,20753030.0,72995600.0,73725800.0,0.62821,1609372800.0,1725235200.0,0.2,1725235200.0,,,0.122700006,2.0,1,2,228.1813504,3454213120.0,81457000.0,1.111,1266678016.0,1678146048.0,25.161,352502016.0,-930526976.0,-602542976.0,27.159,1.1395854,1.3597229,2.058,9.799,0.677,0.618,1.014,109875000.0,1.63,,18.98773,0.06547,0.34794998,0.21004999,0.19600001,0.055570003,0.066139996,"Lancor Holdings Limited, together with its subsidiaries, develops residential and commercial properties in India. It is also involved in the leasing of commercial properties and allied activities; and provision of maintenance services. The company was formerly known as DBS Properties Limited. The company was incorporated in 1985 and is based in Chennai, India.",-0.109,none,506.0
371,371,TEMBO,Tembo Global Industries Limited,EQ,23-APR-2021,INE869Y01010,metal-fabrication,industrials,Industrials,Iron & Steel Products,799.15,781.0,759.2,805.0,799.15,781.0,759.2,805.0,57598.0,57598.0,65266.0,72415.0,72415.0,191.35,905.0,752.359,417.4083,772.3,1.708065,0.22677135,2.0,268.462,0.595,1.13,5587758.0,11103700.0,11688300.0,,1703980800.0,1727049600.0,1.0,1727049600.0,2:1,1614729600.0,0.175,10.0,1,10,857.5387136,10842262528.0,17887000.0,1.611,2283131904.0,5292828160.0,472.772,358241984.0,-1774737536.0,-1453683968.0,76.547,10.089227,1.62019,2.048,30.265,1.793,0.438,1.795,267542000.0,19.98,,38.653652,0.05055,0.14559,0.06768,0.08590999,0.08172,0.36692002,"Tembo Global Industries Limited manufactures and fabricates various engineering and steel products in India and internationally. It offers various products, including clevis, sprinkler, and pipe hangers; U bolts; clamps; cantilever arms; slotted channel; C channel; L angle; threaded rods; stud bolts; wedge and drop anchors; anchor bolts; nuts; washers; ceiling flange; beam clamp; brackets; channel washers; rail nut; end cap; hinge connector; beam clamps; attachments; inertia base; spring mounts; single and double arc floating flange expansion joints; open/close spring mount and anti-vibration pads; and surge restatiners, as well as various types of bathroom pipes, fittings, bathroom accessories, and sanitary wares. The company also manufactures and exports textile products, such as fibre & yarns; suitings; bedsheets & handkerchiefs; and shirting, uniform, and knitted fabrics, as well as trades in metal products. Its products have applications in pipe support systems, fasteners, anchors, HVAC, anti-vibration systems and equipment for industrial, commercial, utility and OEM installations. The company was formerly known as Saketh Exim Limited. Tembo Global Industries Limited was incorporated in 2010 and is headquartered in Navi Mumbai, India.",0.991,none,393.0
