427,427,IEX,Indian Energy Exchange Limited,EQ,23-OCT-2017,INE022Q01020,capital-markets,financial-services,Financial Services,Exchange and Data Platform,167.77,169.0,168.2,172.1,167.77,169.0,168.2,172.1,2620107.0,2620107.0,5365912.0,4313291.0,4313291.0,130.2,244.4,174.7788,179.45975,171.01,0.22281337,0.24450636,2.0,0.784,1.732,1.802,754962915.0,889238976.0,889345984.0,0.16605,1735603200.0,1717113600.0,1.5,1717113600.0,3:1,1638489600.0,0.5669,1.0,1,1,15206.875136,138253942784.0,10790744064.0,12.153,81839000.0,6127452160.0,6.877,5200758784.0,2253575936.0,2008493952.0,11.763,14.537958,24.817616,22.563,26.583,0.258,0.262,0.253,3932567040.0,4.41,4.45,38.77778,0.64179003,0.99815005,0.84876,0.85198,0.19233,0.41028,"Indian Energy Exchange Limited provides automated trading platform for physical delivery of electricity, renewable energy, and certificates. The company's platform offers customers with digital registration, market data insights, financial reconciliation, user access management, and web-based bidding services. Its products include Day-Ahead Market, a physical electricity trading market for deliveries for any/some/all 15 minute time blocks in 24 hours of next day starting from midnight; Term-Ahead-Market that provides a range of products allowing participants to buy/sell electricity on intra-day, day-ahead contingency, and term ahead contracts; Real-Time Market, an auction session every half an hour with power to be delivered after 4 time blocks or an hour after gate closure of the auction; Green Day-Ahead Market that allows anonymous and double-sided closed collective auction in renewable energy on a day-ahead basis; and Cross-Border Electricity Trade building an integrated South Asian Power Market; The Green-Term Ahead Market, a market solution for renewable energy trading which features contracts, including Green-Intraday, Green-Day-ahead Contingency, Green-Daily, and Green-Weekly. Indian Energy Exchange Limited was incorporated in 2007 and is based in Noida, India.",0.635,buy,104.0
428,428,CALSOFT,California Software Company Limited,BE,28-JUN-2000,INE526B01014,software-application,technology,Information Technology,Computers - Software & Consulting,13.88,14.57,14.57,14.57,13.88,14.57,14.57,14.57,18043.0,18043.0,78735.0,366728.0,366728.0,9.755636,28.02,16.963459,18.112616,14.57,-0.2656085,0.24450636,2.0,74.178,1.905,1.905,8751599.0,26437200.0,15605000.0,0.42363,1735603200.0,1283990400.0,2.0,1283990400.0,,,,10.0,1,10,38.5189984,306544160.0,374000.0,0.024,92375000.0,44089000.0,2.852,15791000.0,-19391624.0,-19400000.0,8.057,1.8083653,8.736646,6.953,19.413,0.863,0.036,0.863,6240000.0,0.23,,63.347824,0.14152999,0.5437,0.35816002,0.09658,0.023559999,0.0514,"California Software Company Limited provides integrated software and information services. It offers dSPEEDUp, an ecommerce platform that creates web applications and online stores for businesses; dINSPIRA PoS, a point-of-sale system for small retail businesses; and dULTIMA, a blockchain enabled omnichannel platform that provides an optimized and seamless consumer experience. The company also provides digital marketing services, such as influencer and content marketing, branding, SEO, social media, and email marketing; life science services; blockchain development services and cryptocurrency solutions development; NFT services; software development; and UX design optimization, mobile UI and UX design, and UI and UX design-web solutions. In addition, it develops hyper-casual games, multi-player RPGs, and VR games for mobile, PC, and online platforms. California Software Company Limited was incorporated in 1992 and is based in Chennai, India.",0.673,none,591.0
435,435,DMART,Avenue Supermarts Limited,EQ,21-MAR-2017,INE192R01011,discount-stores,consumer-defensive,Consumer Discretionary,Diversified Retail,3568.45,3570.0,3570.0,3643.3,3568.45,3570.0,3570.0,3643.3,395174.0,395174.0,862555.0,1833504.0,1833504.0,3399.0,5484.85,3690.259,4499.57,3600.95,-0.048121452,0.24450636,2.0,3.54,0.217,2.99,143754615.0,650732992.0,651209984.0,0.77849,1735603200.0,,,,,,,10.0,1,10,234325.6981504,2401012547584.0,3915399936.0,6.019,7129099776.0,548126588928.0,842.445,41899900928.0,-12978674688.0,28737699840.0,287.335,12.532236,4.2750287,4.38,57.304,0.056,0.144,0.058,26872600576.0,41.75,52.27,86.2503,0.04903,0.14639,0.07644,0.061339997,0.10529,0.14303,"Avenue Supermarts Limited engages in the business of organized retail and operating supermarkets under the D-Mart brand name in India. The company offers food products, such as groceries, staples, processed food products, dairy, frozen products, beverages and confectionery products, and fruits and vegetables; non-food products, including home care and personal care products, toiletries, and other over the counter products; and general merchandise and apparel products comprising bed and bath products, toys and games, crockery, plastic goods, garments, footwear, utensils, and home appliances. It is also involved in the online and multi-channel retail of grocery and household products under the DMart Ready brand name. The company was incorporated in 2000 and is based in Mumbai, India.",0.263,hold,6.0
438,438,SHILPAMED,Shilpa Medicare Limited,EQ,03-DEC-2009,INE790G01031,drug-manufacturers-specialty-generic,healthcare,Healthcare,Pharmaceuticals,776.25,777.95,776.15,805.65,776.25,777.95,776.15,805.65,164538.0,164538.0,382636.0,285396.0,285396.0,316.1,959.5,838.92,711.2245,793.7,1.3526292,0.24450636,2.0,52.078,,,34169940.0,97790896.0,97866496.0,0.58411,1735603200.0,1663545600.0,1.1,1663545600.0,2:1,1446768000.0,,1.0,1,1,7767.6642304,93089890304.0,304355008.0,3.16,9373886464.0,11839389696.0,131.733,2737970688.0,,,208.37,3.8090897,6.5608654,7.863,34.0,9.429,0.124,10.926,447572000.0,6.68,,118.81737,0.0378,0.65185,0.23126,0.15894,,,"Shilpa Medicare Limited, together with its subsidiaries, manufactures and sells active pharmaceutical ingredients (APIs), finished dosage formulations, biosimilars, recombinant albumin in India, the United States, Europe, and internationally. The company offers various oncology and non-oncology APIs, such as anastrozole, acebrophylline, ambroxol hydrochloride, axitinib, azacitidine, abiraterone acetate, bendamustine HCL monohydrate, bicalutamide, bortezomib, busulphan, cabazitaxel amorphous, capecitabine, clofarabine, cyclophosphamide, dasatinib, decitabine, dimethyl fumarate, erlotinib HCL, enzalutamide, fingolimod hydrochloride, gemcitabine HCl, ibrutinib, imatinib mesylate, irinotecan HCl trihydrate, lenalidomide, lenvatinib mesylate, letrozole, and melphalan HCL. Its APIs also include nifedipine, oxaliplatin, pazopanib, pemetrexed disodium hemipentahydrate, pemetrexed dipotassium nonahydrate, pirfenidone, pomalidomide, sodium cholesteryl sulfate, sorafenib tosylate, sunitinib malate, temozolomide, teriflunomide, thalidomide, tranexamic and zoledronic acid, phenylephrine, citicholine, palbocicilib, nilotinib, nintedanib, praziquintol, carmustine, elthrombopag olamine, abacavir sulphate, tenofovir disproxyl fumarate API, tenofovir alfanamide, prucalopride succinate, and varenicline tartrate. In addition, the company provides intermediates; high-purity multi-cyclic and long-chain peptides; specialty and biopolymers; biologics; contract development and manufacturing services; and formulations, such as tablets, capsules, liquid injections, dry powder injectable products, orally disintegrating films, transdermal patches, and lyophilized injectables. Further, it is involved in the manufacture of specialized oncology formulations; and wind power generation activities. The company was formerly known as Shilpa Antibiotics Ltd and changed its name to Shilpa Medicare Limited in February 2003. Shilpa Medicare Limited was incorporated in 1987 and is based in Raichur, India.",0.648,none,168.0
439,439,MINDTECK,Mindteck (India) Limited,EQ,02-AUG-2016,INE110B01017,information-technology-services,technology,Information Technology,Computers - Software & Consulting,253.6,259.0,257.5,266.25,253.6,259.0,257.5,266.25,9275.0,9275.0,50078.0,46888.0,46888.0,134.68,368.0,283.629,276.03616,266.25,0.3007797,0.24450636,2.0,1.0,,,8183284.0,31848100.0,31998800.0,0.76515996,1735603200.0,1722556800.0,0.8,1722556800.0,5:4,1726790400.0,0.0933,10.0,1,10,851.9680512,7442572800.0,1248300032.0,39.751,22100000.0,4002700032.0,128.125,310675008.0,,,70.347,3.7848096,2.1284833,1.859,23.956,0.016,0.158,0.024,274600000.0,8.57,,31.067678,0.0686,0.17083,0.07762,0.07277,,,"Mindteck (India) Limited provides engineering and information technology (IT) services in the United States, India, and internationally. The company offers product development, software applications, cybersecurity, Internet of Things solution deployment and commissioning, and IoT enablement consulting services; embedded design, verification and validation services, and system solutions; and product lifecycle management consulting, advisory, system implementation, administration, system validation/testing, program management, and system integration/data migration services. It also provides smart mobility solutions and cloud computing; advanced analytics, analytics on unstructured data, business intelligence, information/data management, and big data services; and IT security and protection services. In addition, it offers system and integration, specialized, software product, and cloud based testing services; test strategy, automation, and infrastructure services; product engineering, re-engineering, and sustenance services; data center transformation and IT infrastructure management services; custom application development, application maintenance and management, legacy modernization, and performance engineering and enhancement services; application and enterprise systems integration, business process management, packaged application, SAP solutions, and service oriented architecture services; and smart city solutions. Further, the company provides IT talent services. It serves medical device and healthcare, life science and analytical instrument, semiconductor, and data storage industries; and government. The company was formerly known as Hinditron Informatics Limited and changed its name to Mindteck (India) Limited in September 1999. The company was incorporated in 1991 and is based in Bengaluru, India. Mindteck (India) Limited is a subsidiary of Embtech Holdings Limited.",0.897,none,399.0
468,468,QUESS,Quess Corp Limited,EQ,12-JUL-2016,INE615P01015,staffing-employment-services,industrials,Services,Diversified Commercial Services,638.75,641.55,641.55,662.0,638.75,641.55,641.55,662.0,229586.0,229586.0,655214.0,770331.0,770331.0,459.5,875.0,673.432,679.1085,647.0,0.25986195,0.24450636,2.0,22.371,1.37,1.442,55352278.0,148687008.0,153792992.0,0.62624,1735603200.0,1725580800.0,6.0,1725580800.0,,,0.42189997,10.0,1,10,9620.0491008,98672648192.0,5867180032.0,39.056,6904189952.0,199340572672.0,1342.694,6095889920.0,3836740096.0,6412319744.0,194.267,3.330468,0.48259363,0.495,16.187,0.266,0.091,0.285,3543160064.0,23.7,27.57,27.299578,0.01777,0.09733,0.030580001,0.024300002,0.04912,0.12323,"Quess Corp Limited operates as a business services provider in India, South East Asia, the Middle East, and North America. The company operates through Workforce Management, Operating Asset Management, Global Technology Solutions, and Product Led Business segments. The Workforce Management segment provides staffing services, IT staffing, HR services, expert talent acquisition, search and recruitment outsourcing, payroll compliance, background verification, training and skill development, and logistic services. The Operating Asset Management segment offers services, such as janitorial, security, electro-mechanical, pest control, food and hospitality, industrial operations and maintenance services, facility management, ERP, cellular, as well as related asset record maintenance services. The Global Technology Solutions segment provides customer lifecycle management, non voice, BPO and CLM solutions, and IT services, digital transformation, HR outsourcing and consulting, and after-sales services. The Product Led Business segment is involved in the provision of break fix services; and digital technology platforms and workforce management tools for workforce hiring, management, engagement, and non-compensation benefits. Quess Corp Limited was formerly known as Ikya Human Capital Solutions Limited and changed its name to Quess Corp Limited in January 2015. The company was incorporated in 2007 and is headquartered in Bengaluru, India.",0.746,strong_buy,135.0
470,470,INDBANK,Indbank Merchant Banking Services Limited,EQ,08-OCT-2008,INE841B01017,capital-markets,financial-services,Financial Services,Stockbroking & Allied,41.71,42.76,41.65,42.76,41.71,42.76,41.65,42.76,138406.0,138406.0,117775.0,90918.0,90918.0,37.51,60.65,45.1894,47.70135,42.03,-0.0021530986,0.24450636,2.0,,2.222,2.441,14272486.0,44378200.0,46038000.0,0.67234004,1735603200.0,1249603200.0,0.75,1249603200.0,,,,10.0,1,10,186.6110976,1025072576.0,849294976.0,19.044,,292308000.0,6.587,,,28506000.0,20.059,2.0953188,6.384057,3.507,,0.345,0.348,0.362,102511000.0,2.31,,18.194805,0.38354,0.93012,,0.53965,0.086840004,0.122159995,"Indbank Merchant Banking Services Limited engages in the provision of merchant banking, stock broking, depository participant, and allied services in India. It offers merchant banking services for public issues, rights issues, private placement, acquisition of shares and takeovers, and employee stock option schemes/stock purchase scheme by corporates. The company also provides advisory services for valuation of shares and other financial instruments, syndication of loans, acquisitions, and mergers and amalgamations, as well as for project counseling, appraisal, and feasibility studies. In addition, it offers stock broking services in the cash, derivatives, and wholesale debt market segments for retail and institutional investors, as well as in cash management; online trading services; and e-services; as well as distributes mutual funds and other investment products. The company was incorporated in 1989 and is based in Chennai, India. Indbank Merchant Banking Services Limited operates as a subsidiary of Indian Bank.",0.353,none,523.0
475,475,VGUARD,V-Guard Industries Limited,EQ,13-MAR-2008,INE951I01027,electrical-equipment-parts,industrials,Consumer Discretionary,Household Appliances,392.95,394.85,390.5,397.8,392.95,394.85,390.5,397.8,250169.0,250169.0,339954.0,326852.0,326852.0,285.8,577.45,422.538,423.9755,392.1,0.34295964,0.24450636,2.0,13.236,0.567,1.569,144043938.0,435376000.0,452849984.0,0.57318,1735603200.0,1721865600.0,1.4,1721865600.0,7:5,1489536000.0,0.2068,1.0,1,1,17071.0925312,172830998528.0,1511699968.0,3.458,2555800064.0,52792500224.0,120.696,4726099968.0,2153062400.0,3948400128.0,44.169,8.877267,3.233621,3.274,36.569,0.075,0.141,0.075,2967699968.0,6.76,6.0,58.002956,0.056209996,0.3427,0.08952,0.068119995,0.08359,0.16426,"V-Guard Industries Limited manufactures and sells electrical and electronic products in India and internationally. It operates through three segments: Electronics, Electrical, and Consumer Durables. The Electronics segment offers voltage stabilizers; inverter, DUPS, inverter batteries, and UPS; and solar panels, solar batteries, off grid systems and inverters, and on grid photovoltaic (PV) inverters. The Electrical segment offers wiring and industrial cables, domestic switch gears and distribution boards, domestic and agriculture pumps, and modular switches. The Consumer Durables Segment includes storage, solar, instant, and gas water heaters, as well as immersion heater, rods and room heaters; heat pump water heaters; ceiling, table, pedestal, wall, and ventilating and exhaust fans; and kitchen appliances, such as mixer grinders, induction cooktops, gas stoves, rice cookers, grill kings, toasters, kettles, chimneys, sandwich makers, and hand blenders. In addition, the company provides air coolers, electric motors, and water purifiers. The company sells its products through a network of distributors, dealers, and service centers. V-Guard Industries Limited was founded in 1977 and is based in Kochi, India.",0.311,buy,93.0
476,476,MARINE,Marine Electricals (India) Limited,EQ,02-DEC-2020,INE01JE01028,marine-shipping,industrials,Industrials,Industrial Products,238.1,244.95,233.9,249.0,238.1,244.95,233.9,249.0,153511.0,153511.0,622167.0,210985.0,210985.0,84.75,333.0,260.2598,207.75755,244.15,1.5726633,0.24450636,2.0,37.979,,,33501846.0,132665000.0,132665000.0,,,1726790400.0,0.2,1726790400.0,5:1,1613606400.0,,2.0,1,2,3239.0158336,30357522432.0,231910000.0,1.756,970366016.0,6595092992.0,51.011,551183232.0,,,19.195,12.719458,4.911251,4.603,55.077,0.929,0.37,0.993,294528000.0,2.86,,85.367134,0.044660002,0.24232,0.08357,0.072119996,,,"Marine Electricals (India) Limited manufactures and sells various marine and industrial electrical and electronic components in India and internationally. The company operates in two segments, Electricals and Electronics; and Solar. It offers power generation and distribution, navigation and communication, electrical propulsion, integrated platform management, information technology, and engineering and project management services, as well as turnkey electrical installations for the marine sector. The company also provides repair, corrective and preventive maintenance, upgrade, and life extension and parts on electrical power generation, power distribution, automation and power management systems, navigation and communication systems, and other electrical and electronic systems, as well as designing and fabricating services for electrical and electronic installation. In addition, it undertakes annual maintenance contracts and solar projects. The company was founded in 1978 and is headquartered in Mumbai, India. Marine Electricals (India) Limited is a subsidiary of KDU Enterprises Private Limited.",0.575,none,258.0
480,480,UNIVASTU,Univastu India Limited,BE,22-JUN-2020,INE562X01013,engineering-construction,industrials,Industrials,Civil Construction,330.35,329.0,314.0,338.0,330.35,329.0,314.0,338.0,79041.0,79041.0,84208.0,163698.0,163698.0,106.7,345.35,254.7042,211.7977,316.45,1.8601732,0.24450636,2.0,62.209,,,2755802.0,11364600.0,11364600.0,,1735603200.0,,,,2:1,1576713600.0,,10.0,1,10,359.6327936,2891725056.0,99702000.0,8.773,335865984.0,1301251968.0,114.5,217630256.0,,,45.737,6.918906,2.7637446,2.222,13.287,0.915,0.048,0.915,80199000.0,8.26,,38.31114,0.06163,0.3068,0.16725,0.14129,,,"Univastu India Limited provides works contract services in India. It offers integrated engineering, procurement, and construction services for civil, structural, and infrastructure projects. The company handles various projects for metro stations, sports complexes, hospitals, commercial buildings, cold storages, educational institutions, mass housing, water supply, drainage, roads, and bridges, as well as multipurpose halls, industrial structures, minor irrigation, and other projects. It also trades in construction materials, including steel, cement, and electrical products; and offers construction contractors, project contractors, project executors, contractors, traders, dealers, distributors, agents, designers, supervisors, consultants, advisors, surveyors, and administrators of all types of heating, ventilation, and air conditioning products. The company serves governmental and private sectors. Univastu India Limited was incorporated in 2009 and is based in Pune, India.",0.303,none,486.0
484,484,ISGEC,Isgec Heavy Engineering Limited,EQ,05-MAY-2021,INE858B01029,specialty-industrial-machinery,industrials,Industrials,Civil Construction,1225.65,1235.9,1219.3,1265.0,1225.65,1235.9,1219.3,1265.0,78043.0,78043.0,83164.0,98041.0,98041.0,810.0,1675.55,1415.672,1309.0472,1231.5,0.26160574,0.24450636,2.0,31.189,,,27084595.0,73529504.0,73619504.0,0.63166,1735603200.0,1724198400.0,4.0,1724198400.0,,,0.0853,1.0,1,1,9055.158272,99254493184.0,1757372032.0,23.9,8143901184.0,63732572160.0,866.725,5284731904.0,,,342.068,3.6001616,1.4208055,1.557,18.781,0.292,0.111,0.292,2584624128.0,39.59,,31.10634,0.040549997,0.30027,0.08292,0.06425,,,"Isgec Heavy Engineering Limited provides engineering solutions worldwide. It operates through two segments: Manufacturing of Machinery & Equipment; and Engineering, Procurement & Construction. The company provides process plant equipment, including reactors, high pressure vessels, shell and tube heat exchangers, columns and towers, and high pressure boiler drums; boilers, such as solid and biomass fuels, bagasse and biomass, oil and gas fired, blast furnace gas fired, waste to energy, and heat recovery boilers, as well as auxiliaries, such as air pollution control equipment, bag filters, SCR/SNCR, flue gas desulphurization systems, and deaerators; and field services comprising site construction and commissioning, operation and maintenance, supervision, retrofitting and modernization, residual life assessment studies, spares, and technical assistance. It offers engineering, procurement, and construction services; sugar plants and machinery that include mills, diffusers, process house equipment, sugar refinery, turnkey distillery plants, and spares and retrofits; presses comprising mechanical and hydraulic straight sided presses, mechanical gap and ring frame presses, and servo presses; and steel castings, including steam/gas turbine, hydro turbine, valve, pump, mining and crushing, and general engineering castings. In addition, the company offers iron castings, air pollution control equipment, and liquefied gas containers, as well as provides contract manufacturing services. Further, it manufactures and sells sugar and its by-products, and ethanol and its by-products. It serves power, fertilizer, sugar and distillery, oil and gas, petrochemicals, automobile, steel, defense, cement, chemicals industries, etc. The company was formerly known as The Saraswati Industrial Syndicate Limited and changed its name to Isgec Heavy Engineering Limited in 2011. The company was incorporated in 1933 and is headquartered in Noida, India.",0.554,strong_buy,140.0
485,485,IIFLSEC,IIFL Securities Limited,EQ,20-SEP-2019,INE489L01022,other_industry,other_sector,Financial Services,Stockbroking & Allied,331.75,326.35,321.1,335.85,331.75,326.35,321.1,335.85,380154.0,380154.0,394473.0,350344.0,350344.0,264.05,386.7,334.3189,334.3189,331.75,-0.16927946,0.24450636,2.0,47.391,19.373,19.438,114675745.0,309662016.0,321843008.0,0.62092,1735603200.0,,,,,,,2.0,1,2,10677.141504,44620763136.0,50648928256.0,164.748,10530553856.0,24795039744.0,80.656,,,4213044992.0,72.193,4.5953207,4.3061604,1.8,,0.823,0.303,0.903,7170855936.0,22.56,9.06,14.705231,0.28921,0.79115,,0.40183997,0.08625,0.38261002,"IIFL Capital Services Limited provides capital market services in the primary and secondary markets in India. The company offers equity, commodities, and currency broking; depository participant services, mutual funds, bonds; broking, corporate access, and research support services; investment and trading across asset classes, including equity, commodity, derivatives, currency, margin trading funding. It also provides investment banking services consisting of initial public offerings, qualified institutional placement, right issues, preferential placement, follow-on public offer, share buybacks, tender offers, and delisting services; and advisory services for private equity placements, and mergers and acquisitions. In addition, the company distributes third-party financial products, such as mutual funds, insurance, portfolio management services, alternate investment funds, fixed income, and healthcare products. Further, it provides in-depth insight for asset allocation, market dynamics, wealth management, and investment strategies; and operates a mobile trading application under the IIFL Markets brand name. It serves retail, mass affluent, wealth investors, domestic and foreign institutional investors, sovereign wealth funds, international portfolio investors, mutual funds, insurance companies, banks, pension funds, non-resident individuals, high net worth individuals, alternate investment funds, and corporates. The company was formerly known as IIFL Securities Limited and changed its name to IIFL Capital Services Limited in November 2024. IIFL Capital Services Limited was incorporated in 1996 and is based in Mumbai, India.",0.936,none,124.0
