1405,1405,EIMCOELECO,Eimco Elecon (India) Limited,EQ,17-APR-1996,INE158B01016,other_industry,other_sector,Industrials,Industrial Products,3113.35,3111.95,3050.0,3194.0,3113.35,3111.95,3050.0,3194.0,4870.0,4870.0,10372.0,10634.0,10634.0,816.0,3499.0,2877.448,2016.566,3103.55,,,2.0,0.106,,,1339823.0,5768380.0,,0.74658996,1735603200.0,1718323200.0,,,,,0.0612,10.0,1,10,1790.2456832,17817823232.0,145262000.0,25.182,4084000.0,2534405888.0,439.332,527092736.0,,,669.461,4.635894,7.063769,7.03,33.804,1.756,0.592,1.756,471083008.0,81.57,,38.04769,0.18587999,0.46745998,0.20797001,0.19047001,,,"Eimco Elecon (India) Limited engages in the manufacture and sale of equipment for mining and construction sectors in India. Its products include air motor, chair lift man riding, coal hauler, drill machine, load haul dumper, low profile dump truck, piling rig, rocker shovel loader, side dump loader, and wheel loader, as well as continuous miner package. The company also exports its products. Eimco Elecon (India) Limited was incorporated in 1974 and is headquartered in Vallabh Vidyanagar, India.",0.557,buy,1097.0
1406,1406,BSL,BSL Limited,EQ,27-JUL-1995,INE594B01012,other_industry,other_sector,Consumer Discretionary,Other Textile Products,215.88,217.01,216.0,225.61,215.88,217.01,216.0,225.61,25718.0,25718.0,61576.0,37105.0,37105.0,159.0,257.77,211.979,195.8627,218.25,,,2.0,388.009,,,3319739.0,10292200.0,,0.67671996,1735603200.0,1722297600.0,,,,,0.1371,10.0,1,10,224.6272768,6610019840.0,1578000.0,0.153,4372228096.0,6697497088.0,650.48,672756480.0,,,109.485,1.9934237,0.33538988,0.987,9.825,0.014,0.021,0.015,112672000.0,10.95,1.04,19.931507,0.01682,0.43773997,0.10045,0.06617,,,"BSL Limited, a textile company, manufactures and sells various yarns and fabrics in India and internationally. The company offers polyester viscose, worsted, poly wool, vortex, and cotton yarns; and polyester viscose, worsted, and fashion fabrics. It also provides suits for men; pure wool and wool cashmere fabrics; and furnishings, such as curtains, upholsteries, madeups, and silk fabrics. The company offers its products under the Geoffrey Hammonds, Geoffrey Hammonds Insignia, Unicare, and Basilio brand names. It also exports its products. BSL Limited was incorporated in 1970 and is headquartered in Kolkata, India.",0.612,none,1671.0
1414,1414,NITINSPIN,Nitin Spinners Limited,EQ,02-FEB-2006,INE229H01012,other_industry,other_sector,Consumer Discretionary,Other Textile Products,427.1,426.4,420.05,430.9,427.1,426.4,420.05,430.9,77115.0,77115.0,327576.0,164337.0,164337.0,260.5,474.0,408.562,361.11774,422.75,,,2.0,116.817,,,32206137.0,56220000.0,,0.57576,1735603200.0,1725840000.0,,,,,0.0971,10.0,1,10,2376.7005184,37403168768.0,4054000.0,0.072,13391086592.0,30915008512.0,549.792,4140932096.0,,,203.961,2.0727003,0.76878536,1.21,9.033,0.457,0.301,0.457,1447363968.0,25.75,,16.417477,0.04682,0.26308,0.13395001,0.10223,,,"Nitin Spinners Limited manufactures and sells cotton and blended yarns, and knitted and woven fabrics in India and internationally. The company offers yarns, including cotton ring spun carded, cotton ring spun, cotton compact ring spun combed, cotton compact ring spun carded, poly/cotton blended ring spun, multifold ring spun, fancy and core slub, compact fancy slub, compact core spun, S and Z twist, organic, BCI/TBC certified, supima and giza certified, contamination free, zero and eli twist, poly/cotton blended open end yarns, and yarns made out of recycled fibers. It also provides knitted fabrics, such as single jersey, lycra blended fabrics, pique structures, interlock structures, rib structures, and 3 T fleece fabrics; and finished and printed fabrics. The company products are used for in woven and knitted apparel, furnishing fabrics, denims, terry towel, medical fabrics, tea bags, uniform, heath care apparel, hotel apparel, as well as inner, comfort, sports, baby, winter, fashion and image, industrial and protective, and defence wear applications. The company was incorporated in 1992 and is headquartered in Bhilwara, India.",0.562,buy,991.0
1421,1421,NAGREEKCAP,Nagreeka Capital & Infrastructure Limited,EQ,18-SEP-2007,INE245I01016,other_industry,other_sector,Financial Services,Investment Company,25.03,24.52,24.52,24.52,25.03,24.52,24.52,24.52,5218.0,5218.0,10593.0,2153.0,2153.0,14.1,31.51,27.0602,21.00805,24.52,,,2.0,3724.631,,,3852186.0,12615300.0,,0.71067,1735603200.0,,,,,,,5.0,1,5,30.9327168,1241582976.0,29906000.0,2.369,955553984.0,714275008.0,56.655,370971008.0,,,2.034,12.055064,0.43306452,1.738,3.347,2.264,0.631,2.251,163636000.0,12.97,,1.8905165,0.22909,0.52939,0.51937,0.32799,,,"Nagreeka Capital & Infrastructure Ltd. is a publicly owned investment manager. The firm invests in equity markets, private equity, mutual funds, real estate, and renewable energy. The firm was founded Nagreeka Securities Ltd. and changed its name to Nagreeka Software Technologies Limited in September 2001. Nagreeka Software Technologies Limited further changed its name to Nagreeka Capital & Infrastructure Ltd. in July 2006. Nagreeka Capital & Infrastructure Ltd. was founded in 1953 is based in Mumbai, India with an additional office in Kolkata, India. Nagreeka Capital & Infrastructure Ltd. operates independently of Nagreeka Exports Ltd. as of September 18, 2007.",-0.488,none,1936.0
1430,1430,HFCL,HFCL Limited,EQ,09-MAR-2011,INE548A01028,other_industry,other_sector,Telecommunication,Telecom - Infrastructure,153.35,154.4,152.67,160.3,153.35,154.4,152.67,160.3,55010608.0,55010608.0,47380296.0,39672856.0,39672856.0,61.5,160.3,130.841,104.62905,157.59,,,2.0,24.782,,,1039874454.0,1492800000.0,,0.43901002,1703980800.0,1727049600.0,,,,,0.0766,1.0,1,1,23525.0352128,234728882176.0,3415399936.0,2.363,9912200192.0,46280998912.0,32.377,6084049920.0,,,27.314,5.769569,5.083087,5.072,38.581,0.571,0.164,0.635,3730200064.0,2.61,4.5,60.37931,0.0806,0.2757,0.13146,0.1302,,,"HFCL Limited manufactures and sells telecom products in India and internationally. It operates in Telecom Products; and Turnkey Contracts and Services segments. The company offers optical fiber cables, such as underground, aerial, microduct, FTTH, and micromodule cables; telecom products and solutions, which includes unlicensed band backhaul radios, Wi-Fi access points, routers, managed switches, antennas, network management solutions, and 5g product portfolio; defence product portfolio comprising electronic fuzes, electro optics, high capacity radio relay, software defined radios, and ground surveillance radars; and passive networking components includes high density cabinets, joint closures, optical splitters, aerial cable accessories, fiber optic cable assemblies, and copper cable assemblies. It provides network solutions for public telecommunications, defence and railway communications, and system integration services. The company has a collaboration agreement with Qualcomm Technologies, Inc. for developing 5G RAN and access products. The company was formerly known as Himachal Futuristic Communications Limited and changed its name to HFCL Limited in October 2019. HFCL Limited was incorporated in 1987 and is based in New Delhi, India.",0.953,buy,312.0
1441,1441,MAHSCOOTER,Maharashtra Scooters Limited,EQ,08-FEB-1995,INE288A01013,other_industry,other_sector,Financial Services,Investment Company,9909.8,9939.55,9761.0,9980.35,9909.8,9939.55,9761.0,9980.35,9245.0,9245.0,9894.0,9550.0,9550.0,6732.1,10180.0,9277.599,8049.2524,9914.25,,,2.0,,,,5082513.0,11428600.0,,0.60525,1735603200.0,1719532800.0,,,,,0.9382,10.0,1,10,11332.186112,113247322112.0,7500000.0,0.656,,2268499968.0,200.812,2058625024.0,,,23639.646,0.4193908,49.954536,49.922,55.011,16.143,0.629,16.208,2070899968.0,181.35,,54.669147,0.91289,0.96751,0.90748,0.26954,,,"Maharashtra Scooters Ltd. manufactures and sells pressure die casting dies, jigs, and fixtures, and die casting components primarily for the two and three-wheeler industry in India. The company operates through Manufacturing and Investments segments. It is also involved in treasury operations, as well as manages surplus funds invested by the company. Maharashtra Scooters Ltd. was incorporated in 1975 and is based in Pune, India. The company operates as a subsidiary of Bajaj Holdings and Investment Ltd.",0.618,none,485.0
1442,1442,COLPAL,Colgate Palmolive (India) Limited,EQ,17-DEC-2007,INE259A01022,other_industry,other_sector,Fast Moving Consumer Goods,Personal Care,3671.4,3674.0,3645.7,3677.35,3671.4,3674.0,3645.7,3677.35,572579.0,572579.0,450380.0,420046.0,420046.0,1929.05,3694.9,3275.668,2782.6208,3659.1,,,2.0,3.828,,,132160539.0,271985984.0,,0.51405,1735603200.0,1716336000.0,,,2:1,1442966400.0,0.9233,1.0,1,1,99619.733504,990395629568.0,8889933824.0,32.685,717492992.0,58534682624.0,215.215,19762382848.0,,,68.914,53.096615,17.018925,16.92,50.115,0.33,0.131,0.33,14139595776.0,52.13,61.86,70.191826,0.24156,0.69348997,0.33762002,0.31190002,,,"Colgate-Palmolive (India) Limited manufactures and trades in personal and oral care products in India. The company offers toothpastes, toothpowder, toothbrushes, mouth wash, rinses, hand washes, and shower gels under the Colgate brand name. It also offers soaps, cosmetics, and toilet preparations. The company exports its products. Colgate-Palmolive (India) Limited was incorporated in 1937 and is headquartered in Mumbai, India.",0.323,hold,104.0
1445,1445,KOPRAN,Kopran Limited,EQ,09-JUN-1999,INE082A01010,other_industry,other_sector,Healthcare,Pharmaceuticals,314.05,316.0,315.2,344.95,314.05,316.0,315.2,344.95,4660810.0,4660810.0,770082.0,1252540.0,1252540.0,185.45,344.95,269.6922,258.99966,341.85,,,2.0,20.199,,,23933742.0,48210600.0,,0.49370998,1451520000.0,1725235200.0,,,,,0.2441,10.0,1,10,1649.655296,16000347136.0,141983008.0,2.943,992284992.0,6370265088.0,131.846,858811008.0,,,101.836,3.356868,2.589618,2.512,18.631,2.966,0.192,3.001,592785984.0,12.28,5.67,27.83795,0.093059994,0.36025003,0.13482,0.10248,,,"Kopran Limited, an integrated pharmaceutical company, engages in the manufacture and marketing of active pharmaceutical ingredients and finished dosage forms in India and internationally. The company offers its products in various dosage forms, including tablets, capsules, syrups, dry powder, suspension, and injectables, as well as branded and generic formulations. It also provides drugs in the categories of macrolide, antibacterial, anticonvulsant, anti-hypertensive, anti-helmentics, anti-acne, anti-infective, anti-thrombotic, antidiabetic, pain management, neuromodular, gastroenterology, and cardiovascular. In addition, the company provides drugs for erectile dysfunction, antiallergics, respiratory, oncology, central nervous system, antiprotozoal, anthelmintics, antipeptic ulcer and gut, and others. Kopran Limited was incorporated in 1958 and is based in Mumbai, India.",0.513,none,1124.0
1446,1446,PERSISTENT,Persistent Systems Limited,EQ,06-APR-2010,INE262H01021,other_industry,other_sector,Information Technology,Computers - Software & Consulting,5249.75,5289.0,5230.2,5289.0,5249.75,5289.0,5230.2,5289.0,219156.0,219156.0,596948.0,567180.0,567180.0,2788.4,5322.65,4769.33,4057.44,5264.65,,,2.0,8.895,1.556,1.906,98457175.0,152328000.0,,0.32676,1735603200.0,1720483200.0,,,2:1,1425945600.0,0.2891,5.0,1,5,80195.3611776,795198095360.0,10516599808.0,68.937,4841520128.0,102696853504.0,677.458,16906460160.0,4423908864.0,14260960256.0,356.786,14.755763,7.8089404,7.743,47.035,0.338,0.179,0.339,11711380480.0,76.12,55.25,69.162506,0.11404,0.26959,0.16462,0.14029999,0.12403,0.24178,"Persistent Systems Limited provides software products, services, and technology solutions in India, North America, and internationally. It operates through Banking, Financial Services and Insurance; Healthcare & Life Sciences; and Software, Hi-Tech and Emerging Industries segments. The company provides Persistent GenAI Hub, a generative artificial intelligence (AI) solution; consulting services for business strategy and transformation; software engineering services to architect, design, develop, and manage software product lifecycle; and CX transformation solutions, such as CX strategy, Salesforce cloud implementation, CX platform integration, customer analytics and insights, Salesforce industry solutions and accelerators. It also offers hybrid and multi-cloud transformation, data center modernization, cloud advisory, service management, service desk, digital workplace, and management and sustenance services, as well as CloudOps, a multi-cloud intelligent operations framework; business process management, robotic process automation, low code application development, and conversational AI solutions; and application modernization, maintenance and support, and portfolio rationalization, as well as application and platform development solutions. In addition, the company enterprise IT security solutions comprising managed security, security assurance and data security, and identity access management, as well as governance, risk, and compliance services; data and analytics advisory, data stack modernization, data science and machine learning, data connectors and certification, and data strategy and governance services; and enterprise integration strategy and advisory, API-led and managed integration, and migration services. It serves customers in the banking, financial services, insurance, healthcare, life sciences, consumer tech, industrial, software and hi-tech, and telecom and media sectors. The company was incorporated in 1990 and is based in Pune, India.",0.701,buy,126.0
1449,1449,IRB,IRB Infrastructure Developers Limited,EQ,25-FEB-2008,INE821I01022,other_industry,other_sector,Industrials,Civil Construction,63.21,63.45,61.59,64.17,63.21,63.45,61.59,64.17,34426896.0,34426896.0,60928433.0,17472815.0,17472815.0,28.75,78.15,65.4516,60.8851,61.88,,,2.0,135.715,,,1993980786.0,6039000064.0,,0.67233,,1724112000.0,,,,,0.29700002,1.0,1,1,37369.331712,550970064896.0,20276342784.0,3.331,186533838848.0,76277104640.0,12.588,34343804928.0,,,22.76,2.7188048,4.8991547,7.223,16.043,0.045,0.134,0.046,6120313856.0,1.01,2.02,61.26733,0.080240004,0.55862,0.45025003,0.32489,,,"IRB Infrastructure Developers Limited engages in the infrastructure development business in India. It operates in two segments, Built, Operate and Transfer/Toll Operate and Transfer; and Construction. The company develops roads and operates and maintains roadways. It also provides real estate, hospitality, and airport development services, as well as operates as an investment manager. The company was incorporated in 1998 and is based in Mumbai, India.",0.803,buy,229.0
1450,1450,SALZERELEC,Salzer Electronics Limited,EQ,02-DEC-2015,INE457F01013,other_industry,other_sector,Industrials,Other Electrical Equipment,1061.8,1067.7,1040.85,1089.0,1061.8,1067.7,1040.85,1089.0,65025.0,65025.0,194457.0,145048.0,145048.0,361.0,1142.95,951.324,721.9158,1047.6,,,2.0,,,,9846015.0,17382700.0,,0.44604,1735603200.0,1724976000.0,,,,,0.080299996,10.0,1,10,1821.0115584,,,,,12345439232.0,708.541,1257805056.0,,,272.375,3.8461678,1.4750481,,,0.333,0.236,0.444,502891008.0,27.39,,38.247536,0.04073,0.23555,0.10188,0.07801,,,"Salzer Electronics Limited manufactures and supplies CAM operated rotary switches, selector switches, wiring ducts, voltmeter switches, copper wires and cables, and allied products primarily in India. The company offers industrial components, including cable ducts, rotary switches, limit and foot switches, terminal connectors, load break and photo voltaic switches, changeover switches, and solar isolators; customized control panels and plugs, and sockets; sensors, and relays. It also offers motor control products comprising of contactors, motor protection breakers (MCBs), and UL approved MCBs. In addition, the company provides toroidal and lamination transformers, rogowski coils, inductors, and chokes. Further, it offers industrial wires and cables, wire harness, and power coords; MCBs, changeover limiter, distribution board, modular switches; movement sensors, remote switches; motor starters, house wires; night light, and Wi-Fi smart switches. Additionally, the company provides enameled copper wire, flexible busbars, and LAN/CCTV cables; and energy savers and panels, and street light controllers. Furthermore, it operates an online store for its products. The company also exports its products. Salzer Electronics Limited was incorporated in 1985 and is based in Coimbatore, India.",0.723,none,1088.0
1453,1453,DJML,DJ Mediaprint & Logistics Limited,BE,05-DEC-2022,INE0B1K01014,other_industry,other_sector,Services,Logistics Solution Provider,123.4,125.0,120.2,127.0,123.4,125.0,120.2,127.0,160472.0,160472.0,43015.0,102025.0,102025.0,42.666664,127.0,109.47093,79.85065,124.45,,,2.0,53.043,,,11000219.0,32483500.0,,0.65101,1735603200.0,1720137600.0,,,,,0.036199998,10.0,1,10,404.9129984,4181953280.0,4450000.0,0.137,177936992.0,634124032.0,18.893,147182000.0,,,10.327,12.050935,6.385391,6.595,28.413,3.666,0.739,4.387,60217000.0,1.84,,67.635864,0.094960004,0.37014,0.2321,0.12964,,,"DJ Mediaprint & Logistics Limited provides integrated printing, logistics, and courier solutions in the Asia Pacific, North America, Europe, and internationally. It offers printing solutions, such as variable data, continuous stationary digital, and security printing; logistics services through air, rail, and road transportation comprising speed post, international courier, and moving services; bulk mailing solutions; and records and data management services. The company also provides manpower supply, bulk scanning, bulk SMS and Email, newspaper print advertising, and other services. It serves the banking, education, finance, lottery ticket, healthcare, insurance, manufacturing, retail, stockbroking, telecom, utility, and other, as well as airlines, shipping, logistics industries. DJ Mediaprint & Logistics Limited was founded in 1999 and is based in Navi Mumbai, India.",-0.882,none,1527.0
1454,1454,TDPOWERSYS,TD Power Systems Limited,EQ,08-SEP-2011,INE419M01027,other_industry,other_sector,Industrials,Heavy Electrical Equipment,431.95,436.5,430.5,440.35,431.95,436.5,430.5,440.35,216728.0,216728.0,722512.0,587855.0,587855.0,226.05,451.0,403.637,326.053,432.55,,,2.0,0.001,,,98277845.0,156170000.0,,0.36055002,1735603200.0,1722902400.0,,,,,0.123,2.0,1,2,6755.91168,65764954112.0,1692818048.0,10.84,95000.0,10540105728.0,67.448,1754467712.0,,,45.152,9.579864,6.409719,6.239,37.484,0.322,0.243,0.326,1270450048.0,8.12,10.65,53.269703,0.12053,0.33653,0.16645999,0.16014,,,"TD Power Systems Limited, together with its subsidiaries, manufactures and sells AC generators and electric motors in India, Japan, the United States, Europe, and Turkey. It operates through Manufacturing Business; and Project Business segments. The company offers steam turbine, gas turbine, hydro turbine, wind turbine, gas engine, and diesel engine generators; induction, traction, and synchronous motors; and spare parts. It also provides replacement and refurbishment services; and after sales services, such as commissioning, overhauling, and repair services, as well as engages in the engineering, procurement, and construction business. The company serves the renewable energy industry comprising water, geothermal energy, wind, heat recovery, biomass, and waste-to-energy; sugar and ethanol industry; oil and gas industry; railway industry; pulp, paper, and textiles industry; marine industry; steel industry; irrigation industry; and thermal energy industry. TD Power Systems Limited was incorporated in 1999 and is headquartered in Bengaluru, India.",0.679,strong_buy,652.0
1459,1459,HYBRIDFIN,Hybrid Financial Services Limited,EQ,05-DEC-2022,INE965B01022,other_industry,other_sector,Financial Services,Non Banking Financial Company (NBFC),14.06,14.05,13.35,14.5,14.06,14.05,13.35,14.5,6995.0,6995.0,27654.0,23893.0,23893.0,7.4,15.79,12.4666,10.4382,13.8,,,2.0,7.001,,,10235582.0,29436300.0,,0.64018,,,,,,,,5.0,1,5,40.622096,248675024.0,186211008.0,6.326,21012000.0,57582000.0,1.992,,,,10.196,1.353472,7.0546517,4.319,,5.571,1.25,5.127,30642000.0,0.66,,20.90909,0.53215003,0.98862,,0.64158,,,"Hybrid Financial Services Limited, together with its subsidiaries, provides management consultancy services primarily in India. The company offers debt recovery advice; and consultancy services in financial, secretarial, commercial, legal, direct and indirect taxation, other levies, statistical, accountancy, and other fields. It also engages in share and stock broking; investment; and depository participant and marketing of financial products. The company was formerly known as Mafatlal Finance Company Limited and changed its name to Hybrid Financial Services Limited in 2008. Hybrid Financial Services Limited was incorporated in 1986 and is headquartered in Mumbai, India.",-2.531,none,1920.0
1460,1460,TPHQ,Teamo Productions HQ Limited,EQ,30-JAN-2009,INE065J01024,other_industry,other_sector,Industrials,Civil Construction,1.54,1.57,1.55,1.59,1.54,1.57,1.55,1.59,2444848.0,2444848.0,6806828.0,4709573.0,4709573.0,1.0,1.86,1.542,1.281325,1.56,,,4.0,,,,377406536.0,1016220032.0,,0.37651002,,,,,,,,1.0,1,1,159.5599104,1134882048.0,-1750000.0,-0.002,,4787109888.0,6.506,75365504.0,,,0.906,1.7218542,0.33331156,0.237,15.058,0.818,0.222,0.565,54143000.0,0.07,,22.285713,0.01131,0.01082,0.01574,0.017239999,,,"Teamo Productions HQ Limited, an engineering design company, primarily engages in the provision of civil engineering and ancillary services in India. It also offers information technology, software program and development, and other related services; and distributes and supplies electrical power and energy, as well as trades in commodities. The company provides trading of engineering goods, such as steel products comprising of TMT bars, girders, hollow sections, electrical conduits, switches, and circuit breakers; and irrigation pipes, sprinklers, drip and hybrid irrigation systems, and borewell pumps, as well as pipes, tubes, and plumbing systems for facilitate infrastructure projects. In addition, it offers offshore engineering services comprising residential design, which includes planned unit developments, single-family subdivisions, traditional and single-family site condominiums, apartment complexes, and manufactured housing communities; and commercial and industrial design, such as industrial subdivisions and site condominiums, commercial and industrial site plans, and marina. Further, the company provides wastewater services, including soil and site evaluations, septic system monitoring, cluster and sanitary sewer systems, alternative septic system designs, package treatment plants, water distribution systems and treatment, and arsenic removal services; and master planning comprising construction supervision, parks, playgrounds, golf courses, pedestrian, and vehicular campuses, as well as site evaluation study, waterfronts, marinas and water, and tree surveys. The company was formerly known as GI Engineering Solutions Limited and changed its name to Teamo Productions HQ Limited in September 2023. Teamo Productions HQ Limited was incorporated in 2006 and is based in Delhi, India.",0.091,none,1758.0
1461,1461,LAL,Lorenzini Apparels Limited,EQ,10-APR-2023,INE740X01023,other_industry,other_sector,Consumer Discretionary,Garments & Apparels,26.77,25.71,25.0,31.09,26.77,25.71,25.0,31.09,6083300.0,6083300.0,266954.0,328959.0,328959.0,14.128529,33.0,23.509,23.40849,30.33,,,2.0,73.17,,,25679606.0,172736992.0,,0.86294997,1703980800.0,,,,,,,1.0,1,1,530.171392,4233587200.0,100578000.0,0.65,189946000.0,557331008.0,3.542,136270256.0,,,1.648,18.404125,9.512684,7.596,31.068,1.542,0.069,1.504,64119000.0,0.39,,77.76923,0.11505,0.36351,0.24451,0.17767,,,"Lorenzini Apparels Limited designs, manufactures, and markets ready-made garments in India. It offers formal, semi-formal, and casual wear for men and women under the Monteil brand name. The company serves customers through retail outlets and e-commerce channels. Lorenzini Apparels Limited was incorporated in 2007 and is based in New Delhi, India.",-0.054,none,1462.0
1462,1462,PODDARMENT,Poddar Pigments Limited,EQ,22-NOV-2016,INE371C01013,other_industry,other_sector,Commodities,Dyes And Pigments,411.3,413.5,411.2,422.95,411.3,413.5,411.2,422.95,6258.0,6258.0,22994.0,9000.0,9000.0,320.4,476.15,426.817,381.72174,419.4,,,2.0,,,,2467948.0,10610000.0,,0.76694,1735603200.0,1726185600.0,,,,,,10.0,1,10,444.9833984,3937416448.0,425460992.0,40.109,,3758938880.0,354.302,400382496.0,,,328.226,1.277778,1.1838006,1.047,9.834,0.108,0.075,0.108,295579008.0,27.85,,15.059245,0.07863,0.31544,0.10651,0.09053001,,,"Poddar Pigments Limited engages in the manufacture and sale of color and additive masterbatches for dope dyeing of man-made fibers and various plastic applications in India. The company offers manmade fiber products, such as polyester, polypropylene, and polyamide products; plastic and packaging products, including additive masterbatches, film and packaging products, injection/blow/roto mouldings, pipe extrusions, cables, pet preforms and bottles, polyester films, and plastics smart products; and engineering compounds under the MASTERPLUS brand name. The company's products are used in various applications, such as textile, home furnishing, automotive, upholstery, luggage, lamination fabrics, carpets, hosiery-wear, PP strapping, non-woven and spun bonded fabrics, apparel, etc. It also exports its products. The company was incorporated in 1991 and is headquartered in Chennai, India.",0.246,none,1507.0
