421,421,UGROCAP,Ugro Capital Limited,EQ,11-AUG-2021,INE583D01011,credit-services,financial-services,Financial Services,Non Banking Financial Company (NBFC),222.22,222.22,216.94,224.99,222.22,222.22,216.94,224.99,129607.0,129607.0,199798.0,161175.0,161175.0,211.1,317.0,234.888,252.8714,219.53,-0.18241352,0.22677135,2.0,272.947,159.468,160.211,30456617.0,91945296.0,92120400.0,0.40494,,,,,,,,10.0,1,10,2018.475008,67660926976.0,5927008768.0,64.574,53438029824.0,5817275904.0,63.595,,,-18659098624.0,213.301,1.0292029,3.4697943,11.631,,0.157,0.257,0.229,1310935040.0,13.89,,15.804895,0.22534999,1.0,,0.32244,0.02042,0.07876,"UGRO Capital Limited, a non-banking financial company, engages in the lending business in India. The company offers business loans to healthcare, education, chemicals, food processing/FMCG, hospitality, electrical equipment and components, auto components, micro enterprises, and light engineering sectors. It also provides factoring services. The company was formerly known as Chokhani Securities Limited and changed its name to UGRO Capital Limited in September 2018. UGRO Capital Limited was incorporated in 1993 and is based in Mumbai, India.",0.57,strong_buy,307.0
433,433,KAPSTON,Kapston Services Limited,BE,27-MAY-2020,INE542Z01010,specialty-business-services,industrials,Services,Diversified Commercial Services,253.65,255.55,248.0,255.55,253.65,255.55,248.0,255.55,1074.0,1074.0,11263.0,6177.0,6177.0,110.05,319.0,270.725,214.8503,254.55,0.71067274,0.22677135,2.0,142.812,,,4159877.0,20288100.0,22377200.0,,1703980800.0,1605571200.0,0.5,1605571200.0,2:1,1723161600.0,,10.0,1,10,516.4336128,7027237888.0,69216000.0,3.412,1022190016.0,5604438016.0,276.097,254551504.0,,,35.241,7.2231207,0.9214726,1.254,27.606,0.189,0.357,0.191,131027000.0,6.27,,40.598087,0.02338,0.0614,0.04542,0.03719,,,"Kapston Services Limited operates as an integrated facilities management company in India. The company offers security, housekeeping, engineering, office support, facade cleaning, pest control, pantry, landscaping and gardening, canine brigade, and e-security services. Kapston Services Limited serves IT and ITES, manufacturing, pharma, e-commerce, logistics, infrastructure, automobile, retail, telecom, hospitality, healthcare, banking and finance, PSUs, and other industries. The company was formerly known as Kapston Facilities Management Limited and changed its name to Kapston Services Limited in February 2022. Kapston Services Limited was incorporated in 2009 and is based in Hyderabad, India.",0.03,none,445.0
434,434,PARADEEP,Paradeep Phosphates Limited,EQ,27-MAY-2022,INE088F01024,agricultural-inputs,basic-materials,Commodities,Fertilizers,113.7,114.61,114.06,119.39,113.7,114.61,114.06,119.39,6895071.0,6895071.0,7810264.0,8812889.0,8812889.0,61.95,128.29,109.8486,89.08265,116.53,0.49901116,0.22677135,2.0,115.615,0.57,1.11,358521329.0,815209984.0,852580992.0,0.56062,1735603200.0,1726617600.0,0.5,1726531200.0,,,0.112399995,10.0,1,10,9499.6414464,126152482816.0,12384400384.0,15.179,43462598656.0,110590394368.0,136.576,11101789184.0,4211184128.0,11469484032.0,46.076,2.5290823,0.85899335,1.141,11.363,1.536,0.044,1.545,3634291968.0,4.45,,26.186518,0.03286,0.26345,0.100389995,0.09825,0.05294,0.10102,"Paradeep Phosphates Limited engages in the manufacture, trade, distribution, and sale of urea and complex fertilizers in India. The company offers Di-ammonium phosphate; nitrogen, phosphorus, and potassium complex fertilizers; and hydrofluorosilicic acid, phospho-gypsum, zypmite, suphuric acid, phosphoric acid, gypsum, muriate of potash, and ammonia products, as well as nutrients, such as sulphur and zinc. It sells its products through dealers and retailers under the Navratna and Jai Kisaan brand names. The company was incorporated in 1981 and is based in Bengaluru, India. Paradeep Phosphates Limited is a subsidiary of Zuari Maroc Phosphates Private Limited.",-0.226,strong_buy,158.0
436,436,LFIC,Lakshmi Finance & Industrial Corporation Limited,EQ,15-APR-2015,INE850E01012,asset-management,financial-services,Financial Services,Investment Company,218.48,220.65,215.05,225.0,218.48,220.65,215.05,225.0,3491.0,3491.0,3736.0,10738.0,10738.0,161.85,372.0,237.1512,226.46326,218.96,0.22363484,0.22677135,2.0,,,,1642830.0,3000000.0,3308640.0,,1735603200.0,1723593600.0,2.5,1723593600.0,,,0.048,10.0,1,10,65.688,214796000.0,514953984.0,171.651,,175604992.0,58.544,154159744.0,,,188.38,1.1623315,3.740668,1.223,1.393,0.796,0.659,0.795,124904000.0,46.21,,4.7383685,0.71128,0.99808997,0.87788004,0.92613,,,"Lakshmi Finance & Industrial Corporation Limited, a non-banking finance company, invests in equity shares and mutual funds in India. The company was formerly known as The Andhra Bank Ltd. and changed its name to Lakshmi Finance & Industrial Corporation Limited in April 1980. Lakshmi Finance & Industrial Corporation Limited was incorporated in 1923 and is based in Hyderabad, India.",0.632,none,566.0
438,438,IONEXCHANG,ION Exchange (India) Limited,EQ,22-FEB-2022,INE570A01022,pollution-treatment-controls,industrials,Utilities,Water Supply & Management,649.5,645.0,642.0,652.9,649.5,645.0,642.0,652.9,72265.0,72265.0,302151.0,245781.0,245781.0,406.95,768.4,661.805,627.127,648.75,0.14147627,0.22677135,2.0,14.946,,,75128966.0,122930000.0,123451000.0,0.4614,1735603200.0,1725321600.0,1.5,1725321600.0,10:1,1686528000.0,0.0713,1.0,1,1,8008.8834048,69803671552.0,5884400128.0,49.63,1524199936.0,24362000384.0,205.491,2887294208.0,,,82.803,7.834861,3.2874491,2.865,24.176,0.351,0.184,0.351,2077100032.0,18.25,,35.547947,0.085260004,0.37818,0.11852,0.09474,,,"Ion Exchange (India) Limited, together with its subsidiaries, provides water and environment management solutions in India and internationally. It operates through Engineering, Chemicals, and Consumer Products segments. The company offers raw water, process, post, and drinking water treatment; waste water, water recycle, and zero liquid discharge systems; sludge dewatering and waste to energy systems; ion exchange process, membrane process, ion exchange membrane process, and 3D modelling systems; water purification equipment; and catalyst grade, adsorbent grade, chemical and special process, pharma grade, nuclear grade, hydrometallurgy, food and beverage, bio diesel, and sugar refining resins. It also provides nano filtration, ultra-filtration, low pressure and sea water RO, fouling resistant, and brackish resistant membranes; and cooling and boiler water treatment products, fireside treatment products, coagulants, flocculants, membrane cleaning chemicals, and water testing kits. In addition, the company offers INDION online controllers and transmitters, water quality monitoring instruments, water quality measuring indicators, remote monitoring systems, and online effluent monitoring systems; and consultancy, operator training, design engineering, project financing, and operations and maintenance services, as well as installation, commissioning, rehabilitation, and plant automation services. The company serves automotive, cement, chemicals, electronics, food and beverage, fertilizers, paper and pulp, pharma, power, refinery and petrochemical, steel and metallurgy, mining and minerals, sugar, and textiles industries; educational, hospitality, hospital, laboratory, railway, and defense institutions; communities and municipalities; and residential and commercial establishments industries. Ion Exchange (India) Limited was incorporated in 1964 and is based in Mumbai, India.",0.691,none,178.0
439,439,APOLLOHOSP,Apollo Hospitals Enterprise Limited,EQ,10-JAN-1996,INE437A01024,medical-care-facilities,healthcare,Healthcare,Hospital,6789.65,6819.95,6762.3,6845.0,6789.65,6819.95,6762.3,6845.0,166695.0,166695.0,354209.0,396826.0,396826.0,5693.2,7545.35,7107.371,6659.5605,6828.1,0.114034414,0.22677135,2.0,93.132,1.195,1.467,102387750.0,143784992.0,143784992.0,0.30388,1735603200.0,1723766400.0,10.0,1723766400.0,2:1,1283385600.0,0.19440001,5.0,1,5,98177.8300928,1074532384768.0,29083000832.0,193.593,73710002176.0,204693995520.0,1435.968,25656000512.0,8041625088.0,16464000000.0,499.315,13.674934,4.796322,5.249,41.882,0.626,0.153,0.699,11875999744.0,82.15,81.6,83.11747,0.05802,0.34702,0.12534,0.11289,0.072270006,0.16549,"Apollo Hospitals Enterprise Limited, together with its subsidiaries, engages in the provision of healthcare services in India and internationally. It operates through Healthcare Services, Retail Health & Diagnostics, Digital Health & Pharmacy Distribution, and Others segments. The company's healthcare facilities comprise primary, secondary, and tertiary care, as well as specialty facilities. It offers services in cardiac sciences, orthopedics, oncology, neurosciences, emergency, robotic surgery, and transplants; and cardiology, neurology, gastroenterology, dermatology, ophthalmology, pediatric, endocrinology, gynecology, urology, nephrology, pulmonology, rheumatology, neurosurgery, radiology, plastic-surgery, neonatology, vascular-surgery, psychiatry, dentistry, ear, nose, and throat care, as well as genomic medicines. The company also provides other services, such as project consultancy, health insurance, medical colleges, medvarsity for e-learning, and research services. In addition, it operates pharmacies, primary care clinics, birthing centers, specialized birthing centers, dialysis centers, cradle and fertility centers, diabetes management centers, single specialty clinics, primary health centers and diagnostic chains, dental clinics, and daycare and home healthcare centers. Further, the company engages in the business of bio-banking of tissues. It serves through national retail healthcare centers and genomics institutes, as well as Apollo 24/7, a digital health mobile platform; and www.apollopharmacy.in, an online pharmacy. The company was incorporated in 1979 and is based in Chennai, India.",0.595,buy,28.0
440,440,SWARAJENG,Swaraj Engines Limited,EQ,06-DEC-1995,INE277A01016,auto-parts,consumer-cyclical,Industrials,Compressors Pumps & Diesel Engines,3043.75,3043.75,3005.2,3263.45,3043.75,3043.75,3005.2,3263.45,86724.0,86724.0,12388.0,8271.0,8271.0,2148.0,3470.0,3043.158,2918.765,3224.95,0.2926824,0.22677135,2.0,0.453,1.495,1.904,5236359.0,12147500.0,12157200.0,0.57370996,1640908800.0,1719532800.0,95.0,1719532800.0,3:1,1123804800.0,0.78050005,10.0,1,10,3917.5077888,37348708352.0,1842300032.0,151.659,15500000.0,15127393280.0,1245.38,2018148992.0,952446144.0,1571204992.0,281.429,11.459196,2.589678,2.469,18.506,0.205,0.194,0.206,1478860032.0,121.75,86.44,26.488295,0.09776,0.20583999,0.13340999,0.123509996,0.2086,0.45433998,"Swaraj Engines Limited manufactures and sells diesel engines, diesel engine components, and spare parts for tractors in India. The company was incorporated in 1985 and is based in Mohali, India. Swaraj Engines Limited operates as a subsidiary of Mahindra & Mahindra Limited.",0.589,strong_buy,247.0
442,442,DEEPAKFERT,Deepak Fertilizers and Petrochemicals Corporation Limited,EQ,17-JAN-2003,INE501A01019,chemicals,basic-materials,Commodities,Commodity Chemicals,1185.35,1188.2,1167.4,1223.8,1185.35,1188.2,1167.4,1223.8,1245730.0,1245730.0,1116769.0,741794.0,741794.0,450.0,1443.1,1256.841,946.66626,1206.75,0.8384645,0.22677135,2.0,66.058,0.58,1.045,67230062.0,126238000.0,126299000.0,0.47939998,1735603200.0,1725321600.0,8.5,1725321600.0,,,0.1583,10.0,1,10,15233.7711104,185549537280.0,4958400000.0,39.273,37757698048.0,89669697536.0,710.272,16605200384.0,-2866899968.0,9752999936.0,449.624,2.6839092,1.6988761,2.069,11.174,2.496,0.133,2.494,6779899904.0,53.7,,22.472067,0.07561,0.35269,0.18518,0.14361,0.067880005,0.1268,"Deepak Fertilisers And Petrochemicals Corporation Limited produces and sells fertilizers and industrial chemicals in India. It operates through Chemicals; Bulk Fertilisers; and Realty segments. The company offers chemicals, including ammonia, methanol, dilute nitric acid, concentrated nitric acid, carbon dioxide, technical ammonium nitrate, iso-propyl alcohol, propane, and bulk and speciality chemical; and bulk fertilisers, such as nitro phosphate, mutriate of potash, diammonium phosphateap, ammonium sulphate, mixtures, single super phosphate, sulphur, micronutrients, SSF, and bio fertilisers. It engages in the real estate business. In addition, the company is involved in manufacturing and trading of fertilisers; produces agricultural products; provision of consultancy services in mining services; and construction and operations of design centers, shopping malls, complexes, and retailing outlets and other allied activities. The company was incorporated in 1979 and is based in Pune, India.",0.265,strong_buy,121.0
447,447,TPLPLASTEH,TPL Plastech Limited,EQ,20-MAY-2015,INE413G01022,packaging-containers,consumer-cyclical,Industrials,Packaging,94.46,96.94,92.3,96.94,94.46,96.94,92.3,96.94,169749.0,169749.0,131525.0,178501.0,178501.0,51.45,136.0,102.3972,99.8839,93.88,0.5017488,0.22677135,2.0,23.447,,,15069649.0,78003000.0,78036000.0,0.78069,1672444800.0,1726531200.0,0.8,1726531200.0,5:1,1666137600.0,0.22729999,2.0,1,2,732.6019584,8608439296.0,55084000.0,0.701,305632992.0,3209675008.0,40.952,374118752.0,,,16.711,5.617856,2.2824802,2.682,23.01,0.213,0.117,0.228,206776000.0,2.79,,33.648746,0.06442,0.20834999,0.116560005,0.09307,,,"TPL Plastech Limited engages in the manufacture and sale of polymer products in India. The company provides its IBCs under QuBC and re-bottled IBC under COBO brand names. It offers narrow mouth drums; narrow mouth and wide mouth carboys for specialty chemical and adhesive industries; bulk and medium open top drums that are used for packing powder, paste type, and semi liquid/solid products. In addition, the company offers HDPE packaging products, such as bottles for packing lubricant oil, pesticides, cosmetics, food and beverages, and cleaning and hygiene products; packaging solutions for pharma and agro based products, and cosmetics and personal care products; and caps and closures, small containers, promotional packaging solutions, etc. The company was formerly known as Tainwala Polycontainers Limited and changed its name to TPL Plastech Limited in January 2007. The company was incorporated in 1992 and is based in Mumbai, India. TPL Plastech Limited operates as a subsidiary of Time Technoplast Limited.",0.739,none,409.0
448,448,DPABHUSHAN,D. P. Abhushan Limited,EQ,03-NOV-2020,INE266Y01019,luxury-goods,consumer-cyclical,Consumer Discretionary,Gems Jewellery And Watches,1589.85,1590.0,1570.05,1685.25,1589.85,1590.0,1570.05,1685.25,36751.0,36751.0,30058.0,19802.0,19802.0,657.15,1927.0,1547.73,1421.0995,1648.25,1.2887065,0.22677135,2.0,58.737,0.082,1.798,4652919.0,22610900.0,23667500.0,0.81124,1735603200.0,1695340800.0,1.0,1695340800.0,,,,10.0,1,10,3726.8414464,38635233280.0,293580992.0,13.097,1981403008.0,28316549120.0,1269.492,1267996032.0,-1032451136.0,-566969024.0,150.487,10.952773,1.3161354,1.364,30.47,0.882,0.839,0.885,831158976.0,37.2,,44.307796,0.02935,0.07198,0.04478,0.0361,0.12694,0.30375,"D. P. Abhushan Limited engages in the manufacturing, sale, and trading of gold, diamond, platinum, silver, and other precious metals and ornaments in India. It also offers solitaire jewellery products; and corporate gifting products, such as gold coins, silver coins, gift vouchers, electroform idols, etc. The company sells jewellery through its retail showrooms located in Ratlam, Indore, Bhopal, Udaipur, Ujjain, Banswara, Bhilwara, and Kota. The company was founded in 1940 and is based in Ratlam, India.",-0.551,none,251.0
455,455,AAVAS,Aavas Financiers Limited,EQ,08-OCT-2018,INE216P01012,mortgage-finance,financial-services,Financial Services,Housing Finance Company,1639.15,1639.95,1626.45,1645.05,1639.15,1639.95,1626.45,1645.05,130662.0,130662.0,137050.0,181409.0,181409.0,1307.0,1978.95,1666.574,1701.303,1638.25,0.100987315,0.22677135,2.0,308.257,236.351,236.351,57660000.0,79143800.0,79237904.0,0.156,,,,,,,,10.0,1,10,12981.149696,240288923648.0,14149410816.0,178.799,124793954304.0,12320992256.0,155.694,,,-17657720832.0,511.572,3.202384,10.535799,19.502,,0.215,0.133,0.216,5332674048.0,67.21,75.04,24.375093,0.43280998,0.9928,,0.5815,0.03341,0.14104,"Aavas Financiers Limited provides housing finance services to customers belonging to low- and middle-income self-employed customers in semi-urban and rural areas in India. The company offers home loans for flats, houses, and bungalows, as well as resale properties; home construction loans for self-construction of residential house; and home improvement loans, including loans for tiling or flooring, plaster, painting, etc. It also provides loans against property; home equity loan; and micro, small, and medium enterprise loans, as well as home loan balance transfer, and Small Ticket Size loan. The company was formerly known as AU Housing Finance Limited and changed its name to Aavas Financiers Limited in May 2017. Aavas Financiers Limited was incorporated in 2011 and is based in Jaipur, India.",0.801,buy,137.0
461,461,LTIM,LTIMindtree Limited,EQ,21-JUL-2016,INE214T01019,information-technology-services,technology,Information Technology,Computers - Software & Consulting,5978.8,5855.0,5770.0,5980.0,5978.8,5855.0,5770.0,5980.0,766623.0,766623.0,329324.0,413969.0,413969.0,4513.55,6767.95,6057.702,5629.8457,5890.3,0.057792187,0.22677135,2.0,11.029,3.071,3.467,91919631.0,296227008.0,296230016.0,0.68795997,1735603200.0,1729814400.0,20.0,1729814400.0,,,0.41439998,1.0,1,1,174488.354816,1695097815040.0,98572001280.0,332.907,23256000512.0,367362015232.0,1241.085,62634000384.0,42270748672.0,57405001728.0,675.884,8.714957,4.749766,4.614,27.064,0.077,0.093,0.077,46535999488.0,154.25,,38.18671,0.12668,0.28717,0.1705,0.18055001,0.13408,0.23783001,"LTIMindtree Limited, a technology consulting and digital solutions company, provides information technology services and solutions in India, North America, Europe, and internationally. The company operates through Banking, Financial Services & Insurance; Technology, Media & Communications; Manufacturing & Resources; Consumer Business; and Health, Life Sciences & Public Services. It offers cloud and infrastructure services, consulting, cyber security, data and insights, digital engineering, enterprise application, platform operation, RPA, and testing services. The company serves various industries, such as banking and financial services, insurance, Hi-tech and service, manufacturing and resources, energy, utilities, retail and consumer packaged goods, public, healthcare, life sciences, travel, transport, and hospitality, as well as communications, media, and entertainment industries. The company was formerly known as Larsen & Toubro Infotech Limited and changed its name to LTIMindtree Limited in November 2022. The company was incorporated in 1996 and is based in Mumbai, India. LTIMindtree Limited operates as a subsidiary of Larsen & Toubro Limited.",0.729,hold,19.0
465,465,PNCINFRA,PNC Infratech Limited,EQ,26-MAY-2015,INE195J01029,engineering-construction,industrials,Industrials,Civil Construction,304.9,305.0,302.05,312.1,304.9,305.0,302.05,312.1,262295.0,262295.0,1579594.0,642667.0,642667.0,279.0,574.8,310.878,420.36874,309.3,-0.25113595,0.22677135,2.0,154.785,,,112601461.0,256539008.0,256539008.0,0.5607,1735603200.0,1726790400.0,0.6,1726790400.0,5:1,1470960000.0,0.0124,2.0,1,2,7934.7515392,138076651520.0,18895575040.0,73.655,80253313024.0,87256809472.0,340.142,25259309056.0,,,202.106,1.530385,0.9093561,1.582,5.466,2.185,0.036,2.184,13039664128.0,48.3,10.36,6.4037266,0.14944,0.40605998,0.28948,0.42823002,,,"PNC Infratech Limited, together with its subsidiaries, operates as an infrastructure investment, development, construction, operation, and management company in India. The company undertakes various infrastructure projects, including roads, highways, bridges, flyovers, power transmission lines, airport runways and pavements, rural drinking water supply, irrigation, industrial area development, rail freight corridors, and other infrastructure projects. It also provides end-to-end infrastructure implementation solutions, such as engineering, procurement, and construction services on a fixed-sum turnkey basis, as well as on an item rate basis; and executes and implements projects on a design-build-finance-operate-transfer, operate-maintain-transfer, hybrid annuity model, and other public-private partnership formats. The company was formerly known as PNC Construction Company Limited and changed its name to PNC Infratech Limited in August 2007. PNC Infratech Limited was founded in 1989 and is headquartered in Agra, India.",0.97,buy,179.0
472,472,VGUARD,V-Guard Industries Limited,EQ,13-MAR-2008,INE951I01027,electrical-equipment-parts,industrials,Consumer Discretionary,Household Appliances,392.1,393.0,379.75,395.15,392.1,393.0,379.75,395.15,386485.0,386485.0,337826.0,288458.0,288458.0,285.8,577.45,421.482,424.19226,384.15,0.3464973,0.22677135,2.0,13.236,0.567,1.569,144043938.0,435376000.0,452849984.0,0.57318,1735603200.0,1721865600.0,1.4,1721865600.0,7:5,1489536000.0,0.2068,1.0,1,1,16727.0825984,168983887872.0,1511699968.0,3.458,2555800064.0,52792500224.0,120.696,4726099968.0,2153062400.0,3948400128.0,44.169,8.697276,3.1684582,3.201,35.755,0.075,0.141,0.075,2967699968.0,6.78,6.0,56.65929,0.056209996,0.3427,0.08952,0.068119995,0.08359,0.16426,"V-Guard Industries Limited manufactures and sells electrical and electronic products in India and internationally. It operates through three segments: Electronics, Electrical, and Consumer Durables. The Electronics segment offers voltage stabilizers; inverter, DUPS, inverter batteries, and UPS; and solar panels, solar batteries, off grid systems and inverters, and on grid photovoltaic (PV) inverters. The Electrical segment offers wiring and industrial cables, domestic switch gears and distribution boards, domestic and agriculture pumps, and modular switches. The Consumer Durables Segment includes storage, solar, instant, and gas water heaters, as well as immersion heater, rods and room heaters; heat pump water heaters; ceiling, table, pedestal, wall, and ventilating and exhaust fans; and kitchen appliances, such as mixer grinders, induction cooktops, gas stoves, rice cookers, grill kings, toasters, kettles, chimneys, sandwich makers, and hand blenders. In addition, the company provides air coolers, electric motors, and water purifiers. The company sells its products through a network of distributors, dealers, and service centers. V-Guard Industries Limited was founded in 1977 and is based in Kochi, India.",0.311,buy,114.0
480,480,DHANBANK,Dhanlaxmi Bank Limited,EQ,01-APR-2004,INE680A01011,banks-regional,financial-services,Financial Services,Private Sector Bank,26.53,27.15,26.53,27.85,26.53,27.15,26.53,27.85,1589134.0,1589134.0,1430036.0,881899.0,881899.0,24.0,59.0,32.834194,38.64835,27.79,-0.36908442,0.22677135,2.0,,,,147185320.0,311988992.0,312224992.0,0.28952998,,1307664000.0,0.5,1307664000.0,,,,10.0,1,10,867.6732928,-3884740096.0,12416700416.0,49.07,1500000000.0,6150214144.0,24.263,,,-4581066240.0,41.72,0.66610736,1.4108018,-0.632,,0.109,0.168,0.114,241719008.0,0.78,,35.62821,0.039300002,,,0.18923001,0.00154,0.02325,"Dhanlaxmi Bank Limited provides various banking and financial services in India. It operates through Treasury Operations, Corporate/Wholesale Banking, Retail Banking, and Other Banking Business Operations segments. The company offers deposit products, such as savings and current accounts, and term deposits; loans, including personal, home, new and used car, two wheeler, commercial, gold, education, business, and green loans, as well as loans against securities and properties, and lease rental discounting; and foreign exchange services comprising foreign currency cash, cheque deposits, foreign currency demand drafts, and remittances. It also provides export and import services; credit products comprising industrial and trade advance, import export assistance, and agricultural assistance; corporate salary accounts; credit treasury bills and linked loans; trade finance, electronic bank guarantees, and liberalized remittance schemes; 3 in 1 trading accounts; and mutual funds investment services, as well as life, health, and car insurance products. In addition, the company offers non-resident Indians (NRI) banking services, such as non-residential external accounts, non-resident ordinary accounts, recurring and term deposits, foreign currency non-resident fixed deposits, and resident foreign currency accounts, as well as money transfer services and NRI property loans; and micro and agricultural banking, and financial planning services. Further, it provides SME banking services, including working capital facilities, trade facilities, and capacity expansion services; credit, debit, and gift cards; retail and corporate net, mobile phone, and SMS banking; online services, such as bill payment, unified payments interface, mobile/DTH/data card recharges, missed call, shopping, positive pay, online trading, and custom duty online payments; and depository services, as well as safe deposit lockers. Dhanlaxmi Bank Limited was incorporated in 1927 and is based in Thrissur, India.",0.729,none,390.0
