476,476,GREENLAM,Greenlam Industries Limited,EQ,02-MAR-2015,INE544R01021,furnishings-fixtures-appliances,consumer-cyclical,Consumer Discretionary,Plywood Boards/ Laminates,560.0,560.05,547.35,595.85,560.0,560.05,547.35,595.85,36057.0,36057.0,84470.0,49393.0,49393.0,388.2,662.0,592.901,549.5665,583.5,0.17511284,0.2086575,2.0,103.013,0.502,1.21,29857384.0,127574000.0,127984000.0,0.77675,1735603200.0,1718928000.0,1.65,1718928000.0,5:1,1644451200.0,0.1383,1.0,1,1,7467.8665216,80729300992.0,1801947008.0,14.125,11093006336.0,23063486464.0,180.785,2769227008.0,-5047582208.0,1936408064.0,84.434,6.910723,3.2379608,3.5,29.152,0.237,0.169,-0.118,1383943040.0,10.86,,53.729282,0.06001,0.51703,0.12007,0.09698,0.05503,0.13563,"Greenlam Industries Limited manufactures and sells laminates, decorative veneers, and their allied products in India and internationally. The company operates through Laminate & Allied Products, Veneer & Allied Products, and Plywood & Allied Products segments. It offers laminates for homes, kitchens, offices, or other premises; decorative and designer laminates for kitchen, wardrobe, doors, living room, office, or commercial spaces; compact laminates for restroom cubicles, lockers, furniture, panels, work tops, lab furniture, and facades; and laminates for exterior and interior claddings. In addition, the company provides melamine faced chip boards; decorative veneers; engineered wood flooring products; and engineered doors and door frames. Greenlam Industries Limited offers its products under the Greenlam Laminates, New Mika, Decowood, Greenlam Sturdo, Greenlam Clads, Mikasa Floors, and Mikasa Doors & Frames brand names. The company serves institutions; hospitality sector; health care segment; luxury retail; and fast food chains. Greenlam Industries Limited sells its products through a network of distributors, dealers, and retailers. The company was founded in 1993 and is based in New Delhi, India.",0.878,none,598.0
483,483,TEGA,Tega Industries Limited,EQ,13-DEC-2021,INE011K01018,specialty-industrial-machinery,industrials,Industrials,Industrial Products,1723.35,1723.3,1680.0,1763.85,1723.35,1723.3,1680.0,1763.85,73395.0,73395.0,83978.0,81803.0,81803.0,841.7,1917.85,1619.248,1272.783,1721.2,0.7412852,0.2086575,2.0,25.844,1.488,2.307,14115097.0,66535500.0,66688000.0,0.74786,1703980800.0,1723075200.0,2.0,1723161600.0,,,0.0688,10.0,1,10,11478.3379456,114141036544.0,3346289920.0,50.406,3080150016.0,14927139840.0,224.611,3159719936.0,2198830080.0,2521420032.0,179.527,9.587416,7.689576,7.647,36.124,0.156,0.279,0.158,1938569984.0,29.12,37.6,59.10714,0.12987,0.56756,0.21168,0.22975999,0.08948,0.17302,"Tega Industries Limited designs, manufactures, and installs process equipment and accessories for the mineral processing, mining, and material handling industries. It offers a range of grinding mill liners, such as DynaPrime, DynaSteel, DynaPulp, and DynaWear. The company also offers conveyor products comprising of centrax, friflo, spill-ex skirt sealing, eco-flip skirt, single wing, ceramic pulley lagging, ceradisc and conveyor belt cleaners. In addition, it provides trommels for heavy duty, heavy and light duty applications along with structure, rubber or polyurethane screen panels, spirals, connecting pieces and end flanges; wear resistant liners for transfer, storage equipment, and handling bulk material; and screen panels. Further, the company designs and supplies hydrocyclones for the mining and mineral processing sectors. It operates in North America, South America, Europe, the Middle East, Russia, Africa, the Asia Pacific, and India. The company was incorporated in 1976 and is based in Kolkata, India. Tega Industries Limited is a subsidiary of Nihal Fiscal Services Private Limited.",0.522,strong_buy,467.0
484,484,SUNTV,Sun TV Network Limited,EQ,24-APR-2006,INE424H01027,broadcasting,communication-services,Consumer Discretionary,TV Broadcasting & Software Production,785.3,782.0,773.55,791.75,785.3,782.0,773.55,791.75,471966.0,471966.0,1495243.0,1525555.0,1525555.0,519.05,823.45,734.721,669.70874,781.45,0.45076668,0.2086575,2.0,0.358,7.626,8.105,84692823.0,394084992.0,394355008.0,0.78497005,1703980800.0,1712534400.0,3.0,1712534400.0,2:1,1185148800.0,0.3326,5.0,1,5,30795.7727232,258319499264.0,51423399936.0,130.561,377500000.0,42821001216.0,108.684,26381000704.0,14540075008.0,21713000448.0,267.503,2.9212759,7.1917453,6.033,9.792,0.091,0.143,0.091,19250700288.0,48.85,56.48,15.99693,0.44956002,0.71929,0.61608005,0.43153,0.12207,0.19433,"Sun TV Network Limited, together with its subsidiaries, engages in producing and broadcasting satellite television and radio software programming in the regional languages. Its flagship channel includes Sun TV. The company also operates various other satellite channels, such as Surya TV, Gemini TV, Udaya TV, SUN Bangla, and Sun Marathi; 24 frequency modulation radio stations; SunRisers Hyderabad, an Indian Premier League franchise; Sun Risers Eastern Cape, a South Africa Premier League franchise; and SUNNXT, an OTT platform. In addition, it offers daily newspapers and magazines. The company provides entertainment in various genres of general entertainment, movies, music, news, kids, action, and life. It operates television channels in Tamil, Telugu, Kannada, Malayalam, Marathi, and Bangla languages for viewers in India, Sri Lanka, Singapore, Malaysia, the United Kingdom, rest of Europe, the Middle East, the United States, Australia, South Africa, and Canada. The company was incorporated in 1985 and is based in Chennai, India.",0.598,buy,249.0
486,486,DPABHUSHAN,D. P. Abhushan Limited,EQ,03-NOV-2020,INE266Y01019,luxury-goods,consumer-cyclical,Consumer Discretionary,Gems Jewellery And Watches,1355.2,1401.6,1313.25,1427.95,1355.2,1401.6,1313.25,1427.95,38698.0,38698.0,35279.0,33809.0,33809.0,255.0,1454.05,1295.474,887.3845,1326.2,4.0332403,0.2086575,2.0,73.264,,,4617087.0,22610900.0,22843900.0,0.80904996,1703980800.0,1695340800.0,1.0,1695340800.0,,,0.036,10.0,1,10,2998.6574336,31611682816.0,292092992.0,13.127,1749192960.0,23735762944.0,1046.747,1141249536.0,,,107.318,12.357665,1.2633499,1.332,27.699,0.605,0.07,0.605,713160000.0,27.78,,47.739376,0.030050002,0.07594,0.04808,0.07269,,,"D. P. Abhushan Limited engages in the wholesale and retail of various jewelleries and ornaments in India. It offers gold, diamond, platinum, silver, and solitaire jewellery products, as well corporate gifting products, such as gold coins, silver coins, gift vouchers, electroform idols, etc. The company sells jewellery through its retail showrooms located in Ratlam, Indore, Bhopal, Udaipur, Ujjain, Banswara, Bhilwara, and Kota. The company was founded in 1940 and is based in Ratlam, India.",-0.598,none,869.0
489,489,RECLTD,REC Limited,EQ,12-MAR-2008,INE020B01018,credit-services,financial-services,Financial Services,Financial Institution,598.4,595.0,591.4,620.6,598.4,595.0,591.4,620.6,13033459.0,13033459.0,23569467.0,16749188.0,16749188.0,162.35,654.0,550.576,454.371,618.8,2.4599595,0.2086575,2.0,689.668,561.557,561.917,1230605153.0,2633220096.0,2664950016.0,0.52643,1703980800.0,1719532800.0,5.0,1719532800.0,4:3,1660694400.0,0.2864,10.0,1,10,162943.6510208,6217567043584.0,154445201408.0,58.157,4782867087360.0,189489201152.0,71.961,,,-577226473472.0,261.142,2.369592,8.599099,32.812,,0.349,0.358,0.331,141121601536.0,53.62,67.3,11.54047,0.7465,0.98845,,0.95398,0.02791,0.22194,"REC Limited, a public financial institution, provides financing services for power generation, transmission, and distribution projects in India. The company primarily offers long, medium, and short-terms loans; debt refinancing, equity financing, financing of equipment manufacturing (Em) for power sector and coal mines, policy for funding against regulatory assets, and revolving bill payment facility services. It also acts as a nodal agency for the implementation of Pradhan Mantri Sahaj Bijli Har Ghar Yojana, Deen Dayal Upadhyaya Gram Jyoti Yojana, and National Electricity Fund. In addition, the company acts as the bid process coordinator for selection of transmission service provider through tariff based competitive bidding process for independent inter-state and intra-state transmission projects; and provides implementation and consultancy services in power sector. It serves central/state government power utilities, as well as private sector power utilities. The company was formerly known as Rural Electrification Corporation Limited and changed its name to REC Limited in October 2018. REC Limited was incorporated in 1969 and is based in Gurugram, India. REC Limited operates as a subsidiary of Power Finance Corporation Limited.",0.771,buy,57.0
490,490,UTIAMC,UTI Asset Management Company Limited,EQ,12-OCT-2020,INE094J01016,asset-management,financial-services,Financial Services,Asset Management Company,990.1,991.0,972.0,997.1,990.1,991.0,972.0,997.1,210035.0,210035.0,227240.0,397599.0,397599.0,731.2,1112.0,986.58,891.25024,979.85,0.21484661,0.2086575,2.0,2.79,26.609,27.716,98106875.0,127374000.0,127380000.0,0.35064998,1735603200.0,1721260800.0,23.0,1721260800.0,,,0.3655,10.0,1,10,12481.3287424,89872039936.0,43362398208.0,340.749,1387699968.0,17369600000.0,136.661,10127899648.0,5197049856.0,3251200000.0,344.83,2.841545,7.185732,5.174,8.874,0.969,0.399,0.974,7656800256.0,60.2,51.94,16.276577,0.44082,0.73417,0.58308,0.52324003,0.13032,0.18143,"UTI Asset Management Company (P) Ltd. is a privately owned investment manager. It manages mutual funds for its clients. The firm invests in money market, fixed income, and public equity markets of India. It employs in-house research while making its investments. UTI Asset Management Company (P) Ltd. was incorporated on November 14, 2002 and is based in Mumbai, India.",0.569,hold,445.0
491,491,LUMAXTECH,Lumax Auto Technologies Limited,EQ,16-JAN-2007,INE872H01027,auto-parts,consumer-cyclical,Consumer Discretionary,Auto Components & Equipments,544.1,540.0,533.95,556.0,544.1,540.0,533.95,556.0,86197.0,86197.0,251941.0,167692.0,167692.0,332.35,609.95,522.184,442.3295,552.6,0.4984852,0.2086575,2.0,79.931,0.82,1.187,26866404.0,68157696.0,68443400.0,0.62601,1703980800.0,1691625600.0,4.5,1691625600.0,5:1,1528329600.0,0.2356,2.0,1,2,3766.3940608,44168798208.0,3251405056.0,47.704,8099061760.0,28217358336.0,413.995,3680730112.0,190192624.0,2653735936.0,115.85,4.769961,1.3347791,1.565,12.0,1.369,0.535,1.371,1301831936.0,19.1,11.76,28.931936,0.04614,0.36113,0.13044,0.083170004,0.065349996,0.17934,"Lumax Auto Technologies Limited, together with its subsidiaries, manufactures and sells in automotive components in India. It offers integrated plastic modules; 2-wheeler chassis and swing arms; 3-wheeler trailing arms; 2/3 wheeler lighting products; gear shifters; sift towers; emission systems; seat frames; oxygen sensors; telematics products; antennas; on-board antennas; and electric devices and components. The company serves two, three, and four-wheeler commercial vehicle and off-road vehicle original equipment manufacturers. It also exports its products. The company was formerly known as Dhanesh Auto Electricals Limited and changed its name to Lumax Auto Technologies Limited in 2006. The company was incorporated in 1981 and is based in New Delhi, India.",0.994,buy,790.0
492,492,GENSOL,Gensol Engineering Limited,EQ,03-JUL-2023,INE06H201014,solar,technology,Industrials,Other Electrical Equipment,938.55,932.0,918.75,952.0,938.55,932.0,918.75,952.0,79319.0,79319.0,182394.0,96096.0,96096.0,460.18332,1376.0,978.829,921.7602,938.25,1.0320067,0.2086575,2.0,482.214,0.733,1.356,10679554.0,37872900.0,37912400.0,0.67530996,1703980800.0,,,,3:1,1697500800.0,,10.0,1,10,3553.4249984,45579509760.0,4760600064.0,126.322,15096200192.0,9630999552.0,255.49,2276000000.0,-7631799808.0,-981000000.0,86.429,10.855731,3.6895704,4.733,20.026,2.172,1.433,2.32,595600000.0,15.77,,59.495876,0.06184,0.28606,0.23632,0.13738,0.05771,0.20446,"Gensol Engineering Limited provides renewable energy solutions in India, Southeast Asia, the Middle East, and Africa. The company offers solar advisory services comprising owners engineering services, such as pre bid assistance; review construction supervision; facilitating permits and clearances; detailed project report and financial closure assistance; and design, engineering, and plant hand over services. It also provides lender engineering services that includes pre financial closure due diligence, performance acceptance, pre disbursement inspection, and performance acceptance services; design engineering and review services; and project management, and strategy and policy advisory services. In addition, the company offers solar EPC services, such as RCC roof, shed roof, ground mounted, and super structures; and solar operation and maintenance services. Further, it provides consultancy services for independent monitors for execution and quality monitoring for transmission lines and substation design services. Additionally, the company provides AI powered SaaS platform that offers real time monitoring, analytics, reporting, and O&M automation services; offers energy storage solutions; and engages in the manufacture and leasing of electric vehicle. Gensol Engineering Limited was founded in 2007 and is based in Ahmedabad, India.",-0.194,none,811.0
493,493,GOODLUCK,Goodluck India Limited,EQ,08-JAN-2015,INE127I01024,steel,basic-materials,Industrials,Iron & Steel Products,877.3,890.0,866.2,890.85,877.3,890.0,866.2,890.85,82587.0,82587.0,106878.0,125681.0,125681.0,463.9,1168.75,902.138,918.80676,879.05,0.8053298,0.2086575,2.0,53.18,0.763,1.932,10954972.0,32738500.0,32788900.0,0.6754,1703980800.0,1712880000.0,2.0,1712880000.0,,,0.1616,2.0,1,2,2882.3083008,31406921728.0,2109012992.0,67.546,6120407040.0,35377254400.0,1244.524,2951910912.0,-2275866112.0,-459256000.0,368.492,2.3855333,0.8147349,0.888,10.64,0.141,0.19,0.319,1319266048.0,46.41,,18.94096,0.03729,0.27006,0.08344,0.07194,0.09273,0.14938,"Goodluck India Limited manufactures and sells a range of galvanized sheets and coils, towers, hollow sections, cold rolled coils, flanges, and pipes and tubes in India. The company provides ERW hot dip galvanized pipes, black pipes, black and GI hollow sections, and galvanized and plain corrugated sheets, as well as CR, G.P.G.C, and CRCA sheets/coils; square and rectangular tubes; painted pipes; EMT and intermediate metal conduits; and road safety products, such as approach end terminals, crash cushion/impact attenuators, bridge/vehicle parapets, metal beam crash barriers, transitions, and end terminals. It also offers cold drawn welded (CDW), auto, CDW/ERW, boiler, transformer, air heater, two-wheeler frame, hydraulic cylinder, crash bumper, exhaust, and engine mounting tubes, as well as cycle frame, forks, and hub tubes; and squire, CBQ pressure outers, front fork, drive shaft, real axels, sections, control arms, and fuel lines. In addition, the company provides forged flanges, gear rings, gear shanks, and forged shafts, as well as railway, defence, and aerospace products; and substation structures, transmission and telecom towers, fabricated steel structures, railway and road bridges, building and boiler structures, launching girders, and solar mounting structures, as well as overhead electrification and defense fabrication structures. It serves clients from public sector, private sector OEMs, and central and state government departments. The company also exports its products to approximately 100 countries, including the United Kingdom, the United States, Singapore, South Africa, the United Arab Emirates, Germany, and France. The company was formerly known as Good Luck Steel Tubes Limited and changed its name to Goodluck India Limited in June 2016. Goodluck India Limited was incorporated in 1986 and is headquartered in Ghaziabad, India.",0.478,none,884.0
500,500,BALPHARMA,Bal Pharma Limited,EQ,08-MAY-2006,INE083D01012,drug-manufacturers-specialty-generic,healthcare,Healthcare,Pharmaceuticals,112.79,115.0,111.6,115.0,112.79,115.0,111.6,115.0,13175.0,13175.0,54819.0,39736.0,39736.0,81.2,132.45,114.0996,106.93515,112.68,0.20117152,0.2086575,2.0,201.625,0.587,1.153,4874905.0,15804400.0,15818000.0,0.66293997,1703980800.0,1694995200.0,1.0,1694995200.0,,,0.2024,10.0,1,10,178.0839808,2850714624.0,200490000.0,13.663,1396483968.0,3392196096.0,226.691,315280000.0,13342375.0,228058000.0,47.223,2.3861253,0.5249814,0.84,9.042,2.622,0.148,2.42,73922000.0,4.94,,22.809717,0.02179,0.43473,0.092939995,0.078590006,0.042329997,0.111999996,"Bal Pharma Limited manufactures and markets pharmaceutical formulations and active pharmaceutical ingredients (APIs) in India, Uzbekistan, Guatemala, and Malta. The company offers prescription drugs, generics, OTC products, intravenous infusion products, and bulk actives. It provides anti-infectives, pain management, respiratory care, and women's health products under the Aziwin, Ebay, Balvibe, MNF, Ocium, and Monogesic Plus Gel brands; diabetic care products under the Diabend and Diabend M Group brands; herbal/ayurvedic preparations targeting conditions, such as prostate enlargement, renal calculi, male infertility, women health, etc. under the Stonex, Ashwamed, Prostowin, Suswas, Menoleap, and Ayursulin brands; anti-hypertensive, anti-lipidemic, and anti-obese products; skin care and bone health products; and cardiac care products under the Secremet and Servace brands. In addition, the company offers a range of APIs for therapeutic areas, such as anti-histamine, platelet inhibitor, anti-diabetic, anti-convulsant, urinary incontinence, neuropathic pain, anti-allergy, anti-inflammatory, diuretic, acne treatment, etc.; and various formulations. Further, it engages in the treatment of gastrointestinal disorders; and piles, fistula, and constipation. The company also exports its products. Bal Pharma Limited was incorporated in 1987 and is based in Bengaluru, India.",0.574,none,1716.0
501,501,INDIAMART,Indiamart Intermesh Limited,EQ,04-JUL-2019,INE933S01016,internet-content-information,communication-services,Consumer Discretionary,Internet & Catalogue Retail,2798.2,2789.95,2738.35,2869.4,2798.2,2789.95,2738.35,2869.4,148145.0,148145.0,247349.0,320077.0,320077.0,2230.0,3292.0,2630.625,2644.8037,2855.75,-0.08153349,0.2086575,2.0,2.342,2.203,2.22,27806120.0,59948900.0,59995000.0,0.51852,1735603200.0,1717718400.0,20.0,1717718400.0,2:1,1687305600.0,0.1817,10.0,1,10,17133.0715648,144924311552.0,23231500288.0,387.521,406670016.0,11967750144.0,197.74,3176770048.0,4242469888.0,5591660032.0,289.599,9.86105,14.316033,12.11,45.62,0.808,0.171,0.78,3339529984.0,55.12,,51.80969,0.27903998,0.53988,0.26544002,0.24048,0.05348,0.17601,"IndiaMART InterMESH Limited operates an online business-to-business marketplace for business products and services in India and internationally. The company's e-marketplace acts as an interactive hub for domestic and international buyers and suppliers. Its platform serves small and medium enterprises, large enterprises, and individuals. IndiaMART InterMESH Limited was incorporated in 1999 and is based in Noida, India.",0.598,buy,372.0
502,502,INCREDIBLE,INCREDIBLE INDUSTRIES LIMITED,EQ,01-JUL-2016,INE452L01012,steel,basic-materials,Industrials,Iron & Steel Products,41.07,39.3,39.25,45.17,41.07,39.3,39.25,45.17,33936.0,33936.0,19137.0,13667.0,13667.0,24.8,51.65,42.3172,40.10655,45.17,0.6527163,0.2086575,2.0,32.584,0.85,2.579,3795122.0,46763800.0,47390000.0,0.91977,1703980800.0,,,,,,,10.0,1,10,214.0606208,2266775552.0,108047000.0,2.284,432087008.0,8203471872.0,175.946,215416000.0,167443008.0,238287008.0,28.033,1.6113151,0.26093906,0.276,10.523,0.065,0.064,0.067,59680000.0,1.28,,35.289062,0.00727,0.07143,0.02626,0.028499998,0.04733,0.046040002,"Incredible Industries Limited manufactures and sells iron and steel products in India. It offers steel related rolled products, such as TMT bars, wire rods, H. B. wires, etc., as well as related services; and billets, linkedge, annaling, torkari, and wire nail products. The company is also involved in the generation of electricity through wind power. It also exports its products. The company was formerly known as Adhunik Industries Limited and changed its name to Incredible Industries Limited in May 2021. Incredible Industries Limited was incorporated in 1979 and is based in Kolkata, India.",0.702,none,1661.0
507,507,GENESYS,Genesys International Corporation Limited,EQ,23-JAN-2003,INE727B01026,software-application,technology,Information Technology,IT Enabled Services,616.25,614.7,606.7,655.0,616.25,614.7,606.7,655.0,253144.0,253144.0,228153.0,339477.0,339477.0,266.0,738.9,567.917,504.93326,635.95,1.0308123,0.2086575,2.0,12.127,2.012,3.044,11772988.0,39598600.0,39653200.0,0.5987,1703980800.0,1568764800.0,0.125,1568764800.0,2:1,1277251200.0,,5.0,1,5,2521.7452032,24057868288.0,763777024.0,19.441,595177984.0,1982429056.0,51.912,805387008.0,-661822144.0,190672992.0,124.511,5.1075807,12.720482,12.136,29.871,4.987,0.527,5.899,220728992.0,5.73,13.6,110.98604,0.11134,0.49907002,0.40625998,0.3523,0.03953,0.04812,"Genesys International Corporation Limited provides geographical information services in India and internationally. The company offers photogrammetry, remote sensing, cartography, data conversion, state of the art terrestrial; and 3D geocontent, including location navigation mapping and other computer based related services. It also provides 3D Digital GeoTwin services; terrestrial, backpack, mobile, and aerial LiDAR scanners; geospatial services, such as data capture, conversion, processing, integration, maintenance, and update; 2D and 3D mapping services; and application development services, including enterprise GIS and web-based application, mobile app development, and system integration services for public and private enterprises, and consumers. In addition, the company offers building information modeling services; and business consulting services, including requirement analysis, project design and planning, project management, GIS orientation seminar and workshop, and database and application design with system configuration; and WoNoBo solutions. Further, the company provides various solutions, such as TeleSCAPE, GaSCAPE, InfraSCAPE, CitySCAPE, WaterSCAPE, and market analysis and route planning system. It provides its services to the urban development, telecom, electric, gas, water supply and sanitization, infrastructure, navigation, and disaster management industries. Genesys International Corporation Limited was incorporated in 1983 and is headquartered in Mumbai, India.",0.554,none,925.0
512,512,EQUITASBNK,Equitas Small Finance Bank Limited,EQ,02-NOV-2020,INE063P01018,banks-regional,financial-services,Financial Services,Other Bank,89.58,89.0,88.3,90.33,89.58,89.0,88.3,90.33,2236199.0,2236199.0,3758021.0,3397327.0,3397327.0,82.1,116.5,96.0194,99.06585,89.97,-0.061498165,0.2086575,2.0,29.948,0.095,0.92,1009422831.0,1136649984.0,1137280000.0,0.15527001,,1690502400.0,1.0,1690502400.0,,,0.1427,10.0,1,10,10232.1086464,83717865472.0,35789516800.0,31.545,17875300352.0,38784311296.0,34.563,,,42978840576.0,52.609,1.7101636,2.6382082,2.159,,0.068,0.085,0.093,7989601792.0,7.01,,12.834522,0.206,1.0,,0.36513,0.01991,0.14361,"Equitas Small Finance Bank Limited provides various banking products and services to for individuals and corporates, as well as micro, small, and medium enterprises in India. The company operates through Treasury, Corporate / Wholesale Banking, Retail Banking, and Other Banking Operations segments. It offers fixed deposit products; and savings, salary, business, current, and TASC accounts. The company also provides loans against property; gold, home, used car, business, and MSME loans; vehicle finance, merchant overdraft, MSME loans monitoring services; overdraft against deposits; investment services; general, life, and health insurances; pension schemes; payments and collection solutions; retail forex services; fund transfer services; and debit cards. In addition, it provides online, mobile, and doorstep banking services. It operates various banking outlets and ATMs. The company was formerly known as Equitas Finance Limited. Equitas Small Finance Bank Limited was incorporated in 1993 and is based in Chennai, India.",-0.113,none,498.0
519,519,KIRLOSIND,Kirloskar Industries Limited,EQ,24-JUN-2010,INE250A01039,metal-fabrication,industrials,Industrials,Other Industrial Products,5708.4,5708.4,5607.05,5875.0,5708.4,5708.4,5607.05,5875.0,5433.0,5433.0,13103.0,9468.0,9468.0,2857.6,6698.9,6103.11,4428.7197,5828.5,0.7731805,0.2086575,2.0,18.074,1.108,2.246,2420230.0,9955680.0,9968940.0,0.78099,1703980800.0,1691107200.0,11.0,1691107200.0,2:1,1193270400.0,0.0592,10.0,1,10,5810.3967744,86593978368.0,1149600000.0,115.69,12178400256.0,63683899392.0,6437.865,9837400064.0,2188624896.0,5761800192.0,4889.508,1.1920422,0.9123808,1.36,8.803,0.394,0.11,0.424,1913900032.0,186.09,,31.320868,0.030079998,0.45406,0.15447,0.1014,0.053590003,0.06183,"Kirloskar Industries Limited manufactures and sells iron castings in India. The company generates and sells wind-power electricity through seven windmills with total installed capacity of 5.6 megawatts in Maharashtra; owns lands and buildings, and apartments and offices; and invests in properties and securities. In addition, it engages in real estate activities; and manufacturing steel and seamless tubes. The company was formerly known as Kirloskar Oil Engines Limited and changed its name to Kirloskar Industries Limited in March 2010. Kirloskar Industries Limited was incorporated in 1978 and is based in Pune, India.",0.644,none,678.0
