1548,1548,WHIRLPOOL,Whirlpool of India Limited,EQ,06-APR-2010,INE716A01013,furnishings-fixtures-appliances,consumer-cyclical,Consumer Discretionary,Household Appliances,1604.0,1605.1,1566.6,1609.0,1604.0,1605.1,1566.6,1609.0,82448.0,82448.0,136818.0,125125.0,125125.0,1186.1,2449.7,1817.653,1904.3163,1573.55,0.19723833,0.24251366,2.0,6.032,1.535,2.295,62170244.0,126872000.0,131151000.0,0.51,1735603200.0,1721952000.0,5.0,1721952000.0,,,0.21040002,10.0,1,10,19964.5741056,177897947136.0,24454500352.0,192.74,2305700096.0,74794901504.0,589.447,4481800192.0,8109912576.0,9061600256.0,298.143,5.2778363,2.6692426,2.378,39.693,0.419,0.126,0.422,3014200064.0,23.74,,66.282646,0.0403,0.33348,0.05992,0.020510001,0.031600002,0.08163,"Whirlpool of India Limited manufactures and markets home appliances in India and internationally. It offers refrigerators, washing machines, air conditioners, microwave ovens, dishwasher, kitchen, built-in, and small appliances. The company was incorporated in 1960 and is headquartered in Gurugram, India. Whirlpool of India Limited operates as a subsidiary of Whirlpool Corporation.",0.488,hold,255.0
1555,1555,AVG,AVG Logistics Limited,EQ,12-MAY-2023,INE680Z01018,integrated-freight-logistics,industrials,Services,Logistics Solution Provider,333.55,330.1,321.1,336.1,333.55,330.1,321.1,336.1,17597.0,17597.0,61496.0,42229.0,42229.0,291.1,668.4,389.929,467.96225,333.75,-0.19295913,0.24251366,2.0,110.255,,,4845158.0,15057700.0,15650800.0,0.59485,1735603200.0,1727049600.0,1.2,1727049600.0,,,0.035,10.0,1,10,502.5507328,7690412544.0,87761000.0,6.418,2204751872.0,5024540160.0,402.716,607756480.0,,,146.372,2.2801492,1.0001925,1.531,12.654,0.772,0.225,1.059,346003008.0,31.09,,10.734963,0.06886,0.2517,0.12096,0.10155,,,"AVG Logistics Limited offers logistics services in India, Bangladesh, and Nepal. The company provides full truckload and less than truckload, dedicated/secondary solution, express delivery, parcel/door to door/household, multimodal, rail, freight forwarding, reverse logistics, and cold chain/refrigerated transportation services. It also offers manpower handling, storage space, multiuser, and bonded warehousing services; and value added services comprising end to end, customized, ODC, custom clearing and port logistics, container on rent, and forklift/cranes on rent services. In addition, the company is involved in the trading business. AVG Logistics Limited was incorporated in 2010 and is headquartered in Delhi, India.",-0.04,none,1140.0
1557,1557,GRSE,Garden Reach Shipbuilders & Engineers Limited,EQ,10-OCT-2018,INE382Z01011,aerospace-defense,industrials,Industrials,Aerospace & Defense,1548.85,1548.65,1467.75,1552.5,1548.85,1548.65,1467.75,1552.5,478889.0,478889.0,694711.0,589406.0,589406.0,673.45,2833.8,1583.134,1676.3247,1542.65,0.72410536,0.24251366,2.0,3.924,,,27966179.0,114552000.0,114641000.0,0.75592005,1735603200.0,1726185600.0,1.44,1726185600.0,,,0.2685,10.0,1,10,17685.0944,122052083712.0,37203382272.0,324.699,656705984.0,38464598016.0,335.832,2453815552.0,,,146.086,10.5598755,4.597759,3.173,49.74,0.138,0.336,0.137,3677808128.0,33.61,53.53,45.89854,0.09562001,0.18892999,0.06379,0.04537,,,"Garden Reach Shipbuilders & Engineers Limited engages in the design and construction of war ships in India. The company offers frigates, anti-submarine warfare corvettes, missile corvettes, landing ship tanks, landing craft utilities, survey vessels, fleet replenishment tankers, fast patrol vessels, offshore patrol vessels, inshore patrol vessels, water jet fast attack crafts, anti-submarine warfare shallow water crafts, electric ferries, ocean going passenger and cargo ferry vessels, hovercrafts, and fast interceptor boats to the Indian Navy, Indian Coast Guard, and other governments. It also provides autonomous underwater vehicles, unmanned surface and aerial vessels, and naval surface guns. In addition, the company offers portable bridges; and deck machinery equipment, such as anchor capstan, anchor windlass, mooring and dock capstan, general purpose davits, ammunition davits, electric boat and electro-hydraulic boat davits, survey motor boat and hydrographic davits, oceanographic winch, anchor cum general purpose winches for beaching operations, helicopter traversing systems, etc. Further, it engages in the assembling, overhauling, and testing of marine diesel engines, as well as provides dry docking and afloat maintenance, refit, and repair services for defence and commercial ships. Garden Reach Shipbuilders & Engineers Limited was founded in 1884 and is based in Kolkata, India.",0.376,none,274.0
1559,1559,CENTRALBK,Central Bank of India,EQ,21-AUG-2007,INE483A01010,banks-regional,financial-services,Financial Services,Public Sector Bank,53.11,53.26,51.41,53.34,53.11,53.26,51.41,53.34,2653828.0,2653828.0,6294307.0,7691071.0,7691071.0,46.5,76.9,54.6262,59.49405,52.32,-0.031722903,0.24251366,2.0,,,,373279612.0,8680939520.0,8689110016.0,0.93082,,1435017600.0,0.5,1435017600.0,,,,10.0,1,10,45461.42208,272891691008.0,324254695424.0,37.205,133466898432.0,143961751552.0,16.563,,,-245671903232.0,37.294,1.4029067,3.157882,1.896,,0.472,0.43,0.485,34170007552.0,4.2,,12.457144,0.23735,,,0.35221002,0.00783,0.10709,"Central Bank of India operates as a commercial bank in India. The company offers deposit products, which include savings and current accounts, time deposits, fixed deposits, and recurring deposit schemes, as well as small saving scheme; and loans, including housing, vehicle, property, personal, senior citizens, education, and agricultural, as well as micro small and medium enterprises loans. It provides credit, debit, and prepaid/gift cards, as well as cash management, mutual funds, depository, mobile and Internet banking, and ATM services. In addition, the company offers corporate loans, such as project finance, infrastructure funding, financing to infrastructure investment trusts, short term corporate loans, advances, working capital facilities, line of credit, export finance, foreign currency loan, bills purchase/discount/negotiation facilities, non-fund based facilities, and facilities to other industries. Further, the company sells and distributes life, general, and health insurance products, including unit linked, whole life, children, money back, endowment, pension, health, property, personal, fire, burglary, engineering, motor, package, travel, and group insurance products, as well as protection and retirement solutions. It operates through a network of branches, ATMs, satellite offices, and an extension counter. Central Bank of India has a strategic co lending partnership with IIFL Home Finance Limited to offer SME LAP loan products under priority sector to MSME borrowers. The company was incorporated in 1911 and is headquartered in Mumbai, India.",0.708,none,144.0
1561,1561,KAMATHOTEL,Kamat Hotels (I) Limited,EQ,29-MAY-1996,INE967C01018,lodging,consumer-cyclical,Consumer Discretionary,Hotels & Resorts,216.87,222.0,213.99,222.0,216.87,222.0,213.99,222.0,14454.0,14454.0,75453.0,29356.0,29356.0,175.0,348.3,220.9864,226.50145,214.98,-0.35039687,0.24251366,2.0,89.153,0.283,0.595,9618454.0,29480100.0,29715200.0,0.59735,,1252627200.0,1.2,1252627200.0,,,,10.0,1,10,638.8173824,8173070336.0,209060992.0,7.212,2149950976.0,3325669888.0,122.442,852147968.0,1157162624.0,833009984.0,83.186,2.5843291,1.9208683,2.458,9.591,280.0,0.334,252.0,531179008.0,18.59,,11.564281,0.15972,0.63852,0.25623,0.20667,0.06939,0.26785,"Kamat Hotels (India) Limited, together with its subsidiaries, engages in the hospitality business in India. It operates hotels and resorts under the The Orchid, Fort Jadhavgadh, Lotus Resorts, Toyam, Mahodadhi Palace, and IRA by Orchid Hotels brands. The company also operates restaurants. Kamat Hotels (India) Limited was founded in 1958 and is based in Mumbai, India.",0.97,none,1077.0
1564,1564,IEX,Indian Energy Exchange Limited,EQ,23-OCT-2017,INE022Q01020,capital-markets,financial-services,Financial Services,Exchange and Data Platform,170.19,170.01,164.5,170.1,170.19,170.01,164.5,170.1,3562396.0,3562396.0,5118102.0,3514381.0,3514381.0,130.2,244.4,174.9026,179.9204,168.18,0.244079,0.24251366,2.0,0.784,1.732,1.802,754962915.0,889238976.0,902876992.0,0.16605,1735603200.0,1717113600.0,1.5,1717113600.0,3:1,1638489600.0,0.5669,1.0,1,1,14955.2201728,138617978880.0,10790744064.0,12.153,81839000.0,6127452160.0,6.877,5200758784.0,2253575936.0,2008493952.0,11.763,14.297373,24.406914,22.622,26.653,0.258,0.262,0.253,3932567040.0,4.41,4.45,38.136055,0.64179003,0.99815005,0.84876,0.85198,0.19233,0.41028,"Indian Energy Exchange Limited provides automated trading platform for physical delivery of electricity, renewable energy, and certificates. The company's platform offers customers with digital registration, market data insights, financial reconciliation, user access management, and web-based bidding services. Its products include Day-Ahead Market, a physical electricity trading market for deliveries for any/some/all 15 minute time blocks in 24 hours of next day starting from midnight; Term-Ahead-Market that provides a range of products allowing participants to buy/sell electricity on intra-day, day-ahead contingency, and term ahead contracts; Real-Time Market, an auction session every half an hour with power to be delivered after 4 time blocks or an hour after gate closure of the auction; Green Day-Ahead Market that allows anonymous and double-sided closed collective auction in renewable energy on a day-ahead basis; and Cross-Border Electricity Trade building an integrated South Asian Power Market; The Green-Term Ahead Market, a market solution for renewable energy trading which features contracts, including Green-Intraday, Green-Day-ahead Contingency, Green-Daily, and Green-Weekly. Indian Energy Exchange Limited was incorporated in 2007 and is based in Noida, India.",0.635,buy,314.0
1565,1565,ARVEE,Arvee Laboratories (India) Limited,BE,22-MAR-2021,INE006Z01016,specialty-chemicals,basic-materials,Commodities,Specialty Chemicals,160.25,158.59,153.01,160.89,160.25,158.59,153.01,160.89,1185.0,1185.0,3357.0,997.0,997.0,117.05,315.0,171.2134,187.4987,156.08,-0.04128027,0.24251366,2.0,3.435,,,2271015.0,11020000.0,11026900.0,,,,,,2:1,1602547200.0,,10.0,1,10,172.0001664,1766041344.0,75401000.0,6.803,10000000.0,333512000.0,30.119,34530128.0,,,26.419,5.9078693,5.157241,5.295,51.145,0.932,0.396,0.933,15065000.0,2.07,,75.40097,0.04517,0.47903,0.10353,0.116059996,,,"Arvee Laboratories (India) Ltd. manufactures and sells various specialized chemicals in India and internationally. The company offers polymer modifiers, including dimethyl 5-sodiosulfoisophthalate, 5-sulfoisophthalic acid mono sodium salt, 5-sulfoisophthalic acid mono lithium salt, and 5-sodiosulfo-bis-(ß-hydroxyethyl)-isophthalate; and contrast media intermediates, such as 5-nitroisophthalic acid, dimethyl 5-nitroisophthalate, monomethyl 5-nitroisophthalate, 5-hydroxyisophthalic acid, 5-aminoisophthalic acid, and dimethyl 5-aminoisophthalate, as well as 3,5-dinitrobenzoic acid and 3,5-diamino benzoic acid. It also provides drug intermediates comprising 2-acetyl thiophene, thiophene-2-carboxaldehyde, 4amino pyridine, and 2chloro5nitrobenzoic acid. In addition, the company exports its products. Arvee Laboratories (India) Ltd. was incorporated in 2012 and is based in Ahmedabad, India.",0.527,none,1333.0
1566,1566,MARICO,Marico Limited,EQ,01-MAY-1996,INE196A01026,household-personal-products,consumer-defensive,Fast Moving Consumer Goods,Edible Oil,666.4,668.0,660.85,670.0,666.4,668.0,660.85,670.0,2085582.0,2085582.0,2254042.0,1932629.0,1932629.0,486.3,719.85,634.537,634.8675,665.35,0.25818932,0.24251366,2.0,10.048,1.174,2.038,541764386.0,1293869952.0,1302480000.0,0.59234,1735603200.0,1709683200.0,6.5,1709683200.0,2:1,1450742400.0,0.77489996,1.0,1,1,86087.630848,856782209024.0,14529999872.0,11.198,4979999744.0,100069998592.0,77.392,20540000256.0,4437499904.0,9760000000.0,35.875,18.54634,8.602741,8.562,41.713,0.194,0.076,0.198,15879999488.0,12.26,14.15,54.26998,0.15869,0.50665003,0.20526,0.18056,0.14896,0.33741,"Marico Limited, together with its subsidiaries, manufactures and sells consumer products in India. It offers coconut oils, refined edible oils, hair oils, anti-lice treatments, fabric care, functional and other processed foods, hair creams and gels, hair serums, shampoos, shower gels, shower gels, hair relaxers and straighteners, deodorants, fabric care, female personal care, baby care, skin care, male grooming and styling, health care, and hygiene products, as well as conditioners. The company markets its products under the Parachute, Saffola, Saffola FITTIFY Gourmet, Saffola ImmuniVeda, Saffola Mealmaker, Hair & Care, Parachute Advansed, Nihar Naturals, Mediker, Pure Sense, Coco Soul, Revive, Set Wet, Livon, Just Herbs, True Elements, Beardo, and Plix brand names in India; and under the Parachute, Parachute Advansed, HairCode, Fiancée, Purité de Prôvence, Ôliv, Lashe', Caivil, Hercules, Black Chic, Code 10, Ingwe, X-Men, Thuan Phat and Isoplus brand names internationally. Its distribution network comprises regional offices, carrying and forwarding agents, redistribution centers, and distributors. The company was incorporated in 1988 and is headquartered in Mumbai, India.",0.251,buy,87.0
1567,1567,MANOMAY,Manomay Tex India Limited,EQ,18-JAN-2023,INE784W01015,textile-manufacturing,consumer-cyclical,Consumer Discretionary,Other Textile Products,207.97,208.0,203.99,208.0,207.97,208.0,203.99,208.0,19024.0,19024.0,48043.0,51023.0,51023.0,152.05,314.95,208.8982,214.76135,207.87,0.099497795,0.24251366,2.0,232.473,,,4056857.0,18048700.0,18919200.0,0.78053004,,,,,,,,10.0,1,10,393.2733952,6275975680.0,207187008.0,11.478,2998868992.0,5980780032.0,331.393,559881984.0,,,71.472,2.9084115,0.657562,1.049,11.209,1.128,0.107,1.122,157040992.0,9.86,,21.08215,0.02626,0.39288,0.09361,0.07718,,,"Manomay Tex India Limited manufactures and sells denims and denim fabrics in India. The company exports its products to Colombia, Mexico, Egypt, Chile, Venezuela, Paraguay, Guatemala, Peru, Ecuador, Lebanon, Sri Lanka, Bangladesh, Argentina, and Bolivia. Manomay Tex India Limited was founded in 1978 and is based in Bhilwara, India.",0.179,none,1190.0
1570,1570,TMB,Tamilnad Mercantile Bank Limited,EQ,15-SEP-2022,INE668A01016,banks-regional,financial-services,Financial Services,Private Sector Bank,445.65,443.2,439.0,445.65,445.65,443.2,439.0,445.65,55079.0,55079.0,107027.0,63168.0,63168.0,418.1,514.0,460.992,464.62775,443.4,-0.1171751,0.24251366,2.0,,,,108177473.0,158351008.0,158423008.0,0.28588,,1726790400.0,10.0,1726790400.0,,,0.14039999,10.0,1,10,7024.47616,57729937408.0,31466199040.0,198.752,18997700608.0,28735031296.0,181.465,,,-33652561920.0,532.486,0.8326979,2.4445689,2.009,,0.109,0.14,0.108,11277625344.0,71.21,,6.2266536,0.39247,,,0.52764,0.01842,0.14263,"Tamilnad Mercantile Bank Limited provides banking and financial products and services in India. It operates through Treasury, Corporate/Wholesale Banking, and Retail Banking segments. The company offers savings, fixed, recurring, term deposit, and current accounts; debit and credit cards; and demat and equity trading account, portfolio management, POS terminal, e-tax payment, online bill payment, mutual fund, insurance, sovereign gold bond scheme, forex, and Internet and mobile banking services. It also provides home, car, two-wheeler, personal, LAP, pension, pharma and health care, education, gold, jewel, commercial vehicle, traders and service, MSME, rice and dhall mill, NRI, doctor, agricultural, green energy, and Mahalir loans, and sovereign gold bonds secured overdraft facilities; and microenterprise and pharma finance. The company was formerly known as The Nadar Bank Ltd. and changed its name to Tamilnad Mercantile Bank Limited on November 26, 1962. Tamilnad Mercantile Bank Limited was incorporated in 1921 and is headquartered in Thoothukudi, India.",-0.227,none,486.0
1571,1571,ROSSELLIND,Rossell India Limited,EQ,25-SEP-2012,INE847C01020,conglomerates,industrials,Industrials,Aerospace & Defense,71.88,72.0,69.0,72.0,71.88,72.0,69.0,72.0,16024.0,16024.0,36840.0,29231.0,29231.0,68.5,664.4,79.697,337.5417,70.21,-0.8410262,0.24251366,2.0,65.356,,,7907590.0,37696500.0,37995400.0,0.77549005,1735603200.0,1723420800.0,0.3,1723420800.0,,,0.0387,2.0,1,2,266.765696,4651682304.0,279320000.0,7.41,1940163968.0,3712366080.0,98.464,356455008.0,,,78.75,0.89155555,0.71858674,1.253,13.05,0.882,0.065,0.884,138656992.0,7.76,,9.04768,0.03735,0.64699996,0.096020006,0.06046,,,"Rossell India Limited offers aviation products and services primarily in India. It operates through Cultivation, Manufacture, and Sale of Tea; and Aviation Products and Services. The company offers aviation products and services, such as wire harnesses, interconnect systems and panels, electronics assemblies, after market services for electrical products, and engineering and systems integration. It also offers black pepper. In addition, the company exports its products to the United States, the United Kingdom, Germany, Israel, and other countries. The company was formerly known as Rossell Tea Limited and changed its name to Rossell India Limited in April 2011. Rossell India Limited was incorporated in 1994 and is headquartered in New Delhi, India. Rossell India Limited is a subsidiary of BMG Enterprises Ltd.",0.702,none,1259.0
1580,1580,TEXRAIL,Texmaco Rail & Engineering Limited,EQ,03-MAR-2011,INE621L01012,railroads,industrials,Industrials,Industrial Products,191.06,190.5,184.0,190.9,191.06,190.5,184.0,190.9,1379284.0,1379284.0,2453239.0,2342596.0,2342596.0,142.0,296.49,205.1584,216.2495,188.78,-0.067089856,0.24251366,2.0,34.543,0.763,2.177,210925936.0,399467008.0,419832000.0,0.48261002,1735603200.0,1726704000.0,0.5,1726704000.0,,,0.0919,1.0,1,1,7541.1382272,82821021696.0,2466360064.0,6.161,9375245312.0,44750807040.0,116.953,4038867968.0,-7837701120.0,-1183448960.0,66.951,2.8196743,1.6851401,1.851,20.506,1.395,0.672,1.956,2084919040.0,5.45,6.95,34.638535,0.04659,0.2174,0.09024999,0.090129994,0.054619998,0.10104,"Texmaco Rail & Engineering Limited manufactures, sells, and provides services for rail and rail related products in India and internationally. It operates through three segments: Heavy Engineering, Steel Foundry, and Rail EPC. The company offers freight cars, such as railway freight cars, loco components and shells, and steel castings; steel girders for railway bridges; pressure vessels; and end-to-end solutions for railways and metros in track work, railway signalling, telecom, railway electrification, power distribution, OHE electrification, and allied works. It also undertakes EPC contracts for execution of railway track, and signaling and telecommunication projects; rail electrification and automatic fare collection; hydro-mechanical equipment for hydro power plant, pumped storage plant, and irrigation and barrage projects; and industrial steel structures for thermal power and steel plant, and flyovers. In addition, the company is involved in manufacture and export of wagons, including open top, double decker, flat, bottom open hopper, covered wagons, etc.; operation of steel foundry, which delivers castings for textile machineries, railway bogies, couplers, and CMS crossings; and supplies electric loco shells, shell assemblies, and sub-assemblies to locomotive plants. It services the logistics and freight, power, process, metal, cement, oil and gas, automotive, etc. The company was founded in 1939 and is based in Kolkata, India.",0.841,none,475.0
1581,1581,KEI,KEI Industries Limited,EQ,23-MAR-2006,INE878B01027,electrical-equipment-parts,industrials,Industrials,Cables - Electricals,4034.55,3999.45,3910.4,4161.7,4034.55,3999.45,3910.4,4161.7,1244769.0,1244769.0,271125.0,226616.0,226616.0,2900.1,5039.7,4225.3,4255.8574,4127.55,0.21715057,0.24251366,2.0,10.161,1.349,2.86,55697749.0,95552600.0,98221696.0,0.36205003,1735603200.0,1710806400.0,3.5,1710806400.0,5:1,1167350400.0,0.0507,2.0,1,2,39439.81056,365345341440.0,2445220096.0,27.082,3513299968.0,87187881984.0,966.135,8843849728.0,-4726687744.0,1879859968.0,348.871,11.831163,4.523543,4.19,41.311,0.104,0.171,0.104,6243350016.0,70.2,98.96,58.79701,0.07159,0.23165001,0.10143,0.08961,0.11502,0.19769,"KEI Industries Limited manufactures, sells, and markets wires and cables in India and internationally. It operates in three segments: Cable & Wires; Engineering, Procurement and Construction; and Stainless Steel Wire. The company offers extra-high voltage, high tension, and low-tension power cables; control and instrumentation cables; specialty, single-core, and multi-core flexible cables; elastomeric/rubber and solar cables; fire survival/resistant cables; flat, EV charging, ESP, and medium voltage covered conductor cables; conflame green + wires; communication and thermocouple cables; and submersible marine and offshore cables, as well as stainless steel, winding, and house wires. It also provides engineering, procurement, and construction solutions in the areas of gas-insulated and air-insulated substations; overhead and underground power transmission and distribution systems; and railway electrification/ substation on a turnkey basis, as well as project management services. The company exports its products to approximately 60 countries. It serves the power, refinery, railway, automobile, cement, steel, fertilizer, textile, real estate, infrastructure, oil and gas, defense, chemical, metal, IT, pharma, manufacturing, renewables, non-metal, data center, consumer durable, government, public, private, and other sectors through dealers and distributors. KEI Industries Limited was founded in 1968 and is headquartered in New Delhi, India.",0.775,buy,161.0
1584,1584,NAM-INDIA,Nippon Life India Asset Management Limited,EQ,06-NOV-2017,INE298J01013,asset-management,financial-services,Financial Services,Asset Management Company,659.85,663.0,641.25,664.0,659.85,663.0,641.25,664.0,1303079.0,1303079.0,1062028.0,921265.0,921265.0,430.0,816.25,713.54,664.0402,642.9,0.327132,0.24251366,2.0,,4.172,4.172,170639302.0,633737984.0,662262016.0,0.00585,1735603200.0,1730851200.0,8.0,1730851200.0,,,0.7988,10.0,1,10,40743.0168576,404168409088.0,2700300032.0,4.267,,24188000256.0,38.425,16678500352.0,10029712384.0,9564199936.0,64.271,10.002956,16.844309,16.709,24.233,0.432,0.456,0.473,13196199936.0,20.65,,31.133173,0.54557,0.83745,0.68954,0.7047,0.24579,0.34569,"Nippon Life Asset Management Limited is a publicly owned investment manager. The firm launches and manages equity and fixed income mutual funds for its clients. It also manages exchange traded funds for its clients. The firm invests in the public equity, fixed income and commodity markets. Nippon Life Asset Management Limited was previously known as Reliance Nippon Life Asset Management Limited. Nippon Life Asset Management Limited was founded on February 24, 1995 and is based in Mumbai, India.",0.516,buy,157.0
1586,1586,LUMAXIND,Lumax Industries Limited,EQ,06-SEP-1995,INE162B01018,auto-parts,consumer-cyclical,Consumer Discretionary,Auto Components & Equipments,2293.75,2281.15,2247.0,2297.9,2293.75,2281.15,2247.0,2297.9,1303.0,1303.0,5691.0,4259.0,4259.0,2130.0,3033.8,2384.601,2613.3223,2264.9,-0.055778503,0.24251366,2.0,107.6,,,2730653.0,9347730.0,9362810.0,0.76009005,1735603200.0,1725840000.0,35.0,1725840000.0,,,0.2067,10.0,1,10,2120.5827584,28276916224.0,469964992.0,50.274,7225845760.0,27839506432.0,2978.288,2575439872.0,,,718.407,3.1526697,0.7617171,1.016,10.979,0.478,0.238,0.478,1220785024.0,132.81,119.4,17.053686,0.04385,0.34435,0.09251001,0.05697,,,"Lumax Industries Limited manufactures and sells automotive components for in India. The company offers automotive lighting systems, including LED light, headlamps, tail lamps, fog lamps, other lighting components, and auxiliary lamps, as well as electronic components. It serves its products to four-wheelers, two-wheelers, commercial vehicles, and tractors in farm equipment segment catering to original equipment manufacturers. The company was founded in 1945 and is headquartered in Gurugram, India.",0.923,strong_buy,777.0
1589,1589,MASFIN,MAS Financial Services Limited,EQ,18-OCT-2017,INE348L01012,credit-services,financial-services,Financial Services,Non Banking Financial Company (NBFC),244.25,245.0,236.9,245.85,244.25,245.0,236.9,245.85,172073.0,172073.0,199842.0,285144.0,285144.0,236.9,387.95,270.377,286.03076,240.3,-0.245754,0.24251366,2.0,332.329,134.607,136.806,43449796.0,181452992.0,181676992.0,0.73317003,1735603200.0,1725408000.0,0.51,1725408000.0,3:1,1708560000.0,0.088,10.0,1,10,4360.3152896,108491456512.0,12535700480.0,77.286,81665499136.0,6706599936.0,40.896,,,-17767499776.0,149.128,1.6113673,6.5015287,16.177,,0.268,0.281,0.254,2814000128.0,17.17,21.1,13.995341,0.41959,0.92427003,,0.59801996,0.02853,0.13789,"MAS Financial Services Limited, a non-banking finance company, provides retail financing services in India. The company offers micro enterprise, small and medium enterprise, two-wheeler, commercial vehicle, salaried personal, used car, tractor, and housing loans. MAS Financial Services Limited serves through distribution network of partner micro-finance institutions, non-banking finance companies, housing finance companies, and franchisees. The company was incorporated in 1995 and is based in Ahmedabad, India.",0.786,strong_buy,587.0
