180,180,STYRENIX,Styrenix Performance Materials Limited,EQ,29-MAR-1995,INE189B01011,chemicals,basic-materials,Commodities,Specialty Chemicals,2754.0,2768.5,2756.45,2810.95,2754.0,2768.5,2756.45,2810.95,18646.0,18646.0,50714.0,43244.0,43244.0,1286.0,3095.65,2735.063,2357.215,2779.15,0.790288,0.24450636,2.0,3.158,1.299,2.513,8966328.0,17585600.0,17596000.0,0.50153,1735603200.0,1734393600.0,31.0,1734393600.0,,,0.7993,10.0,1,10,4887.3017344,48565665792.0,564099968.0,32.076,254100000.0,24353300480.0,1384.81,3112600064.0,686305472.0,1557699968.0,457.548,6.074007,2.0068333,1.994,15.603,0.243,0.098,0.243,2156100096.0,122.55,,22.677681,0.08853,0.25052,0.12781,0.13608,0.15397,0.27533,"Styrenix Performance Materials Limited engages in the manufacture, trading, and sale of engineering thermoplastics in India. The company's products include Absolac, a plastic resin that is used for manufacturing of household appliances, automobile interiors and exteriors, consumer durables, and office equipment; and Absolan, which is primarily used in stationeries, cosmetic packing, industrial goods, electrical appliances, cosmetic jars, and household applications. It also offers general purpose poly styrene, a transparent polymer, which is used in TV light diffuser plate, XPS insulation boards, refrigerator drawers, medical labware, PSP and disposable packaging, CD jewel box, and clothes hanger; and high impact polystyrene resin that is used in electronic housing goods, refrigerator in-liner and door liner, injection mold, beverage cups, dairy products packaging, sheets, disposables, yogurt bottles, and toys; styroloy, a blended product which is used in automotive exterior, interior, household and electronics applications; Asalac, a polymer used for automotive exterior and interior applications. The company was formerly known as INEOS Styrolution India Limited and changed its name to Styrenix Performance Materials Limited in January 2023. Styrenix Performance Materials Limited was incorporated in 1973 and is based in Vadodara, India. Styrenix Performance Materials Limited operates as a subsidiary of Shiva Performance Materials Private Limited.",0.849,none,212.0
182,182,EMUDHRA,eMudhra Limited,EQ,01-JUN-2022,INE01QM01018,software-application,technology,Information Technology,IT Enabled Services,923.85,934.7,929.55,981.95,923.85,934.7,929.55,981.95,234612.0,234612.0,165583.0,119583.0,119583.0,429.4,1024.0,912.518,853.43976,965.2,0.97699547,0.24450636,2.0,,3.188,4.246,23541215.0,82811696.0,84884800.0,0.69281995,1735603200.0,1718841600.0,1.25,1718841600.0,,,0.12560001,5.0,1,5,7992.9851904,73384665088.0,1665440000.0,20.508,,4307279872.0,54.047,1019969984.0,-202293744.0,1048899968.0,84.923,11.365591,18.556921,17.037,71.948,0.128,0.466,0.194,808969984.0,9.98,19.1,96.71343,0.18781,0.40825,0.2368,0.18667999,0.08988,0.14636,"eMudhra Limited provides trust and enterprise solutions to individuals and organizations worldwide. The company provides enterprise signing solutions, such as emSinger enterprise signing suite, esign, digital stamp, and eBG; digital security solutions, which include emCA-certifiying solutions, identity and access management, multi-factor authentication, and CLM; digital trust services including private trust services, SSL/TL, code signing, email encryption, document signing, and IoT certificates, as well as emsign CertHub; and emSign managed services. It offers emSinger enterprise and emSinger for banks; bulksign; and remote sign as-a-services. It serves banking, government, manufacturing, healthcare, aviation, QTSP, telecom, enterprise, and electric vehicles industries. The company was incorporated in 2008 and is based in Bengaluru, India.",-0.04,buy,162.0
185,185,GRSE,Garden Reach Shipbuilders & Engineers Limited,EQ,10-OCT-2018,INE382Z01011,aerospace-defense,industrials,Industrials,Aerospace & Defense,1408.35,1444.85,1429.1,1462.9,1408.35,1444.85,1429.1,1462.9,247643.0,247643.0,801140.0,453219.0,453219.0,673.45,2833.8,1582.432,1663.4005,1447.8,0.5974026,0.24450636,2.0,3.924,,,27966179.0,114552000.0,114641000.0,0.75592005,1735603200.0,1726185600.0,1.44,1726185600.0,,,0.2685,10.0,1,10,16597.7243648,122052083712.0,37203382272.0,324.699,656705984.0,38464598016.0,335.832,2453815552.0,,,146.086,9.910601,4.315065,3.173,49.74,0.138,0.336,0.137,3677808128.0,33.66,53.53,43.012478,0.09562001,0.18892999,0.06379,0.04537,,,"Garden Reach Shipbuilders & Engineers Limited engages in the design and construction of war ships in India. The company offers frigates, anti-submarine warfare corvettes, missile corvettes, landing ship tanks, landing craft utilities, survey vessels, fleet replenishment tankers, fast patrol vessels, offshore patrol vessels, inshore patrol vessels, water jet fast attack crafts, anti-submarine warfare shallow water crafts, electric ferries, ocean going passenger and cargo ferry vessels, hovercrafts, and fast interceptor boats to the Indian Navy, Indian Coast Guard, and other governments. It also provides autonomous underwater vehicles, unmanned surface and aerial vessels, and naval surface guns. In addition, the company offers portable bridges; and deck machinery equipment, such as anchor capstan, anchor windlass, mooring and dock capstan, general purpose davits, ammunition davits, electric boat and electro-hydraulic boat davits, survey motor boat and hydrographic davits, oceanographic winch, anchor cum general purpose winches for beaching operations, helicopter traversing systems, etc. Further, it engages in the assembling, overhauling, and testing of marine diesel engines, as well as provides dry docking and afloat maintenance, refit, and repair services for defence and commercial ships. Garden Reach Shipbuilders & Engineers Limited was founded in 1884 and is based in Kolkata, India.",0.376,hold,97.0
188,188,BHAGERIA,Bhageria Industries Limited,EQ,02-MAR-2016,INE354C01027,specialty-chemicals,basic-materials,Commodities,Dyes And Pigments,180.13,184.0,179.81,184.0,180.13,184.0,179.81,184.0,19766.0,19766.0,18682.0,25434.0,25434.0,140.0,287.4,201.6902,192.5246,180.84,0.14114666,0.24450636,2.0,4.852,2.258,3.038,8125062.0,43644200.0,43867100.0,0.81391,1735603200.0,1724371200.0,1.0,1724371200.0,2:1,1563321600.0,0.1585,5.0,1,5,793.2925952,7301410816.0,814217984.0,18.648,257028000.0,5359071232.0,122.853,542502016.0,-149200624.0,206632000.0,121.472,1.4887381,1.48028,1.362,13.459,1.381,0.259,1.376,275379008.0,6.3,,28.70476,0.05139,0.35801,0.10123,0.043920003,0.022130001,0.05167,"Bhageria Industries Limited manufactures and trades in dyes, dye intermediates, and organic and basic chemicals in India and internationally. The company is also engaged in the generation and distribution of solar power; and provision of engineering, procurement, and commissioning/construction contractor services. It exports its products to Spain, South Korea, Japan, Taiwan, China, Indonesia, Thailand, Turkey, Mexico, the United States, Germany, Rest of Europe, and Africa. The company was formerly known as Bhageria Dye Chem Limited and changed its name to Bhageria Industries Limited in August 2015. Bhageria Industries Limited was incorporated in 1989 and is based in Mumbai, India.",0.995,none,405.0
191,191,COFORGE,Coforge Limited,EQ,30-AUG-2004,INE591G01017,information-technology-services,technology,Information Technology,Computers - Software & Consulting,8583.35,8601.85,8601.85,8963.5,8583.35,8601.85,8601.85,8963.5,374084.0,374084.0,499513.0,511656.0,511656.0,4287.25,10026.8,8898.022,6704.2227,8731.35,0.32324326,0.24450636,2.0,13.323,1.289,1.438,66161814.0,66859400.0,66881600.0,0.03733,1735603200.0,1728604800.0,19.0,1728604800.0,3:2,1188432000.0,0.6068,10.0,1,10,58396.6654464,585377054720.0,17728999424.0,265.847,10636999680.0,101448998912.0,1599.29,13505999872.0,15239874560.0,11820999680.0,896.479,9.739603,5.7562585,5.77,43.342,0.04,0.345,0.117,7970999808.0,125.32,208.66,69.67243,0.07857,0.39591,0.13313,0.09392,0.07749,0.14807999,"Coforge Limited provides information technology (IT) and IT enabled services in India, the Americas, Europe, the Middle East and Africa, India, and the Asia Pacific. The company offers digital process automation services, including workflow/process management, artificial intelligence (AI) and predictive analytics, RPA, and case management; digital services, such as interactive services, product engineering, enterprise, and intelligent automation; and cloud and infrastructure management services comprising cloud, workplace, cybersecurity, data center, and always on network, as well as service integration services. It also offers cybersecurity services, which include security incident management; vulnerability management; threat intelligence; identity and access management; phishing, analysis, and training; governance & risk management; and workplace security. In addition, the company provides AI and machine learning, business analytics and BI, data engineering and management, D&A Ops, and advisory services. Further, it offers engineering services consisting of product quality, advisory consulting,  automation engineering, business assurance testing, enterprise and product testing, AI, and ML infused testing services. Additionally, the company provides business process solutions. Coforge Limited serves insurance, travel, tourism, hospitality, banking and financial services, retail, healthcare, and public sectors. It has strategic alliances with Kong Inc. for cloud API services; and Newgen Software Technologies Limited to enhance digital operations for organizations. The company was formerly known as NIIT Technologies Limited and changed its name to Coforge Limited in August 2020. Coforge Limited was incorporated in 1992 and is based in Greater Noida, India.",0.694,buy,36.0
193,193,KIRLOSBROS,Kirloskar Brothers Limited,EQ,20-APR-2010,INE732A01036,specialty-industrial-machinery,industrials,Industrials,Compressors Pumps & Diesel Engines,1954.7,1965.85,1961.1,2008.95,1954.7,1965.85,1961.1,2008.95,83972.0,83972.0,300178.0,536123.0,536123.0,837.0,2684.0,2153.972,1907.8177,1992.35,1.2409859,0.24450636,2.0,8.997,0.81,1.899,25216870.0,79408896.0,79614096.0,0.69253,1735603200.0,1721952000.0,6.0,1721952000.0,,,0.12060001,2.0,1,2,15821.0310144,152599412736.0,7238000128.0,91.212,1672999936.0,42552991744.0,536.171,5544056832.0,2747883520.0,5014755840.0,233.525,8.531635,3.7179596,3.586,27.525,0.899,0.134,0.899,3948345088.0,49.65,,40.127895,0.09279,0.51088,0.13029,0.11595,0.09713,0.23833999,"Kirloskar Brothers Limited provides fluid management solutions in India and internationally. The company manufactures various pumps, including utility, solid handling, process, split-case, multi-stage, sump, vertical inline and turbine, non-clog submersible, special engineered, hydro turbines and PAT, and submersible pumps; and sluice/gate, non-return/check, globe, air, ball, suction diffuser, triple duty, and butterfly valves. It also provides hydro turbines comprising PAT, PICO, Kaplan, Francis, and Pelton turbines; and hydro-pneumatic, boiler feed, and firefighting pumping systems, as well as heating, ventilation, and air conditioning systems. In addition, the company offers steel castings for various industries, such as power, mining, cement, heavy engineering application, sugar, etc.; stators, rotors, and electric motors, as well as installs SPP pumps and systems; manufactures and sells head multi-stage and rubber lined slurry pumps, and metal lined bearings; and sells centrifugal, fire-fighting, and water and waste water pumps. Further, it is involved in the manufacture of API, non-API pumps, steam turbines, and hydraulic power recovery turbines; bare shaft and packaged pump sets; provision of solutions for HVAC, fire protection, turf irrigation, etc., as well as upgrade, repair and maintenance, and technical support services. The company serves building and construction, irrigation, marine and defence, oil and gas, power, valves, water resource management, retail pumps, and process industries through a network of dealers and distributors. Kirloskar Brothers Limited was founded in 1888 and is headquartered in Pune, India.",0.752,none,101.0
198,198,STERTOOLS,Sterling Tools Limited,EQ,02-FEB-2006,INE334A01023,tools-accessories,industrials,Consumer Discretionary,Auto Components & Equipments,509.35,522.9,513.85,548.0,509.35,522.9,513.85,548.0,169913.0,169913.0,293578.0,188963.0,188963.0,304.35,744.3,600.977,476.73874,540.55,0.2932589,0.24450636,2.0,26.287,,,8824600.0,36024200.0,36452100.0,0.79635,1735603200.0,1725580800.0,2.0,1725580800.0,5:1,1483920000.0,0.118999995,2.0,1,2,1947.2881664,19859703808.0,1049936000.0,29.145,1175332992.0,9930493952.0,275.634,1153707264.0,,,124.113,4.355305,1.9609177,2.0,17.214,0.402,0.277,0.409,607059008.0,18.13,,29.815224,0.06113,0.47109002,0.11618,0.08677,,,"Sterling Tools Limited manufactures and sells high tensile cold forged fasteners to original equipment manufacturers in India. The company offers standard, special, chassis, and engine fasteners; axle, engine, standard, and wheelant bolts, as well as hub/wheel bolts, hub nuts, and wheel studs; and motor control units for electric vehicles. It also leases immovable property; and manufactures and trades in motor control units; and manufactures magnet free motor and associated powertrain components. The company's products are used in automotive industries, which caters to passenger cars, commercial vehicles, and two wheelers. It also exports its products to Europe, the United States, South America, and the Middle East, and internationally. Sterling Tools Limited was incorporated in 1979 and is based in Faridabad, India.",0.691,strong_buy,306.0
203,203,SUDARSCHEM,Sudarshan Chemical Industries Limited,EQ,25-MAY-1995,INE659A01023,specialty-chemicals,basic-materials,Commodities,Dyes And Pigments,1115.1,1121.95,1108.5,1132.45,1115.1,1121.95,1108.5,1132.45,63455.0,63455.0,222050.0,224000.0,224000.0,500.95,1234.45,1070.907,944.70123,1127.35,1.1481409,0.24450636,2.0,46.161,0.619,1.206,36569810.0,71096200.0,71144096.0,0.42973,1735603200.0,1721952000.0,1.0,1721952000.0,5:1,1412035200.0,0.24209999,2.0,1,2,8020.4292096,82207907840.0,1786800000.0,25.693,5594070016.0,26596990976.0,385.038,3601690112.0,1028383744.0,2098560000.0,174.256,6.469505,3.0155401,3.091,22.825,0.654,0.159,0.674,1319629952.0,18.96,17.7,59.45939,0.04962,0.4365,0.13542,0.09262,0.05534,0.11404,"Sudarshan Chemical Industries Limited, together with its subsidiaries, manufactures and sells organic, inorganic, effect pigments, and dispersions in India, the United States, Europe, China, Mexico, Japan, and internationally. It operates in two segments, Pigments and Others. The company offers its pigment products under the Sudaperm, Sudatex, Sudafine, Sudacolor, Sudafast, Sumica, Sudadur, Sudasol, Sumicos, Sudatherm, Sudajet, Sudanyl, Sudacos, and Prestige brands that are used in coatings, paints, plastics, inks, cosmetics, textiles, printing, and other applications. It also manufactures pollution control equipment, size reduction equipment, pneumatic conveying systems, and grinding equipment for industrial applications; and clean air, grinding, and power handling solutions. The company was incorporated in 1951 and is headquartered in Pune, India.",0.474,buy,160.0
207,207,INDIAMART,Indiamart Intermesh Limited,EQ,04-JUL-2019,INE933S01016,internet-content-information,communication-services,Consumer Discretionary,Internet & Catalogue Retail,2209.65,2220.7,2213.15,2254.35,2209.65,2220.7,2213.15,2254.35,221073.0,221073.0,356392.0,272406.0,272406.0,2165.55,3198.4,2308.665,2646.8735,2239.05,-0.112108946,0.24450636,2.0,2.045,2.251,2.285,28007177.0,60008000.0,61201600.0,0.51664,1735603200.0,1717718400.0,20.0,1717718400.0,2:1,1687305600.0,0.2795,10.0,1,10,13436.0915968,108509757440.0,24316000256.0,405.687,384000000.0,12989750272.0,216.652,4144770048.0,4686965248.0,6056659968.0,313.208,7.1487637,10.343611,8.353,26.18,0.982,0.18,0.947,4305529856.0,71.59,,31.276018,0.33146,0.54998,0.31908,0.36353,0.073860005,0.25163,"IndiaMART InterMESH Limited operates an online business-to-business marketplace for business products and services in India and internationally. The company's e-marketplace acts as an interactive hub for domestic and international buyers and suppliers. Its platform serves small and medium enterprises, large enterprises, and individuals. IndiaMART InterMESH Limited was incorporated in 1999 and is based in Noida, India.",0.571,hold,109.0
208,208,SCHNEIDER,Schneider Electric Infrastructure Limited,EQ,20-MAR-2012,INE839M01018,electrical-equipment-parts,industrials,Industrials,Heavy Electrical Equipment,715.1,718.9,718.25,758.0,715.1,718.9,718.25,758.0,209541.0,209541.0,211709.0,173027.0,173027.0,410.9,980.0,783.196,802.56976,738.25,0.65609074,0.24450636,2.0,184.634,,,49611996.0,239104000.0,239188000.0,0.77572995,1735603200.0,1342656000.0,0.4,1342656000.0,,,,2.0,1,2,17658.0542464,178030690304.0,473000000.0,1.981,5468299776.0,23043399680.0,96.346,3289309952.0,,,8.852,83.39923,7.6629553,7.726,54.124,0.39,0.197,0.388,1855900032.0,8.22,,89.81143,0.08054,0.3756,0.14274,0.12793,,,"Schneider Electric Infrastructure Limited designs, manufactures, builds, and services products and systems for electricity distribution in India and internationally. The company offers distribution, medium power, and special transformers; substation automation systems, including power management systems, controllers and RTUs, communication elements, graphic user interfaces, engineering tools, SCADA and EMS gateways, and simulation tools; and ring main units. It also offers medium voltage distribution and grid automation products, such as Easergy T300, a remote terminal unit; EasyPact EXE, a vacuum circuit breaker; medium voltage switchgear; microgrids; digital substations; and Ecofit, a medium and low voltage equipment, as well as EcoStruxure grid, an IoT-enabled open and interoperable platform. In addition, the company provides partner managed, and field and automation services. Schneider Electric Infrastructure Limited serves the grid, power, utility, mining, minerals, metal, power generation, oil and gas, and smart city industries, as well as contractors, global strategic alliances, and panel builders. The company was formerly known as Smartgrid Automation Distribution and Switchgear Limited and changed its name to Schneider Electric Infrastructure Limited in December 2011. The company was incorporated in 2011 and is based in Gurugram, India. Schneider Electric Infrastructure Limited operates as a subsidiary of Energy Grid Automation Transformers and Switchgears India Private Limited.",0.27,none,92.0
214,214,TATACONSUM,TATA CONSUMER PRODUCTS LIMITED,EQ,18-NOV-1998,INE192A01025,packaged-foods,consumer-defensive,Fast Moving Consumer Goods,Tea & Coffee,955.55,960.0,926.05,960.0,955.55,960.0,926.05,960.0,2019564.0,2019564.0,1737740.0,2007926.0,2007926.0,882.9,1269.0,938.827,1085.7285,937.7,-0.16676837,0.24450636,2.0,14.401,0.634,1.448,621066159.0,989459008.0,997328000.0,0.34363,1735603200.0,1716508800.0,7.654853,1716508800.0,10:1,1277856000.0,0.64059997,1.0,1,1,92781.5696384,923418427392.0,23986399232.0,24.88,29546500096.0,162973794304.0,171.794,23807500288.0,11453974528.0,17939099648.0,198.448,4.7251673,5.693036,5.666,38.787,0.038,0.129,0.077,11502399488.0,11.94,14.94,78.53434,0.07058,0.43749002,0.14608,0.113170005,0.04674,0.062329996,"Tata Consumer Products Limited, together with its subsidiaries, produces, distributes, and trades in food products in India, the United States, the United Kingdom, and internationally. It operates through Branded Business and Non Branded Business segments. The company provides tea, coffee products, salt, mineral water, food ingredients, sweeteners, ready to cook and ready to eat options, breakfast cereals, snacks, mini meals, pulses, spices, sauces, chutney, pasta masala, ginger garlic paste, and dry fruits. It also offers health supplements; plant-based meat variants, including nuggets, burger patty, awadhi seekh kebab, and spicy fingers; honey and preserves; Chinese food products; glucose-based ready-to-serve drink; juices; and instant beverages. The company offers its products primarily under the Tata Tea, Tetley, 1868 by Tata Tea, Organic India, Tata Coffee Grand, Tata Coffee Gold, Tata Coffee Quick Filter, Sonnets by Tata Coffee, Tata Salt, Tata Sampann, Smith & Jones, Tata Sampann Yumside, Tata Soulfull, Himalayan honey and preserves, Ching's Secret, Tata Simply Better, Tata GoFit, Himalayan water, Tata Copper+, Tata Gluco+, Tata Fruski, Good Earth, Teapigs, Eight O'Clock, Tata Raasa, Joyfull Millets, Ching's Secret, Vitax, Laager, and Tea4Kidz brands. Tata Consumer Products Limited was formerly known as Tata Global Beverages Limited and changed its name to Tata Consumer Products Limited in February 2020. The company was incorporated in 1962 and is headquartered in Mumbai, India.",0.578,buy,25.0
216,216,PNBHOUSING,PNB Housing Finance Limited,EQ,07-NOV-2016,INE572E01012,mortgage-finance,financial-services,Financial Services,Housing Finance Company,856.6,856.7,856.6,899.6,856.6,856.7,856.6,899.6,657966.0,657966.0,1843230.0,944728.0,944728.0,604.0,1202.2,893.888,863.90576,895.6,0.0004671812,0.24450636,2.0,249.104,3.983,3.983,111608749.0,259855008.0,259855008.0,0.29448998,1735603200.0,1563494400.0,7.454163,1563494400.0,,,,10.0,1,10,23272.6134784,596048871424.0,21749999616.0,83.725,395272388608.0,32666099712.0,125.789,,,-62555398144.0,610.819,1.4662281,7.124393,18.247,,0.223,0.191,0.226,16801800192.0,64.5,67.9,13.885271,0.51435,0.98802,,0.74957,0.0231,0.111719996,"PNB Housing Finance Limited operates as a housing finance company in India. It provides loans to individuals and corporate bodies for purchase, construction, repair, and up-gradation of houses/flats/commercial properties; residential plot loans and loans for NRIs; loan against property, lease rental discounting, and loans for real estate developers; home loans and fixed deposit products. PNB Housing Finance Limited was incorporated in 1988 and is based in New Delhi, India.",0.658,buy,76.0
224,224,BRIGADE,Brigade Enterprises Limited,EQ,31-DEC-2007,INE791I01019,real-estate-development,real-estate,Consumer Discretionary,Residential Commercial Projects,1103.75,1113.9,1113.9,1166.75,1103.75,1113.9,1113.9,1166.75,264656.0,264656.0,302677.0,231602.0,231602.0,827.0,1453.1,1213.025,1227.393,1137.8,0.11281943,0.24450636,2.0,153.745,,,115449948.0,244252000.0,244562000.0,0.46771,1735603200.0,1722297600.0,2.0,1722297600.0,3:2,1566950400.0,0.0932,10.0,1,10,27826.2644736,282815987712.0,18949500928.0,81.997,54699499520.0,53204398080.0,230.284,13058724864.0,,,157.908,7.2054615,5.2300687,5.316,21.657,1.175,0.648,1.173,4968000000.0,20.42,33.61,55.719883,0.093380004,0.42126998,0.24544,0.20846,,,"Brigade Enterprises Limited provides real estate development, leasing, and related services in India. It operates through Real Estate, Hospitality, and Leasing segments. The company develops and sells various residential and commercial, and retail properties. It also manages hotels, state-of the-art convention centers, and recreation clubs. Brigade Enterprises Limited was founded in 1986 and is based in Bengaluru, India.",0.807,strong_buy,62.0
227,227,MASFIN,MAS Financial Services Limited,EQ,18-OCT-2017,INE348L01012,credit-services,financial-services,Financial Services,Non Banking Financial Company (NBFC),247.05,248.0,245.1,254.6,247.05,248.0,245.1,254.6,1054666.0,1054666.0,208518.0,180827.0,180827.0,239.95,387.95,274.669,287.0795,247.45,-0.23632151,0.24450636,2.0,332.329,134.607,136.806,43449796.0,181452992.0,181600000.0,0.73317003,1735603200.0,1725408000.0,0.51,1725408000.0,3:1,1708560000.0,0.088,10.0,1,10,4493.6921088,109586292736.0,12535700480.0,77.286,81665499136.0,6706599936.0,40.896,,,-17767499776.0,149.128,1.6593127,6.7004027,16.34,,0.268,0.281,0.254,2814000128.0,17.17,21.1,14.411764,0.41959,0.92427003,,0.59801996,0.02853,0.13789,"MAS Financial Services Limited, a non-banking finance company, provides retail financing services in India. The company offers micro enterprise, small and medium enterprise, two-wheeler, commercial vehicle, salaried personal, used car, tractor, and housing loans. MAS Financial Services Limited serves through distribution network of partner micro-finance institutions, non-banking finance companies, housing finance companies, and franchisees. The company was incorporated in 1995 and is based in Ahmedabad, India.",0.786,strong_buy,217.0
232,232,SKYGOLD,Sky Gold Limited,BE,06-JAN-2023,INE01IU01018,luxury-goods,consumer-cyclical,Consumer Discretionary,Gems Jewellery And Watches,377.8,378.9,374.9,389.7,377.8,378.9,374.9,389.7,208785.0,208785.0,441532.0,469202.0,469202.0,89.295,488.55,392.2928,254.02612,379.7,2.2800834,0.24450636,2.0,135.31,,,3537945.0,146540000.0,147006000.0,0.71656,1735603200.0,1695168000.0,0.1,1695168000.0,10:1,1734307200.0,0.024300002,10.0,1,10,5581.817856,44892598272.0,767582016.0,56.214,3303154944.0,20928133120.0,1725.246,932428736.0,,,184.417,2.0589209,2.667136,2.145,48.146,0.608,0.924,0.989,510379008.0,7.4,,51.31081,0.024389999,0.060370002,0.044549998,0.048699997,,0.29825002,"Sky Gold Limited designs, manufactures, assembles, cuts, polishes, markets, and sells gold and silver jewelry in India. The company offers necklaces, rings, pendants, bracelets, earrings, bangles, and various other jewelry, as well as customized jewelry. It also imports, exports, buys, sells, deals, distributes, and wholesales jewelry. The company serves wholesalers, showrooms, and retailers. Sky Gold Limited was founded in 2005 and is based in Thane, India.",-0.231,none,200.0
