1036,1036,HYBRIDFIN,Hybrid Financial Services Limited,EQ,05-DEC-2022,INE965B01022,capital-markets,financial-services,Financial Services,Non Banking Financial Company (NBFC),12.84,13.09,13.09,13.09,12.84,13.09,13.09,13.09,5985.0,5985.0,14112.0,2214.0,2214.0,8.3,16.9,13.8936,12.35945,13.09,0.3237114,0.24251366,2.0,3.793,6.021,6.086,10131463.0,29436300.0,30490800.0,0.64018,,,,,,,,5.0,1,5,39.9124576,208231264.0,189170000.0,6.492,16000000.0,64275000.0,2.185,,,21991000.0,14.479,0.904068,6.2096395,3.24,,1.111,0.592,1.131,36518000.0,1.24,,10.556452,0.56815,0.98981005,,0.62698,0.0705,0.10143,"Hybrid Financial Services Limited, together with its subsidiaries, provides management consultancy services primarily in India. The company offers debt recovery advice; and consultancy services in financial, secretarial, commercial, legal, direct and indirect taxation, other levies, statistical, accountancy, and other fields. It also engages in share and stock broking; investment; and depository participant and marketing of financial products. The company was formerly known as Mafatlal Finance Company Limited and changed its name to Hybrid Financial Services Limited in 2008. Hybrid Financial Services Limited was incorporated in 1986 and is headquartered in Mumbai, India.",-2.474,none,1496.0
1040,1040,IGARASHI,Igarashi Motors India Limited,EQ,09-OCT-2003,INE188B01013,auto-parts,consumer-cyclical,Consumer Discretionary,Auto Components & Equipments,661.6,656.7,629.9,657.65,661.6,656.7,629.9,657.65,33626.0,33626.0,101521.0,32047.0,32047.0,402.0,848.95,733.926,624.97974,638.35,0.2656145,0.24251366,2.0,30.892,,,7367050.0,31475000.0,31512200.0,0.76808,1735603200.0,1722384000.0,1.0,1722384000.0,227:202,1538006400.0,0.19309999,10.0,1,10,2009.2065792,23699734528.0,196790000.0,6.252,1380849024.0,7788653056.0,247.782,746953024.0,,,142.013,4.495011,2.5796585,3.043,31.729,4.756,0.32,4.725,163080992.0,7.21,,88.53675,0.02094,0.31423,0.0959,0.05821,,,"Igarashi Motors India Limited manufactures and sells electric micro motors and motor components in India, the United States, Japan, Germany, Hong Kong, and internationally. The company operates through two segments: Automotive and Non-automotive. Its products include ceiling fans motors and printed circuit boards; and electrical, general purpose, and special purpose machinery and equipment. The company was formerly known as CG Igarashi Motors Limited and changed its name to Igarashi Motors India Limited in July 2003. The company was incorporated in 1992 and is based in Chennai, India. Igarashi Motors India Limited operates as a subsidiary of Agile Electric Sub Assembly Private Limited.",0.989,none,793.0
1044,1044,SVLL,Shree Vasu Logistics Limited,EQ,21-APR-2023,INE00CE01017,trucking,industrials,Services,Logistics Solution Provider,450.2,459.2,459.2,459.2,450.2,459.2,459.2,459.2,733.0,733.0,21015.0,4729.0,4729.0,198.8,459.2,344.216,270.4934,459.2,0.7661828,0.24251366,2.0,336.139,,,3061729.0,11466000.0,11692600.0,,1703980800.0,,,,3:2,1665446400.0,,10.0,1,10,526.5187328,4810057216.0,9733000.0,0.848,1074082048.0,1276102016.0,111.373,382874752.0,,,27.352,16.788536,4.1259923,3.769,12.563,0.032,0.156,0.026,31398000.0,1.62,,283.4568,0.024600001,0.80831003,0.30003,0.1162,,,"Shree Vasu Logistics Limited engages in the logistics business in India. It provides carrying and forwarding agency, warehouse renting, packing, and transportation and distribution services, as well as value-added services and third-party logistics solutions. The company serves customers in various industries, such as agriculture, petroleum, food-industry, FMCG, medicines and cosmetics, paints and adhesives, wires and cables, kitchenware, computers peripherals, gensets, and pumps and batteries. Shree Vasu Logistics Limited was founded in 1987 and is based in Raipur, India.",0.253,none,1132.0
1046,1046,SCHNEIDER,Schneider Electric Infrastructure Limited,EQ,20-MAR-2012,INE839M01018,electrical-equipment-parts,industrials,Industrials,Heavy Electrical Equipment,727.8,732.0,691.0,739.25,727.8,732.0,691.0,739.25,202727.0,202727.0,209256.0,163294.0,163294.0,418.8,980.0,780.076,801.746,712.15,0.6721425,0.24251366,2.0,184.634,,,49611996.0,239104000.0,239104000.0,0.77572995,1735603200.0,1342656000.0,0.4,1342656000.0,,,,2.0,1,2,17027.7912576,178030690304.0,473000000.0,1.981,5468299776.0,23043399680.0,96.346,3289309952.0,,,8.852,80.450745,7.389444,7.726,54.124,0.39,0.197,0.388,1855900032.0,8.22,,86.63625,0.08054,0.3756,0.14274,0.12793,,,"Schneider Electric Infrastructure Limited designs, manufactures, builds, and services products and systems for electricity distribution in India and internationally. The company offers distribution, medium power, and special transformers; substation automation systems, including power management systems, controllers and RTUs, communication elements, graphic user interfaces, engineering tools, SCADA and EMS gateways, and simulation tools; and ring main units. It also offers medium voltage distribution and grid automation products, such as Easergy T300, a remote terminal unit; EasyPact EXE, a vacuum circuit breaker; medium voltage switchgear; microgrids; digital substations; and Ecofit, a medium and low voltage equipment, as well as EcoStruxure grid, an IoT-enabled open and interoperable platform. In addition, the company provides partner managed, and field and automation services. Schneider Electric Infrastructure Limited serves the grid, power, utility, mining, minerals, metal, power generation, oil and gas, and smart city industries, as well as contractors, global strategic alliances, and panel builders. The company was formerly known as Smartgrid Automation Distribution and Switchgear Limited and changed its name to Schneider Electric Infrastructure Limited in December 2011. The company was incorporated in 2011 and is based in Gurugram, India. Schneider Electric Infrastructure Limited operates as a subsidiary of Energy Grid Automation Transformers and Switchgears India Private Limited.",0.27,none,285.0
1049,1049,CDSL,Central Depository Services (India) Limited,EQ,30-JUN-2017,INE736A01011,capital-markets,financial-services,Financial Services,Depositories Clearing Houses and Other Intermediaries,1527.55,1526.0,1474.05,1526.0,1527.55,1526.0,1474.05,1526.0,2986003.0,2986003.0,3695800.0,2734659.0,2734659.0,811.0,1989.8,1711.288,1373.1505,1504.7,0.73437417,0.24251366,2.0,0.066,2.237,2.416,174481560.0,209000000.0,218694000.0,,1735603200.0,1721088000.0,1.5,1721088000.0,2:1,1724371200.0,0.3726,10.0,1,10,31448.2294784,306538381312.0,8391724032.0,40.152,10415000.0,11428728832.0,54.671,7270005248.0,3918866176.0,5285935104.0,73.158,20.567812,27.51682,26.822,42.165,0.488,0.558,0.488,5329111040.0,25.51,31.59,58.98471,0.46629003,1.0,0.63612,0.62514,0.2394,0.37493,"Central Depository Services (India) Limited, together with its subsidiaries, provides depository services in India. It operates through Depository; Data Entry and Storage; and Repository segments. The Depository segment offers various services to investors, such as dematerialisation, rematerialisation, holding, transfer, and pledge of securities in electronic form; and e-voting services to companies. Its Data Entry and Stroage segment provides centralized record keeping of KYC document of capital market investors. The Repository segment offers policyholders/warehouse receipt holders a facility to keep insurance policies/warehouse receipts in electronic form and to undertake changes, modifications, and revisions in the policy/receipt. It also provides account opening, processing delivery and receipt instructions, pledging, nomination, transmission of securities, change in address, bank account details, and SMS services for depository participants (DPs). In addition, the company offers various services, such as electronic access to security information, electronic access to security information and execution of secured transaction, SMS alerts related to transactions, electronic consolidated account statements, and virtual annual general meetings; Myeasi mobile application; application programming interfaces for DPs, electronic delivery instruction slip, and electronic margin pledge; and electronic foreign investment monitoring, electronic system driven disclosure services, and electronic notices, as well as e-locker services. Further, it provides KYC registration agency, eKYC, electronic signature service, tax filing, stamp duty calendar, electronic negotiable warehouse receipts and electronic non-negotiable warehouse receipts, and electronic insurance account. The company serves market participants, exchanges, clearing corporations, DPs, issuers, and investors. Central Depository Services (India) Limited was incorporated in 1997 and is based in Mumbai, India.",0.444,hold,188.0
1050,1050,JYOTHYLAB,Jyothy Labs Limited,EQ,19-DEC-2007,INE668F01031,household-personal-products,consumer-defensive,Fast Moving Consumer Goods,Household Products,385.0,385.0,369.2,385.45,385.0,385.0,369.2,385.45,662449.0,662449.0,753806.0,507904.0,507904.0,366.8,595.85,402.191,469.9355,375.05,-0.2816494,0.24251366,2.0,2.793,,,114752701.0,367214016.0,379614016.0,0.68741995,1735603200.0,1719964800.0,3.5,1719964800.0,2:1,1530144000.0,0.3428,1.0,1,1,13772.3609088,156492840960.0,6099299840.0,16.61,505600000.0,28157700096.0,76.694,4878575104.0,,,49.245,7.6160016,4.891153,5.558,32.078,0.057,0.08,0.057,3748900096.0,10.24,5.05,36.625977,0.13314,0.497,0.17326,0.16182,,,"Jyothy Labs Limited, together with its subsidiaries, engages in the manufacture and marketing of fabric care, dishwashing, personal care, and household insecticides products in India and internationally. It operates through Dishwashing, Fabric Care, Household Insecticides, Personal Care, and Others segments. The Dishwashing segment offers dish wash bars, gels, and liquids, as well as dish wash scrubbers and powders under the Pril and Exo brands. The Fabric Care segment provides fabric whiteners, fabric enhancers, detergent powders, and detergent liquids and bar soaps under the Henko, Mr. White, Ujala, and More light brands. The Household Insecticides segment offers mosquito repellent coils, liquids, and insect repellent sticks, as well as surface cleaners and air care products under the Maya, T- Shine, and Maxo brands. The Personal Care segment provides body soaps, toothpastes, deodorants, talcum powders, after shave products, and hand washes under the Margo, Fa, and Neem Active brands. The Others segment offers incense sticks under the Maya brand; toilet and floor cleaner products; and provides dry cleaning and laundry services under the Fabric Spa brand. The company was formerly known as Jyothy Laboratories Limited and changed its name to Jyothy Labs Limited in July 2019. Jyothy Labs Limited was founded in 1983 and is based in Mumbai, India.",0.586,buy,331.0
1051,1051,GOCOLORS,Go Fashion (India) Limited,EQ,30-NOV-2021,INE0BJS01011,apparel-retail,consumer-cyclical,Consumer Discretionary,Speciality Retail,968.45,965.7,927.1,968.45,968.45,965.7,927.1,968.45,17894.0,17894.0,46562.0,69501.0,69501.0,923.6,1407.8,1041.53,1104.4485,939.05,-0.13523531,0.24251366,2.0,75.478,2.06,3.722,25435941.0,54009000.0,54714500.0,0.46351,1735603200.0,,,,,,,10.0,1,10,5071.7151232,53148585984.0,2373040896.0,44.049,4932576256.0,8125015040.0,150.449,1707251968.0,1318568192.0,2202564096.0,121.308,7.7410393,6.2420993,6.541,31.131,0.032,0.104,0.03,857384000.0,15.88,,59.13413,0.10552,0.60568,0.21011999,0.15609,0.078839995,0.14057,"Go Fashion (India) Limited engages in the design, development, sourcing, marketing, and retailing of women's and girl's bottom-wear products under the Go Colors brand in India. Its bottom-wear products include churidars, leggings, harem pants, patialas, palazzos, salwars, culottes, pants, trousers, joggers, capris, treggings, shorts, and jeggings in various categories, such as ethnic wear, western wear, fusion wear, athleisure, denims, plus sizes, and girl's wear. The company sells its products through retail and department stores, exclusive business outlets, and multi-brand outlets, as well as through its website and online marketplaces. Go Fashion (India) Limited was incorporated in 2010 and is headquartered in Chennai, India.",-0.107,strong_buy,560.0
1052,1052,NDL,Nandan Denim Limited,EQ,23-MAR-2012,INE875G01030,textile-manufacturing,consumer-cyclical,Consumer Discretionary,Other Textile Products,4.72,4.75,4.48,4.75,4.72,4.75,4.48,4.75,2273066.0,2273066.0,2488117.0,2409093.0,2409093.0,2.625,7.35,5.025,5.00298,4.55,0.7777778,0.24251366,4.0,51.191,1.04,1.403,572466190.0,1441469952.0,1453689984.0,0.52568,1735603200.0,1567641600.0,0.016667,1567641600.0,10:1,1726704000.0,,10.0,1,10,655.8688768,9397742592.0,240291008.0,0.167,3079335936.0,26131709952.0,17.736,1423393024.0,-58363000.0,1155053952.0,4.173,1.0903428,0.25098583,0.36,6.602,0.053,1.052,0.07,513320992.0,0.71,18.19,6.408451,0.01964,0.15630999,0.05447,0.02229,0.047849998,0.08911,"Nandan Denim Limited engages in the manufacture and sale of denim and cotton fabrics, dyed yarns, shirting fabrics, and fibers in India. The company offers core classics, reinvented classics, novelties, structured, knit, light weight, blends, feather touch, stretch tech, and prints denims; plain, twill, dobby, chambray, fil a fil, herringbone, basket weave, and pin-point oxford shirting fabrics; and grey cotton fabrics, and khakis. It also exports its products. The company offers its products to fabric re-seller, garment converter, distributors, wholesalers, dealers, brand owners, and exporters. The company was formerly known as Nandan Exim Limited and changed its name to Nandan Denim Limited in November 2013. Nandan Denim Limited was incorporated in 1994 and is based in Ahmedabad, India.",0.871,none,1068.0
1057,1057,HAVELLS,Havells India Limited,EQ,21-MAR-2001,INE176B01034,electrical-equipment-parts,industrials,Consumer Discretionary,Consumer Electronics,1576.55,1574.95,1535.55,1576.5,1576.55,1574.95,1535.55,1576.5,820747.0,820747.0,940244.0,1605102.0,1605102.0,1280.0,2106.0,1667.209,1785.9587,1553.65,0.20752907,0.24251366,2.0,4.247,0.914,1.874,281033595.0,626942016.0,626982016.0,0.63589,1735603200.0,1717113600.0,4.0,1737504000.0,5:1,1409011200.0,0.4,1.0,1,1,97411.0654464,948153024512.0,31883200512.0,50.874,3316300032.0,202013999104.0,322.3,19384399872.0,9656887296.0,19144400896.0,118.828,13.07478,4.8219957,4.694,48.913,0.078,0.164,0.077,14107400192.0,22.39,31.16,69.39036,0.06983,0.32479998,0.09596,0.06178,0.08628,0.19171,"Havells India Limited, a fast-moving electrical goods company, manufactures, trades in, and sells various consumer electrical and electronic products in India and internationally. It operates through six segments: Switchgears, Cables, Lighting and Fixtures, Electrical Consumer Durables, Lloyd Consumer, and Others. The company offers switches; switchgears, such as circuit breakers, energy savers, human safety equipment, distribution boards, surge protection devices, and control and monitoring devices, as well as magnetic contractor, thermal overload relays, and starters; lighting products; and home appliances comprising air conditioners, LED televisions, washing machines, refrigerators, air coolers and purifiers, appliances, personal grooming products, and water heaters and purifiers. It also provides flexible, power, control, and fire survival cables; fans comprising ceiling, table, pedestal, wall, ceiling mounting, personal, and domestic exhaust fans; centrifugal, mono block, submersible, borewell and sewage submersible, pressure, and shallow well jet pumps; dishwashers; air circulators; and heavy-duty exhaust fans. In addition, the company offers crane duty, smoke, brake, inverter duty, and energy efficient motors; reactive power solutions; solar rooftop on grid, solar off grid, and solar on grid inverter solutions; and power solutions, including power capacitors, IOT enabled IPFC relays, HD harmonic detuned reactors, IOT enabled APFC panels, and high PIV thyristor switches. The company offers its products under the Havells, Lloyd, Havells Crabtree, Standard, REO, and Havells Studio brands. It also exports its products approximately to 70 countries. Havells India Limited was founded in 1958 and is based in Noida, India.",0.661,buy,71.0
1061,1061,ZODIAC,Zodiac Energy Limited,BE,14-DEC-2021,INE761Y01019,other_industry,other_sector,Industrials,Civil Construction,442.8,439.5,420.7,439.5,442.8,439.5,420.7,439.5,19582.0,19582.0,15265.0,17415.0,17415.0,245.7,816.5,511.43,596.5525,420.7,0.5033101,0.24251366,2.0,85.785,,,3911405.0,,,0.72233003,,,2.5,1568851200.0,2:1,1602115200.0,,10.0,1,10,,7622200832.0,15710000.0,1.072,408115008.0,2673033984.0,182.594,208753504.0,,,32.511,12.940235,,2.852,36.513,1.839,1.472,1.844,124817000.0,3.73,,112.78821,0.046690002,0.15211001,0.078099996,0.05,,,"Zodiac Energy Limited engages in the installation of solar power generation plants and related items primarily in India. The company offers solar photovoltaic (PV) systems; solar water heaters for residential, commercial, and industrial uses; and grid connected solar PV systems, rooftop solar PV systems, off grid solar PV systems, solar pumping solutions, building integrated PV systems, etc. It also provides engineering, procurement, and construction services to captive power producers; generates solar energy; and design, supply, testing and commissioning, and operation and maintenance, as well as turnkey solutions for power plants or diesel and gas generator sets. The company was incorporated in 1992 and is headquartered in Ahmedabad, India.",0.197,none,
1062,1062,KSOLVES,Ksolves India Limited,EQ,23-SEP-2022,INE0D6I01015,software-application,technology,Information Technology,Computers - Software & Consulting,984.65,994.5,984.65,1035.0,984.65,994.5,984.65,1035.0,128379.0,128379.0,30926.0,39103.0,39103.0,900.0,1319.25,979.573,1050.4752,1025.75,-0.22980952,0.24251366,2.0,,1.555,2.426,4018386.0,11856000.0,12048100.0,0.64221,1735603200.0,1730073600.0,8.0,1730073600.0,2:1,1738800000.0,0.8937,10.0,1,10,1216.1292288,11709424640.0,155883008.0,13.146,,1252563968.0,105.656,505931008.0,333522880.0,388756000.0,20.101,51.0298,9.709119,9.348,23.144,0.117,0.34,0.117,364758016.0,31.9,,32.155174,0.29121,0.57712,0.40392,0.36108002,0.65494,1.19699,"Ksolves India Limited provides software services and solutions India and internationally. It designs, develops, and maintains software systems and solutions; creates new applications; and enhances the functionality of its customer's existing software products; and provides enterprise solutions and consulting, as well as range of information technology solutions. The company's solutions include salesforce, java, microservices, artificial intelligence, machine learning, big data, odoo, cross platform, and openshift development services. It also offers tech services, including magento, ruby on rails, prestashop, iOS and android application, reactJS application, and node.js application development, as well as test automation and penetration and performance testing services. The company serves real estate, education and learning, E-commerce and retail, social media and networking, logistics, healthcare, tech and software, life sciences, finance, telecom, CRM, and travel sectors. Ksolves India Limited was founded in 2012 and is based in Noida, India.",0.436,none,924.0
1067,1067,FMGOETZE,Federal-Mogul Goetze (India) Limited.,EQ,08-FEB-1995,INE529A01010,auto-parts,consumer-cyclical,Consumer Discretionary,Auto Components & Equipments,381.55,378.1,378.0,390.1,381.55,378.1,378.0,390.1,43588.0,43588.0,47712.0,50184.0,50184.0,313.05,489.0,398.307,411.48624,381.7,0.045628905,0.24251366,2.0,0.665,,,13916934.0,55632100.0,55909200.0,0.78866,1735603200.0,1125964800.0,4.0,1125964800.0,,,,10.0,1,10,2123.4774016,18256068608.0,4181731072.0,75.168,78711000.0,17340669952.0,311.681,2563689216.0,,,199.58,1.9125164,1.2245648,1.053,7.121,0.186,0.082,0.186,1324526976.0,24.92,,15.317015,0.07638,0.61676,0.14784001,0.09314,,,"Federal-Mogul Goetze (India) Limited engages in the manufacture, supply, and distribution of automotive components for two/three/four-wheeler automobiles in India and internationally. The company provides pistons, piston rings, and wet and dry cylinder liners for a range of applications, including bi-wheelers, passenger cars, SUVs, tractors, light and heavy commercial vehicles, locomotive engines, stationary engines, and high output locomotive diesel engines. It also offers sintered metal products for various engines and automotive applications, such as valve trains, transmission, lubrication pumps, and other engine/structural parts. It exports its products. The company was formerly known as Goetze (India) Limited and changed its name to Federal-Mogul Goetze (India) Limited in 2006. The company was incorporated in 1954 and is based in Gurugram, India. Federal-Mogul Goetze (India) Limited is a subsidiary of Federal Mogul Holding Limited.",0.484,none,774.0
1072,1072,INDOAMIN,Indo Amines Limited,EQ,29-APR-2022,INE760F01028,chemicals,basic-materials,Commodities,Specialty Chemicals,152.83,154.19,145.0,154.19,152.83,154.19,145.0,154.19,123393.0,123393.0,336145.0,444847.0,444847.0,106.6,248.4,173.9908,164.0451,149.43,-0.062680185,0.24251366,2.0,82.324,,,13957691.0,72587600.0,72620800.0,0.78656,1735603200.0,1726531200.0,0.5,1726531200.0,,,0.0704,5.0,1,5,1085.1725312,13693790208.0,222687008.0,3.114,2169758976.0,9649582080.0,137.401,852703232.0,,,37.246,4.0119743,1.1245798,1.419,16.059,0.627,0.088,0.589,499723008.0,7.31,,20.44186,0.05179,0.30813,0.088369995,0.088149995,,,"Indo Amines Limited engages in the manufacture, distribution, and sale of fine and specialty chemicals in India and internationally. The company's fine chemicals comprise aliphatic and aromatic amines, aliphatic and aromatic nitriles, halides, alcohols, cycloalkanols, cycloalkanones, acids and esters, advanced intermediates, amine hydrochlorides, ethanol amines, and other products. Its specialty chemicals include fatty acids, amides, amines, di-amines, tertiary amines, polyamines, amine ethoxylates, and ammonium quats. The company's performance chemicals comprise anticaking, antifoaming, antistatic, antistripping, antibacterial/antislime, and floatation agents, as well as granulating aids, defoamers, emulsifiers, curing aids, bitumen emulsifiers, corrosion inhibitors, demulsifiers, and antibacterial products. Its products are used in pharmaceuticals, agrochemicals, fertilizers, petrochemicals, perfumery chemicals, road construction, pesticides, dyes and intermediates, water treatment chemicals, oil field chemicals, mining, paints, pigments, polymers, metal working and lubricants, additives, textile processing chemicals, cosmetics, home and personal care applications, printing inks, rubber chemicals, surfactants, etc. The company was incorporated in 1992 and is based in Thane, India.",0.893,none,954.0
1074,1074,PPLPHARMA,Piramal Pharma Limited,EQ,19-OCT-2022,INE0DK501011,drug-manufacturers-specialty-generic,healthcare,Healthcare,Pharmaceuticals,240.9,241.6,236.65,244.15,240.9,241.6,236.65,244.15,3337268.0,3337268.0,10807609.0,7341648.0,7341648.0,114.35,307.9,252.557,202.16196,242.3,0.67640924,0.24251366,2.0,60.533,0.427,1.028,608986535.0,1319830016.0,1339849984.0,0.54719,,1720742400.0,0.11,1720742400.0,,,0.2821,10.0,1,10,32012.6779392,365753925632.0,4084100096.0,3.073,47864098816.0,87038197760.0,66.045,12872699904.0,-3665387520.0,6809999872.0,59.505,4.0719266,3.6780033,4.202,28.413,3.25,0.173,3.5,453300000.0,0.39,,621.2821,0.00521,0.60153997,0.1479,0.06664,0.024549998,0.00579,"Piramal Pharma Limited operates as a pharmaceutical company in North America, Europe, Japan, India, and internationally. The company offers a portfolio of pharmaceutical products and services through global development and manufacturing facilities and distribution network. It also operates contract development and manufacturing organization that provides services across the spectrum of the drug life cycle, including discovery, development, and commercial manufacturing of drug substances and products; complex hospital generics business which offers inhalation anesthetics, intrathecal therapy for spasticity management, injectable pain and anesthesia drugs, and other generic and specialty products; and India consumer healthcare business comprising analgesics, skin care, vitamin/mineral supplement, kids' wellness, digestives, women's health, and hygiene and protection. The company was incorporated in 2020 and is based in Mumbai, India.",0.084,strong_buy,184.0
1077,1077,KNRCON,KNR Constructions Limited,EQ,18-FEB-2008,INE634I01029,engineering-construction,industrials,Industrials,Civil Construction,313.35,313.25,300.15,313.25,313.35,313.25,300.15,313.25,692665.0,692665.0,1422933.0,690317.0,690317.0,236.75,415.4,325.973,324.509,305.4,0.19235158,0.24251366,2.0,36.094,,,143869674.0,281235008.0,287203008.0,0.48814,1735603200.0,1726617600.0,0.25,1726531200.0,2:1,1612310400.0,0.0064,2.0,1,2,8588.9171456,92564602880.0,4505352192.0,16.029,12624370688.0,44334682112.0,157.614,11331733504.0,,,126.377,2.416579,1.9372908,2.088,8.169,0.258,0.004,0.259,8128686080.0,39.36,16.64,7.759146,0.18335,0.39134,0.2556,0.25232,,,"KNR Constructions Limited, together with its subsidiaries, engages in the construction, engineering, and infrastructure development activities in India. It provides engineering, procurement, and construction services for roads, highways, bridges and flyovers, expressways, viaducts, irrigation, urban water infrastructure management, and other projects. The company was incorporated in 1995 and is based in Hyderabad, India.",0.77,hold,427.0
