944,944,TEXRAIL,Texmaco Rail & Engineering Limited,EQ,03-MAR-2011,INE621L01012,other_industry,other_sector,Industrials,Industrial Products,235.08,236.8,220.0,237.25,235.08,236.8,220.0,237.25,2261874.0,2261874.0,6413652.0,2250592.0,2250592.0,110.7,296.49,258.1962,201.54214,227.67,,,2.0,24.941,,,207888199.0,399467008.0,,0.48256,1735603200.0,1726704000.0,,,,,0.0395,1.0,1,1,9097.3741056,93184425984.0,6978678784.0,17.475,6310967808.0,37377601536.0,102.621,3169192192.0,,,63.408,3.5905564,2.4339106,2.493,29.403,1.275,0.358,1.85,1367954048.0,3.81,6.3,59.755905,0.0366,0.1531,0.08479,0.06948,,,"Texmaco Rail & Engineering Limited operates as an engineering and infrastructure company in India and internationally. It operates through three segments: Heavy Engineering, Steel Foundry, and Rail EPC. The company offers payload stainless/high tensile steel freight, commodity-specific, special purpose freight, bottom discharge coal hopper, container flat and tank wagons, defense equipment and auto car wagons, and high capacity parcel and brake vans. It provides various domestic steel foundaries; industrial casting for earth moving equipment, hydro power projects, defence, and steel plant; and exports axel bogies, wear resistance shroud and pointer casting center plates, AAR yokes and couplers, follower and knuckles, car cushion yokes ends, articulated couplers, and mark 390 locomotive yokes. The company also constructs railway tracks, metro signaling and telecommunication, overhead and general electrification, railway civil works, metro track and automatic fare collection system, and other power supply installing, railway buildings, platforms, and foot over bridges, as well as rail connectivity and feeder separation. In addition, it provides various gates; bifurcation, trifurcation, transition, expansion joints, manifolds, reducers, dismantling joints, fixed and rocker, and supports and specials; stoplogs/bulkhead gates, hydraulics, rope drums, hoists, screw hoists, travelling hoists, etc.; knife edge gate value/filling-in valves; trashracks/screens; trash rack cleaning machines; goliath/EOT cranes/lifting beams; refurbishment/replacement and overhauling of HM equipment of old hydro projects/barrages; and automation of dam and barrage. Additionally, it offers fabricated bogie, front end and fuel tank, loco components, bolster assembly, APU base frame, snow plow, brake lever, retention tank, and floor and ballast assembly; and bridges and steel structures. The company was incorporated in 1998 and is based in Kolkata, India.",0.909,buy,554.0
946,946,AARTECH,Aartech Solonics Limited,BE,10-JUL-2023,INE01C001018,other_industry,other_sector,Industrials,Heavy Electrical Equipment,80.44,82.8,78.1,83.0,80.44,82.8,78.1,83.0,150524.0,150524.0,112656.0,328864.0,328864.0,42.416664,87.333336,70.4286,61.286633,80.63,,,2.0,14.219,,,4560406.0,31770400.0,,0.52246,1703980800.0,1695340800.0,,,,,0.3268,10.0,1,10,256.674304,2500847104.0,113700000.0,3.555,42002000.0,329783008.0,10.461,-2993250.0,,,9.925,8.123929,7.783127,7.583,-835.496,0.42,0.037,0.438,16172000.0,0.51,,158.09804,0.049039997,0.35029998,-0.00908,-0.06713,,,"Aartech Solonics Limited operates as a system solution oriented research and development enterprise in the field of specialized and selected energy appliances in India. The company manufactures electricity distribution and control apparatus, including electrical apparatus for switching or protecting electrical circuits, such as switches, fuses, voltage limiters, surge suppressors, junction boxes, etc. for a voltage exceeding 1000 volts; apparatus comprising relays, sockets, etc. for a voltage not exceeding 1000 volts; and boards, panels, consoles, cabinets, and other bases for electricity control or distribution of electricity. Its products also include BTS 2000 fast bus transfer system used in power generation utilities and process industries; ultra-capacitors; control relay panels; load checkers; current limiting protectors; Bestcase enclosures; organic waste to compost machines; and backlit photo frames. The company serves renewable and non-renewable energy, power T&D, heavy engineering, defense and exploration, healthcare, IT & Telecom, and transportation industries. Aartech Solonics Limited was incorporated in 1982 and is based in Bhopal, India.",0.508,none,1644.0
948,948,VINYLINDIA,Vinyl Chemicals (India) Limited,EQ,21-JUL-2008,INE250B01029,other_industry,other_sector,Commodities,Trading - Chemicals,407.35,405.05,405.05,416.35,407.35,405.05,405.05,416.35,24395.0,24395.0,63215.0,53875.0,53875.0,311.4,497.2,406.707,400.87476,409.4,,,2.0,0.424,,,8312029.0,18337100.0,,0.54669,,1721779200.0,,,,,0.3943,1.0,1,1,753.6890368,6853080064.0,621489024.0,33.892,4947000.0,6373313024.0,347.404,305681504.0,,,63.683,6.428717,1.1825702,1.075,22.419,0.403,0.35,0.406,232639008.0,12.67,,32.31255,0.0365,0.059169997,0.04796,0.0392,,,"Vinyl Chemicals (India) Limited engages in the trading of chemicals in India. The company sells vinyl acetate monomer. Vinyl Chemicals (India) Limited was incorporated in 1986 and is based in Mumbai, India.",0.325,none,1358.0
950,950,KARURVYSYA,Karur Vysya Bank Limited,EQ,26-JUL-2000,INE036D01028,other_industry,other_sector,Financial Services,Private Sector Bank,219.44,220.25,218.7,224.84,219.44,220.25,218.7,224.84,988399.0,988399.0,2412937.0,1232923.0,1232923.0,125.0,232.75,213.5984,191.8111,219.61,,,2.0,,,,762171605.0,803353024.0,,,1735603200.0,1722470400.0,,,11:10,1534204800.0,0.0943,2.0,1,2,17642.4353792,144781164544.0,56585699328.0,70.319,24783499264.0,49478901760.0,61.587,,,,124.818,1.7594417,3.565648,2.926,,0.278,0.195,0.279,17048299520.0,21.22,11.15,10.349199,0.34456003,,,0.47893003,,,"The Karur Vysya Bank Limited provides various banking and financial services for personal and corporate customers in India. It operates through Treasury, Corporate/Wholesale Banking, Retail Banking, and Other Banking Operations segments. The company offers savings and current accounts; recurring and tax saving deposits; personal, home, vehicle, and educational loans, as well as business loans, including commercial, MSME, and mortgage loans; tokenization for card based transactions services; prepaid instruments; debit and credit cards. It also provides prepaid instruments, including gift, forex travel, and re-loadable cards; life, non-life, and health insurance products; demat, trading, and mutual fund services; digital products; locker facilities; social security schemes; and government sponsored schemes. In addition, the company offers investment and payment collection and transaction banking services; FCNR, NRE, and NRO deposits; mortgage and jewel loans and loans against deposits; remittance services; and Internet and mobile banking services, as well as a range of products for the agricultural sector. The Karur Vysya Bank Limited was incorporated in 1916 and is based in Karur, India.",0.894,strong_buy,385.0
954,954,GRPLTD,GRP Limited,EQ,12-FEB-2015,INE137I01015,other_industry,other_sector,Industrials,Rubber,3418.05,3340.55,3340.55,3560.0,3418.05,3340.55,3340.55,3560.0,4358.0,4358.0,12328.0,7693.0,7693.0,896.4,4815.15,3711.9849,2141.9514,3502.35,,,2.0,67.882,,,1992586.0,5333330.0,,0.67705,1735603200.0,1721952000.0,,,,,0.090500005,10.0,1,10,1881.0912768,19343548416.0,17967000.0,3.369,1131881984.0,4882407936.0,915.544,513721504.0,,,312.634,11.202717,3.8527942,3.962,37.654,1.222,0.27,1.221,250371008.0,46.83,,74.7886,0.05128,0.53252,0.105220005,0.07083,,,"GRP Limited manufactures and sells reclaimed rubber products for tyre and non-tyre rubber goods in India and internationally. The company operates in Reclaim Rubber and Others segments. It offers reclaim natural and synthetic rubber products for use in inner liners and tubes, tyre side walls and piles, tyre treads and retreads, conveyor belts, moulded goods, adhesives, and footwear, as well as rubber mattings, profiles, and roofing; and POLYCOAT, an elastic powder in compounded form, which is used in NBR based molded products, metal to rubber bonded parts, NBR based oil seals, NBR matting/sheeting, and NBR-PVC blend, as well as use in tyres, conveyor belts, molded products, sheeting/matting, tread rubber, seals/gaskets, and flaps applications. The company also provides engineering plastics comprising glass filled and unfilled reprocessed nylon 6 and modified nylon 6,6 used in automotive, electrical and electronics, consumer, and industrial applications; repurposed polyolefins, such as impact copolymer polypropylene, IC PP custom colors, and PP based elastomers used in paint and lubricant pails, automotive battery covers, and pallets; and custom die forms consisting of link, door, and industrial mats, as well as dock bumpers primarily for use in civil and agricultural applications. In addition, it generates power from windmill; offers polymer composite products, including boards, wheel chocks, and assembled products used in logistics, construction, oil and gas, aviation, marine, industrial, and agriculture applications; and develops poly-blends and thermoplastic elastomers. The company was formerly known as Gujarat Reclaim and Rubber Products Limited and changed its name to GRP Limited in June 2012. GRP Limited was incorporated in 1974 and is headquartered in Mumbai, India.",0.514,none,1078.0
955,955,SBC,SBC Exports Limited,EQ,23-NOV-2021,INE04AK01028,other_industry,other_sector,Consumer Discretionary,Garments & Apparels,31.99,32.5,32.2,36.3,31.99,32.5,32.2,36.3,33476854.0,33476854.0,3640206.0,3809967.0,3809967.0,13.333333,36.3,28.9136,25.6326,35.86,,,2.0,118.92,,,106512116.0,317460000.0,,0.63596,1703980800.0,1727049600.0,,,10:1,1645488000.0,0.1333,1.0,1,1,1138.4116224,10480366592.0,49725000.0,0.159,527383008.0,2222692096.0,7.062,177403072.0,,,1.339,26.781181,5.1217694,4.715,59.077,0.159,0.243,0.157,101680000.0,0.25,,143.44,0.04575,0.1874,0.07981,0.0859,,,"SBC Exports Limited manufactures and sells hosiery fabrics and garments in India. The company operates through three segments: Trading and Manufacturing of Garments; Manpower Supply Services; and Tour Operator Services. It offers T-shirts, denims, sweatshirts, trousers, jackets, leggings, etc. under the SBC DESIGN+, F-ROUTE, FEMAS FASHIONS, FEMAS LINGERIE'S, FEMAS JEANS, and IEDEE brand names; and carpets. The company also provides e-governance, Web/software development, scanning and digitization, and system integration services, as well as IT solutions; and manpower supply services. In addition, it organizes adventure, cultural, religious, hill station, and wildlife tours; and offers travel planning, itinerary design, hotel booking, and ticket reservation services, as well as transport facilities and holiday packages. SBC Exports Limited was founded in 1991 and is headquartered in Mirzapur, India.",0.174,none,1246.0
956,956,SUNDARMHLD,Sundaram Finance Holdings Limited,EQ,26-MAR-2018,INE202Z01029,other_industry,other_sector,Financial Services,Investment Company,414.85,425.0,404.35,425.0,414.85,425.0,404.35,425.0,181028.0,181028.0,248800.0,633763.0,633763.0,112.8,433.0,293.679,230.5975,409.5,,,2.0,0.374,,,105066231.0,220692000.0,,,,1720137600.0,,,,,0.29860002,5.0,1,5,9037.3373952,83387039744.0,8931796992.0,40.215,179050000.0,3101061120.0,13.966,2669172992.0,,,215.797,1.8976167,29.142725,26.89,31.241,0.563,0.782,0.561,5728079872.0,25.8,,15.872093,1.8471401,0.90338,0.86073,0.77675,,,"Sundaram Finance Holdings Limited engages in the business of investments, business processing, and support services in India, Australia, and the United Kingdom. It primarily has investments in automotive sector. The company also offers outsourcing services to large and mid-sized firms. In addition, it engages in shared services business. The company was formerly known as Sundaram Finance Investments Limited and changed its name to Sundaram Finance Holdings Limited in March 2017. Sundaram Finance Holdings Limited was incorporated in 1993 and is based in Chennai, India.",0.586,none,556.0
960,960,AUSOMENT,Ausom Enterprise Limited,BE,17-APR-1996,INE218C01016,other_industry,other_sector,Consumer Discretionary,Gems Jewellery And Watches,95.0,95.0,93.7,95.0,95.0,95.0,93.7,95.0,1964.0,1964.0,4406.0,2179.0,2179.0,64.0,133.9,95.6728,89.5519,93.75,,,2.0,2.644,,,2900873.0,13623600.0,,0.78691,1735603200.0,1726790400.0,,,,,0.0596,10.0,1,10,127.7212544,1309172608.0,17243000.0,1.267,33024000.0,18412871680.0,1351.853,152143008.0,,,91.534,1.0242096,0.0693652,0.071,8.605,0.549,486.581,0.548,114247000.0,8.39,,11.174016,0.0062,0.00949,0.00826,0.00765,,,"AuSom Enterprise Limited operates as trading company in India. The company trades in commodities, bullions, gold jewelry, diamonds, derivatives, shares and securities, and units of mutual funds. AuSom Enterprise Limited was formerly known as Core Emballage Limited. The company was incorporated in 1984 and is based in Ahmedabad, India.",-0.215,none,1800.0
963,963,AIRAN,Airan Limited,EQ,03-MAY-2019,INE645W01026,other_industry,other_sector,Information Technology,IT Enabled Services,38.01,39.9,39.05,39.91,38.01,39.9,39.05,39.91,182266.0,182266.0,900605.0,279028.0,279028.0,20.55,48.78,33.9978,28.7463,39.91,,,2.0,0.562,,,64627893.0,125020000.0,,0.72352,1703980800.0,,,,2:1,1555891200.0,,2.0,1,2,498.9548032,4685163008.0,158740992.0,1.271,7570000.0,1077846016.0,8.509,219002256.0,,,9.516,4.1939893,4.6291842,4.347,21.393,11.429,0.096,10.91,324604000.0,2.6,,15.35,0.30115998,0.31461,0.20319,0.14571,,,"Airan Limited, together with its subsidiaries, provides information technology (IT) and IT-enabled services in India. It offers cash management, door step banking and pickup, fee collection/counter management, customer onboarding eKYC, cheque truncation/processing, e-stamping/registration fee collection, document management, contact center, records management, address verification and credit verification, back office management, bookkeeping, software development, self-managed superannuation fund, financials and taxation, data migration, payroll processing, labour law compliance, digital document verification, and automobile inspection services. The company also provides application outsourcing, business process outsourcing, knowledge process outsourcing, application outsourcing, and e-kyc solutions. In addition, it offers CTS clearing processing, account opening forms processing, and managing collection counters services. The company provides its services to the United States of Emirates and the Asia Pacific region.  Airan Limited was founded in 1989 and is headquartered in Ahmedabad, India.",0.915,none,1478.0
964,964,KPITTECH,KPIT Technologies Limited,EQ,22-APR-2019,INE04I401011,other_industry,other_sector,Information Technology,Computers - Software & Consulting,1749.7,1752.0,1715.45,1757.4,1749.7,1752.0,1715.45,1757.4,713797.0,713797.0,1156008.0,687627.0,687627.0,1038.0,1928.7,1780.41,1572.439,1722.9,,,2.0,15.199,,,159744101.0,271353984.0,,0.45811,1703980800.0,1723161600.0,,,,,0.19520001,10.0,1,10,46756.921344,469438758912.0,8568229888.0,31.592,3287520000.0,51727519744.0,190.902,10985615360.0,,,79.12,21.775784,9.039081,9.075,42.732,0.521,0.243,0.524,6646949888.0,24.32,,70.842926,0.1285,0.35586,0.21237,0.17267999,,,"KPIT Technologies Limited provides embedded software, artificial intelligence, and digital solutions for the automobile and mobility sector in the Americas, the United Kingdom, rest of Europe, and internationally. The company offers autonomous driving and advanced driver assistance system solutions, including system engineering and dependability; feature, algorithm, and software development; platform and software integration; verification and validation; and simulation for homologation. It also provides electric power train solutions, which include battery management systems, inverters, smart chargers, and modular and configurable VCU solutions; connected vehicle solutions, a production platforms and tools; and digital connected solutions, such as asset management, remote software management, and predictive maintenance solutions. In addition, the company operates integrated diagnostics and aftersales transformation platform, a cloud-based ecosystem that offers tools and accelerators for the development and validation of E/E diagnostic functions; and AUTOSAR platform, as well as provides vehicle engineering and design services. The company was formerly known as KPIT Engineering Limited and changed its name to KPIT Technologies Limited in March 2019. KPIT Technologies Limited was founded in 1990 and is based in Pune, India.",0.974,buy,190.0
966,966,GLAXO,GlaxoSmithKline Pharmaceuticals Limited,EQ,15-DEC-2000,INE159A01016,other_industry,other_sector,Healthcare,Pharmaceuticals,2848.95,2848.95,2799.75,2876.5,2848.95,2848.95,2799.75,2876.5,76364.0,76364.0,152467.0,119842.0,119842.0,1385.05,3088.0,2735.155,2280.4766,2813.95,,,2.0,1.05,,,41365565.0,169406000.0,,0.75581,1735603200.0,1717113600.0,,,2:1,1536624000.0,0.84699994,10.0,1,10,47673.376768,464247750656.0,18568232960.0,109.608,186650000.0,35066961920.0,206.964,9675461632.0,,,104.934,26.81638,13.5949545,13.239,47.982,0.378,0.07,0.379,6400410112.0,37.89,54.9,74.2663,0.18252,0.61377996,0.27591,0.26285,,,"GlaxoSmithKline Pharmaceuticals Limited manufactures, distributes, and trades in pharmaceuticals in India and internationally. The company offers vaccines, such as Infanrix Hexa for vaccination of infants against diphtheria, tetanus, pertussis, hepatitis B, poliomyelitis, and disease caused by Haemophilus influenzae type B; Synflorix for active immunization of infants against pneumococcal diseases and acute otitis media; Havrix for active immunization against disease caused by Hepatitis A virus; Menveo to prevent invasive meningococcal disease; Boostrix for immunization against diphtheria, tetanus and pertussis; Fluarix Tetra for the prevention of influenza disease; Varilrix for active immunization against varicella; and Shingrix for prevention of herpes zoster and post-herpetic neuralgia. It also provides specialty medicines comprising NUCALA for severe eosinophilic asthma, eosinophilic granulomatosis with polyangiitis, and hypereosinophilic syndrome; and TRELEGY ELLIPTA for treating chronic obstructive pulmonary disease. In addition, the company offers general medicines, including AUGMENTIN and CEFTUM, which are antibiotics to treat bacterial infections; CALPOL for treatment of mild to moderate pain; ELTROXIN for hypothyroidism; CCM to treat calcium and vitamin D deficiency; NEOSPORIN for treatment and prevention of specific bacterial skin infections; BETNOVATE for skin conditions which require relief of inflammation; T-BACT for bacterial skin infections; and PHYSIOGEL for dry skin and dry skin associated with redness and itch. Further, it develops products for infectious diseases, HIV, oncology, and immunology. The company was formerly known as SmithKline Beecham Pharmaceuticals India Ltd. and changed its name to GlaxoSmithKline Pharmaceuticals Limited in 2001. GlaxoSmithKline Pharmaceuticals Limited was incorporated in 1924 and is headquartered in Mumbai, India.",0.233,buy,188.0
968,968,ALMONDZ,Almondz Global Securities Limited,EQ,16-JUN-2008,INE326B01027,other_industry,other_sector,Financial Services,Stockbroking & Allied,32.34,32.0,31.0,32.39,32.34,32.0,31.0,32.39,288448.0,288448.0,1198701.0,1039089.0,1039089.0,13.15,39.13,29.575,21.42095,31.33,,,2.0,10.651,,,51731102.0,168340992.0,,0.68858004,1735603200.0,1316044800.0,,,,,,6.0,1,6,536.2161152,5649977344.0,127000000.0,0.768,234300000.0,1250700032.0,7.504,,,,13.382,2.3412046,4.287328,4.517,,0.562,0.755,0.62,364100000.0,2.15,,14.572092,0.29112,0.54737,,0.08601,,,"Almondz Global Securities Limited provides financial services in India. The company operates through Debt and Equity Market Operations, Corporate Finance/Advisory Fees, Wealth Advisory/Broking Activities, Finance Activities, Infrastructure Advisory, and Healthcare Services segments. It offers corporate finance advisory services, including merchant banking, underwriting commission, corporate and loan syndication, and debts/bonds arrangement services, as well as trades in shares and bonds. The company also provides broking and commission services for mutual funds, equity initial public offerings, capital gain bonds, government undertaking fixed deposits, and RBI taxable bonds, as well as stock and share broking services and other related ancillary services. In addition, it provides advisory services in relation to infrastructure projects, as well as loans. Further, the company operates eye-care hospitals. Additionally, it provides consultancy, private equity, infrastructure advisory, equity broking, wealth management, mergers and acquisitions, government bonds, and debt portfolio management distribution and services; and professional advisory and technical consultancy services in the areas of management, engineering, industrial, technical, and financial for infrastructure sectors. The company also operates commodity trading platforms for retail and corporate investors, as well as engages in the real estate and investment activities. The company was incorporated in 1994 and is based in Mumbai, India. Almondz Global Securities Limited is a subsidiary of Avonmore Capital & Management Services Limited.",-0.061,none,1456.0
969,969,TIDEWATER,Tide Water Oil Company (India) Limited,EQ,16-JAN-2007,INE484C01030,other_industry,other_sector,Energy,Lubricants,2490.9,2480.0,2460.0,2531.0,2490.9,2480.0,2460.0,2531.0,15310.0,15310.0,76460.0,43563.0,43563.0,1108.25,2800.0,2450.925,1816.5222,2470.3,,,2.0,0.151,,,5088091.0,16994900.0,,0.68684,1735603200.0,1720137600.0,,,2:1,1627257600.0,0.5937,2.0,1,2,4198.2500864,40223997952.0,2120999936.0,124.802,12500000.0,19363201024.0,1139.476,1710249984.0,,,486.906,5.073464,2.168159,2.077,23.519,0.19,0.011,0.19,1488300032.0,87.68,,28.174042,0.076859996,0.37308997,0.088319995,0.075780004,,,"Tide Water Oil Co. (India) Limited, together with its subsidiaries, manufactures and markets lubricants under the Veedol brand in India. The company provides automotive lubricants, including two-wheeler, passenger car motor, commercial vehicle, tractor, off-highway, and gear and transmission oils, as well as greases, EV fluids, and OEM oils. It also offers industrial lubricants comprising hydraulic and circulation, spindle, turbine, heavy-duty hydraulic, compressor, refrigeration compressor, steam cylinder, industrial gear, slideway, mill roll, pneumatic tool, and transmission oils; thermic and automotive fluids; lithium soap and complex greases, speciality, graphite, calcium soap, and high-temperature greases; and cardium compounds, industrial-speciality range, and coolants. In addition, the company provides vehicle care products, such as additives range, appearance enhancers, cleaners and degreasers, lubricants, and rust penetrants. Further, it engages in the wind energy business. The company's distribution network consists of distributors, retail outlets, and workshops. It operates in Europe, the Americas, the Middle East, Africa, the Asia Pacific, South Asia. Tide Water Oil Co. (India) Limited was incorporated in 1921 and is based in Kolkata, India.",0.714,none,779.0
974,974,VADILALIND,Vadilal Industries Limited,EQ,15-JUN-2011,INE694D01016,other_industry,other_sector,Fast Moving Consumer Goods,Dairy Products,4163.35,4209.35,4170.1,4300.0,4163.35,4209.35,4170.1,4300.0,8312.0,8312.0,13474.0,15705.0,15705.0,2133.2,5143.0,4222.608,3804.5835,4244.7,,,2.0,41.146,,,2174459.0,7187830.0,,0.67687,1735603200.0,1726704000.0,,,,,0.0070999996,10.0,1,10,3051.01824,31523606528.0,637600000.0,88.706,2232699904.0,11937200128.0,1660.807,2463628800.0,,,754.421,5.6264343,2.555891,2.641,12.796,0.09,0.135,0.09,1523500032.0,211.91,,20.030674,0.12763,0.50376,0.20638001,0.22769,,,"Vadilal Industries Limited, together with its subsidiaries, manufactures and sells ice-cream in India and internationally. It operates through Ice-Cream and Processed Food divisions. The company also offers flavored milk under the Power Sip brand; frozen desserts; processed food products, such as frozen fruits, vegetables, pulp, and ready-to-eat and ready-to-serve products, etc.; and other dairy products, as well as paneer and ghee products. In addition, it is involved in the money changing and chemical businesses. Further, the company exports its products to approximately 24 countries. Vadilal Industries Limited was founded in 1907 and is based in Ahmedabad, India.",0.42,none,898.0
975,975,ETHOSLTD,Ethos Limited,EQ,30-MAY-2022,INE04TZ01018,other_industry,other_sector,Consumer Discretionary,Gems Jewellery And Watches,3313.7,3328.0,3311.0,3433.0,3313.7,3328.0,3311.0,3433.0,90848.0,90848.0,58390.0,107113.0,107113.0,1551.05,3485.0,3054.709,2545.405,3406.25,,,2.0,16.405,,,10805964.0,24480400.0,,0.58095,1703980800.0,,,,,,,10.0,1,10,8338.6359808,79074549760.0,3454606080.0,141.19,1450171008.0,10422187008.0,432.552,1667316480.0,,,361.091,9.433218,8.000851,7.587,47.426,0.199,0.188,0.256,879420992.0,36.45,,93.44993,0.08438,0.29911,0.15998,0.10599,,,"Ethos Limited operates a chain of luxury watch boutiques in India. It sells watches and related accessories, as well as jewellery and travel accessories; and retails certified pre-owned luxury watches. The company also provides watch repair and services, including movement overhauling, battery change, ultrasonic cleaning, polishing, performance tests, parts replacement, and strap change. It also sells its products online.  The company was founded in 2003 and is headquartered in Gurugram, India. Ethos Limited is a subsidiary of KDDL Limited.",-0.062,none,589.0
