528,528,JKCEMENT,JK Cement Limited,EQ,14-MAR-2006,INE823G01014,building-materials,basic-materials,Commodities,Cement & Cement Products,4670.2,4694.45,4655.0,4805.0,4670.2,4694.45,4655.0,4805.0,385984.0,385984.0,154830.0,146268.0,146268.0,3052.65,4805.0,4363.573,4153.4604,4700.55,0.40216768,0.24014747,2.0,104.306,,,35025698.0,77268200.0,77268200.0,0.5466,1735603200.0,1720483200.0,15.0,1720483200.0,,,0.1341,10.0,1,10,36320.3035136,399311077376.0,16600000512.0,214.836,55507898368.0,116009402368.0,1500.846,21289150464.0,,,694.611,6.7671685,3.130807,3.442,18.757,0.616,0.016,0.616,8642199552.0,111.62,69.45,42.112076,0.074499995,0.61202,0.18351,0.12072,,,"J.K. Cement Limited manufactures and sells cement and its related products under the J.K. Cement brand in India and internationally. The company offers grey cement products, including ordinary Portland, Portland Pozzolana, Portland Slag, and weather shield. It provides white cement-based putty; and gypsum plaster for application on walls and ceilings. In addition, the company offers wall putty; white cement-based wall leveller and a polymer modifying self-curing mortar; grey cement-based tile adhesives and grouts; and a range of polyurethane wood finishes, as well as interior and exterior paints. J.K. Cement Limited was founded in 1975 and is headquartered in Kanpur, India.",0.734,buy,235.0
530,530,ABBOTINDIA,Abbott India Limited,EQ,08-JAN-2010,INE358A01014,drug-manufacturers-general,healthcare,Healthcare,Pharmaceuticals,29735.45,29939.0,29616.65,30000.0,29735.45,29939.0,29616.65,30000.0,4071.0,4071.0,17127.0,22328.0,22328.0,22000.0,30521.0,28241.457,26617.201,29664.1,0.29121482,0.24014747,2.0,2.25,,,5210541.0,21249300.0,21255800.0,0.75478,,1721347200.0,410.0,1721347200.0,,,0.3087,10.0,1,10,63053.4176768,611509927936.0,21179899904.0,996.734,832300032.0,59275198464.0,2789.541,14418424832.0,,,1740.711,17.041368,10.6374035,10.316,42.412,0.13,0.053,0.13,12389900288.0,582.81,,50.898407,0.20902,0.45079,0.24325001,0.23923999,,,"Abbott India Limited, together with its subsidiaries, operates as a pharmaceutical company in India. The company offers pharmaceutical products for gastroenterology, women's health, metabolic, central nervous system, vaccines, and multispecialty, including insomnia, vitamin D deficiency, pre-term labor, and pain management. It provides anti-infective, cardio-diabeto, hepatology, hormones, neuro-psychiat, hepatic, gennext, and consumer care products. The company was founded in 1910 and is headquartered in Mumbai, India. Abbott India Limited is a subsidiary of Abbott Capital India Limited.",0.046,none,154.0
531,531,TARACHAND,Tara Chand InfraLogistic Solutions Limited,BE,16-APR-2024,INE555Z01012,farm-heavy-construction-machinery,industrials,Services,Diversified Commercial Services,422.9,432.0,415.2,432.0,422.9,432.0,415.2,432.0,14831.0,14831.0,38302.0,35534.0,35534.0,97.5,523.9,436.158,300.7535,422.3,2.8798165,0.24014747,2.0,89.817,,,5227401.0,15175000.0,15497200.0,,1703980800.0,1585526400.0,0.75,1585526400.0,,,,10.0,1,10,640.8402432,7310244352.0,2039000.0,0.133,852307968.0,1787132032.0,122.376,523432000.0,,,66.376,6.3622394,3.5858583,4.09,13.966,0.198,0.172,0.194,168704992.0,11.33,,37.272728,0.094399996,0.91085,0.29288998,0.13861,,,"Tara Chand Logistic Solutions Limited provides logistics solutions in India. It operates in three segments: Transport & Handling Services, Equipment Rental Services, and Steel Processing & Distribution. The company has a fleet of cranes and other equipment, such as all-terrain telescopic cranes, telescopic/hydraulic truck mounted cranes, crawler cranes, pic-N-carry cranes, pullers and trailer, piling rigs, mobile boom placers, mobile lattice boom, rubber tyre gantry cranes, lorry loaders, concrete boom placers, and concrete batching plant. It serves power, oil and gas, steel, cement, renewable energy, and urban and rural infrastructure sectors. Tara Chand Logistic Solutions Limited was founded in 1980 and is headquartered in Chandigarh, India.",-0.237,none,1397.0
533,533,INDIAGLYCO,India Glycols Limited,EQ,01-JUL-2005,INE560A01015,chemicals,basic-materials,Commodities,Commodity Chemicals,1331.8,1341.0,1313.65,1347.55,1331.8,1341.0,1313.65,1347.55,80463.0,80463.0,407381.0,282486.0,282486.0,621.45,1399.9,1139.194,904.88525,1318.7,0.76783705,0.24014747,2.0,65.735,,,10325909.0,30961500.0,31456700.0,0.66652,1735603200.0,1724198400.0,8.0,1724198400.0,,,0.1342,10.0,1,10,4082.8928,52936359936.0,1378300032.0,44.513,13482300416.0,35735998464.0,1154.082,4248578304.0,,,662.293,1.9911126,1.1425154,1.481,12.46,0.18,0.406,0.181,1822300032.0,55.94,,23.573471,0.05099,0.24417,0.11889,0.101160005,,,"India Glycols Limited, a green petrochemical company, engages in the manufacture and sale of industrial chemicals in India. The company operates through Bio-based Specialities and Performance Chemicals, Potable Spirits, and Ennature Biopharma segments. It offers bio mono ethylene, di ethylene, and tri ethylene glycols; ethyl/butyl glycol ethers and acetates, and brake fluids; bio-polymers comprising guar and natural gums; biofuels; specialty chemicals, such as plasticisers, oil fields chemicals, bio-amines, methyl soyate, MDEA and MDEA derivatives, bio-potash granules, and C-Smart specialty products; molasses and grain based extra neutral alcohol; and specialty gases, including industrial and medical oxygen, food grade and industrial carbon dioxide, liquid argon and nitrogen, ethylene oxide, and bio ethylene oxide. The company also provides Indian made foreign liquor, such as whiskey under Soulmate Blu and Single Reserve brands; vodka under Amazing brand; and rum under Zumba and Beach House XXX brands, as well as economy spirits under Bunty brand, and branded country liquor. In addition, it offers natural active pharmaceutical ingredients, nutraceuticals, standardized botanical extracts, and nicotine derivatives. Further, the company's products find applications in pharma and healthcare, textiles, automotive, personal care, industrial and manufacturing, paints and coatings, oil and gas, food ingredients, packaging, potable spirits, and other various industries. It also exports its products. The company was formerly known as UP Glycols Limited and changed its name to India Glycols Limited in August 1986. India Glycols Limited was incorporated in 1983 and is headquartered in Noida, India.",0.521,none,789.0
543,543,LUPIN,Lupin Limited,EQ,10-SEP-2001,INE326A01037,drug-manufacturers-specialty-generic,healthcare,Healthcare,Pharmaceuticals,2277.25,2285.0,2268.0,2312.0,2277.25,2285.0,2268.0,2312.0,1824674.0,1824674.0,1530859.0,1410822.0,1410822.0,1091.5,2312.0,1930.042,1631.5205,2290.2,1.0042686,0.24014747,2.0,20.328,,,241405015.0,456136992.0,457416000.0,0.47125998,1735603200.0,1721088000.0,8.0,1721088000.0,5:1,1282867200.0,0.0808,2.0,1,2,104464.4888576,1047398776832.0,20345300992.0,44.648,29217699840.0,207970893824.0,456.632,40766599168.0,,,313.604,7.30284,5.023034,5.036,25.693,0.77,0.163,0.772,22635300864.0,49.42,64.72,46.341564,0.108839996,0.65306,0.19601999,0.18546,,,"Lupin Limited, together with its subsidiaries, operates as a pharmaceutical company in India and internationally. It engages in the drug discovery, development, production, marketing, and sale of various branded and generic formulations, biosimilars, over-the-counter and specialty drugs, and active pharmaceutical ingredients (APIs). The company offers formulations for use in the therapeutic areas of anti-tuberculosis, diabetes management, cardiovascular, chronic obstructive pulmonary diseases, asthma, gynecology and women's health, central nervous system, oncology, immunology, genomics, metabolic disorders, dermatology, urology, pediatrics, gastrointestinal, anti-infective, and nonsteroidal anti-inflammatory drug therapies, as well as engages in the bio clinical research activities. It operates through network consists of labs, LupiMitra collection centers, and pick-up points. The company was formerly known as Lupin Chemicals Limited and changed its name to Lupin Limited in 2001. Lupin Limited was founded in 1968 and is headquartered in Mumbai, India.",0.616,hold,99.0
549,549,TIMKEN,Timken India Limited,EQ,06-FEB-2007,INE325A01013,tools-accessories,industrials,Industrials,Abrasives & Bearings,3830.95,3835.0,3791.05,3905.5,3830.95,3835.0,3791.05,3905.5,36431.0,36431.0,138155.0,114652.0,114652.0,2524.5,4817.9,4000.279,3480.29,3805.3,0.18927431,0.24014747,2.0,1.049,,,32857047.0,75218704.0,75234400.0,0.52362,1735603200.0,1721952000.0,2.5,1721952000.0,,,0.028299998,10.0,1,10,28628.9461248,283525840896.0,4887000064.0,64.971,253620000.0,29756600320.0,395.603,5711052288.0,,,321.365,11.841054,9.62104,9.528,49.645,0.068,0.092,0.068,3983099904.0,52.87,23.78,71.974655,0.13385999,0.39527,0.19193001,0.15187,,,"Timken India Limited manufactures and distributes tapered roller bearings, other roller bearings, components, and accessories for the automotive sector and railway industry in India, the United States, and internationally. The company offers cylindrical roller, plain, spherical roller, tapered roller, thrust, precision, slewing, and ball bearing, as well as seals, maintenance tools, housed units, and wheel hub under the Timken brand; and integrated bearing assemblies, driveline center support bearings for commercial and light vehicles, and lubrication and lubrication systems. It provides mechanical power transmission products, such as encoders, gear boxes/transmissions, couplings and joints, belts, augers, linear motion products, brakes and clutches, commercial vehicles wheels and accessories and tools, and chains. In addition, the company offers maintenance contract and refurbishment services; and uptower and motor repair services. Timken India Limited was formerly known as Tata Timken Limited and changed its name to Timken India Limited in July 1999. The company was incorporated in 1987 and is based in Bengaluru, India. Timken India Limited operates as a subsidiary of The Timken Company.",0.566,buy,276.0
551,551,SCHNEIDER,Schneider Electric Infrastructure Limited,EQ,20-MAR-2012,INE839M01018,electrical-equipment-parts,industrials,Industrials,Heavy Electrical Equipment,819.75,825.2,813.45,828.0,819.75,825.2,813.45,828.0,139396.0,139396.0,318581.0,252488.0,252488.0,300.0,980.0,821.064,680.73425,823.85,1.2834263,0.24014747,2.0,184.634,,,49110479.0,239104000.0,239292000.0,0.78181,1735603200.0,1342656000.0,0.4,1342656000.0,,,,2.0,1,2,19698.5831424,200766144512.0,473000000.0,1.981,5468299776.0,23043399680.0,96.346,3289309952.0,,,12.641,65.17285,8.5484705,8.713,61.036,0.39,0.197,0.388,1855900032.0,7.79,,105.75738,0.08054,0.3756,0.14274,0.12793,,,"Schneider Electric Infrastructure Limited designs, manufactures, builds, and services products and systems for electricity distribution in India and internationally. The company offers distribution, medium power, and special transformers; substation automation systems, including power management systems, controllers and RTUs, communication elements, graphic user interfaces, engineering tools, SCADA and EMS gateways, and simulation tools; and ring main units. It also offers medium voltage distribution and grid automation products, such as Easergy T300, a remote terminal unit; EasyPact EXE, a vacuum circuit breaker; medium voltage switchgear; microgrids; digital substations; and Ecofit, a medium and low voltage equipment, as well as EcoStruxure grid, an IoT-enabled open and interoperable platform. In addition, the company provides partner managed, and field and automation services. Schneider Electric Infrastructure Limited serves the grid, power, utility, mining, minerals, metal, power generation, oil and gas, and smart city industries, as well as contractors, global strategic alliances, and panel builders. The company was formerly known as Smartgrid Automation Distribution and Switchgear Limited and changed its name to Schneider Electric Infrastructure Limited in December 2011. The company was incorporated in 2011 and is based in Gurugram, India. Schneider Electric Infrastructure Limited operates as a subsidiary of Energy Grid Automation Transformers and Switchgears India Private Limited.",0.258,strong_buy,353.0
553,553,GUJGASLTD,Gujarat Gas Limited,EQ,15-SEP-2015,INE844O01030,utilities-regulated-gas,utilities,Energy,LPG/CNG/PNG/LNG Supplier,660.55,661.0,661.0,682.8,660.55,661.0,661.0,682.8,4288942.0,4288942.0,2177608.0,6625188.0,6625188.0,397.05,689.95,631.754,564.14026,677.95,0.42698205,0.24014747,2.0,1.946,,,172403257.0,688390016.0,691241024.0,0.74981004,,1725840000.0,5.66,1725840000.0,5:1,1547510400.0,0.36400002,2.0,1,2,46669.4012928,447346573312.0,9261200384.0,13.442,1502599936.0,163589799936.0,237.475,20370800640.0,,,112.127,6.046269,2.8528306,2.735,21.96,0.529,0.177,0.531,12584599552.0,18.3,28.33,37.04645,0.07693,0.20229,0.12452,0.092700005,,,"Gujarat Gas Limited engages in the distribution of natural gas in India. It operates a network of approximately 40,200 kilometers of natural gas pipeline and 811 compressed natural gas stations. The company supplies piped natural gas to approximately 21.52 lakh households; approximately 4,400 industrial customers; and approximately 15,200 commercial customers. It operates in 44 districts in 6 states of Gujarat, Maharashtra, Rajasthan, Haryana, Punjab, Madhya Pradesh; and 1 union territory of Dadra and Nagar Haveli. The company was formerly known as GSPC Distribution Networks Limited and changed its name to Gujarat Gas Limited in May 2015. Gujarat Gas Limited was incorporated in 2012 and is based in Gandhinagar, India. Gujarat Gas Limited operates as a subsidiary of Gujarat State Petronet Limited.",0.421,buy,191.0
555,555,SONAMLTD,SONAM LIMITED,EQ,07-APR-2022,INE00LM01029,furnishings-fixtures-appliances,consumer-cyclical,Consumer Discretionary,Consumer Electronics,54.0,55.0,52.1,55.1,54.0,55.0,52.1,55.1,72955.0,72955.0,161696.0,79318.0,79318.0,24.5,59.4,48.7772,41.702774,53.06,0.78512394,0.24014747,2.0,39.102,,,8074773.0,40032000.0,40513900.0,,1609372800.0,1566172800.0,0.125,1566172800.0,2:1,1715299200.0,,5.0,1,5,212.409792,2405342208.0,1541000.0,0.038,221559008.0,929446016.0,23.143,125447504.0,,,14.166,3.745588,2.2853377,2.588,19.174,0.526,0.306,0.556,59351000.0,1.0,,53.06,0.06386,0.2692,0.13497,0.084910005,,,"Sonam Limited manufactures and trades in horological items, clocks, clock movements, and related items in India. The company offers products, such as alarm time pieces, as well as dial, designer, divine tune, LCD, LED digital, light sensor, musical, office, pendulum, and pendulum musical clocks. It also provides picture God dial, regular, diamond series, rotating, rotating musical, rotating pendulum musical, SQ series, sweep, and sweep office clocks. The company exports its products. The company was formerly known as Sonam Clock Limited and changed its name to Sonam Limited in September 2023. Sonam Limited was founded in 1996 and is headquartered in Morbi, India.",-0.145,none,1685.0
556,556,KITEX,Kitex Garments Limited,EQ,25-SEP-2012,INE602G01020,apparel-manufacturing,consumer-cyclical,Consumer Discretionary,Garments & Apparels,421.35,422.5,422.5,440.0,421.35,422.5,422.5,440.0,899771.0,899771.0,1156257.0,1111273.0,1111273.0,177.0,441.85,268.009,230.6815,425.1,1.0644293,0.24014747,2.0,65.999,,,17501730.0,66500000.0,66578900.0,0.69585,1703980800.0,1726790400.0,1.5,1726790400.0,7:5,1498089600.0,0.13159999,1.0,1,1,2830.2690304,35398217728.0,692342016.0,10.417,6811966976.0,6615781888.0,99.526,1274942720.0,,,136.145,3.1224062,4.2780566,5.351,27.765,2.483,0.306,2.476,757881024.0,11.42,18.95,37.224167,0.11456,0.61955,0.19271,0.18742001,,,"Kitex Garments Limited, together with its subsidiaries, manufactures and sells fabric and readymade garments in India. It primarily offers infant wear comprising body suits; rompters and skirts; burps; sleepsuits; tops and dresses; bibs; sleepwear and SNP; baby quilts and bedding; and training pants and jackets. The company also exports its products to the United States and Europe. Kitex Garments Limited was incorporated in 1992 and is based in Kochi, India.",0.291,strong_buy,928.0
558,558,MHRIL,Mahindra Holidays & Resorts India Limited,EQ,16-JUL-2009,INE998I01010,resorts-casinos,consumer-cyclical,Consumer Discretionary,Hotels & Resorts,425.9,426.75,426.0,435.95,425.9,426.75,426.0,435.95,240415.0,240415.0,340246.0,252652.0,252652.0,347.75,505.0,434.877,411.8145,434.25,0.0591892,0.24014747,2.0,513.395,,,64247876.0,201574000.0,201770000.0,0.70344,,1532563200.0,2.666667,1532476800.0,3:2,1631059200.0,,10.0,1,10,8753.3510656,103887921152.0,9422356480.0,46.753,27382808576.0,27431444480.0,132.691,3069071872.0,,,26.004,16.699354,3.1909916,3.787,33.85,28.0,0.063,31.538,1212363008.0,6.01,8.2,72.25457,0.0442,0.63272,0.11188,0.02558,,,"Mahindra Holidays & Resorts India Limited operates in the leisure hospitality sector. It engages in the sale of vacation ownership and other accommodation related services. The company's flagship brand is Club Mahindra or CMH25, which entitles its members to a week's holiday every year for 25 years. It provides Club Mahindra Fundays, a corporate product that allows enrolled organizations to offer holiday entitlements to its employees either as a part of their reward and recognition programs or as an employment prerequisite; Bliss, a points-based product targeted at the 50-plus age group, which offers a week's holiday every year for 10 years; CMH4, a shorter duration four year nights-based product; and GoZest, which is a three-year points-based product. The company operates a network of resorts across various destinations, including hill stations, beaches, backwaters, wildlife sanctuaries, forts, and heritage destinations in India, as well as in international destinations, such as Thailand, Indonesia, Malaysia, Turkey, Singapore, Dubai, Sri Lanka, Maldives, Vietnam, Cambodia, Abu Dubai, Nepal, Finland, Sweden, and Spain. Mahindra Holidays & Resorts India Limited was incorporated in 1996 and is based in Mumbai, India. Mahindra Holidays & Resorts India Limited is a subsidiary of Mahindra & Mahindra Limited.",0.152,buy,568.0
564,564,SPECIALITY,Speciality Restaurants Limited,EQ,30-MAY-2012,INE247M01014,restaurants,consumer-cyclical,Consumer Discretionary,Restaurants,173.13,172.01,171.45,177.15,173.13,172.01,171.45,177.15,157565.0,157565.0,96291.0,251969.0,251969.0,152.8,287.1,173.7696,192.02335,172.05,-0.21125287,0.24014747,2.0,44.162,,,13588246.0,48097700.0,50791000.0,0.69776,1703980800.0,1726185600.0,1.0,1726185600.0,,,0.4085,10.0,1,10,827.5209216,8503995392.0,1808199936.0,37.977,1387800064.0,4168900096.0,87.193,425409984.0,,,58.172,2.9576085,1.9849862,2.04,19.99,0.116,0.129,0.101,300700000.0,6.11,,28.158756,0.072129995,0.43465,0.10204001,0.07694,,,"Speciality Restaurants Limited owns and operates restaurant outlets and sweet shops in India and internationally. The company operates its restaurants under the Mainland China, Oh! Calcutta, Asia Kitchen by Mainland China, Sigree, Sigree Global Grill, Bohoba, KIX, Jungle Safari, Hoppipola, Gong - Modern Asian, Café Mezzuna, Flame & Grill, Haka, Haka  Asia Bowl, Machaan, Kaazi, Riyasat, Chourangi, and BARishh brand names. It also operates confectionaries and cafes under the Sweet Bengal and Dariole brands; and resto-bars under the Episode One brand. In addition, the company provides catering services; operates cloud kitchens; and franchises its restaurants and confectionaries stores. Speciality Restaurants Limited was founded in 1992 and is based in Mumbai, India.",0.735,hold,1341.0
565,565,IPL,India Pesticides Limited,EQ,05-JUL-2021,INE0D6701023,agricultural-inputs,basic-materials,Commodities,Pesticides & Agrochemicals,222.1,224.5,219.9,226.0,222.1,224.5,219.9,226.0,356693.0,356693.0,610422.0,770249.0,770249.0,191.5,431.75,216.4946,278.26895,220.8,-0.24197954,0.24014747,2.0,3.1,,,32137529.0,115164000.0,115200000.0,0.76315004,1735603200.0,1723420800.0,0.75,1723420800.0,,,0.1346,1.0,1,1,2542.8211712,24934115328.0,904499968.0,7.854,255900000.0,6993399808.0,60.575,915675008.0,,,71.629,3.0825505,3.63603,3.565,27.23,0.252,0.094,0.261,641299968.0,5.57,11.8,39.640934,0.0917,0.41312,0.13093,0.10882,,,"India Pesticides Limited engages in the agri chemicals business in India. It manufactures, sells, and distributes fungicides, herbicides, insecticides, and various agrochemical products, as well as active pharmaceutical ingredients for use in pharmaceutical drugs. The company also exports its products to approximately 29 countries. India Pesticides Limited was incorporated in 1984 and is based in Lucknow, India.",-0.185,buy,961.0
566,566,ATUL,Atul Limited,EQ,06-MAY-1998,INE100A01010,specialty-chemicals,basic-materials,Commodities,Specialty Chemicals,7916.9,7922.6,7922.55,8045.0,7916.9,7922.6,7922.55,8045.0,46659.0,46659.0,78626.0,39618.0,39618.0,5174.85,8135.4,7447.848,6566.4966,7990.45,0.06002462,0.24014747,2.0,4.581,,,15296169.0,29441800.0,29441800.0,0.48043,1735603200.0,1720742400.0,20.0,1720742400.0,,,0.22219999,10.0,1,10,23525.3235712,233148563456.0,4960300032.0,168.478,2365499904.0,48793198592.0,1655.64,6772174848.0,,,1737.104,4.599869,4.821435,4.778,34.427,0.085,0.118,0.083,3315500032.0,112.42,106.25,71.07677,0.06795,0.44623002,0.13879,0.11093,,,"Atul Ltd manufactures and sells chemicals and other chemical products worldwide. It operates in two segments, Life Science Chemicals, and Performance and Other Chemicals. The company offers aromatics, such as 2 nitro para cresol, 2-methylcyclohexyl acetate, allyl caproate and heptanoate, ambrettolide, anethole, cresol mixture, manganese sulphate monohydrate, ortho cresol and methoxy toluene, phenyl acetic acid, skatole, and sodium sulfite and sulphate, as well as para anisic aldehyde, anisyl acetate and alcohol, anisyl propanal, cresidine, cresol, cresyl acetate and methyl ether, methoxy phenyl acetic acid, and aceto nitrile; and bulk chemicals and intermediates, including 1,3-cyclohexanedione, 2-methylresorcinol, 4-chlororesorcinol, anisole, caustic soda lye, chlorosulphonic and hydrochloric acid, gypsum, hydrogen gas, liquid chlorine, liquid sulphur dioxide and trioxide, oleum, resoform, resorcinol, resorcinol dimethyl ether, sodium hypochlorite, sodium sulphite, and sulphuric acid. It also provides colors; biostimulants; fungicides, herbicides, and insecticides; amino acid derivatives, active pharmaceutical ingredients (API), API intermediates, and phosgene derivatives; and epoxy resins, curing agents, reactive diluents, accelerators and catalysts, formulations, and sulfones. In addition, the company produces tissue culture raised oil and date palm plants, as well as engages in the crop protection retail and polymers retail operations. It serves various industries, including adhesives, agriculture, animal feed, aerospace and defense, automotive, composites, construction, electrical and electronics, food and beverage packaging, marine, paint and coatings, sport and leisure, transport, wind energy, cosmetic, dyestuff, flavor, footwear, fragrance, glass, home care, horticulture, hospitality, paper, personal care, pharmaceutical, plastic, polymer, rubber, soap and detergent, textile, and tire. Atul Ltd was incorporated in 1947 and is headquartered in Valsad, India.",0.468,buy,311.0
570,570,KNRCON,KNR Constructions Limited,EQ,18-FEB-2008,INE634I01029,engineering-construction,industrials,Industrials,Civil Construction,349.25,351.05,348.5,359.9,349.25,351.05,348.5,359.9,1639393.0,1639393.0,2572822.0,1070673.0,1070673.0,236.75,415.4,356.299,296.02475,355.15,0.28447962,0.24014747,2.0,36.094,,,143869674.0,281235008.0,281275008.0,0.48814,1735603200.0,1726617600.0,0.25,1726617600.0,2:1,1612310400.0,0.0087,2.0,1,2,9989.4820864,105718784000.0,4505352192.0,16.029,12624370688.0,44334682112.0,157.614,11331733504.0,,,126.351,2.8108206,2.2531981,2.385,9.329,0.258,0.004,0.259,8128686080.0,28.88,17.35,12.297438,0.18335,0.39134,0.2556,0.25232,,,"KNR Constructions Limited, together with its subsidiaries, engages in the construction, engineering, and infrastructure development activities in India. It provides engineering, procurement, and construction services for roads, highways, bridges and flyovers, expressways, viaducts, irrigation, urban water infrastructure management, and other projects. The company was incorporated in 1995 and is based in Hyderabad, India.",0.735,buy,525.0
573,573,OBEROIRLTY,Oberoi Realty Limited,EQ,20-OCT-2010,INE093I01010,real-estate-development,real-estate,Consumer Discretionary,Residential Commercial Projects,1783.6,1791.9,1776.25,1797.6,1783.6,1791.9,1776.25,1797.6,517364.0,517364.0,886697.0,596674.0,596674.0,1051.1,1953.05,1751.548,1572.063,1790.35,0.545045,0.24014747,2.0,18.023,,,117203545.0,363601984.0,363744992.0,0.67705,1735603200.0,1722470400.0,2.0,1722470400.0,,,0.1328,10.0,1,10,65123.0838784,661073690624.0,12399466496.0,34.102,24952193024.0,49909751808.0,137.258,27634989056.0,,,380.757,4.7020802,13.048168,13.245,23.922,0.817,0.544,0.817,21894737920.0,60.29,33.46,29.695637,0.43869,0.60989,0.5537,0.56568,,,"Oberoi Realty Limited, together with its subsidiaries, engages in real estate development and hospitality businesses in India. It operates through The Real Estate and The Hospitality segment. The company develops and sells residential, commercial, hospitality, retail, and social infrastructure projects. It also leases office and retail spaces. In addition, the company engages in the hotel operations comprising sale of rooms, food and beverages, and allied services; construction of residential apartments; and provision of property management services. The company was incorporated in 1998 and is headquartered in Mumbai, India.",0.661,buy,148.0
