411,411,ZYDUSWELL,Zydus Wellness Limited,EQ,13-NOV-2009,INE768C01010,packaged-foods,consumer-defensive,Fast Moving Consumer Goods,Packaged Foods,1862.25,1858.35,1788.25,1865.1,1862.25,1858.35,1788.25,1865.1,178001.0,178001.0,37240.0,8898.0,8898.0,1440.15,2484.0,1958.725,1976.128,1803.85,0.16176426,0.24251366,2.0,2.805,1.269,2.261,13912518.0,63632100.0,64373600.0,0.77046996,1735603200.0,1721347200.0,5.0,1721347200.0,,,0.099700004,10.0,1,10,11478.2765056,112602439680.0,3879000064.0,60.876,1540999936.0,25197000704.0,395.975,3464999936.0,1803250048.0,4048000000.0,862.263,2.091995,4.5554137,4.469,32.497,2.527,0.12,2.542,3192000000.0,50.09,,36.012177,0.12668,0.51959,0.13752,0.02982,0.03463,0.059660003,"Zydus Wellness Limited engages in the development, production, marketing, and distribution of health and wellness products in India. It provides sugar substitute products under the Sugar Free Gold, Sugar Free Natura, and Sugar Free Green brands; milk-based health food drink under the Complan brand; glucose-based beverage under the Glucon-D brand; and I'm lite a blended sugar coated with stevia. The company offers a range of skincare products, such as soap-free face washes, face masks, scrubs, and leave-on-products under the Everyuth brand; prickly heat and cooling powder, and hand sanitizer under the Nycil brand; and probiotic butter spread, table spread, ghee, butter, cholesterol fat-free spread, mayonnaise, and chocolate spread under the Nutralite brand. It exports its products. The company was formerly known as Carnation Nutra Analogue Foods Limited and changed its name to Zydus Wellness Limited in January 2009. The company was founded in 1988 and is based in Ahmedabad, India. Zydus Wellness Limited is a subsidiary of Zydus Lifesciences Limited.",0.091,buy,358.0
414,414,BPL,BPL Limited,EQ,14-JUN-1995,INE110A01019,consumer-electronics,technology,Consumer Discretionary,Consumer Electronics,100.77,101.45,95.98,102.76,100.77,101.45,95.98,102.76,104315.0,104315.0,349961.0,164765.0,164765.0,79.05,147.85,109.6752,113.2064,100.86,0.1373589,0.24251366,2.0,54.612,,,18066705.0,48975800.0,49281900.0,0.65732,1735603200.0,999475200.0,2.5,999475200.0,,,,10.0,1,10,497.0572288,8276489216.0,92984000.0,1.898,2097184000.0,713584000.0,14.689,157144256.0,,,50.943,1.9798598,6.9656444,11.598,52.668,4.25,0.341,4.25,242374000.0,3.8,,26.542107,0.33966,0.51691,0.22022,0.20957,,,"BPL Limited, together with its subsidiaries, manufactures and sells consumer electronic products primarily in India. It operates through Printed Circuit Board and Consumer Electronics segments. The company offers television, lighting, refrigerator, air-conditioner, fan, and kitchen appliances; single, double, and multi-layer printed circuit boards; and medical technologies. It sells its products under the BPL brand. The company was incorporated in 1963 and is based in Bengaluru, India.",0.461,none,1144.0
421,421,JSWHL,JSW Holdings Limited,EQ,21-JUN-2005,INE824G01012,conglomerates,industrials,Financial Services,Investment Company,18608.55,19000.0,17678.15,19000.0,18608.55,19000.0,17678.15,19000.0,2025.0,2025.0,19188.0,3022.0,3022.0,5318.1,20391.2,16034.385,9637.428,17799.45,2.3712974,0.24251366,2.0,,13.641,617.579,3732222.0,11098000.0,11195900.0,0.7005,1735603200.0,,,,,,,10.0,1,10,19753.828352,197522227200.0,14185000.0,1.278,,2436879104.0,219.597,2306579456.0,-257049504.0,1747639040.0,29665.36,0.6000079,81.062,81.055,85.634,0.893,0.819,0.893,2402130944.0,215.86,,82.458305,0.98573995,1.0,0.94653,0.97709,0.00454,0.00858,"JSW Holdings Limited, a non-banking financial company, primarily engages in investing and financing activities in India. It also grants loans; provides securities; and invests in securities. JSW Holdings Limited was incorporated in 2001 and is based in Mumbai, India.",0.81,none,261.0
422,422,CLSEL,Chaman Lal Setia Exports Limited,EQ,12-MAY-2021,INE419D01026,packaged-foods,consumer-defensive,Fast Moving Consumer Goods,Other Agricultural Products,355.25,354.95,331.55,354.95,355.25,354.95,331.55,354.95,104408.0,104408.0,203300.0,71393.0,71393.0,183.35,447.2,368.694,276.3226,345.1,0.43188226,0.24251366,2.0,7.04,2.901,4.749,9939157.0,49725600.0,49851600.0,0.75875,1735603200.0,1726790400.0,2.25,1726790400.0,,,0.1027,2.0,1,2,1720.3787776,15625513984.0,2010263040.0,40.427,475465984.0,15158667264.0,298.932,1563570048.0,255095872.0,-1519117056.0,135.83,2.5406759,1.1349143,1.031,9.993,0.095,0.197,0.018,1112603008.0,21.88,,15.772396,0.0734,0.21385999,0.103149995,0.09362,0.10877,0.16712,"Chaman Lal Setia Exports Ltd. engages in the manufacture, trading, and marketing of rice in India. It offers basmati rice, sella rice, bhatti sella rice for diabetic people, smoked rice, and pesticide residue free rice, as well as brown rice. The company offers its products under the Maharani, Mithas, Begum, Green World Aromatic Rice, Maharani Diabetics Rice, Basmati Rice Plus, and Maharani - Brown Basmati Rice brands. It also exports its products. The company was founded in 1974 and is based in Gurugram, India.",0.718,none,836.0
425,425,UNITEDTEA,The United Nilgiri Tea Estates Company Limited,EQ,28-JAN-2015,INE458F01011,farm-products,consumer-defensive,Fast Moving Consumer Goods,Tea & Coffee,498.05,493.05,493.05,508.9,498.05,493.05,493.05,508.9,5548.0,5548.0,20864.0,7765.0,7765.0,292.5,619.0,503.291,429.58475,502.85,0.5202992,0.24251366,2.0,,6.916,8.898,2508079.0,4996570.0,5008100.0,,1735603200.0,1724976000.0,1.7,1724976000.0,,,0.0771,10.0,1,10,251.2525312,2208208128.0,279839008.0,56.017,,934380032.0,186.985,156232992.0,72939248.0,119411000.0,428.746,1.1728389,2.6889758,2.363,14.134,0.657,0.304,0.657,174922000.0,35.01,,14.36304,0.18721001,0.71001,0.1672,0.16879,0.035,0.0849,"The United Nilgiri Tea Estates Company Limited engages in growing, manufacturing, and selling teas in India. It offers black, special, green, herbal, and gift teas. The company is also involved in letting-out of properties. It exports its products to Australia, Congo, Canada, Germany, the Netherlands, Denmark, Japan, Finland, the United States, and the United Kingdom. The United Nilgiri Tea Estates Company Limited was incorporated in 1922 and is based in Coimbatore, India.",0.364,none,1273.0
426,426,VHL,Vardhman Holdings Limited,EQ,30-JUN-2005,INE701A01023,credit-services,financial-services,Financial Services,Non Banking Financial Company (NBFC),3992.0,4000.05,3906.0,4046.0,3992.0,4000.05,3906.0,4046.0,696.0,696.0,5408.0,1484.0,1484.0,2705.65,5760.0,4645.196,4010.9634,3954.1,0.23316443,0.24251366,2.0,,,,528959.0,3191540.0,3216110.0,0.84629,1735603200.0,1725580800.0,5.0,1725580800.0,,,0.0074,10.0,1,10,1261.966848,15249134592.0,38300000.0,12.001,,180700000.0,56.625,,,,10330.991,0.3827416,69.83768,84.389,,0.67,0.11,0.67,2142099968.0,631.93,,6.2571807,11.854449,1.0,,0.81818,,,"Vardhman Holdings Limited operates as a non-banking financial company in India. It is involved in investing activities. The company was formerly known as Vardhman Spinning and General Mills Limited and changed its name to Vardhman Holdings Limited in March 2006. Vardhman Holdings Limited was incorporated in 1962 and is based in Ludhiana, India.",0.441,none,914.0
430,430,BSL,BSL Limited,EQ,27-JUL-1995,INE594B01012,textile-manufacturing,consumer-cyclical,Consumer Discretionary,Other Textile Products,244.75,240.35,221.0,254.95,244.75,240.35,221.0,254.95,51981.0,51981.0,126926.0,22341.0,22341.0,159.0,331.85,257.4078,218.1544,232.6,0.19594431,0.24251366,2.0,388.009,,,3312740.0,10292200.0,10309400.0,0.6774,1735603200.0,1722297600.0,1.0,1722297600.0,,,0.1371,10.0,1,10,239.3965824,6768107520.0,1578000.0,0.153,4372228096.0,6697497088.0,650.48,672756480.0,,,109.485,2.124492,0.35744187,1.011,10.06,0.014,0.021,0.015,112672000.0,10.94,1.04,21.261427,0.01682,0.43773997,0.10045,0.06617,,,"BSL Limited, a textile company, manufactures and sells various yarns and fabrics in India and internationally. The company offers polyester viscose, worsted, poly wool, vortex, and cotton yarns; and polyester viscose, worsted, and fashion fabrics. It also provides suits for men; pure wool and wool cashmere fabrics; and furnishings, such as curtains, upholsteries, madeups, and silk fabrics. The company offers its products under the Geoffrey Hammonds, Geoffrey Hammonds Insignia, Unicare, and Basilio brand names. It also exports its products. BSL Limited was incorporated in 1970 and is headquartered in Kolkata, India.",0.593,none,1279.0
435,435,KALYANKJIL,Kalyan Jewellers India Limited,EQ,26-MAR-2021,INE303R01014,luxury-goods,consumer-cyclical,Consumer Discretionary,Gems Jewellery And Watches,488.35,486.0,459.0,499.0,488.35,486.0,459.0,499.0,48234733.0,48234733.0,9268312.0,25080952.0,25080952.0,321.95,795.4,697.294,588.8125,485.65,0.35089898,0.24251366,2.0,107.13,,,361816437.0,1031440000.0,1121830016.0,0.63612,1735603200.0,1723161600.0,1.2,1723161600.0,,,0.0817,10.0,1,10,50091.884544,733672701952.0,1777080064.0,1.725,44863578112.0,197080236032.0,191.341,12157437952.0,,,40.668,11.941822,2.5417001,3.723,60.348,0.229,0.265,0.235,6312229888.0,6.1,,79.61475,0.03203,0.14178,0.061690003,0.0543,,,"Kalyan Jewellers India Limited, together with its subsidiaries, manufactures and retails various gold and precious stone studded jewelry products. The company offers gold, diamond, silver, platinum, gemstone, and white and rose gold jewelries, including wedding, staple regional, aspirational, studded, and other jewelries. It also provides chains, necklaces, bangles, bracelets, nose studs, choker, jewelry, and moti sets, daily wear, vaddanam, rings, earrings, pendants, anklets, pearls, studs, jhumka, lockets, harams, kadas, payals, and second studs. The company offers its products under MUDHRA, NIMAH, ANOKHI, RANG, TEJASVI, ZIAH, LAYA, GLO, CANDERE, VEDHA, APOORVA, HERA, and MUHURAT brand names. In addition, it operates showrooms in India and the Middle East, as well as My Kalyan Grassroots stores. Further, the company sells its products through an online platform, candere.com. Kalyan Jewellers India Limited was founded in 1908 and is headquartered in Thrissur, India.",0.25,strong_buy,130.0
442,442,INDUSTOWER,Indus Towers Limited,EQ,28-DEC-2012,INE121J01017,telecom-services,communication-services,Telecommunication,Telecom - Infrastructure,361.65,361.6,348.5,361.9,361.65,361.6,348.5,361.9,9032430.0,9032430.0,9100033.0,11891100.0,11891100.0,206.35,460.35,341.788,370.06625,357.1,0.57273316,0.24251366,2.0,75.207,0.56,1.031,1238435256.0,2637890048.0,2637890048.0,0.53049,1735603200.0,1652400000.0,11.0,1652400000.0,,,,10.0,1,10,94199.054336,1152663552000.0,2905999872.0,1.102,213580005376.0,292404985856.0,108.692,146469994496.0,34147000320.0,156761997312.0,107.657,3.3170161,3.2215269,3.942,7.87,0.729,0.047,0.717,75430002688.0,28.03,21.1,12.739922,0.25796,0.53752,0.50091,0.44566002,0.12465999,0.28957,"Indus Towers Limited, a telecom infrastructure company, engages in the operation and maintenance of wireless communication towers and related infrastructures for various telecom service providers in India. The company offers ground base towers, smart poles, rooftop tower, small cells, and fibre backhauls; and offers energy supply to telecom equipment, as well as acquires the requisite space from residential and commercial property owners and landlords for placing passive infrastructure at strategic locations. It also provides smart digital infrastructure, which includes smart poles LED lights, CCTV cameras, variable digital messaging board, environment sensors, and city public Wi-Fi services including fiber services. The company was formerly known as Bharti Infratel Limited and changed its name to Indus Towers Limited in December 2020. Indus Towers Limited was incorporated in 2006 and is based in Gurugram, India.",0.294,hold,76.0
446,446,TI,Tilaknagar Industries Limited,EQ,16-JUL-2010,INE133E01013,beverages-wineries-distilleries,consumer-defensive,Fast Moving Consumer Goods,Breweries & Distilleries,406.95,407.0,395.3,410.0,406.95,407.0,395.3,410.0,602086.0,602086.0,1793782.0,958683.0,958683.0,182.05,457.0,400.8,298.174,402.75,0.70557415,0.24251366,2.0,12.66,1.782,2.31,88274148.0,193634000.0,193704992.0,0.52827,1735603200.0,1726790400.0,0.5,1726790400.0,3:1,1285632000.0,0.0557,10.0,1,10,7801.4685184,77454524416.0,1148354944.0,5.956,943614976.0,14234046464.0,73.928,2298821120.0,1168235136.0,1854118016.0,38.655,10.419092,5.4808507,5.441,33.693,0.565,0.058,0.572,1735384960.0,8.95,9.5,45.0,0.121920004,0.49716,0.16149999,0.16427,0.11314,0.264,"Tilaknagar Industries Ltd. engages in the manufacture and sale of Indian made foreign liquor and its related products in India. The company offers brandy under the Mansion House and Courier Napoleon brands; rum under the Madiraa brand; whisky under the Mansion House and Senate Royale brands; gin under the Blue Lagoon brand; and extra neutral alcohol. It also exports its products in Africa, the Middle East, East and South-East Asia, and Europe. The company was incorporated in 1933 and is based in Mumbai, India.",0.449,strong_buy,461.0
449,449,UGROCAP,Ugro Capital Limited,EQ,11-AUG-2021,INE583D01011,credit-services,financial-services,Financial Services,Non Banking Financial Company (NBFC),216.2,217.57,210.0,217.99,216.2,217.57,210.0,217.99,227128.0,227128.0,197252.0,183661.0,183661.0,210.0,317.0,233.7772,252.2418,212.11,-0.21467489,0.24251366,2.0,272.947,159.468,160.211,30456617.0,91945296.0,92030400.0,0.40494,,,,,,,,10.0,1,10,1952.0567296,66979868672.0,5927008768.0,64.574,53438029824.0,5817275904.0,63.595,,,-18659098624.0,213.301,0.99441636,3.35562,11.514,,0.157,0.257,0.229,1310935040.0,13.88,,15.2817,0.22534999,1.0,,0.32244,0.02042,0.07876,"UGRO Capital Limited, a non-banking financial company, engages in the lending business in India. The company offers business loans to healthcare, education, chemicals, food processing/FMCG, hospitality, electrical equipment and components, auto components, micro enterprises, and light engineering sectors. It also provides factoring services. The company was formerly known as Chokhani Securities Limited and changed its name to UGRO Capital Limited in September 2018. UGRO Capital Limited was incorporated in 1993 and is based in Mumbai, India.",0.57,none,799.0
458,458,UNIVCABLES,Universal Cables Limited,EQ,17-MAY-1995,INE279A01012,electrical-equipment-parts,industrials,Industrials,Cables - Electricals,717.65,719.0,666.55,720.25,717.65,719.0,666.55,720.25,57265.0,57265.0,76109.0,54757.0,54757.0,385.0,938.0,708.565,691.2147,693.6,0.4669869,0.24251366,2.0,45.412,0.935,1.41,12684653.0,34695400.0,34704400.0,0.72994006,1735603200.0,1721952000.0,3.0,1721952000.0,,,0.108,10.0,1,10,2406.4729088,32243466240.0,78682000.0,2.269,8269891072.0,21736833024.0,626.533,1865272960.0,-851037888.0,1275712000.0,525.153,1.3207579,1.1070945,1.483,17.286,0.568,0.291,0.568,963920000.0,27.77,14.86,24.976593,0.04435,0.26697,0.085810006,0.06315,0.02967,0.05525,"Universal Cables Limited manufactures and sells electrical and other cables, capacitors, wires and conductors, and other products under the UNISTAR brand name in India and internationally. The company offers XLPE cables, such as extra high voltage, medium voltage, low voltage, and aeriel bunched cables for use in power transmission and distribution, railways, fertilizers, petrochemical plants, submarine and under water power transmission, steel plants, power station wiring, chemical plants, underwater wiring, mines for power distribution, and control and instrumentation circuits. It also provides PVC power and control cables for use in power distribution, control system, utility network, railway signaling installations, switching stations, textile mills, chemical plants, machine shops, etc.; winding wires and flat motor leads; power, control, and composite cables for trailing, ship wiring, and defense applications; and mining cables for landline, LHD and SDL machines, drills, coal cutters, stacker-reclaimers, and earth moving equipment. In addition, the company offers silicon rubber cables for high temperature locations; special power and control cables for oil rigs, traction motors, and brush gear connectors, as well as tap changers for EMU's, AC coaches, and wind energy generators; and fire survival type elastomeric cables for circuit integrity during fire hazards. Further, the company provides capacitors, including high and low-voltage capacitors, harmonic filters, surge protection/special duty capacitors, and automatic power factor correction panels. Additionally, it offers engineering services for various industrial needs, such as turnkey contracts, system study, energy audit, harmonic analysis, and testing and commissioning of HT/LT capacitor banks and their associated equipment; and handling and installation services. Universal Cables Limited was incorporated in 1945 and is based in Gurugram, India.",0.907,none,744.0
459,459,APOLLOHOSP,Apollo Hospitals Enterprise Limited,EQ,10-JAN-1996,INE437A01024,medical-care-facilities,healthcare,Healthcare,Hospital,6919.15,6908.0,6829.9,6941.95,6919.15,6908.0,6829.9,6941.95,247081.0,247081.0,362523.0,394908.0,394908.0,5693.2,7545.35,7086.005,6667.338,6892.9,0.113594174,0.24251366,2.0,93.132,1.195,1.467,102387750.0,143784992.0,143784992.0,0.30388,1735603200.0,1723766400.0,10.0,1723766400.0,2:1,1283385600.0,0.19440001,5.0,1,5,99109.5554048,1084267102208.0,29083000832.0,193.593,73710002176.0,204693995520.0,1435.968,25656000512.0,8041625088.0,16464000000.0,499.315,13.804712,4.84184,5.297,42.262,0.626,0.153,0.699,11875999744.0,82.34,81.6,83.712654,0.05802,0.34702,0.12534,0.11289,0.072270006,0.16549,"Apollo Hospitals Enterprise Limited, together with its subsidiaries, engages in the provision of healthcare services in India and internationally. It operates through Healthcare Services, Retail Health & Diagnostics, Digital Health & Pharmacy Distribution, and Others segments. The company's healthcare facilities comprise primary, secondary, and tertiary care, as well as specialty facilities. It offers services in cardiac sciences, orthopedics, oncology, neurosciences, emergency, robotic surgery, and transplants; and cardiology, neurology, gastroenterology, dermatology, ophthalmology, pediatric, endocrinology, gynecology, urology, nephrology, pulmonology, rheumatology, neurosurgery, radiology, plastic-surgery, neonatology, vascular-surgery, psychiatry, dentistry, ear, nose, and throat care, as well as genomic medicines. The company also provides other services, such as project consultancy, health insurance, medical colleges, medvarsity for e-learning, and research services. In addition, it operates pharmacies, primary care clinics, birthing centers, specialized birthing centers, dialysis centers, cradle and fertility centers, diabetes management centers, single specialty clinics, primary health centers and diagnostic chains, dental clinics, and daycare and home healthcare centers. Further, the company engages in the business of bio-banking of tissues. It serves through national retail healthcare centers and genomics institutes, as well as Apollo 24/7, a digital health mobile platform; and www.apollopharmacy.in, an online pharmacy. The company was incorporated in 1979 and is based in Chennai, India.",0.595,buy,67.0
462,462,SYMPHONY,Symphony Limited,EQ,15-JUN-2011,INE225D01027,furnishings-fixtures-appliances,consumer-cyclical,Consumer Discretionary,Household Appliances,1253.8,1258.8,1238.0,1285.5,1253.8,1258.8,1238.0,1285.5,86248.0,86248.0,108027.0,111641.0,111641.0,820.0,1880.95,1344.367,1336.0298,1281.7,0.34067583,0.24251366,2.0,23.562,0.831,1.216,14162959.0,68671400.0,71473104.0,0.75748,1735603200.0,1730937600.0,2.0,1730937600.0,2:1,1473811200.0,0.5621,2.0,1,2,8801.6125952,85722095616.0,4499999744.0,65.17,1720000000.0,14250699776.0,206.83,2686500096.0,2573374976.0,2925600000.0,105.72,12.123533,6.176267,6.015,31.908,0.603,0.145,0.6,2331300096.0,33.85,30.78,37.864105,0.16359,0.49381,0.18852,0.18413,0.11955,0.33044997,"Symphony Limited, together with its subsidiaries, manufactures and trades in residential, commercial, and industrial air coolers and other appliances in India and internationally. The company offers residential and commercial coolers; large space venti-cooling; tower fans; and personal, desert, tower, and portable coolers. It sells its products primarily under the Symphony brand name. The company was formerly known as Symphony Comfort Systems Limited and changed its name to Symphony Limited in March 2010. Symphony Limited was founded in 1939 and is based in Ahmedabad, India.",0.554,buy,418.0
465,465,SWARAJENG,Swaraj Engines Limited,EQ,06-DEC-1995,INE277A01016,auto-parts,consumer-cyclical,Industrials,Compressors Pumps & Diesel Engines,3284.75,3284.75,3026.0,3284.75,3284.75,3284.75,3026.0,3284.75,36480.0,36480.0,11842.0,24252.0,24252.0,2148.0,3470.0,3055.648,2931.7158,3088.1,0.40391934,0.24251366,2.0,0.453,1.495,1.904,5236359.0,12147500.0,12151400.0,0.57370996,1640908800.0,1719532800.0,95.0,1719532800.0,3:1,1123804800.0,0.78050005,10.0,1,10,3751.2695808,37348708352.0,1842300032.0,151.659,15500000.0,15127393280.0,1245.38,2018148992.0,952446144.0,1571204992.0,303.415,10.17781,2.479786,2.469,18.506,0.205,0.194,0.206,1478860032.0,128.11,86.44,24.105066,0.09776,0.20583999,0.13340999,0.123509996,0.2086,0.45433998,"Swaraj Engines Limited manufactures and sells diesel engines, diesel engine components, and spare parts for tractors in India. The company was incorporated in 1985 and is based in Mohali, India. Swaraj Engines Limited operates as a subsidiary of Mahindra & Mahindra Limited.",0.589,strong_buy,623.0
471,471,ATAM,Atam Valves Limited,BE,10-MAY-2023,INE09KD01013,specialty-industrial-machinery,industrials,Industrials,Industrial Products,138.33,140.06,131.2,140.12,138.33,140.06,131.2,140.12,24366.0,24366.0,38579.0,42226.0,42226.0,118.35,228.99,138.1008,168.27605,132.92,-0.3165514,0.24251366,2.0,41.46,,,4808903.0,11463000.0,11572400.0,0.55224997,1735603200.0,1727049600.0,0.75,1727049600.0,,,0.2874,10.0,1,10,153.8203392,1659095424.0,101962000.0,8.873,128710000.0,536783008.0,46.924,97787000.0,,,27.082,4.9080567,2.8655963,3.091,16.966,0.125,0.104,0.107,59221000.0,5.22,,25.463602,0.11033,0.43589002,0.18216999,0.11619,,,"Atam Valves Limited manufactures and sells valves, fittings, steam traps, and strainers in India, Nepal, Indonesia, South Africa, Dubai, and internationally. The company offers cocks and boiler mountings; air, ball, butterfly, check, foot, gate, globe, needle, non-return, parallel slide blow off, plug, pressure reducing, safety, steam stop, and wheel valves; stainless steel and high-pressure steel fittings; fusible plugs; injectors; moisture separators; sight indicators; and water level gauges. It serves the oil and gas refinery, petrochemical, power generation plant, boiler manufacturing, power transformer manufacturing, sugar, textile, rubber, pharmaceutical, chemical, fertilizer, paper, processing, marine and ship building, infrastructure and household, and plumbing industries. The company sells its products under the ATAM and FEBI brands through dealers. It also exports its products to approximately 9 countries. Atam Valves Limited was founded in 1972 and is headquartered in Jalandhar, India.",-0.618,none,1358.0
476,476,LFIC,Lakshmi Finance & Industrial Corporation Limited,EQ,15-APR-2015,INE850E01012,asset-management,financial-services,Financial Services,Investment Company,210.84,209.01,201.0,210.77,210.84,209.01,201.0,210.77,3276.0,3276.0,3750.0,5764.0,5764.0,161.85,372.0,235.056,226.89494,206.71,0.2134676,0.24251366,2.0,,,,1642830.0,3000000.0,3308640.0,,1735603200.0,1723593600.0,1.5,1723593600.0,,,0.048,10.0,1,10,62.0130048,214796000.0,514953984.0,171.651,,175604992.0,58.544,154159744.0,,,188.38,1.0973033,3.5313919,1.223,1.393,0.796,0.659,0.795,124904000.0,46.22,,4.4723063,0.71128,0.99808997,0.87788004,0.92613,,,"Lakshmi Finance & Industrial Corporation Limited, a non-banking finance company, invests in equity shares and mutual funds in India. The company was formerly known as The Andhra Bank Ltd. and changed its name to Lakshmi Finance & Industrial Corporation Limited in April 1980. Lakshmi Finance & Industrial Corporation Limited was incorporated in 1923 and is based in Hyderabad, India.",0.632,none,1462.0
478,478,DODLA,Dodla Dairy Limited,EQ,28-JUN-2021,INE021O01019,food-distribution,consumer-defensive,Fast Moving Consumer Goods,Dairy Products,1078.75,1070.0,1061.0,1115.0,1078.75,1070.0,1061.0,1115.0,37335.0,37335.0,75542.0,60064.0,60064.0,791.1,1346.1,1211.55,1135.4615,1102.25,0.24531019,0.24251366,2.0,3.586,2.179,3.034,20966993.0,60327800.0,60400500.0,0.64682996,1735603200.0,1730332800.0,3.0,1730332800.0,,,,10.0,1,10,6657.6449536,60547735552.0,6191929856.0,102.977,462440000.0,34435059712.0,577.237,3570609920.0,1925823744.0,2964979968.0,214.46,5.1396527,1.9333915,1.758,16.957,0.452,0.299,0.454,2165629952.0,36.14,50.27,30.499447,0.06289,0.27817,0.103690006,0.07774,0.11841,0.18499,"Dodla Dairy Limited, together with its subsidiaries, engages in the production and sale of milk and milk products in India and internationally. The company offers toned, standardized, full cream, ultrahigh temperature processed (UHT)-toned, UHT cow, and UHT-double toned milk; and milk products, such as butter milk, sweet and mango lassi, ghee, paneer, curd, flavored milk, yoghurt, butter, ice cream, and sweets. It also engages in agricultural activities, such as farming, breeding, horticulture, and livestock farming, and seed crushing activities, as well as production and sale of cattle feed. The company was incorporated in 1995 and is based in Hyderabad, India.",0.152,strong_buy,502.0
