291,291,SALASAR,Salasar Techno Engineering Limited,EQ,25-JUL-2017,INE170V01027,steel,basic-materials,Industrials,Industrial Products,12.98,13.06,12.77,13.24,12.98,13.06,12.77,13.24,7493143.0,7493143.0,6969207.0,11674841.0,11674841.0,12.6,33.95,15.7206,18.55445,13.05,-0.078125,0.2353071,2.0,52.665,0.508,1.455,647763339.0,1726770048.0,1728099968.0,0.57238,1735603200.0,1694736000.0,0.02,1694736000.0,5:1,1706745600.0,,1.0,1,1,2253.43488,25875705856.0,248634000.0,0.144,3706003968.0,12467010560.0,7.716,1275129984.0,-1214408192.0,-346505984.0,4.072,3.2048135,1.8075182,2.076,20.293,0.034,0.022,0.06,538265024.0,0.34,,38.382355,0.04318,0.19478,0.10228,0.08026,0.058870003,0.0962,"Salasar Techno Engineering Limited engages in the manufacture and sale of galvanized and non-galvanized steel structures in India and internationally. It operates in two segments, Steel Structure, and Engineering Procurement & Construction. The company's products include telecommunication towers, solar towers, heavy steel structure, smart city solutions, power transmission line towers, railway towers, smart lighting poles and monopoles, guard rails, substation structures, solar module mounting structures, and customized galvanized and non-galvanized steel structures. It also offers engineering, procurement, and control services for rural electrification, power transmission lines, and solar power plant projects. In addition, the company undertakes engineering, procurement, and construction projects for survey, supply of materials, design, erection, and testing and commissioning on a turnkey basis. Salasar Techno Engineering Limited was incorporated in 2001 and is based in Ghaziabad, India.",0.806,none,294.0
294,294,KSCL,Kaveri Seed Company Limited,EQ,04-OCT-2007,INE455I01029,agricultural-inputs,basic-materials,Fast Moving Consumer Goods,Other Agricultural Products,940.55,932.0,901.55,938.7,940.55,932.0,901.55,938.7,62938.0,62938.0,85849.0,75555.0,75555.0,618.5,1201.0,892.116,924.5695,921.05,0.4232428,0.2353071,2.0,0.011,,,16400958.0,51137200.0,54952200.0,0.66802,1735603200.0,1732579200.0,5.0,1732579200.0,5:1,1390780800.0,0.084,2.0,1,2,4709.9916288,37571014656.0,4960921088.0,97.661,1301000.0,12155265024.0,227.17,3032228864.0,,,239.642,3.8434415,3.8748572,3.091,12.391,0.161,0.091,0.058,3147181056.0,59.54,70.5,15.469432,0.25892,0.48236,0.24946,0.35805,,,"Kaveri Seed Company Limited researches, develops, produces, processes, and markets hybrid seeds and vegetable crop seeds in India. Its product portfolio consists of seeds for various field crops, such as maize, cotton, sunflower, mustard, sorghum, paddy, pulses, bajra, and wheat; and vegetables comprising tomatoes, okra, chilies, watermelon, gourds, and brinjal. The company also develops micronutrients. It sells its products through distributors and retailers network. It also exports its products to Pakistan, Sri Lanka, Bangladesh, Vietnam, and internationally. The company was founded in 1976 and is based in Secunderabad, India.",0.654,none,222.0
295,295,GATECH,GACM Technologies Limited,BE,25-JUL-2016,INE224E01028,asset-management,financial-services,Financial Services,Other Financial Services,0.75,0.77,0.71,0.77,0.75,0.77,0.71,0.77,3737348.0,3737348.0,4188802.0,2601805.0,2601805.0,0.62,2.55,0.7472,1.11285,0.71,-0.64285713,0.2353071,4.0,11.911,7.266,8.298,373823916.0,680574016.0,814937984.0,0.08693,1735603200.0,,,,,,,1.0,1,1,57.8605952,328364000.0,73368000.0,0.16,56982000.0,79942144.0,0.186,,,-252522144.0,1.041,0.68203646,7.2378087,4.108,,0.286,0.766,0.492,13913970.0,0.03,,23.666666,0.17405,0.91576,,0.12956001,0.03644,0.051209997,"GACM Technologies Limited provides financial consulting and financial technology-related services. The company was formerly known as Stampede Capital Limited and changed its name to GACM Technologies Limited in May 2023. GACM Technologies Limited was incorporated in 1995 and is based in Hyderabad, India.",0.164,none,575.0
300,300,ASAHIINDIA,Asahi India Glass Limited,EQ,18-MAR-1998,INE439A01020,auto-parts,consumer-cyclical,Consumer Discretionary,Auto Components & Equipments,700.3,695.15,682.75,700.35,700.3,695.15,682.75,700.35,42445.0,42445.0,151657.0,184871.0,184871.0,501.55,833.95,717.451,667.23425,693.85,0.25524282,0.2353071,2.0,95.42,0.329,1.068,75383039.0,243090000.0,243142000.0,0.54852,1735603200.0,1724803200.0,2.0,1724803200.0,2:1,1125532800.0,0.15640001,1.0,1,1,16870.4065536,191559335936.0,1720700032.0,7.082,23389900800.0,44228100096.0,182.048,7030000128.0,-7831562752.0,7910700032.0,101.919,6.807857,3.814409,4.331,27.249,0.101,0.034,0.099,3107500032.0,12.82,,54.122463,0.07026,0.60735,0.15895,0.1425,0.061,0.13222,"Asahi India Glass Limited, an integrated glass and windows solutions company, manufactures and supplies various glass products in India and internationally. It operates in two segments, Automotive Glass and Float Glass. The company offers various automotive glass products, including IR cut and acoustic, antenna printed, heated windscreens, head up displays, and windscreens with rain sensor and ADAS; dark green UV cut, solar control, privacy, water repellent, encapsulated glasses, plug in windows, sliding windows for buses and trucks, IGU for metro and railways, and thinner and laminated sidelites; backlites with defogger, privacy and solar control glasses, and antenna printed backlites; and fixed laminated, tilt and slide, panoramic, bullet resistant glasses, and metro sunroofs, as well as refrigerator shelf and door glasses, and washing machine-flats/bends. It also provides a range of architectural glass products, such as clear float, heat absorbing, solar control, patterned reflective, sunshield, patterned sunshield, ecosense-energy efficient, impact resistance, burglar resistant, noise cancelling, valuglas, securityplus, insulated-glazed, heat-strengthened, swytchglas-electrochromatic, integrated blinds, pyrobel-fire resistant, and energy-efficient reflective glasses, as well as uPVC and aluminum windows. In addition, the company offers designer glasses, including frosted, mesh and colored laminated, fabric laminated, printed, and acid etched glasses, as well as distortion-free mirrors, ceramic frit, disegno, and back painted glasses in vibrant colors for interiors; and glass, window, and door solutions. Further, it provides car glass repair and replacement services. Asahi India Glass Limited was incorporated in 1984 and is based in Gurugram, India.",0.559,none,121.0
301,301,ASALCBR,Associated Alcohols & Breweries Ltd.,EQ,12-FEB-2020,INE073G01016,beverages-wineries-distilleries,consumer-defensive,Fast Moving Consumer Goods,Breweries & Distilleries,1113.35,1113.35,1105.0,1193.9,1113.35,1113.35,1105.0,1193.9,133488.0,133488.0,55547.0,42514.0,42514.0,398.0,1193.9,1010.679,798.0715,1176.55,1.3079395,0.2353071,2.0,20.141,0.668,1.699,6863545.0,18079200.0,18127100.0,0.60400003,1735603200.0,1721952000.0,2.0,1721952000.0,,,0.0629,10.0,1,10,2132.7439872,20415080448.0,559475008.0,31.045,910678976.0,9395384320.0,520.141,908161024.0,-519189248.0,717454016.0,250.895,4.689412,2.2699912,2.173,22.48,0.129,0.495,0.139,578334016.0,31.84,,36.95195,0.06156,0.30613002,0.09666,0.08199,0.07755,0.13778,"Associated Alcohols & Breweries Limited engages in liquor manufacturing, distillation, and bottling activities in India and internationally. It operates through two segments, Potable Alcohols and Ethanol. The company offers extra neutral alcohol, as well as Indian Made Indian Liquor and Indian Made Foreign Liquor. It also provides beer, spirits, wine, whiskey, vodka, rum, gin, tequila, and brandy, as well as grain-based ethanol. The company's brands include Central Province Whisky, Titanium Triple Distilled Vodka, Bombay Special Whisky, Desi Madira Masala, Superman Fine Whisky, James Mc Gill Whisky, and Jamaican Magic Rum; various franchise brands, such as Black and White Scotch Whiskey, Black Dog, Captain Morgan, Smirnoff, and VAT 69; and licensed brands, including Bagpiper Whisky, Blue Rigand Gin, Director Special, MC Dowell No. 1, and White Mischief Vodka. The company was incorporated in 1989 and is based in Indore, India.",0.352,none,298.0
302,302,M&MFIN,Mahindra & Mahindra Financial Services Limited,EQ,17-MAR-2006,INE774D01024,credit-services,financial-services,Financial Services,Non Banking Financial Company (NBFC),277.15,276.1,270.75,280.5,277.15,276.1,270.75,280.5,2581780.0,2581780.0,2171581.0,1920852.0,1920852.0,246.2,343.0,271.407,288.4385,278.75,0.029531956,0.2353071,2.0,498.691,11.584,11.584,572286687.0,1234620032.0,1259449984.0,0.53535,1735603200.0,1721088000.0,6.3,1721088000.0,5:1,1360886400.0,0.35689998,2.0,1,2,34415.034368,1299728171008.0,46349799424.0,37.492,1003025006592.0,76331401216.0,61.834,,,-172876595200.0,162.35,1.7169695,4.508634,17.027,,0.383,0.109,0.385,21799899136.0,17.65,,15.793201,0.2856,0.86982,,0.30296,0.01766,0.11253,"Mahindra & Mahindra Financial Services Limited, a non-banking financial company, provides financial services in the rural and semi-urban areas in India. The company offers vehicle financing and leasing for auto and utility vehicles, tractors, passenger cars, commercial vehicles and construction equipment, and preowned vehicle to transport operators, farmers, businesses, and self-employed and salaried individuals; bill discounting; personal, home, loan against property, and machinery loans; and project finance, equipment finance, working capital finance to small and medium-sized enterprises. It also provides housing finance for purchase, construction, extension, and renovation; investments comprising fixed deposits and investment solution; asset management and trustees services; mutual funds; life, health, and asset protection insurance products; and commercial line insurance services, as well as reinsurance products. Mahindra & Mahindra Financial Services Limited was incorporated in 1991 and is headquartered in Mumbai, India. Mahindra & Mahindra Financial Services Limited is a subsidiary of Mahindra & Mahindra Limited.",0.877,buy,77.0
303,303,SHRIRAMPPS,Shriram Properties Limited,EQ,20-DEC-2021,INE217L01019,real-estate-development,real-estate,Consumer Discretionary,Residential Commercial Projects,104.35,104.3,102.54,104.3,104.35,104.3,102.54,104.3,457939.0,457939.0,1293183.0,1184891.0,1184891.0,91.05,147.6,106.2702,114.64895,103.37,-0.21036702,0.2353071,2.0,50.914,,,84163388.0,170352992.0,182026000.0,0.49372002,1735603200.0,,,,,,,10.0,1,10,1760.939008,21989992448.0,1849200000.0,10.815,6502900224.0,8834899968.0,51.898,750242496.0,,,74.974,1.3787447,1.9931624,2.489,29.311,0.041,0.14,0.049,762499968.0,3.25,,31.806154,0.08631,0.29949,0.08492,-0.02429,,,"Shriram Properties Limited operates as a real estate development company in India. The company engages in the business of construction, development, and sale of housing projects. It also develops residential projects, including mid-market and affordable, mid-market premium, and luxury housing projects, as well as commercial and plotted development projects. The company was founded in 1995 and is based in Bengaluru, India.",0.438,none,319.0
311,311,ESCORTS,Escorts Kubota Limited,EQ,01-MAR-1995,INE042A01014,farm-heavy-construction-machinery,industrials,Industrials,Tractors,3337.95,3335.0,3263.15,3363.0,3337.95,3335.0,3263.15,3363.0,109521.0,109521.0,239419.0,337128.0,337128.0,2648.4,4420.0,3472.995,3718.315,3340.55,0.17740738,0.2353071,2.0,1.015,1.877,2.812,31753203.0,109981000.0,110004000.0,0.73164004,1735603200.0,1720137600.0,18.0,1720137600.0,,,0.16780001,10.0,1,10,36739.7044224,335159492608.0,32917800960.0,299.299,998400000.0,88490999808.0,815.815,11638599680.0,-115362496.0,10683299840.0,894.4,3.734962,4.151801,3.787,28.797,0.432,0.208,0.452,11668400128.0,107.15,120.85,31.176388,0.13186,0.31084,0.13152,0.08076,0.05369,0.12642,"Escorts Kubota Limited manufactures and sells agri machinery, construction equipment, and railway equipment in India and internationally. The company offers agricultural tractors, enagines, spare parts, lubes, and implements under the Farmtrac, Farmpower, Powertrac, Steeltrac E-Kubota, and Digitrac brand name; cranes, hydra cranes, rough terrain cranes, and tower cranes; and vibratory soil compactors, tandem rollers, and backhoe. It also provides construction, earth moving and material handling equipment, round and flat tubes, heating elements, double acting hydraulic shock absorbers for railways coaches, center buffer couplers, automobile shock absorbers, telescopic front fork and Mcpherson struts, brake blocks, internal combustion engines, and all various brake used by railways. In addition, the company offers brake system, couplers, suspension system, and friction and rubber products. Further, the company trades in oils and lubricants, implements, trailers, tractors, compressor accessories and spares, construction, earth moving, and material handling equipment. The company was formerly known as Escorts Limited and changed its name to Escorts Kubota Limited in June 2022. Escorts Kubota Limited was incorporated in 1944 and is based in Faridabad, India. Escorts Kubota Limited is a subsidiary of Kubota Corporation.",0.286,hold,71.0
316,316,NARMADA,Narmada Agrobase Limited,BE,27-OCT-2022,INE117Z01011,agricultural-inputs,basic-materials,Fast Moving Consumer Goods,Animal Feed,20.81,21.25,20.87,21.8,20.81,21.25,20.87,21.8,271904.0,271904.0,397119.0,377326.0,377326.0,14.42,34.95,17.4324,19.83731,21.62,-0.068903804,0.2353071,2.0,57.265,,,4206876.0,37936400.0,38027500.0,0.57363,1735603200.0,1568764800.0,0.042089,1568764800.0,18:10,1582588800.0,,10.0,1,10,82.0185024,304237568.0,7702000.0,0.568,96786000.0,546345024.0,40.543,36461248.0,,,12.475,1.7330662,1.5012218,0.557,8.344,8.375,0.543,8.177,19246000.0,2.06,,10.495147,0.03523,0.1522,0.06674,0.124,,,"Narmada Agrobase Limited manufactures and sells cotton seeds and cattle feeds in India. The company offers cotton seed meal, bleached cotton linters, gwar korma, maize meal, multi grain meal, maize oil cakes, cotton seed oil cakes, cotton linters, poultry feeds, cattle feed, and delinted cotton seeds. Its products are used for fertilizers and animal feed, as well as various industries, including furniture, paper, yarns, absorbent cotton, etc. The company offers its products under the Churma, and Gaay Chhaap Narmada Pashu Aahar brands. It also exports its products. Narmada Agrobase Limited was incorporated in 2013 and is based in Ahmedabad, India.",-0.401,none,562.0
317,317,GTL,GTL Limited,BE,29-MAR-1995,INE043A01012,telecom-services,communication-services,Telecommunication,Other Telecom Services,12.19,12.17,11.79,12.21,12.19,12.17,11.79,12.21,877580.0,877580.0,1708833.0,823949.0,823949.0,9.2,19.45,12.7948,12.7311,11.94,-0.30934846,0.2353071,2.0,,,,128047445.0,157296992.0,157428000.0,0.25718,1735603200.0,1317945600.0,1.0,1317945600.0,,,,10.0,1,10,187.812608,59685711872.0,149506000.0,0.95,57842266112.0,2188665088.0,13.901,903910272.0,,,-382.802,,0.8581149,27.27,66.031,1.645,0.367,1.655,2188350976.0,10.31,,1.1580988,0.99986,0.56228,0.413,0.42360002,,,"GTL Limited operates as an infrastructure services company in India. The company offers services and solutions to address the network life cycle requirements of telecom operators, technology providers, and tower companies. It also offers network operation and maintenance services, such as network monitoring and operation, network field maintenance, technical support and process management, logistics and vendor management, and transition management services. In addition, the company offers energy management solutions in the areas of energy audits of telecom infrastructure, process improvement, technology upgradation, and alternate sources of energy. GTL Limited was incorporated in 1987 and is based in Mumbai, India.",0.865,none,519.0
319,319,VBL,Varun Beverages Limited,EQ,08-NOV-2016,INE200M01021,beverages-non-alcoholic,consumer-defensive,Fast Moving Consumer Goods,Other Beverages,618.2,621.5,603.45,626.35,618.2,621.5,603.45,626.35,5001990.0,5001990.0,5501714.0,4884850.0,4884850.0,478.56,681.12,620.4,612.5907,606.95,0.21817613,0.2353071,2.0,77.304,,,1166969646.0,3381509888.0,3381509888.0,0.60201,1703980800.0,1723161600.0,0.5,1723161600.0,5:2,1726099200.0,0.1279,5.0,1,5,205240.7427072,2073510674432.0,4077479936.0,1.255,67609161728.0,189865476096.0,58.494,45938982912.0,,,26.404,22.98705,10.809798,10.921,45.136,0.24,0.241,0.237,25414590464.0,7.79,10.03,77.913994,0.13385999,0.5554,0.24195999,0.18617001,,,"Varun Beverages Limited, together with its subsidiaries, operates as the franchisee of carbonated soft drinks (CSDs) and non-carbonated beverages (NCBs) sold under trademarks owned by PepsiCo. It is involved in the manufacture, bottling, distribution, and sale of a range of CSDs under the Pepsi, Pepsi Black, Mountain Dew, Mirinda, and 7UP brands; energy drinks under the Sting and Sting Blue brands; club sodas under the Evervess and Dukes brands; and carbonated juice-based drinks under the 7UP Nimbooz Masala Soda brand. The company also produces and distributes NCBs comprising fruit pulp/juice-based drinks under the Tropicana 100%, Tropicana Delight, Slice, and 7UP Nimbooz brands; ice-tea in various flavors under the Lipton brand; sports drinks in various flavors under the Gatorade brand; packaged drinking water under the Aquafina and Aquavess brands; and value-added dairy-based beverages under the Cream Bell brand. It sells its products to retail outlets directly and through distributors in India, as well as territories of Nepal, Sri Lanka, Morocco, Zambia, Zimbabwe, Congo, Dubai, South Africa, Eswatini, Lesotho, Namibia, Botswana, and Mozambique. The company was incorporated in 1995 and is based in Gurugram, India.",0.626,strong_buy,15.0
320,320,ITC,ITC Limited,EQ,23-AUG-1995,INE154A01025,tobacco,consumer-defensive,Fast Moving Consumer Goods,Diversified FMCG,441.1,443.0,437.1,452.05,441.1,443.0,437.1,452.05,13480554.0,13480554.0,13038328.0,18801150.0,18801150.0,399.35,528.5,473.013,467.749,449.55,-0.047917128,0.2353071,2.0,0.402,1.667,3.052,9137953176.0,12511699968.0,13612699648.0,0.28407,1735603200.0,1717459200.0,7.5,1717459200.0,3:2,1467331200.0,0.83739996,1.0,1,1,562463.4540032,5336992841728.0,190998691840.0,15.263,3043399936.0,751352676352.0,60.164,264712994816.0,96529309696.0,161626603520.0,60.148,7.474064,7.486011,7.103,20.161,0.018,0.167,0.019,205402406912.0,16.41,18.95,27.39488,0.27337998,0.58748,0.35232,0.301,0.17,0.28645,"ITC Limited engages in the fast-moving consumer goods, hotels, paperboards and paper and packaging, agri, and information technology businesses in India and internationally. It primarily offers cigarettes and cigars; staples, spices, biscuits, confectionery and gums, snacks, noodles and pasta, beverages, dairy, ready to eat meals, chocolate, coffee, and frozen foods; personal care products; notebooks, pens and pencils, geometry boxes, erasers, sharpeners, rulers, wax and plastic crayons, sketch pens, and oil pastels; safety matches; and incense sticks under various brands. The company also operates hotels under the ITC Hotel, Mementos, Welcomhotel, Storii, Fortune, and WelcomHeritage brands; and Kaya Kalp spas. In addition, it offers virgin, recycled, coated barrier, cupstock base, liner, liquid packaging, anti-fungal, solid, and graphic boards, as well as specialty papers; overlay, surfacing/print base, barrier, and liner papers; plastic substitution products; and packaging products, such as carton board, flexible, tobacco, and green packaging products. Further, the company exports feed ingredients, food grains, marine products, processed fruits, coffee products, leaf tobacco products, and spices; and offers information technology services for the banking, financial services, consumer goods, manufacturing, travel, hospitality, and healthcare industries. Additionally, it provides property infrastructure and estate maintenance; engineering, procurement, and construction management; project management consultancy; cartooning and wrapping; conveyor; and business consulting, real estate development, and agro-forestry and other related services. The company also manages and operates golf courses; fabricates and assembles machinery for tube filling; and produces and commercializes seed potato technology products. ITC Limited was incorporated in 1910 and is headquartered in Kolkata, India.",0.241,buy,2.0
321,321,QUESS,Quess Corp Limited,EQ,12-JUL-2016,INE615P01015,staffing-employment-services,industrials,Services,Diversified Commercial Services,654.25,660.0,639.0,662.0,654.25,660.0,639.0,662.0,296870.0,296870.0,658237.0,794418.0,794418.0,459.5,875.0,682.927,677.55023,644.25,0.27783203,0.2353071,2.0,22.371,1.37,1.442,55352278.0,148687008.0,157928992.0,0.62624,1735603200.0,1725580800.0,6.0,1725580800.0,,,0.42189997,10.0,1,10,9579.1603712,101001150464.0,5867180032.0,39.056,6904189952.0,199340572672.0,1342.694,6095889920.0,3836740096.0,6412319744.0,194.267,3.316312,0.48054242,0.507,16.569,0.266,0.091,0.285,3543160064.0,23.68,27.57,27.206503,0.01777,0.09733,0.030580001,0.024300002,0.04912,0.12323,"Quess Corp Limited operates as a business services provider in India, South East Asia, the Middle East, and North America. The company operates through Workforce Management, Operating Asset Management, Global Technology Solutions, and Product Led Business segments. The Workforce Management segment provides staffing services, IT staffing, HR services, expert talent acquisition, search and recruitment outsourcing, payroll compliance, background verification, training and skill development, and logistic services. The Operating Asset Management segment offers services, such as janitorial, security, electro-mechanical, pest control, food and hospitality, industrial operations and maintenance services, facility management, ERP, cellular, as well as related asset record maintenance services. The Global Technology Solutions segment provides customer lifecycle management, non voice, BPO and CLM solutions, and IT services, digital transformation, HR outsourcing and consulting, and after-sales services. The Product Led Business segment is involved in the provision of break fix services; and digital technology platforms and workforce management tools for workforce hiring, management, engagement, and non-compensation benefits. Quess Corp Limited was formerly known as Ikya Human Capital Solutions Limited and changed its name to Quess Corp Limited in January 2015. The company was incorporated in 2007 and is headquartered in Bengaluru, India.",0.746,strong_buy,165.0
323,323,RALLIS,Rallis India Limited,EQ,01-APR-1999,INE613A01020,agricultural-inputs,basic-materials,Commodities,Pesticides & Agrochemicals,305.15,305.0,295.55,307.7,305.15,305.0,295.55,307.7,347517.0,347517.0,1037612.0,286732.0,286732.0,236.5,378.7,316.827,313.58276,297.9,0.19479251,0.2353071,2.0,3.534,0.996,1.824,84709722.0,194468992.0,194500992.0,0.56154,1735603200.0,1717372800.0,2.5,1717372800.0,10:1,1310688000.0,0.3259,1.0,1,1,5794.1843968,57724723200.0,2289999872.0,11.777,680000000.0,27453800448.0,141.255,3181499904.0,1414612480.0,2330700032.0,98.949,3.0106418,2.1105218,2.103,18.144,0.191,0.115,0.195,1488700032.0,7.66,11.93,38.89034,0.054229997,0.39726,0.11589,0.14655,0.04422,0.0794,"Rallis India Limited manufactures and markets agri-input in India and internationally. The company offers crop protection products, including insecticides, herbicides, fungicides, and bio pesticide; organic fertilizers and plant growth nutrients; seeds, such as maize, watermelon, cauliflower, cabbage, bottle gourd, cucumber, bitter gourd, chilli, okra, tomato, millet, paddy, and cotton; and animal nutrition products. It also provides household products, such as Termex, an insecticide for termite control; Sentry, a chemical composition pest control; and Ralligel plus, a chemical spray for cockroach control. In addition, the company offers contract manufacturing services for crop protection chemicals, specialty chemicals, polymers, and intermediates. It sells its products through a network of dealers and retailers. The company was incorporated in 1948 and is based in Mumbai, India. Rallis India Limited operates as a subsidiary of Tata Chemicals Limited.",0.554,underperform,205.0
